72668,01040345,v,9,propel with force; 'launch the space shuttle',
72669,01040489,v,9,launch with great force; 'launch the rockets',
72672,01040954,v,9,"shoot forth or launch, as if from a catapult; 'the enemy catapulted rocks towards the fort'",
72673,01041143,v,9,"throw, send, or cast forward; 'project a missile'",
72674,01041276,v,9,cause to skip over a surface: 'Skip a stone across the pond',
72675,01041423,v,9,"push or shove upward, as if from below or behind",
72676,01041534,v,9,issue in a jet; come out in a jet; stream or spring forth; 'Water jetted forth'; 'flames were jetting out of the building',
72677,01041724,v,9,"physical or metaphorical, as in 'She rammed her mind into focus'",
72678,01041943,v,9,drive obliquely; 'toe a nail',
72679,01042033,v,9,form into a wreath,
72680,01042123,v,9,"intertwine; 'fold one's hands, arms, or legs'",
72681,01042230,v,9,decorate or deck with wreathes; 'wreathe the grave site',
72682,01042351,v,9,decorate with frosting; 'frost a cake',
72683,01042458,v,9,decorate or cover lavishly with gems,
72684,01042567,v,9,twine or twist together; 'intertwine the threads',
72685,01042856,v,9,undo what has been twined together; 'untwine the strings',
72686,01042996,v,9,interlace to form wattle,
72687,01043084,v,9,weave together into a fabric or design,
72688,01043187,v,9,"twist or braid together, interlace",
72689,01043294,v,9,interlace the shoots of; 'pleach a hedge',
72690,01043407,v,9,work natural fibers into a thread; 'spin silk',
72691,01043523,v,9,interlace as if weaving,
72692,01043738,v,9,undo strands that have been woven together,
72693,01043863,v,9,interweave with tinsel; 'tinseled velvet',
72694,01043968,v,9,form or weave into a braid or braids; 'braid hair',
72695,01044108,v,9,decorate with braids or ribbons; 'braid a collar',
72696,01044220,v,9,undo the braids of; 'unbraid my hair',
72697,01044340,v,9,cancel or reverse an action or its effect; 'I wish I could undo my actions',
72698,01044791,v,9,"destroy wantonly, as through acts of vandalism; 'vandalize the park'",
72699,01044957,v,9,vandalize a car by scratching the sides with a key',
72700,01045069,v,9,become or cause to become undone by separating the fibers or threads of; 'the sweater unravelled',
72701,01045335,v,9,tangle or complicate; 'a ravelled story',
72702,01045506,v,9,disentangle; 'can you unravel the mystery?' 'unravel the ball or yarn',
72703,01045661,v,9,draw through eyes or holes; 'lace the shoelaces',
72704,01045818,v,9,lace again; 'She relaced her boots',
72705,01045917,v,9,pass a thread through; 'thread a needle',
72706,01046021,v,9,of springs,
72707,01046121,v,9,"wrap around, move around",
72708,01046365,v,9,form a circle around; 'encircle the errors',
72709,01046491,v,9,wind onto a spool or a reel,
72710,01046599,v,9,"wind onto a cheese, as of yarn",
72711,01046693,v,9,wind onto or off a reel,
72712,01046804,v,9,"form into a ball by winding, rolling, etc; ball wool, for example",
72713,01046932,v,9,roll into a ball,
72714,01047033,v,9,unwind from or as if from a reel; 'unreel the tape',
72715,01047168,v,9,reverse the winding or twisting of; 'unwinda ball of yarn',
72716,01047336,v,9,separate the tangles of,
72717,01047481,v,9,wind around something in coils or loops,
72718,01047622,v,9,unwind or untwist,
72719,01047721,v,9,crowd or pack to capacity; 'the theater was jampacked',
72775,01056905,v,9,wash in suds,
72721,01048139,v,9,fill completely; 'The child stuffed his pockets with candy',
72722,01048331,v,9,stuff too much; 'The pillow was overstuffed',
72723,01048442,v,9,get stuck and immobilized; 'the mechanism jammed',
72724,01048560,v,9,fail to function or function improperly; 'the coffee maker malfunctioned',
72725,01048752,v,9,do double duty; serve two purposes or have two functions; 'She doubles as his wife and secretary',
72726,01048914,v,9,function properly; 'The washing machine won't go unless it's plugged in',
72727,01049188,v,9,begin operating or running; 'The cameras were rolling'; 'The presses are already rolling',
72728,01049339,v,9,"be running or functioning, as of engines or machines; 'Is the computer running?'",
72729,01049499,v,9,run disconnected or idle; 'the engine is idling',
72730,01049609,v,9,"start running, functioning, or operating, as of lights or power",
72731,01049773,v,9,"stop running, functioning, or operating, as of power",
72732,01049907,v,9,line or stuff with soft material; 'pad a bra',
72733,01050050,v,9,give (hair) the appearance of being fuller by using a rat,
72734,01050168,v,9,squeeze like a wedge into a tight space; 'I squeezed myself into the corner',
72735,01050369,v,9,remove or force from a position of dwelling previously occupied; 'The new employee dislodged her by moving into her office space',
72736,01050608,v,9,cause to fall off; 'The horse threw its unexperienced rider',
72737,01050731,v,9,expel through adjuration or prayers; of evil spirits; in certain religions,
72738,01050882,v,9,"fix, force, or implant; 'lodge a bullet in the table'",
72739,01051078,v,9,sit or recline comfortably; 'He was lounging on the sofa',
72741,01051506,v,9,"to fix or set securely or deeply: 'Kneeling, Cobb planted a sturdy knee in the small of his back,'",
72742,01051765,v,9,"dip into mud before planting, of young plants",
72743,01051874,v,9,plant in checkrows,
72744,01051958,v,9,plant in a pot; 'He potted the palm',
72745,01052073,v,9,"put in a new, usually larger, pot, as of a plant that has grown",
72746,01052199,v,9,fit together or fit inside,
72747,01052287,v,9,insert or squeeze tightly between two people or objects,
72748,01052416,v,9,embed deeply; 'She sank her fingers into the soft sand',
72749,01052558,v,9,insert (a nail below the surface),
72750,01052666,v,9,in surgery,
72751,01052778,v,9,cause to grow together parts from different plants; 'graft the cherry tree branch onto the plum tree',
72752,01052962,v,9,thoroughly work in; 'His hands were grained with dirt',
72753,01053089,v,9,fix firmly or securely,
72754,01053188,v,9,occupy a trench or secured area; 'The troops dug in for the night',
72755,01053311,v,9,raise in a relief; 'embossed stationary',
72756,01053448,v,9,stamp or emboss a title or design on a book with a block; 'block the book cover',
72757,01053591,v,9,raise the nap of (fabrics),
72758,01053698,v,9,"mark or stamp with or as if with pressure; 'To make a batik, you impress a design with wax'",
72759,01053918,v,9,make a spot or mark onto; 'The wine spotted the tablecloth',
72760,01054203,v,9,blotch or spot,
72761,01054290,v,9,remove while making clean; 'Clean the spots off the rug',
72762,01054427,v,9,"make clean by removing dirt, filth, or unwanted substances from; 'Clean the stove!'; 'The dentist cleaned my teeth'",
72763,01054932,v,9,"whiten or clean with pipe-clay, as of leather",
72764,01055044,v,9,make the house clean; 'She housecleans every week',
72765,01055238,v,9,"thoroughly clean the entire house, often done only once a year",
72766,01055370,v,9,clean refuse from; 'Scavenge a street',
72767,01055474,v,9,"make soiled, filthy, or dirty; 'don't soil your clothes when you play outside!'",
72768,01055846,v,9,soil or stain with a splashed liquid,
72769,01055946,v,9,"soil with mud, muck, or mire; 'The child mucked up his shirt while playing ball in the garden'",
72770,01056149,v,9,soil with soot,
72771,01056234,v,9,clean with chemical agents,
72772,01056327,v,9,"cleanse with a cleaning agent, such as soap, and water; 'Wash the towels, please!'",
72773,01056679,v,9,"wash free from unwanted substances, such as dirt",
72777,01057119,v,9,separate dirt or gravel from (precious minerals),
72778,01057265,v,9,wash dirt in a pan to separate out the precious minerals,
72779,01057402,v,9,wash in a cradle; of gold,
72780,01057491,v,9,wash with stones to achieve a worn appearance; of blue jeans,
72781,01057618,v,9,wash or launder by hand instead of with a machine,
72782,01057751,v,9,wash by machine,
72783,01057854,v,9,wash with acid so as to achieve a bleached look; of blue jeans,
72785,01058282,v,9,tarnish or stain: 'a scandal that darkened the family's good name',
72786,01058412,v,9,place under suspicion or cast doubt upon; 'sully someone's reputation',
72787,01058596,v,9,mar or impair with a flaw; 'her face was blemished',
72788,01058727,v,9,mark with small spots; 'speckle the wall with tiny yellow spots',
72789,01058868,v,9,produce a mottled effect; 'The sunlight stippled the trees',
72790,01059010,v,9,"spot, splash, or soil; 'The baby spattered the bib with food'",
72791,01059148,v,9,"become permanently attached, as of mollusks or oysters",
72792,01059272,v,9,dry (ink) with blotting paper,
72793,01059371,v,9,"be able to take in, as of liquids; 'The sponge absorbs water well'",
72794,01059717,v,9,"absorb as if with a sponge, of liquids",
72795,01059830,v,9,"become imbued; of liquids, light, or gases, in chemistry",
72796,01059968,v,9,"take into solution, as of gas, light, or heat",
72797,01060090,v,9,"accumulate of the surface; of liquids or gases, in chemistry",
72798,01060214,v,9,take up a liquid or a gas either by adsorption or by absorption; in chemistry,
72799,01060417,v,9,remove body fluids such as blood,
72800,01060535,v,9,accept; 'The cloth takes up the liquid',
72801,01060691,v,9,unite or merge with something already in existence; 'incorporate this document with those pertaining to the same case',
72802,01060886,v,9,cause to flow out or over; 'spill the beans all over the table',
72803,01061056,v,9,"pour in drops; 'shed tears'; 'spill blood'; also metaphorically, as in 'God shed His grace on Thee'",
72804,01061238,v,9,go to seed; shed seeds; 'The dandelions went to seed',
72805,01061371,v,9,cause to flow or overflow; 'spill blood',
72806,01061500,v,9,arrange in a particular way; 'drape a cloth',
72807,01061625,v,9,fall or flow in a certain way; 'This dress hangs well'; 'Her long black hair flowed down her back',
72808,01061781,v,9,place casually; 'The cat draped herself on the sofa',
72809,01061911,v,9,be seated,
72810,01062160,v,9,sit or lie with one's limbs spread out,
72811,01062306,v,9,stand with arms and legs spread out,
72812,01062411,v,9,"sit, as on a branch; 'The birds perched high in the treee'",
72813,01062571,v,9,show to a seat; assign a seat for: 'The host seated me next to Mrs. Smith',
72814,01062768,v,9,"dislodge from one's seat, as from a horse",
72815,01062881,v,9,show to a different seat; 'The usher insisted on reseating us',
72816,01063016,v,9,put in a horizontal position; 'lay the books on the table'; 'lay the patient carefully onto the bed',
72817,01063367,v,9,lay eggs; of female animals; 'This hen doesn't lay',
72818,01063497,v,9,lay eggs; of certain insects,
72819,01063587,v,9,"sit on one's heels; 'In some cultures, the women give birth while squatting'",
72820,01063788,v,9,rest one's weight on one's knees; 'In church you have to kneel during parts of the service',
72821,01063950,v,9,not move; be in a resting position,
72822,01064160,v,9,be standing; be upright; 'We had to stand for the entire performance!',
72823,01064454,v,9,"stand with arms or forelegs raised, as if menacing",
72824,01064574,v,9,stand away from an object or person; 'He stood back to look at her',
72825,01064709,v,9,put into an upright position; 'Can you stand the bookshelf up?',
72826,01064888,v,9,"be lying, be prostrate; be in a horizontal position; 'The sick man lay in bed all day'l 'the books are lying on the shelf'",
72827,01065170,v,9,"assume a resting position, as on a flat surface",
72828,01065358,v,9,lie in a comfortable resting position; 'He was reposing on the couch',
72829,01065509,v,9,lie upon; lie on top of; 'the granite overlies the older rocks',
72830,01065637,v,9,"lie without sleeping; 'She was so worried, she lay awake all night long'",
72832,01065894,v,9,be exposed; 'The seals were basking in the sun',
72833,01066003,v,9,fasten with a buckle or buckles,
72834,01066124,v,9,undo the buckle of; 'Unbuckle your seat belt',
72835,01066254,v,9,fasten with or as if with a brooch,
72837,01066627,v,9,erase with a sponge; as of words on a blackboard,
72838,01066739,v,9,remove or make invisible; 'Please delete my name from your list',
72839,01066937,v,9,remove by erasing or crossing out; 'Please strike this remark from the record',
72840,01067122,v,9,strike or cancel by or as if by rubbing or crossing out; 'scratch out my name on that list',
72841,01067308,v,9,mar or spoil the appearance of; 'scars defaced her cheeks',
72842,01067496,v,9,cut open or cut apart; 'dissect the bodies for analysis',
72843,01067661,v,9,cut (a body) open while still alive; 'people no longer vivisect animals--it's considered unethical',
72844,01067834,v,9,dissect in order to analyze; 'anatomize the bodies of the victims of this strange disease',
72845,01068003,v,9,cut in half or cut in two; 'bisect a line',
72846,01068118,v,9,cut in three; 'trisect a line',
72847,01068221,v,9,mark with a scar; 'The skin disease scarred his face permanently',
72848,01068448,v,9,mark wit pockmarks; 'Her face was pockmarked by the disease',
72849,01068582,v,9,scar (the body) in certain cultures; 'Some African tribes scarify their faces',
72850,01068733,v,9,"form a scar, after an injury; 'the skin will cicatrice and it will heal soon'",
72851,01068877,v,9,"shape (stone or wood, for example) by whittling away at it; 'She is sculpting an image of her husband'",
72852,01069071,v,9,cut small bits or pare shavings from; 'whittle a piece of wood',
72853,01069206,v,9,cut away in small pieces,
72854,01069335,v,9,separate with or as if with an instrument; 'Cut the rope',
72855,01070523,v,9,as of hair; 'She wanted her hair cropped short',
72856,01070644,v,9,cut unevenly with a chattering tool,
72857,01070744,v,9,remove by cutting off or away; 'cut away the branch that sticks out',
72858,01070922,v,9,cut away the underpart of; 'undercut a vein of ore',
72859,01071039,v,9,cut away material from the underside of (an object) so as to leave an overhanging portion in relief,
72860,01071204,v,9,cut with a tomahawk,
72861,01071289,v,9,cut with a saber,
72862,01071376,v,9,form by cutting out; 'Picasso cut out a piece of paper in the shape of a guitar',
72863,01071557,v,9,cut or shape with a die; 'Die out leather for belts',
72864,01071680,v,9,as of timber or stone,
72865,01071801,v,9,"as of stone, to give it a rustic look",
72866,01071905,v,9,divide at random; 'cut a deck of cards',
72867,01072023,v,9,divide a deck of cards into two parts to make selection difficult; 'Wayne cut',
72868,01072180,v,9,cut grain with a cradle scythe,
72869,01072274,v,9,make an incision into by carving or cutting,
72870,01072497,v,9,cut or carve deeply into; 'letters trenched into the stone',
72871,01072620,v,9,remove or shorten the tail of an animal,
72872,01072734,v,9,to separate or be separated by force: 'planks were in danger of being torn from the crossbars.',
72873,01072925,v,9,"separate or cut with a tool, such as a sharp instrument; 'cleave the bone'",
72875,01073563,v,9,separate the seeds from (cotton) with a cotton gin,
72876,01073674,v,9,"separate from a clinch, in boxing; 'The referee broke the boxers'",
72877,01073802,v,9,come apart; 'The two pieces that we had glued separated',
72878,01074120,v,9,undergo meiosis; 'The cells reduce',
72879,01074219,v,9,make by cutting into,
72880,01074329,v,9,cut a slit into; 'slit the throat of the victim',
72881,01074448,v,9,make a clean cut through; 'slit her throat',
72882,01074569,v,9,cut into gores; 'gore a skirt',
72883,01074661,v,9,cut or tear irregularly,
72884,01074758,v,9,lacerate by biting; of dogs,
72885,01074856,v,9,cut with a saw; 'saw wood for the fireplace',
72886,01074980,v,9,saw with a whipsaw,
72887,01075063,v,9,join by splicing; 'Splice the wires',
72888,01075181,v,9,join the ends of; 'splice wires',
72891,01075495,v,9,cut off from a whole; 'His head was severed from his body',
72892,01075648,v,9,set or keep apart; 'sever a reatlionship',
72893,01075789,v,9,crash together with violent impact: 'The cars collided'; 'Two meteors clashed',
72894,01076000,v,9,collide violently,
72895,01076088,v,9,undergo damage or destruction on impact; 'the plane crashed into the ocean'; 'The car crashed into the lamp post',
72896,01076294,v,9,break violently or noisily; smash;,
72897,01076442,v,9,cause to crash; 'The terorists crashed the car into the gate of the palace',
72898,01076634,v,9,cause to collide,
72899,01076715,v,9,crash or crash-land; 'ditch a car'; 'ditch a plane',
72900,01076829,v,9,divide into segments; 'segment an orange'; 'segment a compound word',
72901,01077017,v,9,divide into syllables; 'syllabify the words',
72902,01077154,v,9,divide into quarters; 'quarter an apple',
72903,01077267,v,9,"divide into parts, pieces, or sections; 'The Arab peninsula was partitioned by the British'",
72905,01077907,v,9,overcome or destroy; 'The ice storm got my hibiscus'; 'the cat got the goldfish',
72906,01078056,v,9,destroy completely; 'Fire had devoured our home',
72907,01078168,v,9,destroy and strip of its possession; 'The soldiers raped the beautiful country',
72908,01078339,v,9,destroy by exploding: 'The enemy destroyed the bridge',
72909,01078466,v,9,destroy completely; 'The fire consumed the building',
72910,01078583,v,9,destroy a ship: 'The vessel was shipwrecked',
72911,01078694,v,9,smash or break forcefully; 'The kid busted up the car',
72912,01078837,v,9,reduce to ruins; 'The country lay ruined after the war',
72913,01078962,v,9,damage or destroy as if by violence; 'The teenager banged up the car of his mother',
72914,01079137,v,9,pull up by or as if by the roots; 'uproot the vine that has spread all over the garden',
72915,01079342,v,9,put or set (seeds or seedlings) into the ground; 'Let's plant flowers in the garden',
72916,01079585,v,9,plant with a dibble,
72917,01079668,v,9,establish a forest on previously unforested land; 'afforest the mountains',
72918,01079853,v,9,"re-establish a forest after clear-cutting or fire, etc; 're-afforest the area that was burned during the fighting'",
72919,01080037,v,9,"forest anew; 'After the fire, they reforested the mountain'",
72920,01080162,v,9,plant again or anew; 'They replanted the land'; 'He replanted the seedlings',
72921,01080303,v,9,"conceal, suppress, or hide; 'smother a yawn'",
72922,01080454,v,9,envelop completely; 'smother the meat in gravy',
72923,01080585,v,9,deprive of the oxygen necessary for combustion; 'smother fires',
72924,01080749,v,9,suffocate; 'Othello smothered Desdemona with a pillow',
72925,01080919,v,9,set up for use; 'install the washer and dryer'; 'We put in a new sink',
72926,01081141,v,9,place; 'Her manager had set her up at the Ritz',
72927,01081273,v,9,install again; 'She reinstalled the the washer after it had been repaired',
72928,01081422,v,9,put up; 'post a sign'; 'post a warning at the dump',
72929,01081544,v,9,be too tight; rub or press; 'This neckband is chocking the cat',
72930,01081691,v,9,wring the neck of; 'The man choked his opponent',
72931,01081810,v,9,squeeze the throat of; 'he tried to strangle his opponent',
72932,01082003,v,9,cut the head of; 'the French King was beheaded during the Revolution',
72933,01082176,v,9,kill by cutting the head off with a guillotine; 'The French guillotined many Vietnamese while they occupied the country',
72934,01082364,v,9,strangle with an iron collar; 'people were garrotted during the Inquisition in Spain',
72935,01082541,v,9,kill by piercing with a spear or sharp pole; 'the enemies were impaled and left to die',
72936,01082726,v,9,kill by pulling the victim's body into pieces by having horses pull on each extremity; 'people were executed by being quartered',
72937,01082938,v,9,separate the limbs from the body; 'the tiger dismembered the tourist',
72938,01083100,v,9,tear into pieces; 'tease tissue for microscopic examinations',
72939,01083224,v,9,divide into pieces; 'our department was dismembered when our funding dried up',
72940,01083390,v,9,stretch or force to the limit; 'strain the rope',
72941,01083534,v,9,hold in a tight grasp; 'The boxer clinched his opponent'; 'clench a steering wheel',
73635,01185493,v,9,play the drums,
72944,01084148,v,9,tear into shreds,
72946,01084469,v,9,press down tightly; 'tamp the coffee grinds in the container to make espresso',
72947,01084628,v,9,press down; 'Depress the space key',
72948,01084749,v,9,cause to drop or sink; 'The lack of rain had depressed the water level in the reservoir',
72949,01084918,v,9,strike or drive against with a heavy impact; 'ram the gate with a sledgehammer',
72950,01085085,v,9,flatten with or as if with a bulldozer,
72951,01085215,v,9,drive forcibly as if by a punch; 'the nail punched through the wall',
72952,01085355,v,9,place firmly,
72953,01085489,v,9,feed as in a meadow or pasture; 'the herd was grazing',
72954,01085640,v,9,let (animals) feed in a field or pasture or meadow,
72955,01085770,v,9,protect from impact; 'cushion the blow',
72956,01085892,v,9,immerse into a liquid; 'dunk the bread into the soup',
72957,01086100,v,9,dip into liquid; 'sop bread into the sauce',
72958,01086204,v,9,Thrust or throw into; 'Immerse yourself in the hot water',
72959,01086431,v,9,put under water; 'submerge yur head completely',
72960,01086552,v,9,submerge in a liquid; 'I soaked in the hot tub for an hour',
72961,01086681,v,9,"plunge or bury in flesh, as of a knife, sword, or tusk",
72962,01086800,v,9,remove with or as if with a ladle; of liquids,
72963,01086949,v,9,take hold of something and move it to a different location; 'lift the box onto the table',
72964,01087136,v,9,lift with a pitchfork; 'pitchfork hay',
72965,01087248,v,9,ladle clumsily; 'slop the food onto the plate',
72966,01087364,v,9,scoop up or take up with a spoon; 'spoon the sauce over the roast',
72967,01087519,v,9,spread out or open from a folded state; 'open the map',
72968,01087782,v,9,spread apart; 'divaricate one's fingers',
72969,01087890,v,9,spread by opening the leaves of,
72970,01087988,v,9,spread out clothes on the grass to let it dry and bleach,
72971,01088107,v,9,enclose or enfold completely with or as if with a covering; 'Fog enveloped the house',
72972,01088442,v,9,wrap; 'The tower was involved in mist',
72973,01088545,v,9,flow over or cover completely; 'The bright light engulfed him completely',
72974,01088690,v,9,"enclose with a sheath, as of a knife or sword",
72975,01088818,v,9,"draw from a sheathe or scabbard, as of a sword",
72976,01088949,v,9,"cover with a protective sheathing, as of a ship's bottom, for example",
72977,01089083,v,9,wrap in or as if in a cocoon,
72978,01089183,v,9,suffuse with or as if with light; 'The room was bathed in sunlight',
72979,01089313,v,9,cover as if with a shroud; 'The origins of this civilization are shrouded in mystery',
72980,01089504,v,9,"enclose or envelop completely, as if by swallowing; 'The huge waves swallowed the small boat and it sank shortly thereafter'",
72981,01089750,v,9,make a mark or lines on a surface; 'draw a line'; 'draw the outlines of a figure in the sand'; 'trace an animal shape',
72982,01090084,v,9,"draw with suitable instruments and under specified conditions, of geometrical figures",
72983,01090236,v,9,draw within a figure so as to touch in as many places as possible,
72984,01090367,v,9,draw a line around; 'He drew a circle around the points',
72985,01090493,v,9,to draw a geometric figure around another figure so that the two are in contact but do not intersect,
72986,01090663,v,9,cut a groove into; 'chase silver',
72987,01090775,v,9,cut a bevel on; shape to a bevel; 'bevel the surface',
72988,01090945,v,9,"bevel the edges of, to make a miter joint",
72989,01091049,v,9,make cione-shaped; 'cone a tire',
72990,01091143,v,9,shape by rotating on a lathe; 'turn the legs of the table',
72991,01091263,v,9,push roughly; 'the people pushed and shoved to get in line',
72992,01091401,v,9,make formless; 'the heat deformed the plastic sculpture',
72993,01091547,v,9,form into breccia; 'brecciated rock',
72994,01091650,v,9,give shape to; 'form the clay into a head',
72995,01091924,v,9,divide so as to form a network,
72996,01092022,v,9,form into flakes,
72997,01092101,v,9,form with a strickle; 'strickle in sand',
73636,01185569,v,9,play the harp,
72999,01092371,v,9,release from entanglement of difficulty; 'i cannot extricate myself from this task',
73000,01092576,v,9,fool or play around with; 'Someone tampered with the documents on my desk',
73002,01092990,v,9,take by force; 'Storm the fort',
73003,01093092,v,9,open violently; 'kick in the doors',
73004,01093204,v,9,enclose in or as if in a frame; 'frame a picture',
73005,01093344,v,9,surround completely; 'Darkness enclosed him',
73006,01093769,v,9,enclose with glass; 'glass in a porch',
73007,01093881,v,9,enclose with a bank; 'bank roads',
73008,01093976,v,9,enclose with a dike; 'dike the land to protect it from water',
73009,01094106,v,9,enclose in a capsule or other small container,
73010,01094220,v,9,enclose with a fence; 'we fenced in our yard',
73011,01094347,v,9,divide by means of a rope,
73012,01094485,v,9,attach a tag or label to; 'label these bottles',
73013,01094688,v,9,attach a code to; 'Code the pieces with numbers so that you can identify them later',
73014,01094834,v,9,put a badge on; 'The workers here must be badged',
73015,01094954,v,9,rest on for support; 'you can lean on me if you get tired',
73016,01095118,v,9,to join or unite the pieces of; 'patch the skirt',
73017,01095264,v,9,piece (something old) with a new part; 'vamp up an old speech,
73018,01095397,v,9,remove the core or center from; 'core an apple',
73019,01095514,v,9,remove; 'He doffed his hat',
73020,01095614,v,9,remove the guts of; 'gut the sheep',
