30667,05000638,n,9,set of standards established and enforced by local government for the structural safety of buildings,
30668,05000798,n,9,set of standards established and enforced by government for health requirements as in plumbing etc,
30669,05000970,n,9,set of standards established and enforced by government for fire prevention and safety in case of fire as in fire escapes etc,
30670,05001151,n,9,an ethical or moral code that applies more strictly to one group than to another,
30671,05001311,n,9,a code that permits greater sexual freedom for men than for women (associated with the subordination of women),
30672,05001502,n,9,a mathematical statement that two expressions are equal,
30673,05001720,n,9,a polynomial equation of the first degree,
30674,05001823,n,9,an equation in which the highest power of an unknown quantity is a square,
30675,05001973,n,9,and equation of the fourth degree,
30676,05002087,n,9,an equation containing differentials of a function,
30677,05002259,n,9,a differential equation involving a functions of more than one variable,
30678,05002406,n,9,a differential equation that describes the passage of harmonic waves through a medium,
30679,05002551,n,9,the fundamental equation of wave mechanics,
30680,05002688,n,9,a proposal for an appropriate course of action,
30681,05002823,n,9,something (as a course of action) that is recommended,
30682,05002955,n,9,a recommendation to consult the (professional) person referred to; 'this patient is a referral from Dr. Bones',
30683,05003120,n,9,cautionary advice,
30684,05003239,n,9,punishment intended as a warning to others; 'they decided to make an example of him',
30685,05003422,n,9,information known only to a special group; 'the secret of Cajun cooking',
30686,05003611,n,9,something that should remain hidden from others (especially information that is not to be passed on); 'the combination to the safe was a secret'; 'he tried to keep his drinking a secret',
30687,05003904,n,9,a secret that is confided or entrusted to another; 'everyone trusted him with their confidences'; 'the priest could not reveal her confidences',
30688,05004104,n,9,secrets known only to an initiated minority,
30689,05004203,n,9,an esoteric or occult matter that is traditionally secret,
30691,05004524,n,9,a secret word or phrase known only to a restricted group; 'he forgot the password',
30692,05004703,n,9,a secret (method or device or formula) that gives a manufacturer an advantage over the competition,
30693,05004860,n,9,information that is spread for the purpose of promoting some cause,
30694,05004983,n,9,a catalog listing the courses offered by a college or university,
30695,05005140,n,9,a document (or organization) from which information is obtained; 'the reporter had two sources for the story',
30696,05005338,n,9,publications from which information is obtained,
30697,05005448,n,9,an abundant source; 'she was a well of information',
30698,05005578,n,9,material suitable for a journalistic account; 'catastrophes make good copy',
30699,05005723,n,9,copy to fill space between more important articles in the layout of a magazine or newspaper,
30700,05005867,n,9,a course of academic studies; 'he was admitted to a new program at the university',
30701,05006100,n,9,a program designed to teach literacy skills,
30702,05006205,n,9,a course of study leading to an academic degree,
30703,05006313,n,9,reproduction by applying ink to paper as for publication,
30704,05006587,n,9,art and technique of printing with movable type,
30705,05006705,n,9,the result of the printing process,
30706,05006809,n,9,printing from a plate with raised characters,
30707,05006929,n,9,printing from a plate with depressed characters,
30708,05007058,n,9,a method of printing colored reproductions from halftone plates,
30709,05007184,n,9,printing from an intaglio plate prepared by photographic methods,
30712,05007725,n,9,"a kind of color printing, used for the finest facsimile reproductions of works of art",
30713,05007911,n,9,a method of planographic printing from a metal or stone surface,
30714,05008086,n,9,a planographic printing process using plates made from a photographic image,
30715,05008224,n,9,single- or multi-color lithography,
30716,05008322,n,9,a method of offset printing using photomechanical plates,
30717,05008461,n,9,"a plate makes an inked impression on a rubber-blanketed cylinder, which in turn transfers it to the paper",
30718,05008673,n,9,offset printing by lithography,
30719,05008768,n,9,image is transferred from a relief type plate to a roller,
30720,05008890,n,9,an electrostatic printing process,
30721,05008980,n,9,a process of printing on paper coated with bichromated gelatin containing pigment,
30722,05009122,n,9,information reported in a newspaper or news magazine; 'the news of my death was greatly exaggerated',
30723,05009327,n,9,a short account of the news; 'the report of his speech'; 'the story was on the 11 o'clock news'; 'the account of his speech that was given on the evening news made the governor furious',
30724,05009680,n,9,report or open letter giving informal or confidential news,
30725,05009825,n,9,a newsletter written by an analyst of the stock market and sold to subscribers,
30726,05009963,n,9,a brief report especially an official statement issued for immediate publication or broadcast,
30727,05010147,n,9,a short news announcement concerning some on-going news story,
30728,05010288,n,9,a bulletin containing the latest information,
30729,05010399,n,9,an official report (usually sent in haste),
30730,05010539,n,9,a news report that is reported first by one news organization; 'he got a scoop on the bribery of city officials',
30731,05010715,n,9,a broadcast of news,
30732,05010825,n,9,a radio broadcast of news,
30733,05010907,n,9,a television broadcast of news,
30734,05010999,n,9,the news as presented by reporters for newspapers or radio of television; 'they accused the paper of biased coverage of race relations',
30735,05011213,n,9,a message that makes a pledge,
30736,05011384,n,9,swearing to the truth of a statement; to lie under oath is to become subject to prosecution for perjury,
30737,05011573,n,9,an oath taken by physicians to observe medical ethics deriving from Hippocrates,
30738,05011715,n,9,a solemn declaration that serves the same purpose as an oath (if an oath is objectionable to the person on religious or ethical grounds),
30739,05011927,n,9,affirmation of acceptance of some religion or faith; 'a profession of Christianity',
30790,05020221,n,9,excessive but superficial compliments given with affected charm,
30741,05012271,n,9,a written assurance that some product or service will be provided or will meet certain specifications,
30742,05012503,n,9,a guarantee that an obligation will be met,
30743,05012609,n,9,a payment given as a guarantee that an obligation will be met,
30744,05012724,n,9,a written certificate that gives the holder the right to purchase shares of a stock for a specified price within a specified period of time,
30745,05012923,n,9,a pledge that something will happen or that something is true; 'there is no guarantee that they are not lying',
30746,05013089,n,9,a message expressing a favorable opinion; 'words of approval seldom passed his lips',
30747,05013513,n,9,official recognition or approval,
30748,05013621,n,9,formal and explicit approval,
30749,05013809,n,9,an endorsement; 'they gave us the OK to go ahead',
30750,05013928,n,9,an endorsement made in a passport that allows the bearer to enter the country issuing it,
30751,05014086,n,9,the phrase used by the official censor of the Roman Catholic Church to say that a publication has been examined and contains nothing offensive to the Church,
30753,05014588,n,9,a recognition of meritorious service,
30754,05014727,n,9,enthusiastic recognition (especially one accompanied by loud applause),
30755,05014889,n,9,an act of honor or courteous recognition: 'a musical salute to the composer on his birthday',
30756,05015047,n,9,(law) tacit approval of someone's wrongdoing,
30757,05015182,n,9,approval to do something; 'he asked permission to leave',
30758,05015367,n,9,permission to do something; 'she was granted leave to speak',
30759,05015479,n,9,a permit to enter or leave a military installation; 'he had to show his pass in order to get out',
30760,05015642,n,9,a document indicating permission to do something without restrictions; 'the media representatives had special passes',
30761,05015881,n,9,a pass that allows you to board a ship or plane,
30762,05016004,n,9,written permission from a teacher for a student to be out the classroom and in the halls of the school,
30763,05016162,n,9,a permit formerly given to convicts allowing them to leave prison under specific restrictions,
30764,05016317,n,9,any authorization to pass or go somewhere; 'the pass to visit had a strict time limit',
30765,05016483,n,9,a document or escort providing safe passage through a region especially in time of war,
30766,05016628,n,9,permission to proceed because obstacles have been removed,
30767,05016741,n,9,the expression of approval and support,
30768,05016983,n,9,enthusiastic approval; 'the book met with modest acclaim'; 'he acknowledged the plaudits of the crowd'; 'they gave him more eclat than he really deserved',
30769,05017234,n,9,a demonstration of approval by clapping the hands together,
30770,05017447,n,9,a round of applause to signify approval; 'give the little lady a great big hand',
30771,05017578,n,9,a clap of the hands to indicate approval,
30772,05017673,n,9,an outburst of applause; 'there was a round of applause',
30773,05017781,n,9,a cry or shout of approval,
30774,05017913,n,9,a Japanese cheer of enthusiasm or triumph,
30775,05018007,n,9,a cry of approval as from an audience at the end of great performance,
30776,05018128,n,9,a sudden outburst of cheers; 'there was a salvo of approval',
30777,05018240,n,9,an expression of approval and commendation; 'he always appreciated praise for his work',
30778,05018478,n,9,offering words of homage as an act of worship; 'they sang a hymn of praise to God',
30779,05018631,n,9,a shout or song of praise to God,
30780,05018720,n,9,an exaggerated expression (usually of praise); 'the critics lavished superlatives on it',
30781,05018866,n,9,a formal expression of praise,
30782,05018986,n,9,something that recommends (or expresses commendation),
30783,05019162,n,9,a formal recommendation by a former employer to a potential future employer describing the person's qualifications and dependability; 'requests for character references are all to often answered evasively',
30784,05019457,n,9,exaggerated praise (as for promotional purposes),
30785,05019556,n,9,a remark (or act) expressing praise and admiration,
30786,05019717,n,9,a compliment that I heard about you that I offer to trade for a compliment you have heard about me,
30787,05019872,n,9,excessive or insincere praise,
30788,05019992,n,9,flattery intended to persuade,
30789,05020101,n,9,flattery designed to gain favor,
30792,05020724,n,9,something given or done as an expression of esteem,
30794,05021232,n,9,a degree granted by a two-year college on successful completion of the undergraduates course of studies,
30795,05021464,n,9,an associate degree in arts,
30796,05021560,n,9,an associate degree in applied science,
30797,05021679,n,9,an associate degree in nursing,
30798,05021781,n,9,an academic degree conferred on someone who has successfully completed undergraduate studies,
30799,05022169,n,9,a bachelor's degree in arts and sciences,
30800,05022304,n,9,a bachelor's degree in library science,
30801,05022431,n,9,a bachelor's degree in nursing,
30802,05022541,n,9,a bachelor's degree in religion,
30803,05022644,n,9,a bachelor's degree in literature,
30804,05022754,n,9,(a British degree) a bachelor's degree in medicine,
30805,05022876,n,9,a bachelor's degree in music,
30806,05022975,n,9,a bachelor's degree in naval science,
30807,05023089,n,9,a bachelor's degree in science,
30808,05023195,n,9,a bachelor's degree in architecture,
30809,05023321,n,9,a bachelor's degree in engineering,
30810,05023436,n,9,a bachelor's degree in theology,
30811,05023540,n,9,(Great Britain) a university degree with honors,
30812,05023676,n,9,(Great Britain) an honours degree of the highest class,
30813,05023829,n,9,(Great Britain) a first-class honours degree in two subjects,
30814,05023948,n,9,an academic degree higher than a bachelor's but lower than a doctor's,
30815,05024331,n,9,a degree granted for the successful completion of advanced study of architecture,
30816,05024488,n,9,a master's degree in arts and sciences,
30817,05024615,n,9,a master's degree in library science,
30818,05024738,n,9,a master's degree in teaching,
30819,05024846,n,9,a master's degree in business,
30820,05024946,n,9,a master's degree in religion,
30821,05025047,n,9,a master's degree in education,
30822,05025149,n,9,a master's degree in fine arts,
30823,05025251,n,9,a master's degree in literature,
30824,05025357,n,9,"a ,aster's degree in library science",
30825,05025471,n,9,a master's degree in questions of public concern,
30826,05025590,n,9,a master's degree in science,
30827,05025692,n,9,a master's degree in engineering,
30828,05025803,n,9,a master's degree in theology,
30829,05025903,n,9,one of the highest academic degrees conferred by a university,
30830,05026254,n,9,a doctor's degree in dental medicine,
30831,05026368,n,9,a doctor's degree in dental surgery,
30832,05026480,n,9,a doctor's degree in religion,
30833,05026579,n,9,a doctor's degree in education,
30834,05026687,n,9,a doctor's degree in medicine,
30835,05026786,n,9,a doctor's degree in music,
30836,05026888,n,9,a doctor's degree in musical arts,
30837,05026998,n,9,a doctor's degree in optometry,
30838,05027099,n,9,doctor's degree in osteopathy,
30839,05027201,n,9,a doctorate awarded for original contributions to knowledge,
30841,05027551,n,9,a British doctorate,
30842,05027622,n,9,a doctor's degree in preventive medicine,
30843,05027738,n,9,a doctor's degree in theology,
30844,05027838,n,9,degree conferred on someone who successfully completes law school,
30845,05027996,n,9,a three-year law degree,
30846,05028088,n,9,an advanced law degree,
30847,05028177,n,9,a degree conferred to honor the recipient,
30848,05028388,n,9,an honorary arts degree,
30849,05028480,n,9,an honorary degree in fine arts,
30850,05028577,n,9,an honorary degree in letters,
30851,05028677,n,9,an honorary degree in the humanities,
30852,05028780,n,9,an honorary law degree,
99997,N0001008,n,10,,
30854,05028973,n,9,the award given to the champion,
30855,05029066,n,9,an indication of approved or superior status,
30857,05029345,n,9,an official recognition of merit; 'although he didn't win the prize he did get special mention',
30858,05029514,n,9,an award earned by participation in a school sport; 'he won letters in three sports',
30859,05029668,n,9,an award for winning a championship,
30860,05030064,n,9,the highest U.S. military decoration awarded for bravery and valor in action `above and beyond the call of duty',
30861,05030268,n,9,a US military decoration for meritorious service in wartime duty of great responsibility,
30862,05030430,n,9,a US Army decoration for extraordinary heroism against an armed enemy,
30863,05030573,n,9,a US Navy decoration for extraordinary heroism against an armed enemy,
30864,05030699,n,9,a US Airforce decoration for heroism while participating in an aerial flight,
30865,05030848,n,9,a US Airforce decoration for meritorious achievement while participating in an aerial flight,
30866,05030996,n,9,a US military decoration for gallantry in action,
30867,05031122,n,9,a US military decoration awarded for meritorious service (except in aerial flight),
30868,05031282,n,9,a US military decoration awarded to any member of the armed forces who is wounded in action,
30869,05031460,n,9,a British military decoration for gallantry,
30870,05031564,n,9,a British military decoration for distinguished conduct in the field,
30871,05031706,n,9,a British military decoration for special service in action,
30872,05031839,n,9,a French military decoration for gallantry,
30873,05031943,n,9,a French military decoration,
30874,05032036,n,9,an award for success in war or hunting,
30875,05032127,n,9,the expression of disapproval,
30876,05032286,n,9,an expression of strong disapproval; pronouncing as wrong or morally culpable; 'his uncompromising condemnation of racism',
30877,05032520,n,9,harsh criticism or disapproval,
30879,05032854,n,9,disapproval expressed by pointing out faults or shortcomings; 'the senator received severe criticism from his opponent',
30880,05033196,n,9,blunt criticism,
30881,05033266,n,9,persistent petty and unjustified criticism,
30882,05033377,n,9,intense adverse criticism; 'Clinton directed his fire at Jesse Helms',
30883,05033521,n,9,verbal criticism; 'he enlivened his editorials with barbed thrusts at politicians',
30884,05033656,n,9,criticism aimed at an easy target and made without careful consideration; 'reporters took potshots at the mayor',
30885,05033822,n,9,a vigorous and unrestrained response; 'her tirade provoked a counterblast from her husband',
30886,05033972,n,9,an expression of criticism and censure; 'he had to take the rebuke with a smile on his face',
30887,05034327,n,9,a moralistic rebuke; 'your preaching is wasted on him',
30888,05034446,n,9,a severely critical attack; 'the reviewers gave his book a sound slating',
30889,05034573,n,9,severe criticism,
30890,05034645,n,9,rebuking a person harshly,
30891,05034767,n,9,a strong reprimand,
30892,05034840,n,9,British slang for a scolding,
30893,05034928,n,9,a severe scolding,
30894,05035082,n,9,a severe rebuke; 'he deserved the berating that the coach gave him',
30895,05035217,n,9,a mild rebuke or criticism; 'words of reproach',
30896,05035355,n,9,the act of blaming yourself,
30897,05035457,n,9,a reproach for some lapse or misdeed; 'he took the blame for it'; 'it was a bum rap',
30898,05035599,n,9,a lengthy rebuke; 'a good lecture was my father's idea of discipline'; 'the teacher gave him a talking to',
30899,05035817,n,9,a private lecture to a husband by his wife,
30900,05035921,n,9,a rebuke for making a mistake,
30901,05036035,n,9,a firm rebuke,
30902,05036131,n,9,(often used with `pay') a formal expression of esteem; 'he paid his respects to the mayor',
30903,05036276,n,9,a courteous or respectful or considerate remark,
30904,05036378,n,9,an expression of lack of respect,
30905,05036589,n,9,a rude expression intended to offend or hurt; 'when a student made a stupid mistake he spared them no abuse'; 'they yelled insults at the visiting team',
30906,05036881,n,9,a remark capable of wounding mentally; 'the unkindest cut of all',
30908,05037154,n,9,open disrespect for a person or thing,
30909,05037290,n,9,showing your contempt by derision,
30911,05037544,n,9,a contemptuous or scornful remark,
30912,05037640,n,9,(informal) a crushing remark,
30913,05037744,n,9,derision of someone or something as foolish or absurd or inconsistent,
30914,05037886,n,9,a communication that belittles somebody or something,
30915,05038134,n,9,a belittling comment,
30916,05038225,n,9,a disparaging remark,
30917,05038308,n,9,a petty disparagement,
30918,05038404,n,9,disparagement of something that is unattainable,
30919,05038509,n,9,a communication that indicates lack of respect by patronizing the recipient,
30920,05038666,n,9,a malicious attack,
30921,05038897,n,9,an attack intended to ruin someone's reputation,
30922,05039030,n,9,slanderous remarks or charges,
30923,05039109,n,9,slanderous defamation,
30924,05039210,n,9,a tort consisting of false and malicious publication printed for the purpose of defaming a living person,
30925,05039384,n,9,words falsely spoken that damage the reputation of another,
30926,05039532,n,9,verbal abuse; a crude substitute for argument,
30927,05039644,n,9,a defamatory or abusive word or phrase; 'sticks and stones may break my bones but names can never hurt me',
30929,05040017,n,9,foul-mouthed or obscene abuse,
30930,05040118,n,9,the expression of bitter deep-seated ill will; rancor,
30931,05040252,n,9,an impudent statement,
30932,05040370,n,9,an impudent or insolent rejoinder; 'don't give me any of your sass',
30933,05040541,n,9,a message that is stated or declared; a communication (oral or written) setting forth particulars or facts etc; 'according to his statement he was in London on that day',
30934,05041342,n,9,a nonverbal message; 'a Cadillac makes a statement about who you are'; 'his tantrums are a statement of his need for attention',
30935,05041525,n,9,a statement that is added to or revises or improves a proposal or document (a bill or constitution etc.),
30936,05041775,n,9,a statement regarded as an object; 'to say the same thing in other terms' or 'how can you say such a thing?',
30937,05041935,n,9,a true statement; 'he told the truth'; 'he thought of answering with the truth but he knew they wouldn't believe it',
30938,05042192,n,9,an unquestionable truth; 'his word was gospel',
30939,05042306,n,9,(in logic) a self-contradiction; 'I always lie',
30940,05042407,n,9,a statement that represents something in words,
30941,05042568,n,9,a detailed description of design criteria for a piece of work,
30942,05042732,n,9,the art of assembling logical elements into a computing device; the specification of the relation between parts of a computer system,
30943,05042932,n,9,specification of design principles (including data formats and procedures) for creating a network configuration of data processors,
30944,05043129,n,9,emphatic or explicit statement,
30945,05043361,n,9,a formal public statement; 'the government made an announcement about changes in the drug war',
30946,05043559,n,9,a public declaration of intentions (as issued by a political party or government),
30947,05043713,n,9,an authoritative declaration,
30948,05043837,n,9,a statement of fundamental rights and privileges (especially the first ten amendments to the US Constitution),
30949,05044064,n,9,an amendment to the Constitution of the United States guaranteeing the right of free expression; includes freedom of assembly and freedom of the press and freedom of religion and freedom of speech,
30951,05044644,n,9,an amendment to the Constitution of the United States adopted in 1868; extends the guarantees of the Bill of Rights to the states as well as to the federal government,
30952,05044896,n,9,an amendment to the Constitution of the United States adopted in 1920; prohibited the manufacture and sale of alcoholic beverages; repealed in 1932,
30953,05045129,n,9,an amendment to the Constitution of the United State adopted in 1920; guarantees that no state can deny the right to vote on the basis of sex,
30954,05045355,n,9,a declaration that is made as if no supporting evidence were necessary,
30955,05045651,n,9,an assertion of a right (as to money or property); 'his claim asked for damages',
31409,05120065,n,9,the 23rd letter of the Greek alphabet,
30957,05045982,n,9,an assertion that someone is guilty of a fault or offence; 'the newspaper published charges that Jones was guilty of drunken driving',
30958,05046181,n,9,statements affirming or denying certain matters of fact,
30959,05046324,n,9,a point asserted as part of an argument,
30960,05046420,n,9,an unsupported assertion,
30961,05046501,n,9,a group of symbols that make a mathematical statement,
30962,05046657,n,9,a conventionalized statement expressing some fundamental principle,
30963,05046777,n,9,a statement of a mathematical relation,
30964,05046939,n,9,a statement asserting the existence or the truth of something,
30965,05047103,n,9,an assertion offering firsthand authentication of a fact; 'according to his own testimony he can't do it',
30966,05047264,n,9,an open avowal (true or false) of some belief or opinion; 'a profession of disagreement',
30967,05047422,n,9,a strong declaration of protest,
30968,05047512,n,9,a declaration of something self-evident; something that can be assumed as the basis for argument,
30969,05047680,n,9,declaration of an intention or a determination to inflict harm on another; 'his threat to kill me was quite explicit',
30970,05047886,n,9,a threat of divine punishment or vengeance,
30971,05047986,n,9,a threat or the act of threatening; 'he spoke with desperate menace',
30973,05048417,n,9,an object or statement produced before a court of law and referred to while giving evidence,
30974,05048562,n,9,a solemn statement made under oath,
30975,05048706,n,9,testimony by word or deed to your religious faith,
30976,05048809,n,9,the body of evidence that constitute the offence; the objective proof that a crime has been committed (sometimes mistakenly thought to refer to the body of a homicide victim),
30977,05049044,n,9,evidence (usually the testimony of a witness) directly related to the fact in dispute,
30978,05049209,n,9,evidence providing only a basis for inference about the fact in dispute,
30979,05049388,n,9,evidence based on what someone has told the witness and not of direct knowledge,
30980,05049531,n,9,evidence for the prosecution in criminal proceedings,
30981,05049646,n,9,unsworn statement in a legal transaction,
30982,05049744,n,9,written declaration made under oath,
30983,05049880,n,9,(bridge) the number of tricks a bridge player is willing to contract to make,
30984,05050089,n,9,(bridge) the highest bid becomes the contract setting the number of tricks that the bidder must make,
30985,05050263,n,9,(bridge) a bid that asks your partner to bid another suit,
