s governing a particular activity or a legal document setting forth such a rule; 'there is a law against kidnapping',
30077,04904974,n,9,a statute prescribing the time period during which legal action can be taken,
30078,04905119,n,9,law determining the fundamental political principles of a government,
30079,04905296,n,9,the constitution written at the Constitutional Convention in Philadelphia in 1787 and subsequently ratified by the original thirteen states,
30080,04905639,n,9,a law affecting the public at large,
30081,04905731,n,9,the legal code of ancient Rome; codified under Justinian; the basis for many modern systems of civil law,
30082,04905933,n,9,the code of laws of the Salian Franks and other German tribes,
30083,04906050,n,9,(civil law) a law established by following earlier judicial decisions,
30084,04906199,n,9,a law enacted by a legislative body,
30085,04906379,n,9,legislation intended to promote free competition in the market place by outlawing monopolies,
30086,04906555,n,9,legislation that gives appropriate officials the authority to implement or enforce the law,
30087,04906712,n,9,a law passed by US Congress to prevent employees from being injured or contracting diseases in the course of their employment,
30089,04907163,n,9,a record of the whole body of legislation in a given jurisdiction,
30090,04907306,n,9,a statute in draft before it becomes law; 'they held a public hearing on the bill',
30092,04907738,n,9,a legislative act finding a person guilty of treason or felony without a trial,
30093,04907880,n,9,a statute that would require merchants to reclaim used bottles,
30094,04908000,n,9,a statute that would regulate farm production and prices,
30095,04908112,n,9,a statute that would regulate foreign trade,
30096,04908212,n,9,a rule made by a local authority to regulate its own affairs,
30097,04908334,n,9,a statute regulating work on Sundays,
30099,04908603,n,9,a law conferring privileges on owners of homesteads,
30100,04908714,n,9,a law providing support for the poor,
30101,04908805,n,9,a former English law requiring mobs to disperse after a magistrate reads the law to them,
30102,04908967,n,9,a vigorous reprimand; 'I read him the riot act',
30103,04909069,n,9,the body of law dealing with crimes and their punishment,
30104,04909203,n,9,a writ issued by a court of law requiring a person to do something or to refrain from doing something,
30105,04909380,n,9,a legally binding command or decision entered on the court record (as if issued by a court or judge); 'a friend in New Mexico said that the order caused no trouble out there',
30106,04909767,n,9,an order that after a specific time certain activities (as being outside on the streets) are prohibited,
30107,04909923,n,9,a decree issued on a first petition for divorce; becomes absolute at some later date,
30108,04910065,n,9,an order to an offending party to rid itself of property; it has the purpose of depriving the defendant of the gains of wrongful behavior; 'the court found divestiture to be necessary in preventing a monopoly',
30109,04910332,n,9,a decree issued by a sovereign ruler,
30110,04910466,n,9,an edict of the Russian tsar,
30111,04910546,n,9,a judicial decree regulating the rights and responsibilities of a married couple living apart,
30112,04910724,n,9,an imperial decree that becomes part of the fundamental law of the land,
30113,04910860,n,9,an edict that has been publicly posted,
30114,04910954,n,9,a law forbidding the sale of alcoholic beverages; 'in 1920 the 18th amendment to the Constitution established prohibition in the US',
30115,04911144,n,9,a decree that prohibits something,
30116,04911307,n,9,a judicial order forbidding some action until an event occurs or the order is lifted; 'the Supreme Court has the power to stay and injunction pending an appeal to the whole Court',
30117,04911555,n,9,an order whereby a judgment is precluded from being executed for a specific period of time,
30118,04911709,n,9,an order that bans something,
30119,04911797,n,9,(law) a judicial remedy issued in order to prohibit a party from doing or continuing to do a certain activity,
30120,04911988,n,9,a document stating the facts and points of law of a client's case,
30121,04912137,n,9,a brief presented by someone interested in influencing the outcome of a lawsuit but who is not a party to it,
30122,04912311,n,9,a legal document declaring a person's wishes regarding the disposal of their property when they die,
30123,04912546,n,9,a judicial certificate saying that a will is genuine and conferring on the executors the power to administer the estate,
30124,04912734,n,9,a supplement to a will; a testamentary instrument intended to alter an already executed will,
30126,04913178,n,9,a legal document signed and sealed and delivered to effect a transfer of property and to show the legal right to possess it; 'he signed the deed'; 'he kept the title to his car in the glove compartment',
30127,04913532,n,9,the instrument by which a claim or right or interest or property is transferred from one person to another,
30128,04913695,n,9,a deed transferring personal property,
30129,04913791,n,9,a deed made and executed by only one party,
30130,04913889,n,9,deed embodying a mortgage,
30131,04913974,n,9,a legal document proving a person's right to property,
30132,04914102,n,9,a written instrument legally conveying property to a trustee often used to secure an obligation such as a mortgage or promissory note,
30133,04914308,n,9,document effecting a property transfer,
30134,04914421,n,9,document transferring title or right or claim to another,
30135,04914550,n,9,deeds and other documentary evidence of title to land,
30136,04914659,n,9,an authorization allowing police to perform specified acts,
30137,04914897,n,9,a warrant to search,
30138,04914977,n,9,a warrant to apprehend an offender,
30140,04915240,n,9,a warrant to execute the death sentence,
30141,04915339,n,9,French history: the king could warrant imprisonment or death in a signed letter under his seal,
30142,04915505,n,9,a warrant granting postponement (usually to postpone the execution of the death sentence),
30143,04915649,n,9,a warrant substituting a lesser punishment for a greater one,
30145,04916087,n,9,a tax return that corrects the information in an earlier return,
30146,04916211,n,9,return required of a taxpayer whose tax withheld from income does not meet the tax liability for the year,
30147,04916415,n,9,an incorrect income tax return,
30148,04916504,n,9,a return that provides information to the tax collector but does not compute the tax liability,
30149,04916663,n,9,a return filed by a husband and wife,
30150,04916758,n,9,a legal document giving official permission to do something,
30151,04917060,n,9,a document authorizing the holder to construct a building of a particular kind on a particular lot,
30152,04917220,n,9,a license authorizing the bearer to drive a motor vehicle,
30153,04917340,n,9,a license authorizing the bearer to fish during a specified period of time,
30154,04917476,n,9,a license authorizing the bearer to kill a certain type of animal during a specified period of time,
30155,04917652,n,9,a document authorizing the bearer to learn to drive an automobile,
30156,04917780,n,9,a license to a private citizen to seize property of another nation,
30157,04917959,n,9,a license authorizing the holder to sell alcoholic beverages,
30158,04918098,n,9,a license to sell liquor for consumption on the premises,
30159,04918211,n,9,a license authorizing a man and a woman to marry,
30160,04918340,n,9,a license to pursue a particular occupation,
30161,04918448,n,9,an official document granting a right or privilege,
30162,04918568,n,9,the legal document stating the reasons for a judicial decision; 'opinions are usually written by a single judge',
30163,04918829,n,9,an opinion that agrees with the court's disposition of the case but is written to express a particular judge's reasoning,
30164,04919014,n,9,an opinion that disagrees with the court's disposition of the case,
30165,04919145,n,9,the opinion joined by a majority of the court (generally known simply as `the opinion'),
30166,04919295,n,9,a warrant granting release from punishment for an offense,
30167,04919415,n,9,a legal document evidencing the discharge of a debt or obligation,
30168,04919548,n,9,a legal document issued by a court or judicial officer,
30169,04919975,n,9,an ancient writ issued by a court of assize to the sheriff for the recovery of property,
30170,04920115,n,9,a common law writ issued by a superior court to one of inferior jurisdiction demanding the record of a particular case,
30171,04920311,n,9,a writ ordering a prisoner to be brought before a judge,
30172,04920450,n,9,a judicial writ ordering a sheriff to summon people for jury duty,
30174,04920862,n,9,a writ ordering a levy on the belongings of a debtor to satisfy the debt,
30175,04920993,n,9,a judicial writ based on some record and requiring the party against whom it is brought to show cause why the record should not be enforced or annulled,
30176,04921203,n,9,a writ ordering the release of goods that have been unlawfully detained,
30177,04921336,n,9,a writ ordering that a judgment be enforced,
30178,04921443,n,9,a writ ordering the holding of an election,
30179,04921548,n,9,a judicial writ from an appellate court ordering the court of record to produce the records of trial,
30180,04921708,n,9,a judicial writ from a higher court ordering a lower court not to exercise jurisdiction in a particular case,
30181,04921882,n,9,a writ ordering that land be restored to its rightful owner,
30182,04922001,n,9,a document giving an official instruction or command,
30183,04922159,n,9,a writ issued by authority of law; usually compels the defendant's attendance in a civil suit; failure to appear results in a default judgment against the defendant,
30184,04922423,n,9,a writ issued by court authority to compel the attendance of a witness at a judicial proceeding; disobedience may be punishable as a contempt of court,
30185,04922656,n,9,a writ issued by a court at the request of one of the parties to a suit; it requires a witness to bring to court or to a deposition any relevant documents under the witness's control,
99995,N0001004,n,10,,
30188,04923203,n,9,a ticket issued for driving above the speed limit,
30189,04923314,n,9,a ticket issued for parking in a restricted place,
30190,04923424,n,9,(law) an allegation in legal form stating something on behalf of a party to a legal proceeding,
30191,04923807,n,9,any defensive pleading that affirms facts rather than merely denying the facts alleged by the plaintiff,
30192,04923977,n,9,a pleading that alleges facts so separate that it is difficult to determine which facts the person intends to rely on,
30194,04924658,n,9,(law) an answer by a defendant that fails to admit or deny the allegations set forth in the complaint,
30195,04924820,n,9,(criminal law) an answer of `no contest' by a defendant who does not admit guilt but that subjects him to conviction,
30196,04925009,n,9,(law) a defendant's answer by a factual matter (as distinguished from a demurrer),
30197,04925177,n,9,a plea that delays the action without settling the cause of action; it can challenge the jurisdiction or claim disability of the defendant etc. (such defenses are usually raised in the defendant's answer),
30198,04925441,n,9,(criminal law) a plea in which the defendant claims innocence due to mental incompetence at the time,
30199,04925620,n,9,(criminal law) a pleading describing some wrong or offense; 'he was arrested on a charge of larceny',
30200,04925822,n,9,(civil law) the first pleading of the plaintiff setting out the facts on which the claim for relief is based,
30201,04925986,n,9,any pleading that fails to conform in form or substance to minimum standards of accuracy or sufficiency,
30202,04926154,n,9,any pleading that attacks the legal sufficiency of the opponent's pleadings,
30203,04926284,n,9,a pleading by the defendant in reply to a plaintiff's surrejoinder,
30204,04926416,n,9,a pleading made by a plaintiff in reply to the defendant's plea or answer,
30205,04926547,n,9,a pleading made by a defendant in response to the plaintiff's replication,
30206,04926676,n,9,a pleading that alleges new facts in avoidance of the opposing allegations,
30207,04926813,n,9,a pleading by the plaintiff in reply to the defendant's rebutter,
30208,04926949,n,9,a pleading by the plaintiff in reply to the defendant's rejoinder,
30209,04927073,n,9,(criminal law) a negotiation in which the defendant agrees to enter a plea of guilty to a lesser charge and the prosecutor agrees to drop a more serious charge,
30210,04927294,n,9,an act passed by a legislative body,
30211,04927456,n,9,a provision in a law that confers on appropriate officials the power to implement or enforce the law,
30212,04927633,n,9,a legislative act that applies only to a particular person or particular district,
30213,04927772,n,9,(computer science) written programs or procedures or rules and associated documentation pertaining to the operation of a computer system and that are stored in read/write memory,
30214,04928310,n,9,a first release of a software product that is usually tested only by the developers,
30215,04928454,n,9,software that can be used to develop interactive computer programs without the technically demanding task of computer programming,
30216,04928648,n,9,pre-release software that has received an alpha test but still has more bugs than a regular release; 'beta software is usually available only to particular users who will test it',
30217,04928887,n,9,software that can run on different computers without modification,
30218,04929018,n,9,application software programs that share common conventions so they can be utilized together,
30219,04929176,n,9,software used in art and architecture and engineering and manufacturing to assist in precision drawing,
30220,04929352,n,9,software that is provided without charge,
30221,04929447,n,9,software that can be used by a group of people who are working on the same information but may be distributed in space,
30222,04929621,n,9,(computer science) software that controls the execution of computer programs and may provide various services,
30223,04929853,n,9,an operating system that is on a disk,
30224,04929982,n,9,an operating system developed by Microsoft for IBM computers,
30225,04930129,n,9,a powerful operating system developed at the Bell Telephone Laboratories,
30226,04930290,n,9,(computer science) a sequence of instructions that a computer can interpret and execute; 'the program required several hundred lines of code',
30227,04931025,n,9,a program that gives a computer instructions that provide the user with tools to accomplish a task; 'he has tried several different word processing applications',
30228,04931399,n,9,an application that is currently running and in the foreground,
30230,04931684,n,9,a program used to view HTML documents,
30231,04931825,n,9,a freeware browser,
30232,04931896,n,9,a commercial browser,
30233,04931971,n,9,(computer science) a program application that may consist of several steps but is a single logical unit,
30234,04932124,n,9,an application that provides the user with tools needed to write and edit and format text and to send it to a printer,
30235,04932327,n,9,a computer program that performs a series of instructions repeatedly until some specified condition is satisfied,
30236,04932490,n,9,a short set of commands to correct a bug in a computer program,
30237,04932604,n,9,a program to translate assembly language into computer language,
30238,04932742,n,9,a program that examines other computer programs for syntax errors,
30239,04932870,n,9,(computer science) a program that decodes instructions written in a higher order language and produces a machine language program,
30240,04933146,n,9,a compiler for programs written in C,
30241,04933239,n,9,a compiler for programs written in Fortran,
30242,04933344,n,9,a compiler for programs written in LISP,
30243,04933443,n,9,a compiler for programs written in Pascal,
30244,04933546,n,9,a program that helps in locating and correcting programming errors,
30245,04933667,n,9,(computer science) a program that determines how a computer will communicate with a peripheral device,
30246,04933837,n,9,a program that recognizes and explains faults in the equipment or mistakes in a computer program,
30248,04934230,n,9,a utility program that organizes the input to a computer,
30249,04934365,n,9,(computer science) a program that controls a display for the user (usually on a computer monitor) and that allows the user to interact with the system,
30250,04934624,n,9,a user interface in which you type commands instead of choosing them from a menu or selecting an icon,
30251,04934800,n,9,a user interface based on graphics (icons and pictures and menus) instead of text; uses a mouse as well as a keyboard as an input device,
30252,04935051,n,9,(computer science) a program that translates and executes source language statements one line at a time,
30253,04935235,n,9,a program that is called to prepare each job to be run,
30254,04935347,n,9,a program in a program library,
30255,04935458,n,9,an editor program that creates one module from several by resolving cross-references among the modules,
30256,04935621,n,9,a program that observes and regulates and controls or verifies the operations of a data-processing system,
30257,04935809,n,9,(computer science) an application that can be used to create and view and edit text files,
30258,04935956,n,9,a fully compiled or assembled program ready to be loaded into the computer,
30259,04936126,n,9,a program written in a language from which statements are translated into machine language,
30260,04936295,n,9,a utility program that organizes the output of a computer,
30261,04936432,n,9,a program that can be located in different parts of memory at different times,
30262,04936575,n,9,a program that can be loaded once and executed repeatedly,
30263,04936695,n,9,a program that can change its performance in response to its environment,
30264,04936835,n,9,a trace program that produces output for selected conditions,
30265,04936958,n,9,a screen-oriented interactive program enabling a user to lay out financial data on the screen,
30266,04937109,n,9,a utility program that sorts data items,
30267,04937225,n,9,a program that controls the execution of other programs,
30268,04937418,n,9,a program to check natural language syntax,
30269,04937521,n,9,a program (as an operating system or compiler or utility program) that controls some aspect of the operation of a computer,
30270,04937741,n,9,a utility program that exhibits the sequence and results of executing the instructions in another program,
30271,04937943,n,9,a program that translates one programming language into another,
30272,04938103,n,9,(computer science) a program designed for general support of the processes of a computer; 'a computer system provides utility programs to perform the tasks needed by most users',
30273,04938497,n,9,a table or matrix of all contingencies and the actions to be taken for each,
30274,04938633,n,9,a diagram of the sequence of operations in a computer program,
30275,04938766,n,9,a graphical representation of a program using formal logic,
30276,04938902,n,9,"a set sequence of steps, part of larger computer program",
30328,04947438,n,9,a periodical that is published every week,
30278,04939467,n,9,a call that passes control to a subroutine; after the subroutine is executed control returns to the next instruction in main program,
30279,04939659,n,9,a set of control statements that have been placed in a library and can be retrieved by name,
30280,04939835,n,9,an alternative to the normal procedure; triggered if an unusual but anticipated situation arises,
30281,04939999,n,9,a routine that writes from an internal store to some external medium,
30282,04940126,n,9,a routine that writes from an external source to an internal store,
30283,04940271,n,9,a debugged routine that is maintained in a program library,
30284,04940410,n,9,a routine that controls an output device,
30285,04940530,n,9,a routine designed to yield a random number,
30286,04940643,n,9,a routine that can call itself,
30287,04940737,n,9,a routine that can be loaded once and executed repeatedly,
30288,04940857,n,9,a routine that coordinates the operation of subroutines,
30289,04941017,n,9,a routine that provides a chronological record of the execution of a computer program,
30290,04941183,n,9,a routine that can be used as needed,
30291,04941372,n,9,(computer science) a line of code written as part of a computer program,
30292,04941647,n,9,commands that a user types in in order to run an application,
30293,04941766,n,9,a single computer instruction that results in a series of instructions in machine language,
30294,04941908,n,9,an instruction that is either not recognized by an operating system or is in violation of the procedural rules,
30295,04942077,n,9,an instruction that interrupts the program being executed and passes control to the supervisor,
30296,04942259,n,9,any instruction that works first one way and then the other; it turns something on the first time it is used and then turns it off the next time,
30297,04942456,n,9,software that has been copyrighted but is sold to users with permission to copy it and give it to others,
30298,04942616,n,9,specialized programs that reside permanently in the computer's main memory and control the processing of user's programs,
30299,04942803,n,9,program listings or technical manuals describing the operation and use of programs,
30300,04942970,n,9,(computer science) a database that can be accessed by computers,
30301,04943225,n,9,a software system that facilitates the creation and maintenance and use of an electronic database,
30302,04943438,n,9,a database management system designed to manage a relational database,
30303,04943591,n,9,a database management system designed to manage an object-oriented database,
30305,04944010,n,9,a printed work offered for distribution,
30306,04944401,n,9,something that is read; 'the article was a very good read',
30307,04944510,n,9,all the copies of a work printed at one time; 'they ran off an initial printing of 2000 copies',
30308,04944727,n,9,the form in which a text (especially a printed book) is published,
30309,04944882,n,9,an edition that is restricted to a specific number of copies,
30310,04945004,n,9,an edition containing various versions of a text or notes by various scholars or editors,
30311,04945166,n,9,(printing) a trial impression made to check for errors,
30312,04945320,n,9,a proof taken before the type is broken up to print pages,
30313,04945436,n,9,a proof taken from a form before duplicate plates are made,
30314,04945554,n,9,a printed impression that is blurred or doubled,
30315,04945654,n,9,a publication containing a variety of works,
30316,04945821,n,9,a collection of selected literary passages,
30317,04945955,n,9,one or more phonograph records or tape recordings issued together,
30318,04946087,n,9,a collection of Persian or Arabic poems (usually by one author),
30319,04946210,n,9,an anthology of short literary pieces and poems and ballads etc.,
30320,04946355,n,9,collection of records especially about an institution,
30321,04946463,n,9,something that is compiled (as into a single book or file),
30322,04946588,n,9,a publication that appears at fixed intervals,
30323,04946816,n,9,a periodical that summarizes the news,
30324,04946906,n,9,a periodical (magazine or newspaper) containing many pictures,
30325,04947023,n,9,a periodical that appears at scheduled times,
30326,04947242,n,9,a periodical that is published every month,
30327,04947338,n,9,a periodical that is published every quarter,
30330,04947696,n,9,a periodical published by a business firm for its employees and customers,
30331,04947827,n,9,a periodic paperback publication; 'it takes several years before a magazine starts to break even or make money',
30332,04948091,n,9,a racing publication giving information on horses,
30333,04948213,n,9,an inexpensive magazine printed on poor quality paper,
30334,04948333,n,9,a magazine printed on good quality paper,
30335,04948442,n,9,a magazine devoted to comic strips,
30336,04948541,n,9,one of a series published periodically; 'she found an old issue of the magazine in her dentist's waitingroom',
30337,04948748,n,9,an issue of a newspaper; 'he read it in yesterday's edition of the Times',
30338,04948875,n,9,a periodical dedicated to a particular subject; 'he reads the medical journals',
30339,04949026,n,9,reports of the work of a society or learned body etc,
30340,04949131,n,9,a periodical that publishes critical essays on current affairs or literature or art,
30341,04949285,n,9,a review devoted to literary criticism,
30342,04949385,n,9,written material intended to be read; 'the teacher assigned new readings',
30343,04949512,n,9,reading carefully with intent to remember,
30344,04949643,n,9,reading superficially or at random,
30345,04949741,n,9,reading or glancing through quickly,
30346,04949838,n,9,what a communication that is about something is about,
30347,04950524,n,9,(psychoanalysis) hidden meaning of a fantasy or dream,
30349,04950917,n,9,a message that departs from the main subject,
30350,04951064,n,9,a message written in a secret code,
30351,04951160,n,9,a sentence (in the indicative mood) that makes a declaration,
30352,04951310,n,9,an ungrammatical sentence in which two or more independent clauses are conjoined without a conjunction,
30353,04951474,n,9,a sentence that states the topic of its paragraph,
30354,04951584,n,9,the message that is intended or expressed,
