31281,05098382,n,9,a human skull (or a representation of a human skull) used as a symbol of death,
31282,05098519,n,9,the Hindu phallic symbol of Siva,
31283,05098604,n,9,a technical system of symbols used to represent special things,
31284,05098813,n,9,a notation used by mathematicians,
31285,05099149,n,9,any notation for the representation of numbers,
31286,05099347,n,9,a numeration system in which a real number is represented by an ordered set of characters where the value of a character depends on its position,
31287,05099664,n,9,any notation that uses 2 characters (usually 0 and 1),
31288,05099779,n,9,a positional system of numeration that uses binary digits and a radix of 2,
31289,05099995,n,9,a positional system of numeration that uses octal digits and a radix of 8,
31290,05100160,n,9,any notation that uses 10 different characters (usually the digits 0 to 9),
31291,05100297,n,9,the Arabic (or decimal) system of numeration,
31292,05100396,n,9,a positional system of numeration that uses decimal digits and a radix of 10,
31293,05100603,n,9,any notation that uses 16 different characters,
31294,05100739,n,9,a positional system of numeration that uses hexadecimal digits and a radix of 16,
31295,05100940,n,9,a character indicating a relation between quantities; 'don't forget the minus sign',
31296,05101128,n,9,a sign indicating that the quantities on either side are equal,
31297,05101248,n,9,a sign indicating the operation of addition,
31298,05101347,n,9,a sign indicating the operation of subtraction,
31299,05101450,n,9,the dot at the left of a decimal fraction,
31300,05101570,n,9,a mathematical notation indicating the number of times a quantity is multiplied by itself,
31301,05101766,n,9,a sign placed in front of an expression to denote that a root is to be extracted,
31302,05101915,n,9,the exponent required to produce a given number,
31303,05102060,n,9,the number of which a given number is the logarithm,
31304,05102181,n,9,a logarithm to the base 10,
31305,05102270,n,9,a logarithm to the base e,
31407,05119853,n,9,the 21st letter of the Greek alphabet,
31308,05102772,n,9,a radix numeration system in which the location of the decimal point is fixed by convention,
31310,05103264,n,9,a notation for forming mathematical expressions using parentheses and governed by rules of operator precedence; operators are dispersed among the operands,
31311,05103479,n,9,a notation for forming mathematical expressions that does not use parentheses to delimit components,
31312,05103686,n,9,a parenthesis-free notation for forming mathematical expressions in which each operator precedes its operands,
31313,05103898,n,9,a parenthesis-free notation for forming mathematical expressions in which each operator follows its operands,
31314,05104113,n,9,a notation used by musicians,
31315,05104658,n,9,a sheet containing the words and melody for a song (and some indication of harmony) written in simple form,
31316,05104821,n,9,a written form of a musical composition; parts for different instruments appear on separate staves on large pages; 'he studied the score of the sonata',
31317,05105059,n,9,a part of the score that must be performed without change or omission,
31318,05105195,n,9,a musical composition in printed or written form; 'she turned the pages of the music as he played',
31319,05105395,n,9,a musical notation indicating the fingering to be used,
31320,05105505,n,9,a notation used by choreographers,
31321,05105597,n,9,a notation used by chemists to express technical facts in chemistry,
31322,05105747,n,9,a representation of a substance using symbols for its constituent elements,
31323,05105949,n,9,a chemical formula based on analysis and molecular weight,
31324,05106088,n,9,an expanded molecular formula showing the arrangement of atoms within the molecule,
31325,05106235,n,9,a chemical formula showing the ratio of elements in a compound rather than the total number of atoms,
31326,05106399,n,9,a written or printed symbol,
31327,05106558,n,9,a written or printed symbol (as for punctuation); 'his answer was just a punctuation mark',
31328,05106879,n,9,a mark to indicate a direction or relation,
31329,05107021,n,9,a mark shaped like an arrowhead; used to mark convicts' clothing,
31330,05107143,n,9,a mark consisting of characters written on a book; used to indicate shelf location,
31331,05107307,n,9,a mark used by an author or editor to indicate where something is to be inserted into a text,
31332,05107451,n,9,a mark indicating that something has been noted or completed etc; 'as he called the role he put a check mark by each student's name',
31333,05107649,n,9,a written symbol that is used to represent speech; 'the Greek alphabet has 24 characters',
31334,05108182,n,9,a variant form of a grapheme as `m' or `M',
31335,05108280,n,9,a character or symbol set or printed or written above and immediately to one side of another character,
31336,05108469,n,9,a character or symbol set or printed or written beneath or slightly below and to the side of another character,
31337,05108664,n,9,any member of the standard code for representing characters by binary numbers,
31338,05108840,n,9,ASCII characters to indicate carriage return or tab or backspace; typed by depressing a key and the control key at the same time,
31339,05109076,n,9,a control character that indicates moving a space to the left,
31340,05109203,n,9,a mark added to a letter to indicate a special pronunciation,
31341,05109482,n,9,a mark used to indicate the word above it should be repeated,
31342,05109607,n,9,a mark ($) written before a number to indicate that it stands for the number of dollars,
31343,05109766,n,9,a symbol of commercialism or greed; 'he worships the almighty dollar' or 'the dollar sign means little to him',
31344,05109957,n,9,a line that forms the length of an arrow pointer,
31345,05110076,n,9,any written symbol standing for a sound or syllable or morpheme or word,
31346,05110203,n,9,a V-shaped mark at one end of an arrow pointer; 'the point of the arrow was due north',
31347,05110367,n,9,a diacritical mark used to indicate stress or (in some languages) placed above a vowel to indicate a special pronunciation,
31348,05110610,n,9,a mark indicating the stress on a syllable,
31349,05110710,n,9,a mark (') placed above a vowel to indicate pronunciation,
31350,05110841,n,9,a mark (`) placed above a vowel to indicate pronunciation,
31351,05110965,n,9,a diacritical mark (u-curved) placed over a vowel to indicate a short sound,
31352,05111092,n,9,"a diacritical mark (,) placed below the letter c to indicate that it is pronounced as an s",
31408,05119959,n,9,the 22nd letter of the Greek alphabet,
31355,05111563,n,9,a diacritical mark (-) placed above a vowel to indicate a long sound,
31357,05111883,n,9,a diacritical mark (two dots) placed over a vowel in German to indicate a change in sound,
31358,05112048,n,9,a graphic symbol consisting of 2 or more letters combined (usually your initials); printed on stationery or embroidered on clothing,
31359,05112234,n,9,printers once kept type for capitals and small letters in separate cases; capitals were kept in the upper half of the type case,
31360,05112484,n,9,the characters that were once kept in bottom half of a compositor's type case,
31361,05112671,n,9,a character having the form of an upper-case letter but the same height as lower-case letters,
31362,05112836,n,9,printed characters; 'small type is hard to read',
31363,05112971,n,9,a complete set of type suitable for printing text,
31364,05113097,n,9,a specific size and style of type within a type family,
31365,05113391,n,9,a typeface is which each character is given the same width (as by a typewriter),
31366,05113609,n,9,any font whose different characters have different widths,
31367,05113802,n,9,(computer science) any font that is contained in a cartridge that can be plugged into a computer printer,
31368,05113984,n,9,a heavy typeface in use from 15th to 18th centuries,
31369,05114103,n,9,a typeface (based on an 18th century design by Giambattista Bodoni) distinguished by regular shape and hairline serifs and heavy downstrokes,
31370,05114351,n,9,a typeface (based on an 18th century design) distinguished by irregularity and slanted ascender serifs and little contrast between light and heavy strokes,
31371,05114596,n,9,a typeface with thick heavy lines,
31372,05114684,n,9,a typeface with letters slanting upward to the right,
31373,05114789,n,9,a typeface used in ancient Roman inscriptions,
31374,05114929,n,9,(computer science) the font that is displayed on a computer screen; 'when the screen font resembles a printed font a document may look approximately the same on the screen as it will when printed',
31375,05115197,n,9,a typeface in which characters have no serifs,
31376,05115311,n,9,a short line at the end of the main strokes of a character,
31377,05115430,n,9,%,
31378,05115508,n,9,a star-shaped character * used in printing,
31379,05115612,n,9,a character used in printing to indicate a cross reference or footnote,
31380,05115745,n,9,a character used in printing to indicate a cross reference or footnote,
31381,05115901,n,9,the conventional characters of the alphabet used to represent speech; 'his grandmother taught him his letters',
31382,05117158,n,9,two successive letters (especially two letters used to represent a single sound: `sh' in `shoe'),
31383,05117308,n,9,the letter H,
31384,05117372,n,9,the letter L,
31385,05117434,n,9,the letter Z; 'the British call Z zed but Americans call it zee',
31386,05117554,n,9,the first letter of a word (especially a person's name); 'he refused to put the initials FRS after his name',
31387,05117716,n,9,the 1st letter of the Greek alphabet,
31388,05117823,n,9,the 2nd letter of the Greek alphabet,
31389,05117929,n,9,the 3rd letter of the Greek alphabet,
31390,05118036,n,9,the 4th letter of the Greek alphabet,
31391,05118143,n,9,the 5th letter of the Greek alphabet,
31392,05118252,n,9,the 6th letter of the Greek alphabet,
31393,05118358,n,9,the 7th letter of the Greek alphabet,
31394,05118463,n,9,the 8th letter of the Greek alphabet,
31395,05118570,n,9,the 9th letter of the Greek alphabet,
31396,05118676,n,9,the 10th letter of the Greek alphabet,
31397,05118784,n,9,the 11th letter of the Greek alphabet,
31398,05118893,n,9,the 12th letter of the Greek alphabet,
31399,05118998,n,9,the 13th letter of the Greek alphabet,
31400,05119103,n,9,the 14th letter of the Greek alphabet,
31401,05119208,n,9,the 15th letter of the Greek alphabet,
31402,05119318,n,9,the 16th letter of the Greek alphabet,
31403,05119423,n,9,the 17th letter of the Greek alphabet,
31404,05119529,n,9,the 18th letter of the Greek alphabet,
31405,05119637,n,9,the 19th letter of the Greek alphabet,
31406,05119743,n,9,the 20th letter of the Greek alphabet,
31411,05120286,n,9,the 1st letter of the Hebrew alphabet,
31412,05120394,n,9,the 2nd letter of the Hebrew alphabet,
31413,05120501,n,9,the 3rd letter of the Hebrew alphabet,
31414,05120609,n,9,the 4th letter of the Hebrew alphabet,
31415,05120718,n,9,the 5th letter of the Hebrew alphabet,
31416,05120823,n,9,the 6th letter of the Hebrew alphabet,
31417,05120929,n,9,the 7th letter of the Hebrew alphabet,
31418,05121037,n,9,the 8th letter of the Hebrew alphabet,
31419,05121144,n,9,the 9th letter of the Hebrew alphabet,
31420,05121251,n,9,the 10th letter of the Hebrew alphabet,
31421,05121359,n,9,the 11th letter of the Hebrew alphabet,
31422,05121467,n,9,the 12th letter of the Hebrew alphabet,
31423,05121577,n,9,the 13th letter of the Hebrew alphabet,
31424,05121684,n,9,the 14th letter of the Hebrew alphabet,
31425,05121791,n,9,the 15th letter of the Hebrew alphabet,
31426,05121901,n,9,the 16th letter of the Hebrew alphabet,
31427,05122009,n,9,the 17th letter of the Hebrew alphabet,
31428,05122115,n,9,the 18th letter of the Hebrew alphabet,
31429,05122224,n,9,the 19th letter of the Hebrew alphabet,
31430,05122332,n,9,the 20th letter of the Hebrew alphabet,
31431,05122440,n,9,the 21st letter of the Hebrew alphabet,
31432,05122547,n,9,the 22nd letter of the Hebrew alphabet,
31434,05122762,n,9,a blank character used to separate successive words in writing or printing; 'he said the space is the most important character in the alphabet',
31435,05122965,n,9,a letter that has two or more pronunciations; '`c' is a polyphone because it is pronounced like `k' in `car' but like `s' in `cell'',
31436,05123174,n,9,a plain hand-drawn letter,
31437,05123274,n,9,the letter A in red; Puritans required adulterers to wear it,
31438,05123395,n,9,a written character used in phonetic transcription of represent a particular speech sound,
31439,05123584,n,9,a character that is used to indicates a mathematical relation or operation,
31441,05123961,n,9,a Germanic character of runic origin,
31442,05124049,n,9,a graphic character used in picture writing,
31443,05124149,n,9,a graphic character used in ideography,
31444,05124291,n,9,a single symbol that represents an entire word or phrase,
31445,05124414,n,9,a character conveying the lexical meaning of a logogram,
31446,05124542,n,9,the marks used to clarify meaning by indicating separation of words into sentences and clauses and phrases,
31447,05125032,n,9,a punctuation mark (&) used to represent conjunction (and),
31448,05125146,n,9,either of two punctuation marks (< or >) used to enclose textual material,
31449,05125289,n,9,the mark (') used to indicate the omission of one or more letters from a printed word,
31450,05125431,n,9,either of two punctuation marks ({ or }) used to enclose textual material,
31451,05125556,n,9,either of two punctuation marks ([ or ]) used to enclose textual material,
31452,05125700,n,9,a punctuation mark (:) used after a word introducing a series or an example or an explanation (or after the salutation of a business letter),
31453,05125892,n,9,"a punctuation mark (,) used to indicate the separation of elements within the grammatical structure of a sentence",
31454,05126057,n,9,a punctuation mark (!) used after an exclamation,
31455,05126188,n,9,a punctuation mark (-) used between parts of a compound word or between the syllables of a word when the word is divided at the end of a line of text,
31456,05126397,n,9,either of two punctuation marks ( or ) used to enclose textual material,
31457,05126526,n,9,a punctuation mark (.) placed at the end of a declarative sentence to indicate a full stop or after abbreviations; 'in England they call a period a stop',
31458,05126790,n,9,(usually plural) one of a series of points indicating that something has been omitted or that the sentence is incomplete,
31459,05126973,n,9,a punctuation mark (?) placed at the end of a sentence to indicate a question,
31460,05127132,n,9,a punctuation mark used to attribute the enclosed text to someone else,
31461,05127342,n,9,a single quotation mark,
31462,05127424,n,9,a pair of quotation marks,
31463,05127509,n,9,the use of quotation marks to indicate that it is not the authors preferred terminology,
31465,05127816,n,9,a punctuation mark (/) used to separate related items of information,
31466,05127989,n,9,a punctuation mark used in text to indicate the omission of a word,
31467,05128112,n,9,the name by which a corporation is identified,
31469,05128468,n,9,a name given to a product or service,
31470,05128586,n,9,a formally registered symbol identifying the manufacturer or distributor of a product,
31471,05128745,n,9,a mark on an article of trade to indicate its origin and authenticity,
31472,05128899,n,9,a symbol that is the result of printing; 'he put his stamp on the envelope',
31473,05129075,n,9,a stamp affixed to a document (as to attest to its authenticity or to seal it); 'the warrant bore the sheriff's seal',
31474,05129243,n,9,an impression produced by pressure or printing,
31475,05129356,n,9,(Judaism) a small leather case containing religious texts; worn by Jewish men during morning prayer,
31476,05129512,n,9,a symbol of cowardice,
31477,05129593,n,9,a series of notes differing in pitch according to a specific scheme (usually within an octave),
31478,05129846,n,9,a short lively tune played on brass instruments; 'he entered to a flourish of trumpets'; 'her arrival was greeted with a rousing fanfare',
31479,05130048,n,9,a rapid series of ascending or descending notes on the musical scale,
31480,05130190,n,9,rapid sliding up or down the musical scale; 'the violinist was indulgent with his swoops and slides',
31481,05130350,n,9,the entire scale of musical notes,
31482,05130435,n,9,(music) the first note of a diatonic scale,
31483,05130539,n,9,(music) the second note of a diatonic scale,
31484,05130639,n,9,(music) the third note of a diatonic scale; midway between the tonic and the dominant,
31485,05130778,n,9,(music) the fourth note of the diatonic scale,
31486,05130881,n,9,(music) the fifth note of the diatonic scale,
31487,05130980,n,9,(music) the sixth note of a major or minor scale (or the third below the tonic),
31488,05131116,n,9,(music) the seventh note of the diatonic scale,
31489,05131232,n,9,a sustained bass note,
31490,05131319,n,9,the difference in pitch between two notes,
31491,05131596,n,9,a musical interval of two semitones,
31492,05131715,n,9,the musical interval between adjacent keys on a keyboard instrument,
31493,05131849,n,9,half of a semitone,
31494,05131925,n,9,a musical interval of eight tones,
31495,05132028,n,9,the musical interval between one note and another three notes away from it; 'a simple harmony written in major thirds',
31496,05132198,n,9,the musical interval between one note and another four notes away from it,
31497,05132324,n,9,the musical interval between one note and another five notes away from it,
31498,05132449,n,9,the musical interval between one note and another six notes away from it,
31499,05132573,n,9,the musical interval between one note and another seven notes away from it,
31500,05132701,n,9,a note that alternates rapidly with another note a semitone above it,
31501,05132829,n,9,a scale with eight notes in an octave; all but two are separated by whole tones,
31502,05132987,n,9,any of a system of modes used in Gregorian chants up until 1600; derived historically from the Greek mode,
31503,05133205,n,9,any of the descending diatonic scales in the music of classical Greece,
31504,05133332,n,9,a diatonic scale with notes separated by whole tones except for the 3rd and 4th and 7th and 8th,
31505,05133508,n,9,a diatonic scale with notes separated by whole tones except for the 2nd and 3rd and 5th and 6th,
31506,05133684,n,9,a 12-note scale including all the semitones of the octave,
31507,05133803,n,9,a musical scale with fewer than seven notes,
31508,05133923,n,9,a gapped scale with five notes,
31509,05134016,n,9,any of various fixed orders of the various diatonic notes within an octave,
31510,05134228,n,9,(music) the system of five horizontal lines on which the musical notes are written,
31511,05134408,n,9,any of the 5 horizontal marks comprising a staff,
31512,05134551,n,9,one of the areas between or below or above the lines of a musical staff; 'the spaces are the notes F-A-C-E',
31513,05134748,n,9,a short line; a notation for extending the range above or below the staff,
31514,05134911,n,9,a musical notation written on a staff indicating the pitch of the notes following it,
31516,05135288,n,9,a clef that puts the F below middle C on the fourth line of a staff,
31517,05135420,n,9,a clef that puts middle C on the third line of a staff,
31518,05135543,n,9,a movable clef that puts middle C on one of the lines of a staff,
31519,05135660,n,9,a clef that puts middle C on the bottom line of the staff,
31521,05135952,n,9,the sharps or flats that follow the clef and indicate the key,
31522,05136085,n,9,any of 24 major or minor diatonic scales that provide the tonal framework for a piece of music,
31523,05136258,n,9,the absence of a key; alternative to the diatonic system,
31524,05136400,n,9,a musical notation indicating the number of beats to a measure and kind of note that takes a beat,
31525,05136601,n,9,notation for a repeating pattern of musical beats; written followed by a vertical bar,
31526,05136746,n,9,a vertical line marking the boundary between musical bars,
31527,05136894,n,9,notation marking the end of principal parts of a musical composition; two adjacent bar lines,
31528,05137043,n,9,a musical time signature indicating two or four half notes to a measure,
31529,05137171,n,9,a musical notation indicating a silence of a specified duration,
31530,05137303,n,9,a notation representing the pitch and duration of a musical sound; 'the singer held the note too long',
31531,05137875,n,9,(music) a curved line spanning notes that are to be played legato,
31532,05138009,n,9,(music) a slur over two notes of the same pitch; indicates that the note is to be sustained for their combined time value,
31533,05138180,n,9,a notation indicating one half step higher than the note named,
31534,05138294,n,9,a notation indicating one half step lower than the note named,
31535,05138406,n,9,a notation cancelling a previous sharp or flat,
31536,05138515,n,9,a notation that makes a note sharp or flat or natural although that is not part of the key signature,
31537,05138672,n,9,a system of naming the notes of a musical scale by syllables instead of letters,
31538,05138841,n,9,a system of solmization using the solfa syllables: do-re-mi-fa-sol-la-ti,
31539,05138998,n,9,one of the names for notes of a musical scale in solmization,
31540,05139264,n,9,the syllable naming the first (tonic) note of any major scale in solmization,
31541,05139400,n,9,the syllable naming the second (supertonic) note of any major scale in solmization,
31542,05139537,n,9,the syllable naming the third (mediant) note of any major scale in solmization,
31543,05139664,n,9,the syllable naming the fourth (subdominant) note of the diatonic scale in solmization,
31544,05139799,n,9,the syllable naming the fifth (dominant) note of any musical scale in solmization,
31545,05139941,n,9,the syllable naming the sixth (submediant) note of a major or minor scale in solmization,
31546,05140084,n,9,the syllable naming the the seventh (subtonic) note of any musical scale in solmization,
31547,05140230,n,9,(music) a notation written at the beginning or end of a passage that is to be repeated,
31548,05140368,n,9,(music) a notation written above a note and indicating that it is to be played with a strong initial attack,
31549,05140531,n,9,a chord whose notes are played in rapid succession rather than simultaneously,
31550,05140663,n,9,an accented chord,
31551,05140736,n,9,the note designated by the first ledger line below the treble staff; 261.63 Hertz,
31552,05140872,n,9,a combination of three or more notes that blend harmoniously when sounded together,
31553,05141078,n,9,a 3-note major or minor chord; a note and its third and fifth tones,
31554,05141212,n,9,a triad with a seventh added,
31555,05141300,n,9,a nonharmonic note inserted for transition between harmonic notes,
31556,05141439,n,9,a musical note having the longest time value,
31557,05141552,n,9,a rest equal in duration to a whole note,
31558,05141649,n,9,a musical note having the time value of half a whole note,
31559,05141770,n,9,a musical note having the time value of a quarter of a whole note,
31560,05141905,n,9,a musical note having the time value of an eighth of a whole note,
31561,05142037,n,9,a musical note having the time value of a sixteenth of a whole note,
31562,05142178,n,9,a musical note having the time value of a thirty-second of a whole note,
31563,05142331,n,9,a musical note having the time value of a sixty-fourth of a whole note,
31564,05142486,n,9,an embellishing note usually written in smaller size,
31565,05142625,n,9,the musical quality of the voice while singing,
31567,05142982,n,9,a very deep bass voice,
31568,05143065,n,9,the second lowest adult male singing voice,
31569,05143179,n,9,the adult male singing voice above baritone,
31570,05143288,n,9,the highest adult male singing voice,
31571,05143390,n,9,the lowest female singing voice,
31573,05143606,n,9,the highest female voice; the voice of a boy before puberty,
31574,05143719,n,9,communication that relies on vision,
31575,05143966,n,9,a signal that involves visual communication,
31576,05144322,n,9,a fire lighted at night as a signal,
31577,05144414,n,9,a visual warning signal; 'they saw the light of the beacon'; 'there was a light at every corner',
31578,05144580,n,9,a visual signal to control the flow of traffic at intersections,
31579,05144786,n,9,the signal to proceed,
31580,05144876,n,9,the signal to stop,
31581,05144950,n,9,a cautionary sign of danger,
31582,05145049,n,9,the signal to proceed with caution,
31583,05145142,n,9,a burst of light used to communicate or illuminate,
31584,05145306,n,9,a rectangular piece of fabric used as a signalling device,
31585,05145464,n,9,a flag longer than it is wide (and often tapering),
31586,05145568,n,9,one of an international code of flag signals used between ships,
31587,05145728,n,9,a blue flag with a white square in the center indicates that the vessel is ready to sail,
31588,05145873,n,9,language expressed by visible hand gestures,
31589,05146041,n,9,an alphabet of manual signs,
31590,05146129,n,9,the sign language used in the US,
31591,05146255,n,9,a gesture that is part of a sign language,
31592,05146366,n,9,the use of movements (especially of the hands) to communicate familiar or prearranged signals,
31593,05146736,n,9,communication via the movements or attitudes of the body,
31594,05146852,n,9,a beckoning gesture,
31595,05146922,n,9,a gesture executed with the facial muscles,
31596,05147207,n,9,an expression of open-mouthed astonishment,
