32282,05244018,n,9,the liturgical language of the Coptic Church of Egypt and Ethiopia; written in the Greek alphabet,
32284,05244362,n,9,the dialect of Berber spoken by the Tuareg people,
32285,05244464,n,9,a group of languages spoken in Ethiopia and Somalia and NW Kenya and adjacent regions,
32286,05244622,n,9,the Cushitic language spoken by the Somali people,
32287,05244724,n,9,a group of related languages spoken in a valley of southern Ethiopia; closely related to Cushitic languages,
32288,05244884,n,9,"the family of languages that includes most of the languages spoken in sub-Saharan Africa; the majority of them are tonal languages but there are important exceptions (e.g., Swahili or Fula)",
32289,05245202,n,9,a group of languages spoken in the relatively small Kordofan area of the south Sudan,
32290,05245344,n,9,a family of African language spoken in west Africa,
32291,05245560,n,9,a family of languages widely spoken in the southern half of the African continent,
32292,05246126,n,9,the Bantu language of the Chewa people of east central Africa,
32293,05246242,n,9,a Bantu language spoken in southern Somalia,
32294,05246340,n,9,a Bantu language that is one of the two major languages of Zimbabwe,
32295,05246462,n,9,a Bantu language spoken in Cameroon,
32296,05246548,n,9,a Bantu language spoken in western Kenya,
32297,05246641,n,9,a Bantu language spoken in the coastal regions of eastern Kenya,
32298,05246758,n,9,a Bantu language spoken by the Kamba people in Kenya,
32299,05246862,n,9,a Bantu language spoken by the Chaga people in northern Tanzania,
32300,05246997,n,9,a Bantu language,
32301,05247071,n,9,a Bantu language,
32302,05247143,n,9,the Bantu language spoken by the Kongo people living in the tropical forests of Zaire and Congo and Angola,
32303,05247301,n,9,a Bantu language spoken in southern Zaire,
32304,05247393,n,9,the Bantu language of the Buganda people; spoken in Uganda,
32305,05247505,n,9,a Bantu language,
32306,05247573,n,9,a Bantu language,
32307,05247641,n,9,a Bantu language spoken in southern coastal Tanzania,
32308,05247745,n,9,a group of southern Bantu languages,
32309,05247904,n,9,a Bantu language sometimes considered a dialect of Zulu,
32310,05248024,n,9,a Bantu language closely related to Zulu,
32311,05248116,n,9,a Bantu language closely related to Zulu,
32312,05248208,n,9,a Bantu language of considerable literary importance in southeastern Africa,
32313,05248334,n,9,a Bantu language spoken in central Tanzania,
32314,05248432,n,9,a Bantu language spoken in the Kenyan coastal areas of East Africa,
32315,05248551,n,9,any of the mutually intelligible southern Bantu languages of the Sotho people in Botswana and South Africa and Lesotho,
32316,05248757,n,9,a Bantu language spoken in Angola,
32317,05248844,n,9,the dialect of Sotho spoken by the Basotho; an official language of Lesotho,
32318,05248982,n,9,the dialect of Sotho spoken by the Tswana people in Botswana,
32319,05249117,n,9,the most widely spoken Bantu languages; the official language of Kenya and Tanzania and widely used as a lingua franca in east and central Africa,
32320,05249316,n,9,the language of the Tonga people of south central Africa (Zambia and Rhodesia),
32321,05249446,n,9,a group of Niger-Congo languages spoken primarily in SE Mali and N Ghana,
32322,05249578,n,9,a group of languages spoken in the extreme western part of West Africa,
32324,05249988,n,9,a West African language closely related to Fula; spoken primarily in Senegal and Gambia,
32325,05250127,n,9,the West AFrican language of the Wolof people in Senegal,
32326,05250235,n,9,a group of African languages in the Niger-Congo group spoken from Senegal east as far as the Ivory Coast,
32327,05250391,n,9,a group of African language in the Niger-Congo group spoken from the Ivory Coast east to Nigeria,
32328,05250591,n,9,a Kwa language spoken by the Yoruba people in SW Nigeria,
32329,05250706,n,9,a Kwa language spoken in Ghana and the Ivory Coast,
32330,05250807,n,9,a Kwa language spoken by the Ewe people in Ghana and Togo and Benin,
32332,05251162,n,9,a group of Nilo-Saharan language spoken in parts of the Sudan and Zaire and Uganda and Tanzania,
32333,05251332,n,9,a group of languages of East Africa belonging to the Chari-Nile group,
32334,05251528,n,9,a Nilotic language,
32335,05251598,n,9,a Nilotic language,
32336,05251666,n,9,a Nilotic language,
32337,05251736,n,9,a Nilo-Saharan language spoken in parts of Chad,
32338,05251837,n,9,a Nilo-Saharan language spoken by the Songhai people in Mali and Niger,
32339,05251961,n,9,photographs or other visual representations in a printed publication,
32340,05252175,n,9,artwork that helps make something clear or attractive,
32341,05252378,n,9,illustrations used to decorate or explain a text; 'the dictionary had many pictures',
32343,05252690,n,9,a visual display of information,
32344,05252935,n,9,a chart or map showing the movements or progress of an object,
32345,05253047,n,9,a drawing illustrating the relations between certain quantities plotted with reference to a set of axes,
32346,05253348,n,9,(electronics) a graph of frequency response with signal amplitude or gain plotted against frequency,
32347,05253576,n,9,a line on a graph representing data,
32348,05253700,n,9,a chart showing the lines of responsibility between departments of a large organization,
32349,05253852,n,9,a chart displaying colors,
32350,05253953,n,9,a chart in which complementary colors (or their names) are arranged on opposite sides of a circle,
32351,05254123,n,9,a chart with bars whose lengths are proportional to quantities,
32352,05254271,n,9,a bar chart representing a frequency distribution; heights of the bars represent observed frequencies,
32353,05254428,n,9,a chart that is read from a fixed distance; used as a test of vision,
32354,05254552,n,9,a chart with several sheets hinged at the top; sheets can be flipped over to present information sequentially,
32355,05254718,n,9,a circular chart divided into triangular areas proportional to the percentages of the whole,
32356,05254865,n,9,a chart showing the relative positions of the stars in a particular part of the sky,
32357,05255005,n,9,a graph representing the extent to which something exhibits various characteristics,
32358,05255160,n,9,a chart showing the number of people as a function of their ages,
32359,05255289,n,9,information set out in tabular form,
32360,05255398,n,9,an illustration that is drawn by hand and published in a book or magazine; 'it is shown by the drawing in Fig. 7',
32361,05255565,n,9,a sequence of drawings in a newspaper telling a story,
32362,05255719,n,9,a graphical record of the cardiac cycle produced by an electrocardiograph,
32363,05255900,n,9,a graphical record of electrical activity of the brain; produced by an electroencephalograph,
32364,05256081,n,9,a graphical record of electric currents associated with muscular contractions,
32365,05256219,n,9,a graphical record of speed and distance produced by a tachograph,
32366,05256340,n,9,the art of writing and producing plays,
32367,05256519,n,9,(usually 'the stage'); the theater as a profession; 'an early movie simply showed a long kiss by two actors of the contemporary stage',
32368,05256705,n,9,a presentation for the stage or screen or radio or television; 'have you seen the new production of Hamlet?',
32369,05256907,n,9,the production of a drama on the stage,
32370,05257041,n,9,a highly successful theatrical production,
32371,05257144,n,9,a sensational bit of stagecraft,
32372,05257256,n,9,a play for performance on the stage or television or in a movie etc.,
32373,05257517,n,9,a dramatic work intended for performance by actors on a stage; 'he wrote several plays but only one was produced on Broadway',
32374,05257865,n,9,a brief dramatic piece (usually comic) presented after a play,
32376,05258261,n,9,an introduction to a play,
32377,05258360,n,9,a short play,
32378,05258426,n,9,a subdivision of a play or opera or ballet,
32379,05258594,n,9,a subdivision of an act of a play; 'the first act has three scenes',
32380,05258732,n,9,a written version of a play or other dramatic composition; used in preparing for a performance,
32381,05259025,n,9,the copy of the playscript used by the prompter,
100100,N0001559,n,10,,
32383,05259291,n,9,the lines spoken by characters in drama or fiction,
32385,05259571,n,9,words making up the dialogue of a play; 'the actor forgot his lines',
32387,05259958,n,9,an actor's line that immediately precedes and serves as a reminder for some action or speech,
32388,05260118,n,9,a (usually long) dramatic speech by a single actor,
32389,05260224,n,9,a (usually long) dramatic speech intended to give the illusion of unspoken reflections,
32390,05260366,n,9,words spoken in a casual way with conscious under-emphasis,
32391,05260480,n,9,a cue given to a performer (usually the beginning of the next line to be spoken),
32392,05260613,n,9,the words of an opera or musical play,
32393,05260705,n,9,an outline or synopsis of a play,
32394,05260792,n,9,a script for a film including dialogue and descriptions of characters and sets,
32395,05260927,n,9,the final detailed script for making a movie or TV program,
32396,05261047,n,9,a linear string of words expressing some idea; 'the letter consisted of three short lines',
32397,05261386,n,9,plausible glib talk (especially useful to a salesperson),
32398,05261517,n,9,a linear sequence of words as spoken or written,
32399,05261742,n,9,a manifestation of insincerity; 'he put on quite an act for her benefit',
32400,05261864,n,9,an unrestrained expression of emotion,
32401,05262010,n,9,a fit of weeping; 'had a good cry',
32402,05262094,n,9,a (usually irritating) impulsive and uncontrollable outburst by a problem child or a neurotic adult,
32403,05262250,n,9,a grouping of words in a sentence,
32404,05262341,n,9,drama more suitable for reading that for performing,
32405,05262451,n,9,light and humorous drama with a happy ending,
32406,05262692,n,9,a comedy with serious elements or overtones,
32407,05262807,n,9,drama in which the protagonist is overcome by some superior force or circumstance; excites terror or pity,
32408,05263002,n,9,a dramatic composition involving elements of both tragedy and comedy usually with the tragic predominating,
32409,05263166,n,9,a humorous television program based on situations that could arise in everyday life,
32410,05263312,n,9,a television production that features a particular person or work or topic; 'the last of a series of BBC specials on Iran is being shown tonight',
32411,05263511,n,9,a humorous drama based on situations that might arise in day-to-day life,
32412,05263646,n,9,Italian comedy of the 16th to 18th centuries improvised from standardized situations and stock characters,
32413,05263816,n,9,an extravagant comedy in which action is more salient than characterization,
32414,05263947,n,9,a boisterous comedy with chases and collisions and practical jokes,
32415,05264069,n,9,a theatrical entertainment of broad and earthy humor; consists of comic skits and short turns (and sometimes striptease),
32416,05264245,n,9,a comedy characterized by broad satire and improbable situations,
32417,05264387,n,9,a farcical afterpiece in the ancient Roman theater,
32418,05264489,n,9,a comedy characterized by slapstick and burlesque,
32419,05264595,n,9,a medieval play representing episodes from the life of a saint or martyr,
32420,05264726,n,9,an allegorical play popular in the 15th and 16th centuries; characters personified virtues and vices,
32421,05264886,n,9,a medieval play representing episodes from the life of Christ,
32422,05265006,n,9,a play representing the Passion of Christ,
32423,05265106,n,9,an ancient Greek burlesque with a chorus of satyrs,
32424,05265213,n,9,a theatrical performance of a drama; 'the play lasted two hours',
32425,05265364,n,9,a play or film whose action and dialogue is interspersed with singing and dancing,
32426,05265552,n,9,a short play presented before the main play,
32427,05265656,n,9,a drama executed by throwing shadows on a wall,
32428,05265789,n,9,a show in which the actors are puppets,
32429,05265899,n,9,a form of erotic entertainment in which a person gradually undresses to music,
32430,05266046,n,9,a variety show with topical sketches and songs and dancing and comedians,
32431,05266197,n,9,a revue with elaborate costuming,
32432,05266283,n,9,a show consisting of a series of short unrelated performances,
32433,05266449,n,9,a variety show with songs and comic acts etc.,
32434,05266564,n,9,an artistic form of nonverbal communication,
32437,05267811,n,9,music consisting of a single vocal part (usually with accompaniment),
32438,05267951,n,9,music arranged in parts for several voices or instruments,
32439,05268119,n,9,music that uses two or more different keys at the same time,
32440,05268252,n,9,music adapted to the understanding and taste of the majority,
32441,05268369,n,9,a musical form involving the simultaneous sound of two or more melodies,
32442,05268499,n,9,music conforming to an established form and appealing to critical interest and developed musical taste,
32443,05268805,n,9,serious music performed by a small group of musicians,
32445,05269194,n,9,opera with a happy ending and in which some of the text is spoken,
32446,05269375,n,9,opera in which all the text is sung,
32447,05269468,n,9,opera in which the musical and dramatic elements are equally important; the music is appropriate to the action,
32448,05269638,n,9,a short amusing opera,
32449,05269728,n,9,the structure of music with respect to the composition and progression of chords,
32450,05269934,n,9,a piece of harmonized music,
32451,05270055,n,9,a piece of music whose original harmony has been revised,
32452,05270173,n,9,harmony in which each chord has four notes that create four melodic lines,
32453,05270310,n,9,a dissonant chord is followed by a consonant chord,
32454,05270417,n,9,a succession of notes forming a distinctive sequence; 'she was humming an air from Beethoven',
32455,05270769,n,9,a melodic phrase that accompanies the reappearance of a person or situation (as in Wagner's operas),
32456,05270936,n,9,a melody that recurs and comes to represent a musical play or movie,
32457,05271060,n,9,a melody used to identify a performer or a dance band or radio/tv program,
32458,05271219,n,9,melodic subject of a musical composition; 'the theme is announced in the first measures'; 'the accompanist picked up the idea and elaborated it',
32459,05271508,n,9,a persistent but subordinate motif,
32460,05271609,n,9,a theme that is elaborated on in a piece of music,
32461,05271737,n,9,(music) the presentation of a musical theme; 'the initial statement of the sonata',
32462,05271875,n,9,a repetition of a musical theme in which it is modified or embellished,
32463,05272001,n,9,the melody carried by a particular voice or instrument in polyphonic music; 'he tried to sing the tenor part',
32464,05272223,n,9,vocal music for several voices in independent parts (usually performed without accompaniment),
32465,05272391,n,9,part music with one dominant voice (in a homophonic style),
32466,05272505,n,9,a part written for a singer,
32467,05272607,n,9,the highest part (usually the melody) in a piece of choral music,
32468,05272723,n,9,a subordinate musical part; provides background for more important parts,
32469,05272901,n,9,a decorative accompaniment (often improvised) added above a basic melody,
32470,05273037,n,9,an improvised accompaniment,
32471,05273115,n,9,the lowest part in polyphonic music,
32472,05273267,n,9,a short melody in the bass that is constantly repeated,
32473,05273397,n,9,a bass part written out in full and accompanied by figures for successive chords,
32474,05273554,n,9,a bass part in which the notes have numbers under them to indicate the chords to be played,
32475,05273703,n,9,music composed for performance as part of religious ceremonies,
32476,05273932,n,9,a verse or song to be chanted or sung in response,
32477,05274066,n,9,(Roman Catholic) an antiphon (usually from the Book of Psalms) immediately after the epistle at Mass,
32478,05274220,n,9,a musical setting for a Mass,
32479,05274336,n,9,a musical setting for a Mass celebrating the dead,
32480,05274458,n,9,religious music used in a procession,
32481,05274565,n,9,bound collection of antiphons,
32482,05274665,n,9,a repetitive song in which as many syllables as necessary are assigned to a single tone,
32483,05274858,n,9,(Judaism) a chant of praise (Psalms 113 through 118) used at Passover and Shabuoth and Sukkoth and Hanukkah and Rosh Hodesh,
32484,05275034,n,9,a chant to the Hindu god Krishna,
32485,05275125,n,9,a liturgical chant of the Roman Catholic Church,
32486,05275277,n,9,a melody used as the basis for a polyphonic composition,
100101,N0001561,n,10,,
32488,05275552,n,9,a kind of religious song originated by Blacks in the southern US,
32489,05275690,n,9,joyful religious song celebrating the birth of Christ,
32490,05275813,n,9,a song of praise (to God or to a saint or to a nation),
32491,05276089,n,9,a hymn or verse in Christian liturgy glorifying God,
32493,05276329,n,9,a hymn derived from the Bible,
32494,05276431,n,9,the first words of a medieval Latin hymn describing the Last Judgment (literally 'day of wrath'),
32495,05276583,n,9,a revolutionary socialist anthem,
32496,05276676,n,9,a hymn of praise (especially one sung in ancient Greece to invoke or thank a deity),
32497,05276818,n,9,the canticle of the Virgin Mary (from Luke 1:46 beginning 'Magnificat anima mea Dominum'),
32498,05276964,n,9,a hymn that is sung at the end of a service as the clergy and choir withdraw,
32499,05277098,n,9,an ancient liturgical hymn,
32500,05277178,n,9,a musical work that has been created; 'the composition is written in four movements',
32501,05277879,n,9,a piece of music that has been adapted for performance by a particular set of voices or instruments,
32502,05278094,n,9,an arrangement of a piece of music for performance by an orchestra or band,
32503,05278228,n,9,the instruments called for in a musical score or arrangement for a band or orchestra,
32504,05278374,n,9,the closing section of a musical composition,
32505,05278516,n,9,a short piece of instrumental music composed for performance between acts of a drama or opera,
32506,05278666,n,9,a short movement coming between the major sections of a symphony,
32507,05278787,n,9,music that precedes a fugue or introduces an act in an opera,
32508,05278919,n,9,a composition for organ using a chorale as a basis for variations,
32509,05279046,n,9,orchestral music played at the begining of an opera or oratorio,
32510,05279164,n,9,a musical composition for one performer,
32512,05279455,n,9,a musical composition for two performers,
32513,05279561,n,9,a musical composition for three performers,
32514,05279654,n,9,a musical composition for four performers,
32515,05279761,n,9,a musical composition for five performers,
32516,05279868,n,9,a musical composition written for six performers,
32517,05279989,n,9,a musical composition written for seven performers,
32518,05280103,n,9,a musical composition written for eight performers,
32519,05280215,n,9,a musical setting for a religious text,
32520,05280318,n,9,a light piece of music for piano,
32521,05280406,n,9,a musical composition in several movements; has no fixed form,
32522,05280537,n,9,(Irish) a funeral lament sung with loud wailing,
32523,05280635,n,9,a contrapuntal piece of music in which a melody in one part is imitated exactly in other parts,
32524,05280799,n,9,a canon in which the entrances of successive parts were indicated by cryptic symbols and devices (popular in the 15th and 16th centuries),
32525,05281048,n,9,a composition for orchestra and a soloist,
32526,05281162,n,9,a baroque composition for orchestra and a group of solo instruments,
32527,05281291,n,9,a short composition for a solo instrument; intended as an exercise or to demonstrate technical virtuosity,
32528,05281448,n,9,a musical form consisting of a theme repeated a fifth above or a fourth below its first statement,
32529,05281597,n,9,a musical composition that evokes rural life,
32530,05281716,n,9,a musical form that is often the last movement of a sonata,
32531,05281836,n,9,a musical composition of 3 or 4 movements of contrasting forms,
32532,05282006,n,9,a sonata for piano,
32533,05282083,n,9,a baroque musical composition (usually for a keyboard instrument) with full chords and rapid elaborate runs in a rhythmically free style,
32534,05282273,n,9,a musical composition of a free form usually incorporating several familiar themes,
32535,05282410,n,9,a long and complex sonata for symphony orchestra,
32536,05282531,n,9,a short section of a musical composition,
32537,05282751,n,9,a brief introductory passage to a piece of popular music,
32538,05282859,n,9,a short musical passage two to four measures long,
32539,05283015,n,9,a musical phrase repeated over and over during a composition,
32540,05283166,n,9,a jazz ostinato; usually provides a background for a solo improvisation,
32542,05283408,n,9,a major self-contained part of a symphony or sonata; 'the second movement is slow and melodic',
32543,05283630,n,9,a movement that is to be performed in a slow and broad manner,
32544,05283743,n,9,a fast movement (usually in triple time),
32545,05283837,n,9,a musical composition of several movements only loosely connected,
32546,05283954,n,9,an orchestral composition based on literature or folk tales,
32547,05284086,n,9,a musical composition consisting of a series of songs or other musical pieces from various sources,
32548,05284260,n,9,a pensive lyrical piece of music (especially for the piano),
32549,05284374,n,9,a musical composition to be played in adagio tempo (slowly and gracefully),
32551,05284976,n,9,a composition intended to develop one aspect of the performer's technique; 'a study in spiccato bowing',
32552,05285131,n,9,alternate (responsive) singing by a choir in two parts,
32553,05285241,n,9,a song formally adopted as the anthem for a nation,
32554,05285389,n,9,the French national anthem,
32555,05285474,n,9,the national anthem of the US,
32556,05285570,n,9,an elaborate song for solo voice,
32557,05285690,n,9,a short aria,
32558,05285769,n,9,a narrative song with a recurrent refrain,
32559,05285887,n,9,ballads sung by minstrels,
32560,05285969,n,9,a boating song sung by Venetian gondoliers,
32561,05286080,n,9,a rhythmical work song originally sung by sailors,
32562,05286215,n,9,the part of a song where a soloist is joined by a group of singers,
32563,05286381,n,9,a set of nonsensical syllables used while humming a refrain,
32564,05286505,n,9,a short simple song (or the words of a poem intended to be sung),
32565,05286621,n,9,a song or hymn of mourning composed or performed as a memorial to a dead person,
32566,05286811,n,9,a song celebrating the joys of drinking; sung at drinking parties,
32567,05286936,n,9,a song that is traditionally sung by the common people of a region and forms part of their culture,
32568,05287140,n,9,a type of folk song that originated among Black Americans at the beginning of the 20th century; has a melancholy sound from repeated used of blue notes,
32569,05287380,n,9,a flattened third or seventh,
32570,05287483,n,9,a German art song of the 19th century,
32571,05287571,n,9,a song about love or expressing love for another person,
32572,05287681,n,9,a quiet song intended to lull a child to sleep,
32573,05287805,n,9,the text of a popular song or musical-comedy number; 'his compositions always started with the lyrics'; 'he wrote both words and music'; 'the song uses colloquial language',
32574,05288085,n,9,the lyric of a lovesong,
32575,05288165,n,9,a song with two or more voice parts,
32576,05288291,n,9,an unaccompanied partsong for 2 or 3 voices; follows a strict poetic form,
32578,05288668,n,9,a song in which a line or phrase is repeated as the refrain,
32579,05288783,n,9,a song (sometimes improvised) sung by guests at a banquet,
32580,05288909,n,9,a song characteristically played outside the house of a woman,
32581,05289043,n,9,a popular song concerned with disappointment in love,
32582,05289152,n,9,a usually rhythmical song song to accompany repetitious work,
32583,05289286,n,9,a noisy mock serenade (made by banging pans and kettles) to a newly married couple,
32584,05289482,n,9,music written for a ballet,
32585,05289561,n,9,music written in the rhythm of the bolero dance,
32586,05289661,n,9,music composed for dancing the conga,
32587,05289749,n,9,music composed in quadruple time for dancing the gavotte,
32588,05289859,n,9,music for dancing the hornpipe,
32589,05289944,n,9,music in three-four time for dancing a jig,
32590,05290036,n,9,music in triple time for dancing the landler,
32591,05290134,n,9,music composed for dancing the mazurka,
32592,05290226,n,9,a stately piece of music composed for dancing the minuet; often incorporated into a sonata or suite,
32593,05290378,n,9,music in march time composed for dancing the paso doble; often played a bull fights,
32594,05290518,n,9,music composed for dancing the pavane,
32596,05290697,n,9,music for dancing the quadrille,
32597,05290784,n,9,music composed for dancing a reel,
32598,05290868,n,9,syncopated music in duple time for dancing the rumba,
32599,05290981,n,9,music composed for dancing the samba,
32600,05291069,n,9,music composed for dancing the saraband,
32601,05291163,n,9,music performed for dancing the schottische,
32603,05291456,n,9,a type of serial music introduced by Arnold Schoenberg; uses a tone row formed by the twelve semitones of the chromatic scale (and inverted or backward versions of the row),
