7224,01206665,n,9,any of numerous very agile and alert New World lizards,
7225,01206901,n,9,very swift lizard of eastern and central United States,
7226,01207078,n,9,having distinct longitudinal stripes: of Colorado Plateau from Arizona to western Colorado,
7227,01207261,n,9,having longitudinal stripes overlaid with light spots; upland lizard of United States southwest and Mexico,
7228,01207467,n,9,active lizard having a network of dusky dark markings; of semiarid areas from Oregon and Idaho to Baja California,
7229,01207666,n,9,markings are darker and more marked than in western whiptail; from southeastern Colorado to eastern Chihuahua,
7230,01207867,n,9,tejus,
7231,01207986,n,9,large (to 3 feet) blackish yellow-banded South American lizard; raid henhouses; used as food,
7232,01208148,n,9,crocodile-like lizard of South America having powerful jaws for crushing snails and mussels,
7233,01208299,n,9,an Old World reptile family of Sauria,
7234,01208523,n,9,a lizard of the family Agamidae,
7235,01208714,n,9,type genus of the Agamidae,
7237,01208964,n,9,frilled lizards,
7239,01209286,n,9,flying dagons,
7240,01209403,n,9,any of several small tropical Asian lizards capable of gliding by spreading winglike membranes on each side of the body,
7241,01209626,n,9,genus of Australian desert lizard,
7242,01209775,n,9,any lizard of the genus Moloch,
7243,01209895,n,9,desert lizard that feeds on ants,
7244,01210040,n,9,alligator lizards,
7245,01210225,n,9,any of a small family of lizards widely distributed in warm areas; all are harmless and useful as destroyers of e.g. slugs and insects,
7246,01210492,n,9,alligator lizards,
7247,01210625,n,9,slim short-limbed lizard having a distinctive fold on each side that permits expansion; of western North America,
7248,01210819,n,9,type genus of the Anguidae: blindworms,
7249,01210963,n,9,small burrowing legless European lizard with tiny eyes; popularly believed to be blind,
7250,01211153,n,9,glass lizards,
7251,01211280,n,9,snakelike lizard of Europe Asia and North America with vestigial hind limbs and the ability to regenerate its long fragile tail,
7252,01211513,n,9,monotypic family of Mexican lizards,
7253,01211667,n,9,type and sole genus of Xenosauridae: slender-bodied Mexican lizards having the upper surface covered with tiny granules and tubercles,
7254,01211895,n,9,legless lizards,
7255,01212027,n,9,degenerate wormlike burrowing lizard of California closely related to alligator lizards,
7256,01212194,n,9,stout-bodied lizards,
7257,01212335,n,9,1 species,
7258,01212460,n,9,a stout-bodied pleurodont lizard of Borneo,
7259,01212590,n,9,only known venomous lizards,
7260,01212759,n,9,any of two or three large heavy-bodied lizards; only known venomous lizards,
7261,01212951,n,9,type genus of the Helodermatidae; American venomous lizards,
7262,01213141,n,9,large orange and black lizard of southwestern United States; not dangerous unless molested,
7263,01213331,n,9,lizard with black and yellowish beadlike scales; of western Mexico,
7264,01213521,n,9,Old World lizards,
7265,01213672,n,9,Old World terrestrial lizard,
7266,01213828,n,9,type genus of the Lacertidae,
7267,01213983,n,9,a common and widely distributed lizard of Europe and central Asia,
7268,01214142,n,9,a common Eurasian lizard about a foot long,
7269,01214280,n,9,Old World chameleons; in some classifications Rhiptoglossa is considered a superfamily of Sauria,
7270,01214598,n,9,lizard of Africa and Madagascar able to change skin color and having a projectile tongue,
7271,01214810,n,9,type genus of the Chamaeleontidae,
7272,01214993,n,9,a chameleon found in Africa,
7273,01215126,n,9,a kind of chameleon,
7274,01215245,n,9,monitor lizards,
7275,01215373,n,9,type and sole extant genus of the Varanidae,
7277,01215766,n,9,destroys crocodile eggs,
7278,01215871,n,9,the largest lizard in the world (10 feet); found on Indonesian islands,
7279,01216070,n,9,a large subclass of diapsid reptiles including: crocodiles; alligators; dinosaurs; pterosaurs; plesiosaurs; ichthyosaurs; thecodonts,
7280,01216492,n,9,extinct reptiles including: dinosaurs; plesiosaurs; pterosaurs; ichthyosaurs; thecodonts,
7281,01216801,n,9,early archosaurian carnivore,
7282,01216926,n,9,early archosaurian carnivore,
7283,01217057,n,9,crocodiles; alligators; caimans; gavials,
7284,01217300,n,9,former name for the order Crocodylia,
7285,01217408,n,9,extant archosaurian reptile,
7286,01217624,n,9,true crocodiles,
7287,01217777,n,9,type genus of the Crocodylidae,
7288,01217953,n,9,large voracious aquatic reptile having a long snout with massive jaws and a body covered with bony plates; of sluggish tropical waters,
7289,01218216,n,9,a dangerous crocodile widely distributed in Africa,
7290,01218370,n,9,estuarine crocodile of eastern Asia and Pacific islands,
7291,01218508,n,9,a variety of crocodile,
7292,01218596,n,9,a genus of Malayan crocodiles,
7510,01257705,n,9,water snakes; a cosmopolitan genus,
7294,01218903,n,9,alligators; caimans,
7295,01219062,n,9,type genus of the Alligatoridae,
7296,01219193,n,9,either of two amphibious reptiles with shorter broader snouts than crocodiles,
7297,01219381,n,9,large alligator of southeastern United States,
7298,01219519,n,9,small of the Yangtze valley of China having unwebbed digits,
7299,01219663,n,9,caimans,
7300,01219767,n,9,alligator-like reptile of Central and South America having a more heavily armored belly,
7301,01219953,n,9,caiman with bony ridges about the eyes; found from southern Mexico to Argentina,
7302,01220114,n,9,gavials,
7303,01220236,n,9,type genus of the Gavialidae,
7304,01220374,n,9,large fish-eating Indian crocodilian with a long slender snout,
7305,01220530,n,9,any of numerous extinct terrestrial reptiles of the Mesozoic era,
7307,01221169,n,9,herbivorous dinosaur with a pelvis like that of a bird,
7308,01221453,n,9,primitive ornithiscian dinosaur found in Argentina; early Triassic,
7309,01221622,n,9,primitive dinosaur found in Argentina,
7310,01221750,n,9,primitive ornithiscian dinosaur found in Brazil,
7311,01221902,n,9,primitive dinosaur found in Brazil,
7312,01222031,n,9,armored dinosaurs: stegosaurs and ankylosaurs,
7316,01222784,n,9,armored herbivorous dinosaurs of the Cretaceous,
7317,01222953,n,9,having the back covered with thick bony plates; thought to have walked with a sprawling gait resembling a lizard's,
7318,01223176,n,9,heavily armored and highly spiked dinosaur with semi-upright posture,
7319,01223320,n,9,includes bone-headed (pachycephalosaurs) and horned (ceratopsian) dinosaurs,
7349,01228584,n,9,extinct terrestrial reptiles: theropods (carnivorous); sauropods (herbivorous),
7352,01229334,n,9,the earliest known dinosaurs,
7401,01238278,n,9,swift-running bipedal dinosaurs,
7402,01238472,n,9,a kind of maniraptor,
7403,01238569,n,9,advanced bipedal carnivorous dinosaur,
7454,01248216,n,9,mostly harmless temperate-to-tropical terrestrial or arboreal or aquatic snakes,
7456,01249015,n,9,thunder snake,
7462,01250103,n,9,leaf-nosed snakes,
7513,01258236,n,9,any of numerous North American water snakes inhabiting fresh waters,
7515,01258573,n,9,a small harmless grass snake,
7571,01267941,n,9,copperheads,
7572,01268064,n,9,venomous but sluggish reddish-brown snake of Australia,
7573,01268214,n,9,cobras,
7628,01277989,n,9,small pygmy rattlesnake,
7629,01278107,n,9,fer-de-lance,
7685,01296479,n,9,a tick that usually does not bite humans; transmits Lyme disease spirochete to dusky-footed woodrats,
7687,01296907,n,9,parasitic on mice of genus Peromyscus (especially P. leucopus) and bites humans; principal vector for Lyme disease in eastern United States (especially New England); northern form was for a time known as Ixodes dammini (deer tick),
7726,01304044,n,9,small elongate centipedes living in soil and under stones and having more than 30 pairs of legs,
7727,01304261,n,9,small extremely elongate earth-living centipedes,
7728,01304426,n,9,type genus of the Geophilidae: cosmopolitan genus of centipedes sometimes called earwigs,
7729,01304607,n,9,arthropods having the body composed of numerous double somites each with two pairs of legs: millipedes,
7730,01304851,n,9,any of numerous herbivorous nonpoisonous arthropods having a cylindrical body of 20 to 100 or more segments most with two pairs of legs,
7731,01305084,n,9,sea spiders,
7792,01314620,n,9,large black Old World grouse,
7733,01305397,n,9,used in some classifications; includes the orders Xiphosura and Eurypterida,
7734,01305607,n,9,horseshoe crabs and extinct forms,
7735,01305752,n,9,horseshoe crabs,
7736,01305899,n,9,type genus of the family Limulidae,
7738,01306338,n,9,a genus of Limulidae,
7739,01306472,n,9,horseshoe crab of the coast of eastern Asia,
7740,01306601,n,9,extinct aquatic arthropods of the Paleozoic,
7741,01306760,n,9,large extinct scorpion-like arthropod considered related to horseshoe crabs,
7742,01306911,n,9,tongue worms,
7743,01307045,n,9,wormlike arthropod having two pairs of hooks at the sides of the mouth; parasitic in nasal sinuses of mammals,
7744,01307245,n,9,pheasants; turkeys; grouse; partridges; quails; chickens; brush turkeys; curassows; hoatzins,
7745,01307567,n,9,heavy-bodied largely ground-feeding domestic or game birds,
7746,01307921,n,9,a domesticated gallinaceous bird though to be descended from the red jungle fowl,
7747,01308280,n,9,an American breed of domestic fowl,
7748,01308374,n,9,English breed of compact domestic fowl; raised primarily to crossbreed to produce roasters,
7749,01308518,n,9,small plump hybrid developed by crossbreeding Plymouth Rock and Cornish fowl,
7750,01308672,n,9,any of several breeds reared for cock-fighting,
7751,01308774,n,9,Asian breed of large fowl with dense plumage and feathered legs,
7752,01308905,n,9,common domestic birds and related forms,
7753,01309069,n,9,small Asiatic wild bird; believed to be ancestral to domestic fowl,
7754,01309276,n,9,male jungle fowl,
7755,01309350,n,9,female jungle fowl,
7756,01309425,n,9,SE Asian jungle fowl considered ancestral to domestic fowl,
7757,01309561,n,9,bred for flesh or eggs; believed to have been developed from the red jungle fowl,
7758,01309874,n,9,any of various small breeds,
7759,01309954,n,9,young bird esp. of domestic fowl,
7760,01310064,n,9,adult male chicken,
7761,01310180,n,9,the fleshy red crest on the head of the domestic fowl and other gallinaceous birds,
7762,01310354,n,9,a young domestic cock; not older than one year,
7763,01310455,n,9,castrated male chicken,
7764,01310529,n,9,adult female chicken,
7765,01310661,n,9,a hen that has just laid an egg and emits a shrill squawk,
7766,01310772,n,9,a domestic hen ready to brood,
7767,01310893,n,9,young hen usually less than a year old,
7768,01310984,n,9,American breed of heavy-bodied brownish-red general-purpose chicken,
7769,01311114,n,9,American breed of chicken having barred gray plumage raised for meat and brown eggs,
7770,01311264,n,9,English breed of large white-skinned chickens,
7771,01311365,n,9,turkeys and some extinct forms,
7772,01311535,n,9,type genus of the Meleagrididae: wild and domestic turkeys,
7773,01311705,n,9,large gallinaceous bird with fan-shaped tail; widely domesticated for food,
7774,01311891,n,9,male turkey,
7775,01312008,n,9,a genus of birds of the family Meleagrididae including the ocellated turkey,
7776,01312199,n,9,wild turkey of Central and northern South America,
7777,01312362,n,9,any bird hunted as game,
7778,01312495,n,9,grouse,
7779,01312770,n,9,popular game bird having a plump body and feathered legs and feet,
7780,01313089,n,9,black grouse,
7781,01313209,n,9,grouse of which the male is bluish-black,
7782,01313399,n,9,large north European black grouse with a lyre-shaped tail,
7783,01313553,n,9,of W. Asia,
7784,01313652,n,9,male black grouse,
7785,01313738,n,9,female black grouse,
7786,01313834,n,9,ptarmigans,
7787,01313952,n,9,large arctic and subarctic grouse with feathered feet and usually white winter plumage,
7788,01314131,n,9,reddish-brown grouse of upland moors of Great Britain,
7789,01314329,n,9,female red grouse,
7790,01314400,n,9,male red grouse,
7791,01314470,n,9,type genus of the Tetraonidae: capercaillies,
7795,01315072,n,9,sage grouse,
7796,01315201,n,9,large grouse of sagebrush regions of North America,
7797,01315367,n,9,ruffed grouse,
7798,01315486,n,9,valued as a game bird in eastern United States and Canada,
7799,01315652,n,9,sharp-tailed grouse,
7800,01315768,n,9,large grouse of prairies and open forests of western North America,
7801,01315939,n,9,prairie chickens,
7802,01316071,n,9,brown mottled North American grouse of western prairies,
7803,01316293,n,9,the most common variety of prairie chicken,
7804,01316426,n,9,a smaller prairie chicken of Western Texas,
7805,01316566,n,9,extinct prairie chicken,
7806,01316673,n,9,curassows; guans; chachalacas,
7808,01317127,n,9,type genus of the Cracidae: curassows,
7809,01317266,n,9,large crested arboreal game bird of warm parts of the Americas having long legs and tails; highly esteemed as game and food,
7810,01317463,n,9,a genus of guans (turkey-like arboreal birds valued as game and food birds),
7811,01317629,n,9,genus of large crested guans (the piping guans),
7812,01317782,n,9,a kind of guan,
7813,01317873,n,9,chachalacas,
7814,01318011,n,9,slender arboreal guan resembling a wild turkey; native to Central America and Mexico; highly regarded as game birds,
7815,01318220,n,9,of Mexico and Texas,
7816,01318346,n,9,megapodes,
7817,01318550,n,9,type genus of the Megapodiidae,
7818,01318675,n,9,large-footed short-winged birds of Australasia; build mounds of decaying vegetation to incubate eggs,
7819,01318944,n,9,mallee fowl,
7820,01319052,n,9,Australian moundbird; incubates eggs naturally in sandy mounds,
7821,01319244,n,9,adult female mallee fowl,
7822,01319325,n,9,brush turkeys,
7823,01319448,n,9,black megapode of wooded regions of Australia and New Guinea,
7824,01319605,n,9,maleos,
7825,01319731,n,9,Celebes megapode that lays eggs in holes in sandy beaches,
7826,01319881,n,9,pheasants; quails; partridges,
7827,01320293,n,9,a kind of game bird in the family Phasianidae,
7828,01320467,n,9,type genus of the Phasianidae: the typical pheasants,
7829,01320650,n,9,large long-tailed gallinaceous bird native to the Old World but introduced elsewhere,
7830,01320934,n,9,common pheasant having bright plumage and a white neck ring,
7831,01321120,n,9,Congo peafowl,
7832,01321213,n,9,both sexes are brightly colored,
7833,01321336,n,9,argus pheasants,
7834,01321465,n,9,large brilliantly patterned East Indian pheasant,
7835,01321601,n,9,golden pheasants,
7836,01321735,n,9,brightly colored crested pheasant of mountains of western and central Asia,
7837,01321912,n,9,New World quail: the bobwhites,
7838,01322050,n,9,a popular North American game bird; named for its call,
7839,01322225,n,9,a favorite game bird of eastern and central United States,
7840,01322368,n,9,Old World quail,
7841,01322493,n,9,small game bird with a rounded body and small tail,
7842,01322642,n,9,the typical Old World quail,
7843,01322771,n,9,monals,
7844,01322893,n,9,brilliantly colored south Asian pheasant,
7846,01323259,n,9,peafowl,
7847,01323368,n,9,very large terrestrial southeast Asian pheasant often raised as an ornamental bird,
7848,01323628,n,9,a young peafowl,
7849,01323698,n,9,male peafowl; having a crested head and very large fanlike tail marked with iridescent eyes or spots,
7850,01323852,n,9,female peafowl,
7851,01323919,n,9,peafowl of India and Ceylon,
7852,01324022,n,9,peafowl of southeast Asia,
7853,01324122,n,9,small gallinaceous game birds,
7854,01324295,n,9,California quail,
7855,01324402,n,9,plump chunky bird of coastal California and Oregon,
7858,01324820,n,9,Old World partridges,
7859,01325051,n,9,small Old World gallinaceous game birds,
7860,01325256,n,9,a genus of Perdicinae,
7861,01325383,n,9,common European partridge,
7862,01325526,n,9,a genus of Perdicidae,
7863,01325678,n,9,common western European partridge with red legs,
7864,01325829,n,9,of mountainous areas of southern Europe,
7865,01325985,n,9,mountain quail of western United States,
7866,01326134,n,9,California partridge; slightly larger than the California quail,
7867,01326323,n,9,guinea fowl and related birds of Africa and Madagascar,
7868,01326527,n,9,guinea fowl,
7869,01326644,n,9,W African bird having dark plumage mottled with white; native to Africa but raised for food in many parts of the world,
7870,01326904,n,9,female guinea fowl,
7871,01326979,n,9,comprising the hoatzins,
7872,01327125,n,9,type genus of the Opisthocomidae: hoatzins,
7873,01327285,n,9,crested ill-smelling South American bird whose young have claws on the first and second digits of the wings,
7874,01327510,n,9,coextensive with the family Tinamidae,
7875,01327665,n,9,comprising the tinamous,
7876,01327801,n,9,heavy-bodied small-winged South American game bird resembling a gallinaceous bird but related to the ratite birds,
7877,01327999,n,9,sand grouse; pigeons; doves; extinct dodos and solitaires,
7878,01328233,n,9,cosmopolitan order of land birds having small heads and short legs with four unwebbed toes,
7879,01328477,n,9,extinct dodos and solitaires,
7880,01328635,n,9,type genus of the Raphidae: dodos,
7881,01328774,n,9,extinct heavy flightless bird of Mauritius related to pigeons,
7882,01328925,n,9,constituted by the extinct solitaire,
7883,01329073,n,9,extinct flightless bird related to the dodo,
7884,01329213,n,9,doves and pigeons,
7885,01329440,n,9,wild and domesticated birds having a heavy body and short legs,
7886,01329700,n,9,any of numerous small pigeons,
7887,01329834,n,9,type genus of the Columbidae: typical pigeons,
7889,01330229,n,9,wild pigeon of western North America; often mistaken for the now extinct passenger pigeon,
7890,01330451,n,9,Eurasian pigeon with white patches on wings and neck,
7891,01330619,n,9,turtledoves,
7892,01330747,n,9,any of several Old World wild doves,
7893,01330893,n,9,the common European wild dove noted for its plaintive cooing,
7894,01331019,n,9,grayish Old World turtledove with a black band around the neck; often caged,
7895,01331172,n,9,a genus of Columbidae,
7896,01331309,n,9,small Australian dove,
7897,01331452,n,9,mourning doves,
7898,01331578,n,9,wild dove of the United States having a mournful call,
7899,01331731,n,9,domesticated pigeon raised for sport or food,
7900,01331910,n,9,an unfledged pigeon,
7901,01331981,n,9,fancy domestic pigeon having blue-and-white plumage and heavily muffed feet,
7902,01332116,n,9,pigeon that executes backward somersaults in flight or on the ground,
7903,01332264,n,9,pigeon trained to return home,
7904,01332379,n,9,a homing pigeon used to carry messages,
7905,01332478,n,9,a genus of Columbidae,
7906,01332613,n,9,gregarious North American migratory pigeon now extinct,
7907,01332774,n,9,sandgrouses,
7908,01332944,n,9,pigeon-like bird of arid regions of the Old World having long pointed wings and tail and precocial downy young,
7909,01333198,n,9,type genus of the Pteroclididae,
7910,01333360,n,9,sandgrouse of India,
7911,01333483,n,9,sandgrouse of Europe and Africa having elongated middle tail feathers,
7912,01333679,n,9,a genus of Pteroclididae,
7913,01333817,n,9,Eurasiatic sandgrouse with a black patch on the belly,
7914,01333978,n,9,an order of birds including parrots and amazons and cockatoos and lorikeets and lories and macaws and parakeets,
7915,01334230,n,9,usually brightly colored zygodactyl tropical birds with short hooked beaks and the ability to mimic sounds,
7919,01335094,n,9,type genus of the Psittacidae: usually restricted to the African gray,
7921,01335476,n,9,a genus of Psittacidae,
7922,01335606,n,9,mainly green tropical American parrots,
7923,01335716,n,9,macaws,
7924,01335822,n,9,long-tailed brilliantly colored parrot of Central and South America; among the largest and showiest of parrots,
7925,01336003,n,9,a genus of Psittacidae,
7926,01336131,n,9,large brownish-green New Zealand parrot,
7927,01336258,n,9,a genus of Psittacidae,
7928,01336414,n,9,white or light-colored crested parrot of the Australian region; often kept as cage birds,
7929,01336612,n,9,white cockatoo with a yellow erectile crest,
7930,01336764,n,9,white Australian cockatoo with roseate tinged plumage,
7931,01336899,n,9,a genus of Psittacidae,
7932,01337033,n,9,small gray Australian parrot with a yellow crested head,
7933,01337217,n,9,a genus of Psittacidae,
7934,01337351,n,9,small African parrot noted for showing affection for their mates,
7935,01337489,n,9,lories,
7936,01337647,n,9,small brightly colored Australasian parrots having a brush-tipped tongue for feeding on nectar and soft fruits,
7937,01337845,n,9,any of various small lories,
7938,01337963,n,9,a genus of Loriinae,
7939,01338100,n,9,lorikeet with a colorful coat,
7940,01338237,n,9,a genus of Loriinae,
7941,01338376,n,9,a kind of lorikeet,
7942,01338503,n,9,any of numerous small slender long-tailed parrots,
7943,01338718,n,9,a genus of Psittacidae,
7944,01338854,n,9,extinct parakeet whose range extended far into the United States,
7945,01339027,n,9,a genus of Psittacidae,
7946,01339169,n,9,small Australian parakeet usually light green with black and yellow markings in the wild but bred in many colors,
7947,01339464,n,9,a genus of Psittacidae,
7948,01339600,n,9,African parakeet,
7949,01339723,n,9,cuckoos; touracos; etc.,
7950,01339902,n,9,birds having zygodactyl feet (except for the touracos),
7951,01340073,n,9,includes cuckoo; ani; roadrunner,
7952,01340313,n,9,any of numerous European and North American birds having pointed wings and a long tail,
7953,01340561,n,9,type genus of the Cuculidae,
7954,01340696,n,9,common European cuckoo having a distinctive two-note call; lays eggs in the nests of other birds,
7955,01340891,n,9,a genus of Cuculidae,
7956,01341021,n,9,North American cuckoo; builds a nest and rears its own young,
7957,01341193,n,9,roadrunners,
7958,01341316,n,9,speedy largely terrestrial bird found from California and Mexico to Texas,
7959,01341508,n,9,ani,
7960,01341625,n,9,black tropical American cuckoo,
7961,01341724,n,9,a genus of Cuculidae,
7962,01341856,n,9,Old World ground-living cuckoo having a long dagger-like hind claw,
7963,01342030,n,9,common coucal of India and China,
7964,01342143,n,9,Australian bird with a tail like a pheasant,
7965,01342290,n,9,touracos,
7966,01342436,n,9,type genus of the Musophagidae,
7967,01342559,n,9,large brightly crested bird of Africa,
7968,01342698,n,9,rollers; kingfishers; hornbills; hoopoes; motmots; bee_eaters; todies,
7970,01343211,n,9,chiefly short-legged arboreal nonpasserine birds that nest in holes,
7971,01343504,n,9,rollers,
7972,01343645,n,9,Old World bird that tumbles or rolls in flight; related to kingfishers,
7973,01343823,n,9,type genus of the Coraciidae,
7974,01343961,n,9,common European blue-and-green roller with a reddish-brown back,
7975,01344125,n,9,Madagascan roller with terrestrial and crepuscular habits that feeds on e.g. insects and worms,
7976,01344279,n,9,kingfishers,
7977,01344464,n,9,nonpasserine large-headed bird with a short tail and long sharp bill; usually crested and bright-colored; feed mostly on fish,
7978,01344719,n,9,type genus of the Alcedinidae,
99830,N0000294,n,10,,
7980,01345009,n,9,a genus of birds of the family Aldecinidae,
7981,01345157,n,9,grayish-blue North American kingfisher with a chestnut band on its chest,
7982,01345328,n,9,Australasian kingfishers,
7983,01345458,n,9,Australian kingfisher having a loud cackling cry,
7984,01345616,n,9,bee-eaters,
7985,01345758,n,9,type genus of the Meropidae,
7987,01346039,n,9,hornbills,
7988,01346184,n,9,type genus of the family Bucerotidae,
7989,01346309,n,9,bird of tropical Africa and Asia having a very large bill surmounted by a bony protuberance; related to kingfishers,
7990,01346498,n,9,hoopoes,
7991,01346635,n,9,type genus of the Upupidae,
7992,01346765,n,9,any of several crested Old World birds with a slender down-curving bill,
7993,01346935,n,9,pinkish-brown hoopoe with black-and-white wings,
7994,01347076,n,9,wood hoopoes,
7995,01347209,n,9,type and only genus of the family Phoeniculidae,
7996,01347372,n,9,tropical African bird having metallic blackish plumage but no crest,
7997,01347516,n,9,a family of birds of the order Coraciiformes,
7998,01347692,n,9,type genus of the Momotidae,
7999,01347808,n,9,tropical American bluejay-like bird having greenish and bluish plumage,
8000,01347958,n,9,a family of birds of the order Coraciiformes,
8001,01348111,n,9,type genus of the Todidae,
8002,01348240,n,9,tiny insectivorous West Indian bird having red-and-green plumage and a long straight bill,
8003,01348399,n,9,swifts; hummingbirds,
8004,01348592,n,9,nonpasserine bird having long wings and weak feet; spends much of its time in flight,
8005,01348810,n,9,swifts; in former classifications included in the order Coraciiformes,
8006,01349047,n,9,small plain-colored bird that resembles a swallow and is noted for its rapid flight,
8007,01349255,n,9,type genus,
8008,01349367,n,9,common European bird with a shrieking call that nests chiefly about eaves of buildings or on cliffs,
8009,01349558,n,9,a genus of Apodidae,
8010,01349687,n,9,American swift that nests in e.g. unused chimneys,
8011,01349853,n,9,a genus of Apodidae,
8012,01349986,n,9,swift of eastern Asia; produces the edible bird's nest,
8013,01350139,n,9,tree swifts,
8014,01350271,n,9,birds of southeast Asia and East Indies differing from true swifts in having upright crests and nesting in trees,
8015,01350475,n,9,hummingbirds,
8016,01350661,n,9,tiny American bird having brilliant iridescent plumage and long slender bills; wings are specialized for vibrating flight,
