73779,01206498,v,9,seethe with deep anger or resentment; 'She was sizzling with anger',
73780,01206630,v,9,have an emotional or cognitive impact upon; 'This struck me as odd',
73781,01206985,v,9,refer to or be relevant to; 'I hope this message hits home!',
73782,01207150,v,9,affect suddenly with deep feeling; 'He was smitten with love for this young girl',
73783,01207302,v,9,make gloomy or depressed; 'Their faces were clouded with sadness',
73784,01207430,v,9,"move or affect (a person's emotions, bodily feelings, etc.) deeply or sharply; 'The cold pierced her bones'; 'Her words pierced the students'",
73785,01207643,v,9,impress positively; 'The young chess player impressed her audience',
73786,01207819,v,9,make a positive impression (on someone) beforehand: 'A prepossessing appearance',
73787,01207975,v,9,impress greatly; 'The speaker wowed the audience',
73788,01208093,v,9,overwhelm emotionally; 'Her swept her away',
73789,01208224,v,9,move deeply; 'This book upset me'; 'A troubling thought',
73790,01208417,v,9,affect emotionally; 'A stirring movie'; 'I was touched by your kind letter of sympathy',
73791,01208618,v,9,evoke an emotional response; 'Brahms's 'Requiem' gets me every time',
73792,01208774,v,9,irritate; 'Her childish behavior really get to me'; 'His lying really gets me',
73793,01208947,v,9,arouse sympathy or compassion in; 'Her fate moved us all',
73794,01209074,v,9,undergo an emotional sensation; 'She felt resentful'; 'He felt regret',
73795,01209585,v,9,experience anew: 'She could not recapture that feeling of happiness',
73796,01209720,v,9,be proud,
73797,01209835,v,9,be proud of; 'He prides himself on making it into law school',
73798,01209982,v,9,have strong suppressed feelings,
73799,01210089,v,9,"give expression or emotion to, in a stage or movie role",
73800,01210207,v,9,arouse or elicit a feeling,
73801,01210323,v,9,"maintain; as of a theory, thoughts, or feelings; 'bear a grudge'; 'hold a grudge'",
73802,01210505,v,9,feel bitter or indignant about; 'She resents being paid less than her co-workers',
73803,01210676,v,9,cause to be bitter or resentful; 'These injustices embittered her even more',
73804,01210839,v,9,accept or admit unwillingly,
73805,01210930,v,9,gnaw into; make resentful or angry,
73806,01211054,v,9,bear a grudge; harbor ill feelings,
100686,N0000442,n,10,,
73808,01211403,v,9,find repugnant,
73809,01211520,v,9,look down on with disdain; 'He despises the people he has to work for'; 'The professor scorns the students who don't catch on immediately',
73810,01211759,v,9,have a great affection or liking for; 'I love French food'; 'She loves her boss and works hard for him',
73811,01212004,v,9,be enamored or in love with; 'She loves her husband deeply',
73812,01212143,v,9,have a love affair with,
73813,01212239,v,9,fall in love with; become infatuated with; 'She fell for the man from Brazil',
73814,01212390,v,9,to remain emotionally or intellectually attached; 'He clings to the idea that she might still love him.',
73815,01212539,v,9,be fond of; be attached to,
73816,01212690,v,9,hold sacred,
73817,01212775,v,9,have a fancy or particular liking or desire for; 'She fancied a necklace that she had seen in the jeweler's window',
73818,01212998,v,9,have or feel a dislike or distaste for; 'I really dislike this salesman',
73819,01213205,v,9,be fond of; 'I like my nephews',
73820,01213288,v,9,take a liking to; 'cotton to something',
73821,01213391,v,9,find enjoyable or agreeable; 'I like jogging'; 'She likes to read Russian novels',
73822,01213640,v,9,shower with love; show excessive affection for; 'Grandmother dotes on her the twins',
73823,01213786,v,9,have affection for; feel tenderness for,
73824,01213888,v,9,feel less enamoured of something or somebody,
73825,01213998,v,9,love intensely; 'he just adored his wife',
73826,01214144,v,9,love unquestioningly and uncritically,
73827,01214306,v,9,be in awe of; 'Fear God as your father',
73828,01214483,v,9,"show religious devotion to, as of a deity; 'Many Hindus worship Shiva'",
73829,01214618,v,9,cause fear in; 'The stranger who hangs around the building frightens me',
73830,01214954,v,9,inspire awe in; 'The famous professor awed the undergraduates',
73831,01215095,v,9,"subdue, restrain, or overcome by affecting with a feeling of awe",
73832,01215256,v,9,intimidate or overawe,
73833,01215350,v,9,drive out by frightening,
73835,01215644,v,9,be uneasy or apprehensive about; 'I fear the results of the final exams',
73836,01215760,v,9,be sorry; used to introduce an unpleasant statement: 'I fear I won't make it to your wedding party',
73837,01215921,v,9,be afraid or feel anxious or apprehensive about a possible or probable situation or event; 'I fear she might get aggressive',
73838,01216115,v,9,fill with terror; frighten greatly,
73839,01216252,v,9,make timid or fearful; 'Her boss intimidates her',
73840,01216405,v,9,intimidate somebody (with a threat); 'She was holding it over him',
73841,01216538,v,9,be bossy towards; 'Her big brother always bullied her when she was young',
73842,01216775,v,9,rule or exercise power over (somebody) in a cruel and autocratic manner; 'her husband and mother-in-law tyrannize her',
73843,01216971,v,9,cause to feel horror,
73844,01217082,v,9,cause panic in; fill with panic; 'Th mere thought of an isolation cell panicked the prisoners',
73845,01217265,v,9,feel panic; 'The students panicked when told that final exams were less than a week away',
73846,01217443,v,9,anticipate with dread or anxiety,
73847,01217571,v,9,fill with apprehension or alarm,
73848,01217709,v,9,strike with horror or terror; 'The news of the bombing shocked her',
73849,01217847,v,9,haunt like a ghost; pursue; 'She is haunted by her fear of illness',
73850,01218002,v,9,engage or engross the interest or attention of beforehand; 'His work preoccupies him',
73851,01218191,v,9,cause to be preoccupied; 'The idea of his failure prepossesses him',
73852,01218326,v,9,disturb the composure of,
73853,01218470,v,9,cause to lose one's nerve; 'an unmanning experience',
73854,01218593,v,9,"lose one's nerve; 'When he saw the accident, he freaked out'",
73855,01218755,v,9,"lose control of one's emotions; 'When she heard that she had not passed the exam, she lost it completely'",
73857,01219263,v,9,languish as with love or desire; 'She dying for a cigarette'; 'I was dying to leave',
73858,01219416,v,9,force out or release suddenly and often violently something pent up; 'break into tears'; 'erupt in anger',
73860,01219733,v,9,cause to lose courage; 'dashed by the refusal',
73861,01219920,v,9,make angry; 'The news angered him',
73862,01220151,v,9,irritate or vex; 'It galls me that we lost the suit',
73863,01220279,v,9,make furious,
73864,01220411,v,9,become angry; 'He angers easily',
73866,01220665,v,9,make mad; 'His behavior is maddening',
73867,01220774,v,9,drive up the wall; go on someone's nerves,
73868,01220887,v,9,cause to go crazy; cause to lose one's mind,
73870,01221478,v,9,"cause to be annoyed, irritated, or resentful",
73871,01221593,v,9,trouble or vex; 'ruffle somebody's composure',
73872,01221710,v,9,cause annoyance in,
73873,01221816,v,9,cause to feel resentment or indignation; 'Her tactless remark offended me',
73874,01221988,v,9,annoy continually or chronically; 'He is known to harry his staff when he is overworked',
73875,01222254,v,9,cause to lose one's composure,
73876,01222491,v,9,cause to be flustered or consternated,
73877,01222619,v,9,cause to feel embarrassment; 'The constant attention of the young man confused her',
73878,01222893,v,9,cause to be confused emotionally,
73879,01223033,v,9,make confused or perplexed or puzzled,
73880,01223160,v,9,make nervous or agitated; 'The mere thought of her bothered him and made his heart beat faster',
73881,01223346,v,9,draw someone's attention away from something,
73882,01223486,v,9,be flustered; behave in a confused manner,
73883,01223592,v,9,cause to be embarrassed; cause to feel self-conscious,
73884,01223746,v,9,cause to be ashamed,
73885,01223854,v,9,look with disfavor on; 'The republic soon discountenanced its few friends',
73886,01224008,v,9,"cause anguish;, make miserable",
73887,01224189,v,9,hurt the feelings of; 'She hurt me when she did not include me among her guests',
73888,01224409,v,9,worry unnecessarily of excessively,
73889,01224565,v,9,raise scruples; 'He lied and did not even scruple about it',
73890,01224697,v,9,suffer agony or anguish,
73891,01224803,v,9,cause to agonize,
73892,01224912,v,9,endure emotional pain,
73894,01225225,v,9,"be mad, angry, or furious",
73895,01225320,v,9,"blow one's stack; fly off the handle, flip one's wig; lose one's temper; blow a fuse",
73896,01225491,v,9,put into a rage; make violently angry,
73897,01225618,v,9,feel intense anger,
73898,01225706,v,9,feel sudden intense sensation or emotion; 'he was thrilled by the speed and the roar of the engine.',
73899,01225879,v,9,feel remorse for; feel sorry for; be contrite about,
73900,01226025,v,9,turn away from sin or do penitence,
73901,01226113,v,9,feel sad about the loss or absence of,
73902,01226222,v,9,fell sadness; 'She is mourning her dead child',
73903,01226339,v,9,observe the customs of mourning after the death of a loved one,
73904,01226464,v,9,feel grief; eat one's heart out,
73905,01226612,v,9,break the heart of; cause to feel sorrow,
73906,01226745,v,9,cause great unhappiness for,
73907,01226873,v,9,cause mental pain to,
73908,01226967,v,9,test the limits of; 'You are trying my patience!',
73909,01227121,v,9,rack one's brains,
73910,01227200,v,9,give pain or trouble to; 'I've been sorely tried by these students',
73911,01227336,v,9,fail to meet the hopes or expectations of,
73912,01227518,v,9,"disappoint, prove undependable to; abandon, forsake; 'His sense of smell failed him this time'; 'His strength finally failed him'; 'His children failed him in the crisis'",
73913,01227767,v,9,fail to meet (expectations or standards),
73914,01227912,v,9,"hinder or prevent (the efforts, plans, or desires) of; thwart",
73915,01228083,v,9,make ineffective or powerless; 'The teachers were hamstrung by the overly rigid schedules',
73916,01228249,v,9,lower in esteem; hurt the pride of,
73917,01228413,v,9,"reduce in worth, character, etc; disgrace; dishonour",
73919,01228705,v,9,lower in grade or rank; 'She reduced her niece to a servant'; force somebody into an unpleasant situation,
73920,01228874,v,9,show to be irresponsible; demonstrate someone's incompetence,
73921,01229000,v,9,deprive of human qualities,
73922,01229112,v,9,make more human,
73923,01229222,v,9,cause to be unpretentious; 'This exeprience will humble him',
73924,01229372,v,9,hold within limits and control; 'subdue one's appetites',
73925,01229528,v,9,express grief verbally,
73926,01229639,v,9,give verbal or other expression to one's feelings,
73927,01229834,v,9,torment emotionally or mentally,
73928,01229968,v,9,annoy constantly,
73929,01230185,v,9,annoy persistently; 'The children teased the boy because of his stammer',
73930,01230365,v,9,offer and withdraw,
73932,01230743,v,9,gain favor with somebody by deliberate efforts,
73933,01230883,v,9,ingratiate oneself to; often with insincere behavior; 'She is playing up to the chairman',
73934,01231091,v,9,be excited or anxious about,
73935,01231225,v,9,become excited about; 'He warmed to the idea of a trip to Antarctica',
73936,01231359,v,9,"be apathetic, gloomy, or dazed",
73937,01231478,v,9,be in a huff; be silent or sullen,
73938,01231606,v,9,feel or suffer from the lack of: 'He misses his mother',
73939,01231785,v,9,have a yen for,
73940,01231918,v,9,recognize with gratitude; be grateful for,
73941,01232027,v,9,prepare (oneself) for something unpleasant or difficult,
73942,01232171,v,9,get ready for something difficult or unpleasant,
73943,01232289,v,9,gain courage,
73944,01232387,v,9,attract; cause to be enamored; 'She captured all the men's hearts',
73945,01232663,v,9,appear inviting; 'The shop window decorations beckoned',
73946,01232782,v,9,make attractive or lovable: 'This behavior endeared her to me',
73947,01232908,v,9,provoke the hostility of; 'Don't antagonize your boss',
73948,01233051,v,9,give rise to a desire,
73949,01233160,v,9,try to seduce,
73950,01233236,v,9,be attractive to; 'The idea of a vacation appeals to me'; 'The beautiful garden attracted many people',
73951,01233464,v,9,attract or elicit; 'The school attracts students with artistic talents'; 'His playing drew a crowd',
73952,01233712,v,9,attract the attention of; 'The noise and the screaming brought the curious',
73953,01233868,v,9,cause aversion in; offend the moral sense of,
73954,01234043,v,9,cause to feel intense dislike or distaste,
73955,01234179,v,9,be repellent to; cause aversion in,
73956,01234366,v,9,surprise greatly; knock someone's socks off,
73957,01234562,v,9,"overcome, as with emotions or perceptual stimuli",
73958,01234840,v,9,"overwhelm with hilarity, pleasure, or admiration; 'The comedian was so funny, he was killing me!'",
73959,01235007,v,9,silence or overwhelm by shouting,
73960,01235107,v,9,overtake with darkness or night,
73961,01235203,v,9,overwhelm with admiration; 'All the guys were knocked out by her charm',
73962,01235349,v,9,"astound or overwhelm, as with shock: 'She was staggered with bills after she tried to rebuild her house following the earthquake'",
73963,01235543,v,9,hold fast (in a certain state); 'He was locked in a laughing fit',
73964,01235670,v,9,strike with disgust or revulsion; 'The scandalous behavior of this married woman shocked her friends',
73965,01235891,v,9,abandon hope; give up hope; lose heart; 'Don't despair--help is on the way!',
73966,01236040,v,9,be optimistic; be full of hope; have hopes; 'I am still hoping that all will turn out well',
73967,01236227,v,9,fill with high spirits; fill with optimism,
73968,01236454,v,9,make proud or conceited; 'The sudden fame puffed her ego',
73970,01236819,v,9,heighten or intensify; 'These paintings exalt the imagination',
73971,01237013,v,9,become glad or happy,
73972,01237116,v,9,make unhappy; 'The news of her death saddened me',
73973,01237297,v,9,come to feel sad,
73974,01237403,v,9,make glad or happy,
73976,01237680,v,9,feel happiness or joy,
73977,01237834,v,9,make more cheerful,
73978,01237971,v,9,be oppressive or disheartening to,
73980,01238399,v,9,give moral or emotional strength to,
73981,01238553,v,9,lessen the intensity of; calm; as of of anxieties and fears,
73982,01238726,v,9,"discharge bad feelings or tension through verbalization, in psychoanalysis",
73983,01238865,v,9,give pleasure to; be pleasing to,
73984,01239069,v,9,excite pleasurably,
73985,01239189,v,9,make happy or satisfied,
73986,01239331,v,9,fail to satisfy,
73987,01239476,v,9,make content; 'I am contented',
73988,01239597,v,9,make dissatisfied,
73989,01239708,v,9,give displeasure to,
73990,01239874,v,9,hold spellbound,
73991,01240044,v,9,free from enchantment,
73992,01240173,v,9,give encouragement to,
73993,01240333,v,9,become heartened or elated; 'Her spirits rose when she heard the good news',
73994,01240452,v,9,inspire with confidence; give hope or courage to,
73995,01240719,v,9,"encourage to be less reserved, as of a shy person",
73996,01240859,v,9,give heart or courage to,
73997,01240960,v,9,depress or discourage; 'The news of the city's surrender chilled the soldiers',
73998,01241117,v,9,deprive of courage or hope; take away hope from; cause to feel discouraged,
73999,01241339,v,9,take away the enthusiasm of,
74000,01241470,v,9,to compel or deter by or as if by threats,
74001,01241634,v,9,make a fuss; be agitated,
74002,01241746,v,9,make upset or troubled,
74003,01241840,v,9,act nervously; be undecided; be uncertain,
74004,01241953,v,9,derive or receive pleasure from; get enjoyment from; take pleasure in; 'She relished her fame and basked in her glory',
74005,01242209,v,9,"enjoy avidly, as of a book; 'She devoured his novels'",
74006,01242326,v,9,exasperate or irritate,
74008,01242774,v,9,excite the curiosity of; engage the interest of,
74009,01242949,v,9,to stimulate to action : '..startled him awake.',
74010,01243090,v,9,cause to be bored,
74011,01243184,v,9,share the suffering of,
74012,01243364,v,9,to feel or express sympathy or compassion,
74013,01243513,v,9,"express one's sympathetic grieve, as on the death of someone to his survivors",
74014,01243663,v,9,share the feelings of; understand the sentiments of,
74015,01243790,v,9,feel concern or interest; 'I really care about my work'; 'I don't care',
74016,01243967,v,9,show no concern or interest; always used in the negative: 'I don't give a hoot'; 'She doesn't give a damn about her job',
74017,01244174,v,9,be ecstatic with joy,
74018,01244286,v,9,"arouse enmity or indifference in where there had formerly been love, affection, or friendliness",
74019,01244504,v,9,detach the affections of,
74020,01244590,v,9,hope for; have a wish; 'I wish I could go home now',
74021,01244729,v,9,feel or express a desire or hope concerning the future or fortune of,
74022,01244897,v,9,prefer or wish to do something; 'Do you care to try this dish?' 'Would you like to come along to the movies?',
74023,01245100,v,9,be the will of or have the will (to); 'he could do many things if he pleased',
74024,01245250,v,9,wish ill or allow unwillingly,
74025,01245362,v,9,feel or have a desire for; want strongly; 'I want to go home now; 'I want my own room',
74026,01245795,v,9,want to have; 'I'd like a beer now!',
74027,01245893,v,9,have as one's ambition,
74028,01245981,v,9,have an inclination for something or some activity; 'I feel like staying in bed all day'; 'I feel like a cold beer now',
74029,01246175,v,9,express a desire for,
74030,01246259,v,9,like better; value more highly; 'Some people prefer camping to staying in hotels'; 'We prefer sleeping outside',
74031,01246466,v,9,expect with desire; 'I trust you will behave better from now on'; 'I hope she understands that she cannot exepct a raise',
74032,01246666,v,9,be envious of; set one's heart on,
74034,01246968,v,9,feel envious towards; admire enviously,
74035,01247076,v,9,envy without restraint,
74036,01247189,v,9,feel admiration for,
74037,01247311,v,9,have a strong sexual desire for; 'he is lusting after his secretary',
74038,01247460,v,9,desire strongly or persistently,
74039,01247570,v,9,"have a liking, fondness, or taste (for)",
74040,01247684,v,9,get pleasure from; 'I love cooking',
74041,01247815,v,9,be in want of,
74042,01247914,v,9,feel pride of; 'She took great pride in her sons',
74043,01248047,v,9,lose one's emotional or mental composure,
74044,01248170,v,9,"feel strong emotion, esp. anger or passion; 'She was burning with anger'; 'He was burning to try out his new skies'",
74045,01248347,v,9,become suddenly excited or angry; 'She flares up easily',
74046,01248467,v,9,feel indifferent towards; 'She died to worldly things and eventually entered a monastery',
74047,01248617,v,9,be elated; 'He was flying high during the summer months',
74049,01248980,v,9,be exuberant or high-spirited; 'Make the people's hearts glow',
74050,01249112,v,9,cause to feel enthusiasm,
74051,01249227,v,9,cause to be enthusiastic; 'Her playing brought down the house',
74052,01249365,v,9,"move so as to change position, as of a body part (nontranslational motion): 'He moved his hand slightly to the right'",
74053,01251262,v,9,"take position in the rear, esp. of a military formation or team sporting event, 'The defender dropped back behind his teammate'",
74054,01251456,v,9,"fall or drop suddenly, usually to evade some danger; 'The soldiers hit the dirt when they heard gunfire'",
74055,01251646,v,9,'He fell down to his knees,
74056,01251793,v,9,of body parts: 'prolapsed rectum',
74057,01251892,v,9,dash violently or with great speed or impetuosity; 'She plunged at it eagerly',
74058,01252034,v,9,move gently or carefully; 'He eased himself into the chair',
74059,01252181,v,9,move with a whish,
74060,01252269,v,9,remain in place; hold still; remain fixed or immobile,
74061,01252435,v,9,stop moving or become immobilized; 'When he saw the police car he froze',
74062,01252601,v,9,be unable to move further; 'The car bogged down in the sand',
74063,01252772,v,9,cause to get stuck as if in a mire; 'The mud mired our cart',
74064,01252913,v,9,of boats,
74065,01253005,v,9,move due to the pull of gravitation,
74067,01255856,v,9,go to or towards; 'a liquid seeks its own level',
74068,01255966,v,9,move with a whining sound; 'The bullets were whining past us',
74069,01256090,v,9,be dissipated; 'Rumors and accusations are flying',
74070,01256209,v,9,move like a floating object; 'The moon rode high in the night sky',
74071,01256361,v,9,cover a certain distance: 'She came a long way',
74072,01256478,v,9,move like a ghost; 'The masked men ghosted across the moonlit yard',
74073,01256616,v,9,displace oneself; go from one location to another,
74074,01256745,v,9,fly over; 'The plane passed over Damascus',
74075,01256872,v,9,travel in an airplane; 'she is flying to Cincinnati tonight'; 'Are we driving or flying?',
74076,01257030,v,9,"informal: travel by means of an aircraft, bus, etc; 'She hopped a train to Chicago'; 'He hopped rides all over the country'",
74077,01257215,v,9,"undergo transportation, as in a vehicle",
74078,01257396,v,9,direct one's course or way,
74079,01257484,v,9,cause to sheer: 'She sheered her car around the obstacle',
74080,01257604,v,9,travel or traverse (a distance) 'This car does 150 miles per hour'; 'We did 6 miles on our hike every day',
74081,01257779,v,9,"travel by boat, car, or plane",
74082,01257892,v,9,navigate in space; of astronauts,
74083,01257991,v,9,move quickly or suddenly; 'He flew about the place',
74084,01258127,v,9,leave the house to go somewhere; 'We never went out when our children were small',
74085,01258290,v,9,travel by raft in water; 'Raft the Colorado River',
74252,01285412,v,9,change place or direction; 'Shift one's position',
74087,01258616,v,9,move around; move from place to place; 'How does she get around without a car?',
74088,01258783,v,9,make a trip for pleasure,
74089,01259002,v,9,go on a junket,
74090,01259080,v,9,move travel or proceed toward something; 'He went to his cabin.',
74091,01259232,v,9,go to certain places,
74092,01259363,v,9,visit famous or interesting sights,
74094,01259670,v,9,visit again: 'We revisited Rome after 25 years',
74095,01259782,v,9,be a regular or frequent visitor to a certain place,
74096,01259899,v,9,go on a cruise,
74097,01259985,v,9,travel at a moderate speed; of vessels or airplanes,
74098,01260134,v,9,cruise in slow or routine flights,
74099,01260239,v,9,make a tour of a certain place,
74100,01260375,v,9,travel all over the world for pleasure and sightseeing,
74101,01260505,v,9,give theatrical performances while traveling from town to town,
74102,01260638,v,9,travel as for pleasure and sightseeing; go on travels,
74103,01260845,v,9,travel with a sledge; 'the antarctic expedition sledged along the coastline',
74104,01260993,v,9,travel by boat,
74105,01261115,v,9,travel by ship on (a body of water); 'We sailed the Atlantic'; 'This frigate has sailed to France',
74106,01261299,v,9,travel upon or across; 'travel the oceans',
74107,01261495,v,9,"ride over, along, or through: 'Travel the highways of America'",
74108,01261627,v,9,travel over (an area of land or sea) in an aircraft; 'Lindbergh was the first to fly the Atlantic',
74109,01261786,v,9,cause to fly or float: 'fly a kite',
74110,01261882,v,9,be stationary,
74111,01261992,v,9,"move in order to make room for someone for something; 'The park gave way to a supermarket'; '`Move over,' he told the crowd'",
74112,01262245,v,9,move away from a place into another direction; 'Go away before I start to cry'; 'The train departs at noon',
74113,01262491,v,9,leave; informal or rude: 'shove off!'; 'The children shoved along'; 'Blow now!',
74115,01263165,v,9,"metaphorically, as in time; 'Winter is approaching'; 'approaching old age'",
74116,01263393,v,9,grow late or (of time) elapse; 'It is getting on midnight--let's all go to bed!',
74117,01263545,v,9,approach while driving; 'The truck entered the driveway and drove up towards the house',
74118,01263706,v,9,"cause to move; 'Move those boxes into the corner, please'",
74119,01265292,v,9,move in ran agitated manner; 'His fingers worked with tension',
74120,01265417,v,9,move text to the previous line; in printing,
74121,01265527,v,9,move into the center; 'That vase in the picture is not centered',
74122,01265700,v,9,enter again; 'You cannot re-enter the country with this visa',
74123,01265859,v,9,raise with a pump; of gases or fluids,
74124,01265966,v,9,"move up and down, as of weights",
74125,01266059,v,9,draw or pour with a pump,
74126,01266171,v,9,"convey, draw off, or empty by or as if by a siphon",
74127,01266307,v,9,"draw through a sluice, as of water",
74128,01266405,v,9,"transport in or send down a sluice, as of logs",
74129,01266515,v,9,take liquid out of a container or well; 'She drew water from the barrel',
74130,01266812,v,9,draw something in by or as if by a vacuum; 'Mud was sucking at her feet',
74131,01266956,v,9,"draw off from the lees, as of wine",
74132,01267052,v,9,lift and reset in another soil or situation; 'Transplant the young rice plants',
74133,01267218,v,9,"move a light beam over; in electronics, to reproduce an image",
74134,01267341,v,9,"change residence, affiliation, or place of employment; 'We moved from Idaho to Nebraska'; 'The basketball player moved from one team to another'",
74135,01267627,v,9,move into a new house or office,
74136,01267741,v,9,occupy a place; 'The crowds are moving in',
74137,01267856,v,9,move out of one's old house or office,
