8407,01423521,n,9,hydras; polyps; jellyfishes; sea anemones; corals,
8408,01423832,n,9,radially symmetrical animals having saclike bodies with only one opening and tentacles with stinging structures; they occur in polyp and medusa forms,
8410,01424434,n,9,one of two forms that coelenterates take: is the free-swimming sexual stage in the life cycle of a coelenterate and has a gelatinous umbrella-shaped body and tentacles,
8411,01424673,n,9,coelenterates in which the polyp stage is absent or at least inconspicuous: jellyfishes,
8412,01424891,n,9,any of numerous usually marine and free-swimming coelenterates that constitute the sexually reproductive forms of hydrozoans and scyphozoans,
8413,01425161,n,9,small medusa,
8414,01425226,n,9,any of various usually free-swimming marine coelenterates having a gelatinous medusoid stage as the dominant phase of its life cycle,
8415,01425434,n,9,a genus of Scyphozoa,
8416,01425566,n,9,a type of jellyfish,
8417,01425674,n,9,coelenterates typically having alternation of generations; hydroid phase is usually colonial giving rise to the medusoid phase by budding: hydras and jellyfishes,
8418,01426002,n,9,colonial coelenterates having the polyp phase dominant,
8419,01426195,n,9,hydras,
8420,01426297,n,9,small tubular solitary freshwater hydrozoan polyp,
8421,01426417,n,9,marine colonial hydrozoans,
8422,01426599,n,9,a floating or swimming oceanic colony of polyps often transparent or showily colored,
8423,01426833,n,9,a genus of Siphonophora,
8424,01426954,n,9,small creatures resembling pieces of fuzzy rope; each with a cluster of swimming bells serving as the head and long elastic tentacles for drawing in prey,
8425,01427180,n,9,Portuguese man-of-war,
8426,01427311,n,9,large siphonophore having a bladderlike float and stinging tentacles,
8427,01427491,n,9,colonial siphonophore of up to 130 ft long,
8428,01427585,n,9,large siphonophore of up to 50 ft long,
8429,01427678,n,9,sessile hydroid that forms feathery colonies,
8430,01427836,n,9,feathery colony of long-branched stems bearing stalkless paired polyps,
8431,01427983,n,9,no alternation of generations the medusoid phase being entirely suppressed: sea anemones; corals,
8432,01428276,n,9,sessile marine coelenterates including solitary and colonial polyps; the medusoid phase is entirely suppressed,
8433,01428528,n,9,sea anemones,
8434,01428722,n,9,marine polyps that resemble flowers but have oral rings of tentacles; differ from corals in forming no hard skeleton,
8435,01428933,n,9,any sea anemone or related animal,
8436,01429064,n,9,a genus of sea anemone common in rock pools,
8437,01429196,n,9,corals and sea anemones having eight branches,
8438,01429393,n,9,comprising the soft corals,
8439,01429517,n,9,sea pens,
8440,01429644,n,9,type genus of the family Pennatulidae: sea pens,
8443,01430113,n,9,red corals and sea fans,
8444,01430290,n,9,corals having a horny of calcareous branching skeleton,
8445,01430491,n,9,corals forming featherlike colonies,
8446,01430584,n,9,corals having a treelike or fan-shaped horny skeleton,
8447,01430691,n,9,corals of esp. the Mediterranean having pink or red color used for ornaments and jewelry,
8448,01430835,n,9,stony corals,
8449,01431022,n,9,corals having calcareous skeletons aggregations of which form reefs and islands,
8450,01431264,n,9,brain corals,
8451,01431386,n,9,massive reef-building coral having a convoluted and furrowed surface,
8452,01431531,n,9,"coelanterate genus of order Madreporaria, including staghorn corals",
8453,01431708,n,9,large branching coral resembling antlers,
8454,01431848,n,9,mushroom corals,
8455,01431950,n,9,flattened disk-shaped stony coral usually solitary,
8456,01432061,n,9,a family of ctenophores,
8457,01432203,n,9,a genus of ctenophores,
8458,01432361,n,9,comb jellies; sea acorns; a small phylum formerly considered a class of Coelenterata,
8459,01432636,n,9,comb-plate or locomotor organ consisting of a row of strong cilia whose bases are fused,
8461,01433149,n,9,ctenophores lacking tentacles; comprises one genus: Beroe,
8462,01433308,n,9,coextensive with the class Nuda,
8463,01433435,n,9,delicately iridescent thimble-shaped ctenophores,
8464,01433554,n,9,ctenophores have retractile tentacles,
8465,01433764,n,9,ctenophores having two long pinnate tentacles,
8466,01433962,n,9,an order of Tentaculata,
8467,01434101,n,9,ctenophore have long tentacles and flattened body,
8468,01434228,n,9,sea gooseberries,
8469,01434352,n,9,sea gooseberries,
8470,01434488,n,9,ctenophore having a rounded body with longitudinal rows of cilia,
8471,01434632,n,9,ctenophore having short tentacles; one family,
8472,01434785,n,9,coextensive with the order Cestida; ctenophores having a greatly flattened and elongated body,
8473,01434989,n,9,Venus's girdle,
8474,01435109,n,9,ctenophore having a ribbon-shaped iridescent gelatinous body,
8475,01435266,n,9,ctenophore having tentacles only in the immature stage; body compressed vertically having two large oral lobes and four pointed processes,
8476,01435490,n,9,ciliated comb-like swimming plate of a ctenophore,
8477,01435609,n,9,a family of worms,
8478,01435937,n,9,a genus of worms,
8480,01436731,n,9,worm that is parasitic on the intestines of vertebrates especially roundworms and tapeworms and flukes,
8481,01436962,n,9,a larva of a woodborer,
8482,01437039,n,9,any of various insects or larvae or mollusks that bore into wood,
8483,01437167,n,9,phylum or class of elongated wormlike parasites that live in the intestines of vertebrates: spiny-headed worms,
8484,01437400,n,9,any of various worms living parasitically in intestines of vertebrates having a retractile proboscis covered with many hooked spines,
8485,01437633,n,9,arrowworms: a group of small active transparent marine worms,
8486,01437850,n,9,any worm of the Chaetognatha; transparent marine worm with horizontal lateral and caudal fins and a row of movable curved spines at each side of the mouth,
8487,01438111,n,9,chief genus of Chaetognatha including the largest arrowworms,
8488,01438269,n,9,any arrowworm of the genus Sagitta,
8489,01438376,n,9,marine worms resembling the sagittas but with a broader body and only one pair of lateral fins,
8490,01438550,n,9,flatworms,
8491,01438760,n,9,encysted saclike larva of the tapeworm,
8492,01438876,n,9,parasitic or free-living worms having a flattened body,
8493,01439093,n,9,free-living flatworms,
8494,01439230,n,9,free-swimming mostly freshwater flatworms; popular in laboratory studies for the ability to regenerate lost parts,
8495,01439429,n,9,flukes,
8496,01439623,n,9,parasitic flatworms having external suckers for attaching to a host,
8669,01471228,n,9,razor clams,
8498,01439965,n,9,a family of Trematoda,
8499,01440103,n,9,a genus of Fasciolidae,
8500,01440235,n,9,flatworm parasitic in liver and bile ducts of domestic animals and humans,
8501,01440405,n,9,a family of Trematoda,
8502,01440553,n,9,type genus of the family Schistosomatidae: blood flukes,
8503,01440724,n,9,flatworms parasitic in the blood vessels of mammals,
8504,01440866,n,9,tapeworms,
8506,01441231,n,9,a family of Cestoda,
8507,01441382,n,9,tapeworms,
8508,01441494,n,9,tapeworms whose larvae are parasitic in humans and domestic animals,
8509,01441639,n,9,type genus of the family Taeniidae: tapeworms,
8510,01441781,n,9,tapeworms parasitic in humans which uses the pig as its intermediate host,
8511,01441926,n,9,proboscis worms,
8512,01442083,n,9,soft unsegmented marine worms having a threadlike proboscis and the ability to stretch and contract,
8513,01442300,n,9,beard worms,
8514,01442428,n,9,slender animal with tentacles and a tubelike outer covering; lives on the deep ocean bottom,
8515,01442610,n,9,a phylum including: rotifers,
8516,01442749,n,9,minute aquatic multicellular organisms having a ciliated wheel-like organ for feeding and locomotion; constituents of freshwater plankton,
8517,01442959,n,9,unsegmented worms: roundworms; threadworms; eelworms,
8518,01443351,n,9,one of two subgroups of Nematoda used in some classification systems,
8519,01443514,n,9,one of two subgroups of Nematoda used in some classification systems,
8520,01443675,n,9,unsegmented worms with elongated rounded body pointed at both ends; mostly free-living but some are parasitic,
8521,01444014,n,9,large roundworms parasitic in intestines of vertebrates,
8522,01444201,n,9,type genus of the family Ascaridae: roundworms with a three-lipped mouth,
8523,01444381,n,9,intestinal parasite of humans and pigs,
8524,01444524,n,9,roundworm having a preanal sucker,
8525,01444669,n,9,intestinal parasite of domestic fowl,
8526,01444806,n,9,pinworms,
8527,01444927,n,9,pinworms,
8528,01445049,n,9,small threadlike worm infesting human intestines and rectum esp. in children,
8529,01445237,n,9,any of various small free-living plant-parasitic roundworms,
8530,01445368,n,9,a family of Nematoda,
8531,01445507,n,9,a genus of Cephalobidae,
8532,01445674,n,9,minute eelworm that feeds on organisms that cause fermentation in e.g. vinegar,
8533,01445881,n,9,a family of Nematoda,
8534,01446018,n,9,type genus of the family Tylenchidae,
8535,01446166,n,9,small roundworm parasitic on wheat,
8536,01446323,n,9,hookworms,
8537,01446459,n,9,parasitic blood-sucking roundworms having hooked mouth parts to fasten to the intestinal wall of human and other hosts,
8538,01446651,n,9,threadlike roundworms,
8539,01446787,n,9,slender threadlike roundworms living in the blood and tissues of vertebrates; transmitted as larvae by biting insects,
8540,01446977,n,9,greatly elongated roundworm,
8541,01447125,n,9,type genus of the family Dracunculidae,
8542,01447279,n,9,parasitic roundworm of India and Africa that lives beneath the skin of man and other vertebrates,
8543,01447477,n,9,segmented worms: earthworms; lugworms; leeches,
8544,01447710,n,9,worms with cylindrical bodies segmented both internally and externally,
8545,01447957,n,9,a class of Annelida,
8546,01448096,n,9,small primitive marine worm lacking external segmentation and resembling polychaete larvae,
8547,01448264,n,9,earthworms,
8549,01448647,n,9,terrestrial worm that burrows into and helps aerate soil; often surfaces when the ground is cool or wet; used as bait by anglers,
8550,01448949,n,9,small annelid worms with the posterior end modified into an adhesive sucker; especially formerly regarded as modified leeches,
8551,01449203,n,9,type genus of the Branchiobdellidae: a small worm that lives on the gills or surface of a crayfish attached by a sucker,
8552,01449425,n,9,marine annelid worms,
8609,01460955,n,9,marine gastropods having smooth rounded short-spired shells,
8554,01449877,n,9,marine worms having a row of tufted gills along each side of the back; often used for fishing bait,
8555,01450064,n,9,any of several large worms having a broad flattened body with a mat of coarse hairs covering the back,
8556,01450221,n,9,marine burrowing or tube-forming polychete worms usually having long thick bodies,
8557,01450440,n,9,type genus of Terebellidae; tube-forming marine polychete worms with many filamentous tentacles,
8558,01450628,n,9,genus of soft-bodied polychete marine worms,
8559,01450785,n,9,a segmented marine worm with bright red body; often used for bait,
8560,01450925,n,9,hermaphroditic aquatic or terrestrial or parasitic annelids,
8561,01451115,n,9,carnivorous or bloodsucking aquatic or terrestrial worms typically having a sucker at each end,
8562,01451343,n,9,a family of Hirudinea,
8563,01451500,n,9,type genus of the family Hirudinidae,
8564,01451642,n,9,large European freshwater leech formerly used for bloodletting,
8565,01451806,n,9,leeches,
8566,01451923,n,9,any of several large freshwater leeches,
8567,01452038,n,9,a family of mollusks,
8568,01452786,n,9,a genus of mollusks,
8569,01453676,n,9,gastropods; bivalves; cephalopods; chitons,
8571,01454218,n,9,small class of bilaterally symmetrical marine forms comprising the tooth shells,
8572,01454411,n,9,burrowing marine mollusk,
8573,01454528,n,9,any of various seashore mollusks having a tapering tubular shell open at each end and a foot pointed like a spade for burrowing,
8574,01454726,n,9,snails and slugs and their relatives,
8575,01455233,n,9,a class of mollusks typically having a one-piece coiled shell and flattened muscular foot with a head bearing stalked eyes,
8576,01455657,n,9,abalones,
8577,01455780,n,9,type genus of the family Haliotidae,
8578,01455925,n,9,any of various large edible marine gastropods of the genus Heliotis having an ear-shaped shell with pearly interior,
8579,01456143,n,9,found near the Channel Islands,
8580,01456258,n,9,conchs,
8581,01456398,n,9,scorpion shells of shallow tropical waters of the eastern hemisphere,
8582,01456572,n,9,any of numerous tropical marine snails that as adults have the outer lip of the aperture produced into a series of long curved spines,
8583,01456785,n,9,type genus of the family Strombidae,
8584,01456930,n,9,any of various edible tropical marine gastropods of the genus Strombus having a brightly-colored spiral shell with large outer lip,
8585,01457149,n,9,a large variety of conch,
8586,01457248,n,9,land snails including the common edible snail and some pests,
8587,01457421,n,9,freshwater or marine or terrestrial gastropod mollusk usually having an external enclosing spiral shell,
8588,01457630,n,9,type genus of the family Helicidae,
8589,01457825,n,9,one of the chief edible snails,
8590,01457968,n,9,any of several inedible snails of the genus Helix; often destructive pests,
8591,01458156,n,9,serious garden pest having a brown shell with paler zigzag markings; nearly cosmopolitan,
8592,01458337,n,9,a kind of garden snail,
8593,01458440,n,9,slugs,
8594,01458577,n,9,a genus of Limacidae,
8595,01458682,n,9,any of various terrestrial gastropods having an elongated slimy body and no external shell,
8596,01458842,n,9,any of several creeping marine gastropods with a spirally coiled shell: whelks; tritons; moonshells; neritids,
8597,01459114,n,9,neritids,
8598,01459273,n,9,operculate seasnail of coastal waters with a short spiral shell,
8599,01459483,n,9,type genus of the Neritidae,
8601,01459803,n,9,gastropod having reddish toothlike projections around the shell opening; of the Caribbean area,
8602,01459996,n,9,a genus of Neritidae,
8603,01460115,n,9,ornately marked and brightly colored snails of brackish waters,
8604,01460251,n,9,whelks,
8605,01460372,n,9,large carnivorous marine gastropods of coastal waters and intertidal regions having a strong snail-like shell,
8606,01460571,n,9,tritons,
8607,01460693,n,9,tropical marine gastropods having beautifully colored spiral shells,
8608,01460832,n,9,moonshells,
8612,01461381,n,9,edible marine gastropod,
8614,01461723,n,9,marine limpets,
8615,01461852,n,9,type genus of the family Patellidae: common European limpets,
8616,01462020,n,9,marine limpet,
8617,01462130,n,9,marine limpets,
8618,01462265,n,9,type genus of the family Fissurellidae: keyhole limpets,
8619,01462434,n,9,marine limpet having a conical shell with an opening at the apex,
8620,01462619,n,9,freshwater gastropod,
8621,01462752,n,9,type genus of the family Ancylidae: river limpet,
8623,01463130,n,9,gastropods having the gills when present posterior to the heart and having no operculum: includes sea slugs; sea butterflies; sea hares,
8624,01463392,n,9,comprising numerous marine gastropod mollusks lacking a shell in the adult state and usually having a body like a slug,
8625,01463666,n,9,any of various marine gastropods of the suborder Nudibranchia having a shell-less and often beautifully colored body,
8626,01463887,n,9,sea hares,
8627,01464042,n,9,type genus of the family Aplysiidae,
8628,01464209,n,9,naked marine gastropod having a soft body with reduced internal shell and two pairs of ear-like tentacles,
8629,01464407,n,9,genus of marine sea slugs,
8630,01464548,n,9,a kind of sea slug,
8631,01464656,n,9,bubble shells,
8632,01464780,n,9,common genus of marine bubble shells of the Pacific coast of North America,
8633,01464964,n,9,marine gastropod mollusk having a very small thin shell,
8634,01465097,n,9,large order of gastropods usually breathing by means of a lung-like sac comprising most land snails and slugs and many freshwater snails,
8635,01465364,n,9,freshwater snails,
8636,01465492,n,9,type genus of the physidae; freshwater air-breathing snails,
8637,01465647,n,9,any member of the genus Physa,
8638,01465747,n,9,large order of gastropods comprising univalve mollusks that have a single gill resembling a comb,
8639,01465967,n,9,family of marine gastropods comprising the cowries,
8640,01466132,n,9,type genus of the family Cypraeidae: the typical cowries,
8641,01466296,n,9,any of numerous tropical marine gastropods of the genus Cypraea having highly polished usually brightly marked shells,
8642,01466530,n,9,cowrie whose shell is used for money in parts of South Pacific and Africa,
8643,01466679,n,9,cowrie whose shell is used for ornament,
8644,01466794,n,9,comb-like respiratory structure serving as the gill of certain mollusks,
8645,01466921,n,9,one of the often brightly colored and branching hornlike structures on the backs of nudibranchs and other related mollusks that serve as gills,
8646,01467115,n,9,a class of Gastropoda,
8647,01467253,n,9,an order of Amphineura,
8648,01467429,n,9,deep-water wormlike mollusks lacking calcareous plates on the body but having fine slimy spicules on the covering mantle,
8649,01467642,n,9,small class of marine mollusks comprising the chitons; sometimes considered an order of the subclass Amphineura,
8650,01467875,n,9,a genus of Polyplacophora,
8651,01467997,n,9,primitive elongated bilaterally symmetrical marine mollusk having a mantle covered with eight calcareous plates,
8652,01468231,n,9,tuft of strong filaments by which e.g. a mussel makes itself fast to a fixed surface,
8653,01468376,n,9,oysters; clams; scallops; mussels,
8654,01468846,n,9,marine or freshwater mollusks having a soft body with platelike gills enclosed within two shells hinged together,
8655,01469203,n,9,a young oyster or other bivalve,
8656,01469304,n,9,burrowing marine mollusk living on sand or mud,
8657,01469510,n,9,the shell of a marine organism,
8658,01469595,n,9,the shell of a clam,
8659,01469670,n,9,clams,
8660,01469821,n,9,soft-shell clams,
8661,01469948,n,9,type genus of the family Myacidae,
8662,01470081,n,9,an edible clam with thin oval-shaped shell found in coastal regions of the United States and Europe,
8663,01470337,n,9,hard-shell clams,
8664,01470485,n,9,type genus of the family Veneridae: genus of edible clams with thick oval shells,
8665,01470669,n,9,a genus of Veneridae,
8666,01470784,n,9,an edible American clam,
8672,01471610,n,9,large marine hard-shell clams,
8673,01471756,n,9,type genus of the family Tridacnidae: giant clams,
8674,01471915,n,9,giant clam inhabiting reefs in the South Pacific weighing up to 500' pounds,
8675,01472083,n,9,somewhat heart-shaped sand-burrowing bivalve mollusks,
8676,01472249,n,9,type genus of the family Cardiidae: cockles,
8678,01472571,n,9,common edible European cockle,
8679,01472695,n,9,oysters,
8680,01472853,n,9,marine mollusks having a rough irregular shell; found on the sea bed mostly in coastal waters,
8681,01473163,n,9,a young oyster esp. of a size for transplantation,
8682,01473270,n,9,type genus of the family Ostreidae,
8683,01473429,n,9,small edible oyster typically from the south shore of Long Island,
8684,01473601,n,9,large native of Japan introduced along United States Pacific coast; candidate for introduction in Chesapeake Bay,
8685,01473809,n,9,Virginia oysters,
8686,01473941,n,9,common edible oyster of Atlantic coast of North America,
8687,01474077,n,9,pearl oysters,
8688,01474203,n,9,pearl oysters,
8689,01474326,n,9,tropical marine bivalve found chiefly off eastern Asia and Pacific coast of North and Central America; a major source of pearls,
8690,01474556,n,9,saddle oysters,
8691,01474683,n,9,type genus of the family Anomiidae: saddle oysters,
8692,01474839,n,9,thin-shelled bivalve having the right valve deeply notched,
8693,01474995,n,9,windowpane oysters,
8694,01475121,n,9,marine bivalve common in Philippine coastal waters characterized by a large thin flat translucent shell,
8695,01475350,n,9,ark shells,
8696,01475469,n,9,type genus of the family Arcidae: ark shells and blood clams,
8697,01475650,n,9,marine bivalve mollusk having a heavy toothed shell with a deep boat-like inner surface,
8698,01475812,n,9,red-blooded clam,
8699,01475904,n,9,marine or freshwater bivalve mollusk that lives attached to rocks etc.,
8700,01476063,n,9,marine mussels,
8701,01476209,n,9,type genus of the family Mytilidae: smooth-shelled marine mussels,
8702,01476382,n,9,marine bivalve mollusk having a dark elongated shell; live attached to solid objects esp. in intertidal zones,
8703,01476598,n,9,dark-shelled edible mussel that lives attached to rocks,
8704,01476768,n,9,bivalve mollusk abundant in rivers of central United States,
8705,01476963,n,9,freshwater mussels found worldwide,
8706,01477148,n,9,type genus of the family Unionidae,
8707,01477284,n,9,the pearly lining of the dark shells is a source of mother-of-pearl,
8708,01477438,n,9,thin-shelled freshwater mussels,
8709,01477579,n,9,mussel with thin fragile shells having only rudimentary hinge teeth,
8710,01477731,n,9,zebra mussels,
8712,01478074,n,9,scallops,
8713,01478216,n,9,edible marine bivalve having a fluted fan-shaped shell that swim by expelling water from the shell in a series of snapping motions,
8714,01478484,n,9,type genus of the family Pectinidae: sea and bay scallops,
8715,01478657,n,9,small scallop inhabiting shallow waters and mud flats of the North American Atlantic coast,
8716,01478862,n,9,large scallop inhabiting deep waters of the North American Atlantic coast,
8717,01479069,n,9,shipworms,
8718,01479233,n,9,type genus of the family Teredinidae,
8719,01479366,n,9,wormlike marine bivalve that bores into wooden piers and ships by means of drill-like shells,
8720,01479580,n,9,typical shipworm,
8721,01479668,n,9,giant shipworms,
8722,01479789,n,9,giant shipworm of the Pacific coast of North America,
8723,01479949,n,9,a family of Bivalvia,
8724,01480084,n,9,type genus of the family Pholadidae: piddocks,
8725,01480235,n,9,marine bivalve that bores into rock or clay or wood by means of saw-like shells,
8726,01480387,n,9,octopuses; squids; cuttlefish; pearly nautilus,
8727,01480587,n,9,marine mollusk characterized by well-developed head and eyes and sucker-bearing tentacles,
8728,01480845,n,9,spiral-shelled cephalopods,
8731,01481357,n,9,comprising all living cephalopods except the family Nautilidae: the orders Octopoda (octopuses) and Decapoda (squids and cuttlefish),
8732,01481683,n,9,cephalopods having two gills,
8733,01481804,n,9,octopuses and paper nautilus,
8734,01481980,n,9,eight-armed cephalopod lacking an internal shell,
8735,01482137,n,9,a family of Octopoda,
8736,01482274,n,9,type genus of the family Octopodidae,
8737,01482408,n,9,bottom-living cephalopod having a soft oval body with eight long tentacles,
8738,01482586,n,9,represented solely by the genus Argonauta,
8739,01482746,n,9,type genus of the family Argonautidae: paper nautilus,
8740,01482911,n,9,cephalopod mollusk of warm seas whose females have delicate papery spiral shells,
8741,01483099,n,9,squids and cuttlefishes,
8742,01483327,n,9,cephalopods having eight short tentacles plus two long ones,
8743,01483513,n,9,widely distributed fast-moving ten-armed cephalopod mollusk having a long tapered body with triangular tail fins,
8744,01483750,n,9,squids,
8745,01483853,n,9,somewhat flattened cylindrical squid,
8746,01483961,n,9,a genus of Decapoda,
8747,01484083,n,9,extremely active cylindrical squid with short strong arms and large rhombic terminal fins,
8748,01484250,n,9,giant squid,
8749,01484364,n,9,largest mollusk known about but never seen (to 60 feet long),
8750,01484516,n,9,true cuttlefishes,
8751,01484644,n,9,type genus of the Sepiidae,
8752,01484774,n,9,ten-armed oval-bodied cephalopod with narrow fins as long as the body and a large calcareous internal shell,
8753,01484966,n,9,coextensive with the genus Spirula; included in the order Belemnoidea in some older classifications,
8754,01485180,n,9,genus of small cephalopods with many-chambered spiral shells resembling those of the extinct belemnites,
8755,01485381,n,9,a small tropical cephalopod of the genus Spirula having prominent eyes and short arms and a many-chambered shell coiled in a flat spiral,
8756,01485608,n,9,order of extinct dibranchiate cephalopods related to the surviving spirulas,
8757,01485799,n,9,family of extinct Mesozoic cephalopods,
8759,01486270,n,9,a pouch in many birds and some lower animals that resembles a stomach for storage and preliminary maceration of food,
8760,01486444,n,9,thick-walled muscular pouch below the crop in many birds and reptiles for grinding food,
8761,01486614,n,9,class of mandibulate arthropods including: lobsters; crabs; shrimps; woodlice; barnacles; decapods; water fleas,
8762,01486970,n,9,any mainly aquatic arthropod usually having a segmented body and chitinous exoskeleton,
8763,01487314,n,9,one of a pair of glands (believed to have excretory functions) in some crustaceans near the base of the large antennae,
8764,01487509,n,9,"largest subclass of Crustacea including most of the well-known marine, freshwater, and terrestrial crustaceans: crabs; lobsters; shrimps; sow bugs; beach flies",
8765,01487884,n,9,a major subclass of crustaceans,
8766,01488077,n,9,lobsters; crayfish; crabs; shrimps; prawns,
8767,01488343,n,9,crustaceans characteristically having five pairs of locomotor appendages each joined to a segment of the thorax,
