513,00094066,n,9,"a gentle affectionate stroking (or something resembling it); ""he showered her with caresses""; ""soft music was a fond caress""; ""the caresses of the breeze played over his face""",
511,00093873,n,9,the act of tickling,
512,00093956,n,9,a light touch with the hands,
520,00095235,n,9,"the act of joining together as one: ""the merging of the two groups occurred quickly""; ""there was no meeting of minds""",
514,00094294,n,9,touching a player in a game,"2633,2638"
515,00094409,n,9,the act of bringing two things into contact,
516,00094688,n,9,the act of joining by causing your path to intersect your target's path,
517,00094818,n,9,the act of bringing near or bringing together especially the cut edges of tissue,
518,00094984,n,9,the act of linking together as in a series or chain,
519,00095095,n,9,the act of converging (coming closer),
527,00096215,n,9,"the act of making something tighter: ""the tightening of economic controls""",
521,00095452,n,9,a coming together of people,
522,00095548,n,9,a casual meeting with a person of thing,
523,00095657,n,9,the act of joining things in such a way that motion is possible,
524,00095779,n,9,a act of adjoining things,
525,00095872,n,9,the act of fastening things together,
526,00096085,n,9,the act of making something less tight,
535,00097160,n,9,"loosening the ties that fasten something: ""the tying of bow ties is an art; the untying is easy""",
528,00096382,n,9,tying with a ligature (as in surgery),
530,00096699,n,9,fastening firmly together,
531,00096790,n,9,fastening by dowels,
532,00096864,n,9,fastening electrical equipment to earth,
533,00096970,n,9,the act of linking things together,
534,00097058,n,9,the act of tying things together,
486,00089847,n,9,kicking (as for a field goal) in which the football is dropped and kicked as it touches the ground,2871
536,00097334,n,9,fastening two pieces of metal together by softening with heat and applying pressure,
537,00097489,n,9,creating a butt joint by welding,
487,00090000,n,9,"a light glancing touch: ""there was a brief kiss of their hands in passing""",
539,00097810,n,9,touching with the tongue,
540,00097891,n,9,the act of brushing against while passing,
541,00098007,n,9,the act of discovering something,
542,00098205,n,9,the act of detecting something; catching sight of something,
543,00098360,n,9,discovering your own individuality,
544,00098455,n,9,making an important discovery,
545,00098543,n,9,the act of determining the properties of something,
546,00098771,n,9,the act of discovering again,
547,00098857,n,9,the act of designating or identifying something,
552,00099504,n,9,identification a disease from its symptoms,2232
549,00099105,n,9,the procedure of taking inked impressions of a person's fingerprints,
550,00099234,n,9,identifying the nature or cause of some phenomenon,
551,00099389,n,9,determining a person's blood type by serological methods,
553,00099666,n,9,a prediction of the course of a disease,2232
583,00104367,n,9,"a seduction culminating in sexual intercourse: ""calling his seduction of the girl a ""score"" was a typical example of male slang""",1703
554,00099792,n,9,finding a solution to a problem,
555,00099890,n,9,the act of finding or testing the truth of something,
556,00100102,n,9,validating the authenticity of something or someone,
558,00100437,n,9,establishing something (e.g. gold or silver) as the legal tender of a country,
559,00100606,n,9,the act of proving that an instrument purporting to be a will was signed and executed in accord with legal requirements,
560,00100779,n,9,ending something (e.g. gold or silver) as no longer the legal tender of a country,
561,00100956,n,9,the act of determining that something is false,
568,00102045,n,9,"using force to cause something: ""though pressed into rugby under compulsion I began to enjoy the game""; ""they didn't have to use coercion""",
563,00101310,n,9,determining the location of something by measuring the time it takes for an echo to return from it,
564,00101483,n,9,determining again,
565,00101562,n,9,the act of causing something to happen,
566,00101756,n,9,an act that sets in motion some course of events,
567,00101901,n,9,deliberate and intentional triggering (of trouble or discord),
570,00102506,n,9,"stimulating influence among diverse elements: ""the cross-pollination of the arts""",
569,00102269,n,9,causing something without any direct or apparent effort,
571,00102651,n,9,"the act of subjecting someone to an influencing experience: ""she denounced the exposure of children to pornography""",
572,00102821,n,9,"influencing strongly: ""they resented the impingement of American values on European culture""",
573,00102995,n,9,"exerting shrewd or devious influence especially for one's own advantage; ""his manipulation of his friends was scandalous""",
575,00103290,n,9,"act of bringing about a desired result: ""inducement of sleep""",
574,00103181,n,9,the act of inducing hypnosis,
577,00103541,n,9,"the act of influencing by exciting hope or desire: ""his enticements were shameless""",
576,00103419,n,9,inducement by argument or reasoning or entreaty,
579,00103904,n,9,"the act of enticing or alluring: ""she was an invitation to trouble""",
578,00103784,n,9,the act of urging by means of teasing or flattery,
580,00104028,n,9,the act of enticing others into sinful ways,
581,00104146,n,9,enticing someone astray from right behavior,
582,00104245,n,9,an act of winning the love of someone,
586,00104850,n,9,"the act of choosing or selecting: ""your choice of colors was unfortunate""; ""you can take your pick""",
584,00104565,n,9,the act of enticing a person to do something wrong (as an offer of sex in return for money),
585,00104728,n,9,deterrence by argument or reasoning or entreaty,
548,00098997,n,9,a system or procedure for identifying persons,1802
587,00105129,n,9,the choice of actors to play particular roles in a play or movie,"2606,2610"
588,00105247,n,9,the selection of a suitable sample for study,
589,00105382,n,9,the selection of a random sample; each element of the population has an equal chance of been selected,
590,00105545,n,9,the population is divided into subpopulations (strata) and random samples are taken of each stratum,
562,00101111,n,9,"a determination of the location of something: ""he got a good fix on the target""",
598,00107174,n,9,"(sports) the decision made by an umpire or referee; ""he was ejected for protesting the call""",2638
594,00106381,n,9,"the act of putting a person into a non-elective position; ""the appointment had to be approvied by the whole committee""",
602,00107670,n,9,laying hands on a person's head to invoke spiritual blessing in Christian ordination,1565
595,00106665,n,9,the act of nominating (especially a candidate for election),
601,00107544,n,9,the act of ordaining,1565
603,00107819,n,9,"the act of deciding to do something: ""he didn't make a move to help""; ""his first move was to hire a lawyer""",
599,00107317,n,9,the act of appointing summarily (with or without the appointee's consent),
600,00107460,n,9,the appointment of a delegate,
614,00109535,n,9,the act of maneuvering a vehicle into a location where it can be left temporarily,1946
608,00108577,n,9,(chess) a direct attack on an opponent's king,2628
615,00109670,n,9,"the act of changing your residence or place of business: ""they say that three moves equal one fire""",
604,00108013,n,9,(games) a player's turn to move a piece or take some other permitted action,"2633,2638"
605,00108157,n,9,the act of moving a chess piece,"2628,2638"
606,00108354,n,9,interchanging the positions of the king and a rook,"2628,2638"
607,00108468,n,9,the removal of an opponent's piece from the chess board,"2628,2638"
597,00107010,n,9,(computer science) the assignment of particular areas of a magnetic disk to particular data or instructions,1355
618,00110118,n,9,a bank so steep that the plane's lateral axis approaches the vertical,1942
610,00108876,n,9,a move constituting an inescapable and indefensible attack on the opponent's king,"2628,2638"
611,00109013,n,9,a chess move early in the game in which the player sacrifices minor pieces in order to obtain an advantageous position,"2628,2638"
612,00109184,n,9,a diplomatic move,
613,00109256,n,9,a move made to gain a tactical end,
623,00110741,n,9,a flight maneuver; aircraft slides sideways in the air,1942
616,00109838,n,9,"a secret move (to avoid paying debts); ""they did a moonlight flit""",
626,00111216,n,9,"any clever (deceptive) maneuver; ""he would stoop to any device to win a point""",
593,00106179,n,9,"a reversal in attitude or principle or point of view: ""an about-face on foreign policy""",1718
620,00110371,n,9,a flight maneuver; aircraft rotates about its longitudinal axis without changing direction or losing altitude,1942
609,00108692,n,9,a check on the opponent's king that is delivered by moving a piece out of the line of attack by a queen or rook or bishop,2628
622,00110674,n,9,a fast roll,1942
624,00110857,n,9,an evasive maneuver by an aircraft,1942
621,00110567,n,9,a roll in which the plane follows a spiral course,1942
625,00111045,n,9,(football) the act of warding off a tackler by holding the arm fully extended with the hand against the opponent,2871
619,00110247,n,9,a flight maneuver; aircraft flies a complete circle in the vertical plane,1942
627,00111383,n,9,"a cunning or deceitful action or device: ""he played a trick on me""; ""he pulled a fast one and got away with it""",
631,00111872,n,9,"how a result is obtained or an end is achieved: ""a means of communcation""; ""an example is the best agency of instruction""; ""the true way to success""",
628,00111557,n,9,any distracting maneuver (as a mock attack),
629,00111652,n,9,a maneuver in a game or conversation,
630,00111760,n,9,a deceptive maneuver (especially to avoid capture),
632,00112303,n,9,"interchangeable with ""means"" in the expression ""by dint of""",
633,00112413,n,9,"a means or way of escaping: ""hard work was his escape from worry""; ""they installed a second hatch as an escape""; ""their escape route""",
634,00112599,n,9,"the means whereby something is accomplished: ""my greed was the instrument of my destruction"" or ""science has given us new tools to fight disease""",
635,00112808,n,9,"a way or means to achieve something: ""the road to fame""",
636,00112932,n,9,"an auspicious way or means to achieve something: ""the royal road to success""",
637,00113065,n,9,"any means of advancement: ""the job was just a stepping stone on his way to fame and riches""",
638,00113217,n,9,"any maneuver made as part of progress toward a goal: ""the police took steps to reduce crime""",
617,00109955,n,9,a flight maneuver; aircraft tips laterally about its longitudinal axis (especially in turning),1942
639,00113406,n,9,an action taken to offset another action,
7916,01334606,n,9,archaic,"2158,2188"
592,00106049,n,9,"the act of making a choice: ""followed my father of my own choice""",
644,00114262,n,9,a measure undertaken by a corporation to discourage unwanted takeover attempts,1794
668,00118200,n,9,"the act of selecting someone: ""many candidates ran for election""",1718
645,00114532,n,9,giving top executives lucrative benefits that must be paid by the acquirer if they are discharged after a takeover,1794
647,00114886,n,9,the target company defends itself by threatening to take over its acquirer,1794
648,00115023,n,9,the target company defends itself by making its stock less attractive to an acquirer,1794
649,00115183,n,9,a poison pill with potentially catastrophic implications for the company it is intended to protect,1794
650,00115340,n,9,the target company defends itself by acquiring a company so onerously regulated that it makes the target less attractive (gives it a safe harbor),1794
651,00115543,n,9,the target company defends itself by selling off its crown jewels,1794
652,00115676,n,9,a procedure followed in making a medical diagnosis,2232
654,00116092,n,9,a procedure adopted to meet an emergency (especially a medical emergency),2232
653,00115902,n,9,a means to an end; not necessarily a principled or ethical one,
669,00118337,n,9,the selection of a new member (usually by a vote of the existing membership),1718
655,00116303,n,9,something contrived to meet an urgent need or emergency,
658,00116660,n,9,"French for ""worst going""",
657,00116556,n,9,an unplanned expedient,
659,00116754,n,9,"desperate actions taken as a means to an end: ""he had to resort to desperate measures""",
661,00117009,n,9,"a means of preserving from harm or unpleasantness: ""tourism was their economic salvation""; ""they turned to individualism as their salvation""",
660,00116904,n,9,any very successful means of achieving a result,
662,00117205,n,9,"a means of enforcement: ""the treaty had no teeth in it""",
663,00117312,n,9,"a means or agency by which something is expressed or communicated: ""the voice of the law""; ""the Times is not the voice of New York""; ""conservatism has many voices""",
664,00117527,n,9,"a means of flight or ascent: ""necessity lends wings to inspiration""",
675,00119253,n,9,a national or state election; candidates are chosen in all constituencies,1718
665,00117646,n,9,making a chance decision by using lots (straws or pebbles etc.) that are thrown or drawn,
674,00119067,n,9,"the opinion of a group as determined by voting: ""they put the question to a vote""",1718
670,00118483,n,9,"election again: ""he did not run for reelection""",1718
666,00117820,n,9,"the act of accepting with approval; favorable reception: ""its adoption by society""; ""the proposal found wide acceptance""",1718
671,00118587,n,9,a vote by the electorate determining public opinion on a question of national importance,1718
678,00119715,n,9,"a primary in which only registered members of a particular political party can vote: ""closed primaries strengthen party unity""",1718
672,00118732,n,9,a legislative act is referred for final approval to a popular vote by the electorate,1718
673,00118873,n,9,a vote to select the winner of a political office,1718
676,00119389,n,9,a preliminary election where delegates or nominees are chosen,1718
683,00120576,n,9,a vote in which each person's choice is secret by the totaled votes are public,1718
642,00113917,n,9,a buyout using borrowed money; the target company's assets are usually security for the loan,1769
682,00120305,n,9,"a choice that is made by voting: ""there were only 17 votes in favor of the motion""",1718
679,00119902,n,9,a primary in which any registered voter can vote (but must vote for candidates of only one party),1718
677,00119541,n,9,a primary where voters directly select the candidates who will run for office,1718
680,00120058,n,9,a special election between regular elections,1718
681,00120175,n,9,a final election to resolve an earlier election that did not produce a winner,1718
684,00120714,n,9,a ballot cast by a voter who votes for candidates from more than one party,1718
643,00114090,n,9,a leveraged buyout in which the target company's assets are sold to repay the loan that financed the takeover,1769
646,00114709,n,9,paying the raider to give up a takeover attempt (as by an extravagant buyback of the stock they hold in your corporation),1794
685,00120865,n,9,a ballot cast by a voter who votes for all the candidates of one party,1718
686,00121015,n,9,voting in more than one place by the same person at the same election (illegal in U.S.),1718
667,00118026,n,9,"a close affectionate and protective acceptance: ""his willing embrace of new ideas""; ""in the bosom of the family""",1718
7917,01334668,n,9,a tame parrot,"2158,2188"
656,00116424,n,9,"anything that serves as an expedient: ""he uses drugs as a psychological crutch""",
688,00121287,n,9,the act of making equal or uniform,
690,00121609,n,9,the act of regarding as equal,
693,00122025,n,9,assisting women at childbirth,2232
692,00121863,n,9,the act of delivering a child,"2232,2233"
694,00122110,n,9,the delivery of a fetus by surgical incision through the abdominal wall and uterus (from the belief that Julius Caesar was born that way),2232
696,00122802,n,9,the score in a bowling match,2631
697,00122890,n,9,"in target shooting: a score made by hitting the center of the target; ""in repeated sets of five shots his numbers of bull's-eyes varied""","2633,2638"
703,00123789,n,9,(American football) a play in which the opposing team has kicked the football into your end zone,2871
698,00123083,n,9,"a successful attempt at scoring: ""the winning goal came with less than a minute left to play""","2633,2638"
699,00123227,n,9,"a score in tenpins: knocking down all ten with the first ball; ""he finished with three strikes in the tenth frame""","2638,2633"
701,00123524,n,9,"any frame in which a bowler fails to make a strike or spare: ""the break in the eighth frame cost him the match""","2633,2638"
700,00123407,n,9,a score in tenpins; knocking down all ten after rolling two balls,"2633,2638"
705,00124068,n,9,"a score in American football; being in possession of the ball across the opponents"" goal line","2633,2638"
702,00123700,n,9,the score in a football game,"2633,2638"
719,00126620,n,9,the reduction of expenditures in order to become financial stable,1753
704,00123941,n,9,a score in American football; a player is tackled behind his own goal line,"2633,2638"
706,00124217,n,9,"a score in American football; a score made by kicking the ball between the opponents"" goal posts","2633,2638"
709,00124616,n,9,"a score in baseball made by a runner touching all four bases safely: ""the Yankees scored 3 runs in the bottom of the 9th"" or ""their first tally came in the 3rd inning""","2633,2638"
707,00124370,n,9,a score in American football made on a try for points after a touchdown,"2633,2638"
708,00124527,n,9,the score of a baseball game,"2633,2638"
712,00125179,n,9,"a run that is the result of the batter's performance; ""he had more than 100 rbi last season""","2633,2638"
710,00124895,n,9,a run that was not scored as the result of an error by the other team,"2633,2638"
711,00125039,n,9,a run that was scored as a result of an error by the other team,"2633,2638"
716,00125689,n,9,"the act of changing something: ""the change of government had no impact on the economy""; ""his change on abortion cost him the election""",
713,00125337,n,9,the score in a basketball game,"2633,2871"
714,00125430,n,9,a score in basketball made by throwing the ball through the hoop,"2633,2638"
718,00126393,n,9,"an act of economizing; reduction in cost: ""it was a small economy to walk to work every day"" or ""there was a saving of 50 cents""",1753
727,00127808,n,9,"the act of changing from imperial units of measurement to metric units: meters, grams, seconds",1951
717,00126290,n,9,the act of reducing complexity,
715,00125560,n,9,a difficult or unusual feat; usually done to gain attention,2638
720,00126771,n,9,reduction in cost of production due to a large number of items produced,1753
721,00126907,n,9,(physiology) the automatic adjustment in focal length of the lens of the eye,2234
722,00127097,n,9,(physiology) the responsive adjustment of a sense organ (as the eye) to varying conditions (as of light),2234
724,00127380,n,9,the act of adjusting again (to changed circumstances),2234
723,00127258,n,9,the action of taking up as by tightening or absorption or reeling in,
728,00127976,n,9,a general accommodation to unchanging environmental conditions,2234
730,00128267,n,9,"act of changing in practice or custom: ""the law took many turnings over the years""",
691,00121704,n,9,the act of digging up something (especially a corpse) that has been buried,2800
726,00127649,n,9,"the act of changing to a decimal system: ""the decimalization of British currency""",1951
731,00128403,n,9,"the act of diversifying (introducing variety); ""my broker recommended a greater diversification of my investments""",
732,00128579,n,9,"in constant change: ""his opinions are in flux""",
733,00128676,n,9,"the act of changing one thing or position for another: ""his switch on abortion cost him the election""",
735,00128951,n,9,"the act of putting one one thing or person in the place of another: ""he sent Smith in for Jones but the substitution came too late to help",
734,00128868,n,9,a sudden unexpected switch,
725,00127492,n,9,"accommodation to domestic life: ""her explorer husband resisted all her attempts at domestication""",2234
695,00122416,n,9,"the act of scoring in a game or sport: ""the winning score came with less than a minute left to play""","2638,2633"
737,00129412,n,9,replacing a pitcher in baseball,
738,00129505,n,9,act of replacing one person or thing by another especially one held to be superior,
739,00129660,n,9,act of taking the place of another especially using underhanded tactics,
740,00129804,n,9,the substitution of one method of payment for another,
741,00129915,n,9,the act of substituting other food for the mother's milk in the diet of a child or young mammal,
742,00130078,n,9,act of raising in rank or position,
754,00132311,n,9,"the action of opposing something that you disapprove or disagree with: ""he encountered a general feeling of resistance from many citizens""; ""despite opposition from the newspapers he went ahead""",
744,00130362,n,9,act of lowering in rank or position,
745,00130470,n,9,the act of changing something into something different in essential characteristics,
746,00131083,n,9,the act of making something different (as e.g. the size of a garment),
747,00131327,n,9,the act of distracting; drawing someone's attention away from something,
748,00131456,n,9,the act of charging a liquid with a gas making it effervescent,
750,00131763,n,9,the act of passing from one stage to the next,
751,00131893,n,9,becoming inflexible or out of date,
752,00131987,n,9,altering something secretly or improperly,
756,00132807,n,9,"doing something in opposition to another way of doing it that you don't like; ""his style of painting was a reaction against cubism""",
758,00133181,n,9,backlash by white racists against black civil rights advances,1718
759,00133315,n,9,"the act of rejecting something: ""his proposals were met with rejection""",
780,00136307,n,9,the act of banishing a member of the Church from the communion of believers and the privileges of the Church,1565
762,00133803,n,9,"the act of turning away: ""averting her gaze means that she must be angry with me""",
760,00133568,n,9,a curt or disdainful rejection,
761,00133654,n,9,deliberately avoiding,
763,00133939,n,9,"an avoidance of danger or difficulty: ""that was a narrow escape""",
769,00134709,n,9,"the act of refusing an offer: ""the turndown was polite but very firm""",
764,00134056,n,9,the act of giving something up,
765,00134222,n,9,abandoning without shelter or protection (as by leaving as infant out in the open),
766,00134359,n,9,the act of abandoning a party or cause,
767,00134469,n,9,a sudden abandonment (as from a political party),
768,00134568,n,9,the act of renouncing,
781,00136477,n,9,"mild banishment; consignment to an inferior position: ""he has been relegated to a post in Siberia""",
770,00134849,n,9,the act of forsaking,
771,00134937,n,9,renunciation of your own interests in favor of the interests of others,
772,00135125,n,9,the act of losing or surrendering something as a penalty for a mistake or fault or failure to perform etc.,
755,00132629,n,9,a management action resisting employee's demands; employees are barred from entering the workplace until they agree to terms,1794
774,00135464,n,9,the act of banishing someone,
775,00135654,n,9,the act of expelling a lawyer from the practice of law,
776,00135765,n,9,the act of expelling someone,
777,00135937,n,9,the act of excluding someone from society by general consent,
778,00136053,n,9,the act of excluding someone by a negative vote or veto,
779,00136174,n,9,the act of expelling a person from their native land,"1802,2768"
784,00136859,n,9,a temporary debarment (from a privilege or position etc),1802
788,00137299,n,9,"the act of ending something: ""the termination of the agreement""",
782,00136632,n,9,the act of ejecting someone or forcing them out,
783,00136760,n,9,the act of deposing someone,
785,00136992,n,9,act of removing from office or employment,1794
786,00137092,n,9,a vote that blocks a decision,1718
787,00137190,n,9,indirect veto of legislation by refusing to sign it,1718
773,00135310,n,9,a group's refusal to have commercial dealings with some organization in protest against its policies,1675
757,00133011,n,9,"an adverse reaction to some political or social occurrence: ""there was a backlash of intolerance""",1718
743,00130222,n,9,"the act of preferring: ""the preferment went to the younger candidate""",
829,00143925,n,9,"the shedding of blood resulting in murder: ""he avenged the blood of his kinsmen""",1675
791,00138106,n,9,a concluding action,
792,00138296,n,9,the act of finalizing,
794,00138540,n,9,the successful completion of a program of study,
795,00138644,n,9,withdrawal from your position or occupation,
800,00139314,n,9,"act of relinquishing property or authority etc: ""the handover of occupied territory""",
797,00138954,n,9,a final appearance or performance before retirement,
798,00139061,n,9,the act of relinquishing,
799,00139216,n,9,the act of ceding,
804,00139905,n,9,"an act exempting someone: ""he was granted immunity from prosecution""",
810,00140714,n,9,the act of terminating someone's employment,1753
811,00140964,n,9,an abrupt and unceremonious dismissal,1753
803,00139768,n,9,a formal written statement of relinquishment,
805,00140078,n,9,"an exemption granted after influence (e.g., money) is brought to bear; ""collusion resulted in tax fixes for gamblers""",
