e by combing towards the ends towards the scalp, for a full effect; of hair",2371
66202,00028976,v,9,"apply lipstick to: ""She lipsticked her mouth""",2371
66208,00029688,v,9,apply talcum powder to (one's body),2371
66215,00030664,v,9,"apply perfume to: ""She perfumes herself every day""",2371
66203,00029095,v,9,redden by applying rouge to; of cheeks,2371
66205,00029326,v,9,use dental floss to clean; of teeth,2371
66209,00029785,v,9,"care for one's hand by cutting and shaping the nails, etc.",2371
66212,00030138,v,9,"care for one's feet by cutting and shaping the nails, etc.",2371
66211,00030012,v,9,perform the services of a barber: cut the hair and/or beard of,2371
66158,00022497,v,9,laugh loudly and in an unrestrained way,2633
66173,00024706,v,9,"clear the throat, as of phlegm",2158
66179,00025845,v,9,wash with a sponge,2371
66181,00026062,v,9,"rub soap all over, usually with the purpose of cleaning",2371
66183,00026356,v,9,remove body hair with a razor,2371
66184,00026510,v,9,shave with a razor,2371
66185,00026591,v,9,shave the head of a newly inducted monk,2371
66187,00026855,v,9,"direct a spray of water into a bodily cavity, for cleaning",2371
66190,00027257,v,9,of hair,2371
66197,00028050,v,9,"apply pomade to, of hair",2371
66199,00028289,v,9,care for the external appearance,2371
66206,00029432,v,9,use shampoo on (hair),2371
66216,00030795,v,9,dress or groom with elaborate care,2875
66218,00031049,v,9,dress up in a cheap and provocative way,2875
66219,00031161,v,9,put on special clothes to appear particularly appealing and attractive,2875
66221,00031723,v,9,adorn with a robe,2875
66222,00031804,v,9,dress primly,2875
66223,00031899,v,9,dress up garishly and tastelessly,2875
66224,00032005,v,9,put on clothes that make a careless or ill-dressed impression,2875
66225,00032165,v,9,dress very carefully and in a finicky manner,2875
66226,00032272,v,9,of dogs and horses,"2188,2371"
66227,00032369,v,9,take off weight,2371
66233,00033398,v,9,"put on or wear a hat: ""He was unsuitably hatted""",2875
78325,00031053,a,9,"immoderately desirous of acquiring e.g. wealth; ""they are avaricious and will do anything for money""; ""casting covetous eyes on his neighbor's fields""; ""a grasping old miser""; ""grasping commercialism""; ""greedy for money and power""; ""grew richer and greedier""; ""prehensile employers stingy with raises for their employees""",1502
84512,01081614,a,9,"(informal) ""a rubber check""; ""a no-good check""",2234
84522,01083240,a,9,"bringing about salvation or redemption from sin: ""saving faith""; ""redemptive (or redeeming) love""",2234
84514,01081873,a,9,"(British) severe; punishingly bad; ""swingeing taxation""; ""swingeing damages awarded by the judge""",2234
92780,02452346,a,9,"made of bamboo: ""bamboo furniture""",2172
96701,00104825,r,9,"in a dominant fashion: ""religion functions dominantly in many societies""",1675
96702,00104954,r,9,"like a girl: ""she was girlishly shy""",2234
96714,00106515,r,9,"with respect to history: ""this is historically interesting""",2768
96732,00108947,r,9,"in essence or effect but not in fact: ""the strike virtually paralyzed the city""; ""I'm virtually broke""",2234
96723,00107789,r,9,"in a humble manner: ""he humbly lowered his head""",1502
96738,00109770,r,9,"throughout the world: ""She is internationally known""",1753
96758,00112720,r,9,"of or relating to physiological processes; with respect to physiology: ""physiologically ready""; ""physiologically addicted""",2234
96753,00111977,r,9,"unpleasantly: ""his ignorance was painfully obvious""",2234
96756,00112467,r,9,"with regard to phylogeny: ""a phylogenetically primitive part of the brain""",2158
96757,00112604,r,9,"in accord with physical laws: ""it is physically impossible""",2097
96761,00113209,r,9,"with regard to social relationships involving authority: ""politically correct clothing""",1718
96772,00114583,r,9,"to an extravagant or immoderate degree: ""atrociously expensive""","1951,2234"
96773,00114720,r,9,"in a very offensive manner: ""he behaved outrageously""",2234
96777,00115465,r,9,"with respect to volume: ""analyzed volumetrically""",1951
96799,00118606,r,9,"on the basis of axioms: ""this is axiomatically given""","1451,2873"
96800,00118719,r,9,"by photoelectric means: ""they measured it photoelectrically""",2107
96750,00111515,r,9,"in a mechanical manner; by a mechanism: ""this door opens mechanically""",2097
96817,00121025,r,9,in an idyllic manner,2234
96811,00120339,r,9,"by electronic means: ""the door opens electronically""",2284
96812,00120452,r,9,"with respect to ethnicity: ""the neighborhood is ethnically diverse""",1675
96814,00120681,r,9,"by genetic mechanisms: ""genetically passed down talents""",2158
96815,00120795,r,9,"in a graphic way: ""he described the event graphically""",1422
96818,00121103,r,9,"by industrial means: ""industrially produced""","1787,1794"
96821,00121368,r,9,"in a legal manner: ""he acted legally""",1802
96822,00121459,r,9,"by hand: ""this car shifts manually""","2188,2233"
96825,00121769,r,9,"in name only: ""nominally he is the boss""",1969
96827,00121994,r,9,"in a professorial manner: ""she behaved very professorially""","1919,1922"
96829,00122237,r,9,"in a realistic manner: ""the figure was realistically painted""",1451
96830,00122358,r,9,"(chemistry; physics) in a reversible manner; ""reversibly convertible""","2097,2111"
96834,00122806,r,9,"with respect to scholastic activities: ""scholastically apt""","1707,1919"
96835,00122926,r,9,"in a serial manner: ""serially composed music""",2536
96841,00123585,r,9,"with regard to temporal order: ""temporally processed""",1463
96842,00123695,r,9,"at the end: ""terminally ill""","1463,1951"
96859,00125555,r,9,"in a linear manner: ""linearly polarized radiation""",2066
96862,00125911,r,9,"by bacteria: ""spreads bacterially""",2158
96864,00126132,r,9,"with respect to race: ""racially integrated""",1675
99642,00510296,r,9,"with regard to taxonomy: ""closely related taxonomically""",2158
148972,L9824581,n,1,"a very fruitful province in Asia Minor, between the Propontis and the Black Sea, where the Romans carried on a considerable trade, now Ejalet Anadoli",2775
145339,L1234310,n,1,"Boeotia, a district of Greece proper, whose capital was Thebes, the birthplace of Bacchus and Hercules",2775
148059,L7646434,n,1,"a marshy place in Southern Latium, near Amycloe, distinguished for producing the most excellent kind of Roman wine",2775
146528,L4023960,n,1,"a river in Magna Graecia, whose water was said to redden the hair, now Crati or Gratti",2775
147271,L5805440,n,1,"a celebrated philosopher born at Abdera, an adherent of the Eleatic school, and the originator of the atomic theory",1545
146958,L5059900,n,1,"a small town in Gallia Cisalpina, between Parma and Placentia",2775
148556,L8824070,n,1,"a valley of Boevtia sacred to Diana, with a fountain of the same name, where Actoeon was torn to pieces by his hounds",1666
147248,L5736404,n,1,"a city of great antiquity in Caria, the birthplace of the historians Herodotus and Dionysius, also celebrated for the mausolëum erected there, now Bodrun or Boudroum",2775
147459,L6286173,n,1,"an epithet of Jupiter, derived from the town of Labranda, in Caria, where there was a temple to him",2775
147848,L7159868,n,1,"a temple in Athens, reared in honor of the three daughters of Leos, who suffered themselves to be sacrificed in order to avert a famine",1666
146209,L3304571,n,1,"a city of Campania, situated to the north of the mouth of the river Liternus, now the village of Patria",2775
147359,L6059245,n,1,"a city of Gallia Transpadana, on the Mincius, in whose vicinity was Andes, the birthplace of Virgil, still called Mantua",2775
147515,L6438746,n,1,"the capital of Lesbos, the birthplace of Sappho, Pittacus, Alcaeus, and Diophanes, the orator, now Mytilini or Castro",2775
146491,L3949332,n,1,"the council of the whole of Aetolia, a general assembly or congress of the Aetolians",2798
148353,L8376478,n,1,"one of the Cyclades, famous for its white marble and as the birthplace of the poet Archilochus, now Paro",2775
148492,L8683881,n,1,"a river in Boeotia sacred to Apollo and the Muses, which rises in Mount Helicon and flows into the Copaic lake",2775
146996,L5166592,n,1,"the largest town in Arabia Felix, especially celebrated for its myrrh, frankincense, etc.",2775
147754,L6950258,n,1,"a river in Lusitania, celebrated for its golden sands, now Tajo or Tagus",2775
148042,L7621033,n,1,"a people of Italy, in the district of Umbria, which was named after them",2775
146110,L3066944,n,1,"a town on the borders of Apulia and Lucania, the birthplace of the poet Horace, now Venosa",2775
148122,L7777929,n,1,"the goddess of the rainbow, daughter of Thaumas and Electra, the sister of the Harpies, and the swift-footed messenger of the gods",1666
91599,02261477,a,9,"(mathematics, logic) such that the arguments or roles can be interchanged; ""the arguments of the symmetric relation, ""is a sister of,"" are interchangeable""","1451,2873"
69721,00598488,v,9,show off,
70146,00665315,v,9,of verbs,1974
72222,00969423,v,9,hit hard,
74298,01292328,v,9,of boats,1946
74989,01393615,v,9,go down,
75559,01483772,v,9,look at,
79664,00251310,a,9,not tied,
103161,W0021119,n,10,None,
1,00001740,n,9,anything having existence (living or nonliving),
11,00010123,n,9,an object occurring naturally; not made by man,
14,00011937,n,9,a man-made object,
10,00009457,n,9,"a physical (tangible and visible) entity: ""it was full of rackets, balls and other objects""",
15,00012704,n,9,"one of a class of artifacts: ""an article of clothing""",
103236,W0005173,n,10,None,
7,00004123,n,9,"a human being: ""there was too much for one person to do""","2158,2516"
8,00008019,n,9,a living organism characterized by voluntary movement,"2158,2188"
9,00008864,n,9,a living organism lacking the power of locomotion,"2158,2172"
13,00011575,n,9,any substance that can be metabolized by an organism to give energy and build tissue,2354
16,00012865,n,9,a feature of the mental life of a living organism,1502
12,00010572,n,9,"that which has mass and occupies space: ""an atom is the smallest indivisible unit of matter""",2097
18,00013243,n,9,the psychological result of perception and learning and reasoning,
22,00015185,n,9,"the spatial arrangement of something as distinct from its substance: ""geometry is the mathematical science of shape""",
21,00014887,n,9,a point or extent in space,
24,00015975,n,9,"the unlimited 3-dimensional expanse in which everything is located; ""they tested his ability to locate objects in space""",
34,00020056,n,9,how much there is of something that you can measure,1951
36,00020709,n,9,"an action: ""how could you do such a thing?""",
26,00017297,n,9,something that happens at a given place and time,
27,00017487,n,9,something that people do or cause to happen,
28,00017954,n,9,any number of entities (members) considered as a unit,
29,00018376,n,9,anything owned or possessed,
30,00018604,n,9,an abstraction belonging to or characteristic of an entity,
31,00018916,n,9,an abstraction belonging to or characteristic of two entities or parts together,
23,00015594,n,9,the continuum of experience in which events pass from the future through the present to the past,1463
33,00019671,n,9,something that is communicated between people or groups,"1935,1969"
54,00024260,n,9,taking part in a game or sport or other recreation,2638
35,00020461,n,9,any state or process known through the senses rather than by intuition or reasoning,
39,00021392,n,9,"a notable achievement: ""the book was her finest effort""",
37,00020804,n,9,a kind act,
38,00020977,n,9,the act of accomplishing something,
42,00022060,n,9,"used in the phrase ""to your credit"" to indicate an achievement deserving praise; ""she already had several performances to her credit""",
40,00021866,n,9,an outstanding achievement,
41,00021950,n,9,an achievement demonstrating great skill or mastery,
43,00022246,n,9,"something done (usually as opposed to something said); ""there were stories of murders and other unnatural actions""",
44,00022737,n,9,"a mode of action: ""if you persist in that course you will surely fail""",
47,00023118,n,9,"close interaction: ""they kept in daily contact""; ""they claimed that they had been in contact with extraterrestrial beings""",
45,00022878,n,9,a mutual or reciprocal action; interacting,
46,00023032,n,9,reciprocal action and reaction,
48,00023330,n,9,"contact that occurs when two people look directly at each other: ""a teacher should make eye contact with the students""",
49,00023506,n,9,"contact established between applicants and prospective employees: ""the agency provided placement services""",
52,00023967,n,9,"social or verbal interchange (usually followed by ""with"")",
50,00023668,n,9,mutual interaction; the activity of interchanging or reciprocating,
51,00023860,n,9,mutual exchange of commercial or other privileges,
53,00024107,n,9,"(usually plural) mutual dealings or connections among persons or groups: ""international relations""",
59,00024877,n,9,"any recognized accomplishment: ""they admired his performance under stress""",
55,00024436,n,9,the act using a sword (or other weapon) vigorously and skillfully,2642
56,00024570,n,9,the playing of a game of tenpins or duckpins etc,2631
66,00025919,n,9,"the act of arriving at a certain place: ""they awaited her arrival""",1946
57,00024710,n,9,brave and heroic deeds,
58,00024789,n,9,a masterly or brilliant feat,
62,00025398,n,9,"the sum of recognized accomplishments: ""the lawyer has a good record""",
60,00025045,n,9,better than expected performance (better than might have been predicted from intelligence tests),
61,00025221,n,9,poorer than expected performance (poorer than might have been predicted from intelligence tests),
64,00025630,n,9,"advancing toward a goal: ""persuading him was easy going"" or ""the proposal faces tough sledding""",
63,00025520,n,9,an irreversible accomplishment,
65,00025788,n,9,accomplishment of an objective,
67,00026147,n,9,"arrival at a new stage: ""his attainment of puberty was delayed by malnutrition""",
68,00026283,n,9,"esp. of something momentous; ""the advent of the computer""",
20,00014045,n,9,"the psychological feature of experiencing affective and emotional states: ""he had a feeling of euphoria""",1502
32,00019464,n,9,a relation between living organisms; esp between people,1675
71,00026874,n,9,entrance by force or without permission or welcome,
73,00027115,n,9,"the act of entering: ""she made a graceful entree into the ballroom""",
75,00027339,n,9,"the act of appearing in public view: ""the rookie made a brief appearance in the first period""; ""it was Bernhardt's last appearance in America""",
74,00027235,n,9,the act of enrolling,"1820,1753"
94,00030321,n,9,"withdrawal for prayer and study and meditation: ""a religous retreat""",1565
76,00027592,n,9,the act of emerging,
77,00027678,n,9,the act of appearing again,
80,00028092,n,9,the act of returning to the country of origin,1946
81,00028196,n,9,"the act of forcing a way into or through something: ""the penetration of upper management by women""",
82,00028352,n,9,a act of securing an arriving vessel with ropes or anchors,1942
84,00028670,n,9,"the act of coming down to the earth (or other surface); ""the plane made a smoothe landing""; ""his landing on his feet was catlike""","1942,2772"
83,00028503,n,9,the act of coming to land after a voyage,1946
96,00030612,n,9,breaking camp,1781
88,00029442,n,9,"the act of departing politely: ""he disliked long farewells""; ""he took his leave""",
85,00028871,n,9,an unscheduled airplane landing that is made under circumstances (engine failure or adverse weather) not under the pilot's control,"1942,2772"
86,00029100,n,9,act of departing,
87,00029365,n,9,departing hastily,
78,00027781,n,9,(astronomy) the reappearance of a celestial body after an eclipse,2076
89,00029628,n,9,the act of saying farewell,
90,00029712,n,9,the act of leaving secretly or without explanation,
91,00029873,n,9,suddenly disappearing from sight,
92,00029961,n,9,the act of withdrawing,
93,00030184,n,9,withdrawing into the background; making yourself inconspicuous,
95,00030456,n,9,the act of evacuating; leaving a place in an orderly fashion; esp. for protection,
98,00030946,n,9,the act of running away secretly (as to avoid arrest),1781
120,00033906,n,9,"an escape from jail: ""the breakout was carefully planned""",
99,00031070,n,9,unauthorized military absence,1781
100,00031190,n,9,ideological defection from the party line (especially from orthodox communism),1781
101,00031327,n,9,migration into a place,1675
102,00031422,n,9,migration out of a place,1675
103,00031519,n,9,(military) withdrawal to a more favorable position,1781
104,00031641,n,9,(military) withdrawal of a military presence,1781
105,00031741,n,9,to break off a military action with an enemy,1781
107,00031963,n,9,the departure of a vessel from a port,1946
106,00031866,n,9,a act of becoming more distant,
108,00032054,n,9,the act of passengers and crew getting off of a ship or aircraft,1946
109,00032245,n,9,debarkation from a boat or ship,1946
110,00032335,n,9,the act of passengers and crew getting aboard a ship or aircraft,1946
118,00033679,n,9,(in boxing) the act of one boxer holding onto the other to avoid being hit and to rest momentarily,2642
111,00032499,n,9,the act of going out,
112,00032570,n,9,the act of running away with a lover (usually to get married),
114,00032997,n,9,leaving (without permission) the place you are expected to be,
115,00033153,n,9,the act of physically escaping from something (an opponent or a pursuer or an unpleasant situation) by some adroit maneuver,
116,00033384,n,9,the act of avoiding capture (especially by cunning),
117,00033506,n,9,an action aimed at evading an enemy,
224,00050377,n,9,buying goods to be shipped through the mail,1753
119,00033830,n,9,a quick evasive movement,
121,00034082,n,9,"a rapid escape (as by criminals); ""the thieves made a clean getaway""; ""after the expose he had to take it on the lam""",
79,00027910,n,9,"a coming to or returning home: ""on the eve of his return to Australia we gave him a goodbye party""",1946
122,00034259,n,9,a journey by a large group to escape from a hostile environment,
97,00030682,n,9,"withdrawing support or help despite allegiance or responsibility: ""his abandonment of his wife and children left them penniless""",1781
72,00026980,n,9,"a sudden violent entrance; a bursting in: ""the recent irruption of bad manners""",
124,00034546,n,9,something achieved (or escaped) by a narrow margin,
125,00034703,n,9,the act of coming (or going) out; becoming apparent,
126,00034867,n,9,emerging to the surface and becoming apparent,
148,00038219,n,9,a unit of academic credit; one hour a week for an academic semester,1919
131,00035534,n,9,"something that is realized: ""the victory was the realization of a whole year's work""",
130,00035376,n,9,the act of bringing to completion or fruition,
136,00036271,n,9,"the act of achieving an aim: ""the attainment of independence""",
133,00035863,n,9,an orgasm accompanied by the ejaculation of semen,1703
138,00036590,n,9,the best record in the whole world,2638
134,00035970,n,9,the act of consummating something (a desire or promise etc),
135,00036136,n,9,the fulfillment of your capacities,
132,00035701,n,9,the moment of most intense pleasure in sexual intercourse,1703
139,00036683,n,9,"an attainment that is successful: ""his success in the marathon was unexpected""; ""his new play was a great success""",
147,00038052,n,9,educational recognition that a course of studies has been successfully completed,1919
140,00037013,n,9,"succeeding with great difficulty: ""just winning the shore exhausted him""",
141,00037139,n,9,"a conspicuous success: ""that song was his first hit and marked the beginning of his career""",
142,00037304,n,9,"something that exactly succeeds in achieving its goal: ""the new advertising campaign was a bell ringer""; ""scored a bull's eye""; ""hit the mark""",
144,00037624,n,9,"success in mastering something difficult: ""the conquest of space""",
143,00037524,n,9,the act of raising someone to the nobility,
146,00037826,n,9,"success in satisfying a test or requirement: ""his future depended on his passing that test""; ""he got a pass in introductory chemistry""",
145,00037744,n,9,a brilliant and notable success,
150,00038527,n,9,"an unexpected omission: ""he resented my failure to return his call""",
166,00040844,n,9,a breach of a legal duty,1802
155,00039334,n,9,"loss due to not showing up: ""he lost the game by default""",2638
149,00038346,n,9,an act that does not achieve its intended goal,
152,00038917,n,9,"failure to reach a minimum required performance: ""his failing the course led to his disqualification""",
151,00038702,n,9,an act that fails,
153,00039090,n,9,"complete failure: ""all my efforts led to naught""",
154,00039191,n,9,"an unexcused absence from class: ""he was punished for taking too many cuts in his math class""",
169,00041300,n,9,a failure of the seller's guarantee of good title,1802
156,00039445,n,9,"an informal word for any attempt or effort: ""he gave it his best shot""",
158,00039700,n,9,"the act of losing: ""everyone expected him to win so his loss was a shock""",
157,00039566,n,9,an attempt to score in a game,
161,00040167,n,9,"an improbable and unexpected victory: ""the biggest upset since David beat Goliath""",
160,00040027,n,9,an act of hindering someone's plans or efforts,
127,00034968,n,9,the act of sending off something,1946
162,00040312,n,9,a failure to maintain a higher state,
163,00040483,n,9,the act of disappointing someone,
164,00040608,n,9,a failure to perform some promised act or obligation,
165,00040749,n,9,a failure to face some difficulty squarely,
167,00041059,n,9,a breach of contract committed prior to the time of required performance,1802
170,00041430,n,9,failure to keep a promise (of marriage),1802
168,00041219,n,9,a breach of due care,
137,00036443,n,9,"the best performance ever attained in a sport: ""he broke the Olympic record""",2638
171,00041533,n,9,violation (either through fraud or negligence) by a trustee of a duty that equity requires of him,1802
172,00041692,n,9,larceny after trust rather than after unlawful taking,1802
173,00041830,n,9,a breach that occurs when an item is deficient according to the terms of a warranty,1802
175,00042074,n,9,a breach serious enough to destroy the value of the contract and to give a basis for an action for breach of contract,1802
174,00041978,n,9,the act deviating from a vertical position,
225,00050501,n,9,purchasing insurance policies for cash from terminally ill policy holders,1753
129,00035222,n,9,"the act of becoming or making complete: ""her work is still far from completion""",
180,00043135,n,9,"an act that brings discredit to the person who does it: ""he made a huge blot on his copybook""",
178,00042794,n,9,a mistake that occurs when the server in tennis fails to keep both feet behind the baseline,"2633,2871"
179,00042960,n,9,(baseball) a failure of a defensive player to make an out when normal play would have sufficed,"2633,2871"
190,00044604,n,9,"a blunder that makes you look ridiculous; used in the phrase ""make a spectacle of"" yourself",
182,00043525,n,9,a mistake in calculating,
183,00043659,n,9,a miscalculation that recoils on its maker,
184,00043768,n,9,the mistake of misrepresenting the facts,
185,00043865,n,9,an inadvertent mistake,
186,00043956,n,9,a mistake resulting from inattention,
187,00044056,n,9,a mistake resulting from neglect,
188,00044168,n,9,an embarrassing mistake,
189,00044471,n,9,an acronym often used by soldiers in World War II: Situation Normal All Fucked Up,
192,00044878,n,9,"a serious and ludicrous blunder: ""he made a bad bull of the assignment""",
191,00044751,n,9,(British) something badly botched or muddled,
196,00045336,n,9,"(British) a conspicuous mistake whose effects seem to reverberate; ""he dropped a clanger""",
194,00045103,n,9,a blunder (especially an actor's forgetting the lines),2610
208,00047693,n,9,purchasing back something previously sold,1753
195,00045209,n,9,a socially awkward or tactless act,
197,00045479,n,9,"an unintentional but embarrassing blunder: ""he recited the whole poem without a single trip""; ""confusion caused his unfortunate misstep""",
198,00045686,n,9,"a sudden drop from an upright position: ""he had a nasty spill on the ice""",
199,00045827,n,9,"the act of contracting or assuming or acquiring possession of something: ""the acquisition of wealth""; ""the acquisition of one company by another""",
200,00046246,n,9,"the act of acquiring something: ""I envied his talent for acquiring new friends""; ""did you hear about his getting a car?""",
202,00046665,n,9,"becomeing infected: ""catching cold is sometimes unavoidable""; ""the contracting of a serious illness can be financially catastrophic""",
201,00046576,n,9,the act of obtaining,
203,00046866,n,9,"acquiring or coming into something (usually undesirable): ""incurring debts is easier than paying them""",
205,00047131,n,9,"something added to what you have already: ""the librarian shelved the new accessions""; ""he was a new addition to the staff""",
204,00047024,n,9,the act of making money (and accumulating wealth),
222,00050044,n,9,"searching for or buying goods or services: ""went shopping for a reliable plumber""; ""does her shopping at the mall rather than down town""",1753
221,00049855,n,9,"the act of buying: ""buying equipment for the trip took several hours""",1753
223,00050253,n,9,"shopping at a market: ""does the weekly marketing at the supermarket""",1753
209,00047814,n,9,buying or selling securities or commodities,2872
