2114,00335980,n,9,"something shown to the public: ""the museum had many exhibits of oriental art""","2600,2772"
2117,00336519,n,9,"the act of exhibiting: ""a remarkable exhibition of musicianship""",2600
2116,00336363,n,9,"a show of military force or preparedness: ""he confused the enemy with feints and demonstrations""","1781,2600"
2128,00338341,n,9,a stately court dance of the 17th and 18th centuries; in slow time,2621
2091,00332755,n,9,the ancient Panhellenic celebration at Olympia in honor of Zeus; held every 4 years beginning in 472 BC,2600
2120,00336981,n,9,a show on tour,2600
2121,00337051,n,9,a minor show that is part of a larger one (as at the circus),2600
2122,00337166,n,9,an entertainment that provokes pleased interest and distracts you from worries and vexations,2600
2123,00337330,n,9,taking a series of rhythmical steps (and movements) in time to music,2621
2124,00337690,n,9,the interpretation in harmonious bodily movements of the rhythm of musical compositions,2600
2126,00338081,n,9,an intricate traditional dance in India performed by professional dancing girls,2621
2127,00338236,n,9,a stately court dance of the 16th and 17th centuries,2621
2130,00338623,n,9,dancing in which the steps are more important than gestures or postures,2621
2129,00338462,n,9,a form of dancing in which dancers slam into one another; normally performed to punk rock,2621
2109,00335147,n,9,"a public entertainment or exhibition: ""a remarkable show of skill""",2600
2131,00338800,n,9,a dance step tapped out audibly with the feet,2621
2132,00338969,n,9,a dance performed on tiptoe,2621
2133,00339066,n,9,tap dancing wearing soft-soled shoes,2621
2134,00339198,n,9,a solo tap dance emphasizing sharp taps,2621
2136,00339532,n,9,a theatrical representation of a story performed to music by ballet dancers,2621
2135,00339297,n,9,artistic dancing,"2536,2621"
2137,00339825,n,9,a solo dance or dance figure,2621
2138,00339927,n,9,a dance for two people (usually a ballerina and a danseur noble),2621
2139,00340075,n,9,a style of ballet based on precise conventional steps performed with graceful and flowing movements,2621
2140,00340237,n,9,a style of ballet that admits a wider variety of movements,2621
2113,00335874,n,9,"a visible display: ""she made a parade of her sorrows""",2600
2106,00334700,n,9,"performance given by a traveling company of acrobats clowns and trained animals: ""the children always love to go to the circus""",2600
2102,00334294,n,9,a traveling show; having sideshows and rides and games of skill etc.,2600
2147,00341254,n,9,a strutting dance based on a march; was performed in minstrel shows; originated as a competition among Black dancers to win a cake,2621
2146,00341135,n,9,a Spanish dance in triple time accompanied by guitar and castanets,2621
2148,00341439,n,9,a high-kicking dance of French origin performed by a female chorus line,2621
2145,00340952,n,9,a Middle Eastern dance in which the dancer makes sensuous movements of the hips and abdomen,2621
2149,00341563,n,9,erotic dancing with little or no clothing,2621
2150,00341717,n,9,a solo dance in which large fans are manipulated to suggest or reveal nakedness,2621
2152,00342023,n,9,a solo dance similar to a fan dance except large balloons are used instead of fans,2621
2161,00343528,n,9,a lively dance step consisting of hopping on each foot in turn,2621
2154,00342388,n,9,dancing as part of a social occasion,2621
2156,00342773,n,9,an energetic American dance that was popular in the 1930s (probably named for the aviator Charles Lindbergh),2621
2155,00342665,n,9,a jerky American dance that was popular in the 1940s,2621
2168,00344796,n,9,a modern ballroom dance from Latin America; small steps and swaying movements of the hips,2621
2186,00346860,n,9,a style of dancing that originated among ordinary people (not in the royal courts),2621
2159,00343242,n,9,a style of dancing characteristic of the Andalusian gypsies; vigorous and rhythmic with clapping and stamping of feet,2621
2157,00342945,n,9,a provocative Spanish courtship dance in triple time; performed by a man and a woman playing castanets,2621
2171,00345159,n,9,a ballroom dance in quadruple time; combines short and long and fast and slow steps fixed sequences,2621
2169,00344953,n,9,an early ballroom dance; precursor to the fox-trot,2621
2162,00343652,n,9,a dance involving a rhythmical stamping step,2621
2163,00343748,n,9,a lively whirling Italian dance for two persons,2621
2165,00344095,n,9,(ballet) quick gliding steps with one foot always leading,2621
2151,00341852,n,9,"a form of entertainment in which a dancer undresses to music: ""she did a strip right in front of everyone""",2621
2166,00344233,n,9,a gliding or sliding step in ballet,2621
2167,00344342,n,9,any of a variety of social dances performed by couples in a ballroom,2621
2170,00345076,n,9,an early ragtime one-step,2621
2160,00343430,n,9,an old formal French dance in quadruple time,2621
2172,00345313,n,9,a ballroom dance in duple meter; marked by sliding steps,2621
2174,00345544,n,9,a syncopated ballroom dance formerly popular in the US,2621
2153,00342164,n,9,a form of modern dance in which the dancer's movements depict an emotion or tell a story,2621
2173,00345424,n,9,a Spanish dance in triple time; accompanied by guitar and castanets,2621
2175,00345654,n,9,an American ballroom dance in syncopated rhythm; popular early in the 20th century,2621
2176,00345793,n,9,a Latin American dance of 3 steps and a kick by people in single file,2621
2164,00343865,n,9,"a sequence of foot movements that make up a particular dance: ""he taught them the waltz step""",2621
2177,00345914,n,9,a lively dance originating in France in the 18th century,2621
2178,00346037,n,9,a stately court dance in the 17th century,2621
2179,00346131,n,9,a ballroom dance in fast duple time,2621
2180,00346223,n,9,a ballroom dance with both quick and slow steps,2621
2181,00346326,n,9,a ballroom dance based on the Cuban folk dance,2621
2182,00346424,n,9,a lively ballroom dance from Brazil,2621
2183,00346511,n,9,a ballroom dance characterized by revolving movement,2621
2184,00346637,n,9,a ballroom dance of Latin-American origin,2621
2185,00346730,n,9,a ballroom dance in triple time with a strong accent on the first beat,2621
2187,00347194,n,9,a Polish national dance in triple time,2621
2188,00347286,n,9,a Bohemian dance with 3 steps and a hop in fast time,2621
2189,00347390,n,9,a German round dance resembling a slow polka,2621
2190,00347492,n,9,any of various English folk dances performed by men in costume,2621
2191,00347630,n,9,any of various dances by men who step nimbly over swords or flourish them in the air,2621
2192,00347788,n,9,a rhythmic syncopated Cuban folk dance in duple time,2621
2193,00347892,n,9,a vigorous Scottish reel,2621
2158,00343102,n,9,a lively dance from Provence; all the dancers join hands and execute various figures,2621
2143,00340661,n,9,a dance performed while wearing clogs; has heavy stamping steps,2621
2198,00348670,n,9,an American country dance which starts with the couples facing each other in two lines,2621
2200,00348934,n,9,American country dancing in which couples form squares,2621
2205,00349666,n,9,a square-dance figure; two dancers approach each other and circle back to back before returning to their original places,2621
2202,00349361,n,9,a Scottish reel for eight dancers,2621
2206,00349860,n,9,a square dance figure; couples march counterclockwise in a circle,2621
2203,00349450,n,9,a square dance of 5 or more figures for 4 or more couples,2621
2204,00349581,n,9,a quadrille for 8 or 16 couples,2621
2210,00350444,n,9,a dance that is part of a religious ritual,2621
2207,00350000,n,9,a square dance figure; partners circle each other taking sideways steps,2621
2209,00350303,n,9,a moderately slow Austrian country dance in triple time; involves spinning and clapping,2621
2208,00350143,n,9,a square dance figure; a pair of dancers join hands and dance around a point between them,2621
2197,00348506,n,9,country dancing performed with couples in two long lines facing each other,2621
2229,00353377,n,9,a type of dance music originating in the 1950s; a blend of rhythm-and-blues with country-and-western,2536
2211,00350744,n,9,a ritual dance of the Apache Indians,2621
2212,00350845,n,9,a rain dance of Amerindians,2621
2213,00350929,n,9,a medieval dance in which a skeleton representing death leads a procession of others to the grave,2621
2214,00351103,n,9,a religious dance of native Americans looking for communication with the dead,2621
2215,00351238,n,9,a Polynesian rain dance performed by a woman,2621
2216,00351364,n,9,an ancient Greek dance imitating the motions of warfare,2621
2217,00351473,n,9,a ritual dance intended to bring rain,2621
2240,00355108,n,9,"the act of singing: ""with a shout and a song they marched up to the gates""",2536
2218,00351603,n,9,a ceremonial dance (as by the American Hopi Indians) in which snakes are handled or invoked,"1960,2621"
2219,00351752,n,9,a ceremonial dance performed by Amerindians at the summer solstice,"1960,2621"
2230,00353591,n,9,rock music with deliberately offensive lyrics expressing anger and social alienation,2536
2220,00351874,n,9,a ceremonial dance performed before a battle or after a victory,2621
2222,00352265,n,9,music composed for ballroom dancing,"2536,2600"
2223,00352447,n,9,music with a syncopated melody (usually for the piano),"2536,2600"
2224,00352561,n,9,a style of dance music popular in the 1920s; similar to New Orleans jazz but played by large bands,"2536,2600"
2225,00352710,n,9,music that originated in New Orleans around 1900 and developed through increasingly complex styles,"2536,2600"
2226,00352985,n,9,an early form of modern jazz (originating around 1940),"2536,2600"
2227,00353097,n,9,an instrumental version of the blues (especially for piano),"2536,2600"
2228,00353243,n,9,any of various styles of jazz that appeared after 1940,"2536,2600"
2231,00353738,n,9,(Brit) traditional jazz as revived in the 1950s,2536
2237,00354831,n,9,(British) informal group singing of popular songs,2536
2233,00354025,n,9,a kind of danceable music popular among black South Africans; includes a whistle among its instruments,"2536,2600"
2234,00354179,n,9,music that is vocalized (as contrasted with instrumental music),"2536,2600"
2235,00354354,n,9,a form of vocal music in which rhyming lyrics are chanted to a musical accompaniment,"2536,2600"
2236,00354500,n,9,the act of singing vocal music,"2536,2600"
2241,00355296,n,9,a joyful song (usually celebrating the birth of Christ),2536
2238,00354935,n,9,a style of operatic singing,"2536,2600"
2239,00355018,n,9,singing with florid ornamentation,"2536,2600"
2246,00355815,n,9,"singing in a soft low tone: ""her crooning soon put the child to sleep""","2536,2600"
2242,00355403,n,9,a quiet song that lulls a child to sleep,2536
2243,00355510,n,9,an elaborate song for solo voice,2536
48460,07739067,n,9,1925-1965,1718
2244,00355593,n,9,singing joyful religious songs (especially at Christmas),"2536,2600"
2245,00355704,n,9,the act of singing popular songs in a sentimental manner,"2536,2600"
2199,00348823,n,9,a folk dance; dancers form a circle,2621
2247,00355940,n,9,singing jazz; the singer substitutes nonsense syllables for the words of the song and tries to sound like a musical instrument,"2536,2600"
2201,00349176,n,9,a lively dance of Scottish highlanders; marked by circular moves and gliding steps,2621
2221,00351993,n,9,"a musical diversion: ""his music was his central interest""","2536,2600"
2250,00356514,n,9,a march accompanying quick time,"1781,2536,2600"
2262,00358063,n,9,the performance of a part or role in a drama,2610
2264,00358502,n,9,"an impressionistic portrayal of a person: ""he did a funny impression of a politician""",2610
2252,00356720,n,9,a slow march to be played for funeral processions,"2536,2600"
2253,00356842,n,9,a march to be played for processions,"2536,2600"
2254,00356963,n,9,playing a set of bells that are (usually) hung in a tower,"2536,2600"
2255,00357127,n,9,ringing tuned bells in a fixed order that is continually changing,"2536,2600"
2257,00357398,n,9,"the act of whistling a tune: ""his cheerful whistling indicated that he enjoyed his work""","2536,2600"
2258,00357542,n,9,"a stroke or blow: ""the signal was two beats on the steam pipe""",
2271,00359430,n,9,"the act of presenting a play or a piece of music or other entertainment: ""we congratulated him on his performance at the recital""",2425
2259,00357655,n,9,a stroke with a curved piece of wood with taut horsehair strands that is used in playing stringed instruments,
2260,00357850,n,9,a downward stroke from the heel to the tip of the bow,
2261,00357958,n,9,an upward stroke from the tip to the heel of the bow,
2263,00358359,n,9,acting the part of a character on stage,2610
2265,00358644,n,9,imitating the mannerisms of another person,2610
2266,00358778,n,9,the act of mimicking; imitative behavior,2610
2267,00358898,n,9,humorous or satirical mimicry,2610
2249,00356331,n,9,brisk marching music suitable for troops marching in a military parade,"1781,2536,2600"
2268,00359000,n,9,a performance using gestures and body movements without words,2610
2269,00359154,n,9,(British) an abbreviation of pantomime,2610
2274,00360073,n,9,a short theatrical episode,2610
2282,00360851,n,9,"a frenetic disorganized (and often comic) disturbance suggestive of a circus or carnival; ""it was so funny it was a circus""; ""the whole occasion had a carnival atmosphere""",
2273,00359972,n,9,the entertainment offered at a public presentation,
2275,00360150,n,9,poor acting by a ham actor,2610
2276,00360243,n,9,ostentatious hammy conduct,2610
2277,00360323,n,9,acting a particular role (as in psychotherapy),2610
2278,00360427,n,9,a trick performed with playing cards,2425
2279,00360520,n,9,manual dexterity in the execution of tricks,2425
2272,00359780,n,9,"a performance (or series of performances) at a public presentation; ""the program lasted more than two hours""",2425
2280,00360644,n,9,general activity and motion,
2281,00360740,n,9,a confused disturbance far greater than its cause merits,
2295,00362624,n,9,"a sudden flurry of activity (often for no obvious reason); ""a burst of applause""; ""a fit of housecleaning""",
2283,00361086,n,9,the act of causing disorder,
2284,00361221,n,9,the act of disrupting an established order,
2285,00361333,n,9,the act of surprising someone,
2286,00361442,n,9,the act of making a noisy disturbance,
2287,00361596,n,9,a sudden outburst (as of protest),
2288,00361708,n,9,violent and needless disturbance,
2289,00361801,n,9,a noisy riotous fight,
2290,00361901,n,9,disturbance usually in protest,
2291,00362034,n,9,a sudden violent disturbance,
2292,00362142,n,9,violently angry and destructive behavior,
2294,00362507,n,9,a rapid bustling commotion,
2296,00362788,n,9,"the act of moving hurriedly and in a careless manner: ""in his haste to leave he forgot his book""",
2297,00362997,n,9,"the act of moving with great haste: ""he made a dash for the door""",
2299,00363237,n,9,"a deliberate coordinated movement requiring dexterity and skill: ""he made a great play""",
2298,00363120,n,9,rushing about hastily in an undignified way,
2300,00363615,n,9,"a predetermined set of movements in dancing or skating: ""she made the best score on compulsory figures""",
2251,00356601,n,9,martial music with variations; for the Scottish Highlands bagpipe,"1781,2536,2600"
2301,00363807,n,9,a skating figure that carves an 8 in the ice,
2302,00363910,n,9,a skating figure executed with the skates heel to heel in a straight line,
2256,00357253,n,9,"the act of playing drums: ""he practiced his drumming several hours every day""","2536,2600"
2305,00364396,n,9,a skillful maneuver in catching balls or in stealing the ball from the opposing team,
2306,00364539,n,9,in sports (baseball or basketball or ice hockey) the act of enabling another player to make a good play,
2339,00369708,n,9,"(sports) the act of swinging or striking at a ball with a club or racket or bat or cue or hand; ""a good shot require good balance and tempo""; ""he left me an almost impossible shot""",2638
2308,00364910,n,9,a play by the offensive team in a football game,"2633,2871"
2325,00367659,n,9,an illegal check (chopping at an opponent's arms or stick),2646
2313,00365964,n,9,(football) an attempt to advance the ball by running around the end of the line,2871
2311,00365634,n,9,the act of running back the football after a kickoff or punt or interception or fumble,"2633,2871"
2312,00365792,n,9,"(football) an attempt to advance the ball by running into the line; ""the linebackers were ready to stop a rush""",2871
2315,00366358,n,9,a football play in which one player hands the ball to a teammate,2871
2322,00367201,n,9,"the act of blocking someone's path with your body (as in football); ""he threw a rolling block into the line backer""",
2316,00366476,n,9,a pass to a receiver downfield from the passer,2871
2317,00366608,n,9,a forward pass in which the receiver is protected by a screen of blockers,2871
2318,00366739,n,9,a pass to a receiver upfield from the passer,2871
2319,00366852,n,9,(football) grasping an opposing player with the intention of stopping by throwing to the ground,2638
2323,00367431,n,9,(football) an illegal block,2638
2320,00367000,n,9,the performance of a juggler,
2321,00367083,n,9,getting in someone's way,
2330,00368385,n,9,a basketball maneuver; two defensive players shift assignments so that each guards the player usually guarded by the other,2871
2324,00367515,n,9,obstructing an opponent in ice hockey,2646
2326,00367774,n,9,knocking the puck away by jabbing at it with the hockey stick,2646
2329,00368227,n,9,"a basketball maneuver; obstructing an opponent with one's body; ""he was called for setting an illegal pick""",2871
2327,00367892,n,9,any exciting and complex play intended to confuse (dazzle) the opponent,2638
2333,00368906,n,9,the act of getting two players out on one play,2871
2328,00368056,n,9,a play executed by a basketball team,"2633,2871"
2340,00370110,n,9,"a stroke (in tennis or badminton or squash) that puts reverse spin on the ball; ""cuts do not bother a good tennis player""",2638
2332,00368739,n,9,a play executed by a baseball team,"2633,2871"
2334,00369010,n,9,the act of getting three players out on one play,2871
2335,00369116,n,9,a baseball play in which a runner on third base tries to score as the batter bunts the pitch,2871
2336,00369303,n,9,the runner on third base starts home as the pitcher delivers the ball,2871
2337,00369457,n,9,the runner on third base waits to start home until the batter has bunted successfully,2871
2341,00370281,n,9,a sweeping stroke or blow,2638
2338,00369625,n,9,the manner of using the feet,
2310,00365447,n,9,the quarterback moves back as if to pass and then hands the ball to the fullback who is running toward the line of scrimmage,2871
2343,00370521,n,9,"a tennis stroke that returns the ball to the other player: ""he won the point on a cross-court return""","2632,2871"
2307,00364695,n,9,(ice hockey) the act of shooting the puck from within your own defensive area the length of the rink beyond the opponent's goal,2646
2342,00370358,n,9,the act of hitting a tennis ball with a tennis racket,"2632,2871"
2351,00371920,n,9,"a stroke (in tennis or badminton or squash) that puts the ball in play; ""his powerful serves won the game""","2632,2871"
2344,00370892,n,9,a return made with the palm of the hand facing the direction of the stroke (as in tennis or badminton or squash),"2632,2871"
2345,00371093,n,9,hard straight return made on the forehand side (as in tennis or badminton or squash),"2632,2871"
2346,00371238,n,9,a return made with the back of the hand facing the direction of the stroke,"2632,2871"
2347,00371419,n,9,a hard straight return made on the backhand side,"2632,2871"
2348,00371528,n,9,a backhand shot made holding the racquet in both hands,"2632,2871"
2349,00371648,n,9,a tennis return made with a downward motion that puts backspin on the ball,"2632,2871"
2350,00371785,n,9,a hard straight return (as in tennis or squash),"2632,2871"
2309,00365145,n,9,"a football play in which a player runs with the ball: ""the defensive line braced to stop the run""; ""the coach put great emphasis on running""",2871
54736,09057633,n,9,a holly shrub,"2158,2172"
2314,00366105,n,9,"a football play that involves one player throwing the ball to a teammate: ""the coach sent in a passing play on third and long""",2871
2354,00372370,n,9,a serve that strikes the net before falling into the receiver's court; the ball must be served again,"2632,2871"
2355,00372531,n,9,a tennis return made by hitting the ball before it bounces,"2632,2871"
2356,00372660,n,9,a tennis return made by hitting the ball after it has bounced once,"2632,2871"
2357,00372804,n,9,a tennis return made by hitting the ball immediately after it bounces,"2632,2871"
2358,00372931,n,9,an easy return of a tennis ball in a high arc,"2632,2871"
2359,00373026,n,9,a hard return hitting the tennis ball above your head,"2632,2871"
2360,00373142,n,9,a soft return so that the tennis ball drops abruptly after crossing the net,"2632,2871"
2361,00373273,n,9,a tennis return that passes an opponent who has approached the net,"2632,2871"
2363,00373566,n,9,a method of moving the arms and legs to push against the water and propel the swimmer forward,2649
2365,00374054,n,9,an elementary swimming stroke imitating a swimming dog,2649
2388,00377627,n,9,"any activity that is easy to do: ""marketing this product will be no picnic""",2600
2367,00374336,n,9,a swimming stroke in which the arms are thrown forward together out of the water while the feet kick up and down,2649
2369,00374747,n,9,a swimming stroke that resembles the crawl except the swimmer lies on his or her back,2649
2385,00377205,n,9,a kick used in the sidestroke; legs are brought together in a scissoring motion,2649
2371,00375073,n,9,the act of swinging a golf club at a golf ball and (usually) hitting it,2871
2364,00373866,n,9,a swimming stroke; arms are moved alternately overhead accompanied by a flutter kick,2649
2372,00375330,n,9,a swing downward of a golf club,2871
2373,00375417,n,9,a golf shot that curves to the right for a right-handed golfer,2871
2374,00375538,n,9,a golf shot that curves to the left for a right-handed golfer,2871
2376,00375802,n,9,hitting a golf ball on the putting surface with a putter,2871
2382,00376710,n,9,a swimming kick; the legs are moved rapidly up and down without bending the knees,2649
2379,00376324,n,9,a low running approach shot,2871
2377,00375919,n,9,a form of golf in which you putt from positions arranged on the circumference of a circle around the hole,"2633,2871"
2380,00376414,n,9,a high approach shot in golf,2871
2381,00376507,n,9,a movement of the legs in swimming,2649
2386,00377363,n,9,a swimming kick used while treading water,2649
2383,00376888,n,9,a swimming kick; knees are drawn upward and outward so the legs can be brought together when fully extended,2649
2384,00377070,n,9,a swimming kick; an up and down kick of the feet together,2649
2394,00379237,n,9,"performance of moral or religious acts: ""salvation by deeds"" or ""the reward for good works""",1565
2366,00374165,n,9,a swimming stroke in which the arms move forward and backward while the legs do a scissors kick,2649
2387,00377476,n,9,a stroke that keeps the head above water by thrashing the legs and arms,2649
2396,00379558,n,9,washing clothes and bed linens,2353
2389,00377835,n,9,"activity directed toward making or doing something: ""she checked several points needing further work""",
2390,00378419,n,9,"a damaging piece of work: ""dry rot did the job of destroying the barn""; ""the barber did a real job on my hair""",
2391,00378579,n,9,"an act or process or manner of functioning or operating: ""the power of its engine determines its operation"": ""the plane's performance in high winds""",
2392,00378829,n,9,"the performance of a piece of work: ""she did an outstanding job as Ophelia""; ""he gave it up as a bad job""",
2393,00378984,n,9,"a process or series of acts especially of a practical or mechanical nature involved in a particular form of work: ""the operations in building a house""; ""certain machine tool operations""",
2370,00374908,n,9,"in baseball; a batter's attempt to hit a pitched ball; ""he took a vicious cut at the ball""",2638
2395,00379388,n,9,"work done by one person or group that benefits another: ""budget separately for goods and services""",
2397,00379645,n,9,"the work of making something shine by polishing it: ""he performed the menial chore of shining shoes""",
2368,00374542,n,9,a swimming stroke; the arms are extended together in front of the head and swept back on either side accompanied by a frog kick,2649
2398,00379811,n,9,"the service provided by a utility company: ""the cost of utilities never decreases""",
2375,00375657,n,9,"hitting a golf ball off of a tee with a driver: ""he sliced his drive out of bounds""",2871
2399,00379947,n,9,(common law) the acts performed by an English feudal tenant for the benefit of his lord which formed the consideration for the property granted to him,"1802,2768"
2362,00373398,n,9,any one of the repeated movements of the limbs and body used for locomotion in swimming or rowing,2649
2404,00380642,n,9,the work of cleaning and running a house,2353
2402,00380452,n,9,land tenure by service to the lord as a knight,"1802,2768"
2403,00380561,n,9,the work of a housewife,
2407,00380970,n,9,the number of cases handled in a given period of time (as by a court or agency),1802
2405,00380753,n,9,the work of ironing washed clothes,
2406,00380841,n,9,work that a person is expected to do in a specified time,
