71460,00860261,v,9,"coat with stucco, as of a ceiling",2415
71446,00858322,v,9,cut a nick into,
71448,00858574,v,9,"carve with a chisel: ""chisel the marble""","1787,2415"
71449,00858686,v,9,"break a small piece off from: ""chip the glass""; ""chip a tooth""",
71450,00858865,v,9,"break off; of a piece from a whole: ""Her tooth chipped""",
71451,00859073,v,9,"come off in flakes or thin small pieces: ""The paint in my house is peeling off""",
71453,00859341,v,9,"form by chipping: ""They chipped their names in the stone""",
71452,00859245,v,9,come off in a very thin piece,
71454,00859460,v,9,"strike with an axe; cut down, strike: ""hew and oak""",
71456,00859683,v,9,"make or shape as with an axe: ""hew out a pth in the rock""",
71455,00859608,v,9,hew jaggedly,
71457,00859829,v,9,"hew roughly, without finishing the surface: ""rough-hew stone or timber""",
71458,00859979,v,9,"remove from the surface: ""skim cream from the surface of milk""",
71461,00860358,v,9,"coat with beaten egg: ""egg a schnitzel""",
71459,00860170,v,9,coat with a layer; of liquids,
71464,00860715,v,9,"cover with flour, as of fish or meat, in cooking",1957
71463,00860557,v,9,"cover before cooking: ""dredge the chicken in flour before frying it""",
71462,00860458,v,9,cover or coat with a crust,
71465,00860834,v,9,"make or form a layer: ""layer the different colored sands""",
71474,00861951,v,9,remove the bark of a tree,2172
71466,00860970,v,9,"form a coat over: ""Dirt had coated her face""",
71468,00861159,v,9,"remove the edges from: ""trim the picture""",
71467,00861083,v,9,coat with soot,
71472,00861664,v,9,"remove the surface from: ""strip wood""",
71469,00861277,v,9,"strip the skin off (fruit, for example)",
71470,00861436,v,9,peel off the outer layer of something,
71471,00861557,v,9,"remove the surface, in scales or laminae",
71473,00861844,v,9,"strip the cured leaves from: ""strip tobacco""",
71477,00862261,v,9,"remove the scales from: ""scale fish""",
71475,00862053,v,9,cover with bark,
71478,00862378,v,9,"put a coat on; cover the surface of; furnish with a surface: ""coat the cake with cholocate""",
71479,00863143,v,9,"give a new surface: ""refinish the dining room furniture""",
71480,00863265,v,9,"apply with a brush: ""Brush butter on the roast""",
71483,00863572,v,9,"coat with bread crumbs: ""crumb a cutlet""",
71481,00863378,v,9,coat with a patina,
71482,00863481,v,9,cover with a new surface,
71486,00863917,v,9,"put a finish on: ""dress the surface smooth""",
71484,00863675,v,9,coat with a layer of copper,
71485,00863766,v,9,"provide with a finish, as of furniture, for example",
71445,00858217,v,9,"cut lumber, as in woods and forests",2172
71487,00864023,v,9,finish with a broom,
71488,00864105,v,9,coat steel with corrosion-prevention coat,
71489,00864213,v,9,"coat with blacktop, as of a driveway",
71490,00864315,v,9,coat or back with metal foil; of surfaces such as glass,
71491,00864435,v,9,"cover with zinc; as of steel, for example",
71492,00864543,v,9,of roads,"1946,2415"
71493,00864685,v,9,pave with cobblestones,"1946,2415"
71431,00856275,v,9,"cut to pieces: ""Father carved the ham""",
71495,00864890,v,9,pave a road with cobblestones or pebbles,"1946,2415"
71496,00864996,v,9,"cover with tar or asphalt, of roads","1946,2415"
71499,00865289,v,9,cover with wallpaper,2415
71498,00865195,v,9,cover with soap,
71504,00865827,v,9,cover with varnish,2415
71501,00865480,v,9,"cover with oil, as if by rubbing: ""oil the wooden surface""",
71502,00865599,v,9,"cover with wax: ""wax the car""",
71503,00865707,v,9,"cover with beeswax: ""Chris beeswaxed the kitchen table""",
71540,00870232,v,9,"puncture the skin, as, for example, in some African cultures; for ritual purposes",1675
71511,00866610,v,9,"cover with calcimine, of walls",2415
71505,00865953,v,9,"cover with veneer, as of furniture",
71506,00866051,v,9,lubricate with grease,
71507,00866136,v,9,"coat with a glaze, as of pottery, for example",
71515,00867018,v,9,"cover with shellac, as of wooden objects: ""She wanted to shellac the desk to protect it from water spots""",2415
71509,00866366,v,9,cover with whitewash; as of walls,
71510,00866484,v,9,"apply a thin coating of paint, metal, etc., to",
71527,00868622,v,9,"join tongue and groove, in carpentry",1787
71512,00866707,v,9,wash with water,
71513,00866790,v,9,clean with some chemical process,
71516,00867188,v,9,"cover the interior of, as of garments: :lined gloves""",
71518,00867480,v,9,"cover the front or surface of: ""The building was faced with beautiful stones""",
71517,00867391,v,9,provide with a new lining,
71519,00867637,v,9,"provide with a new facing: ""The building was refaced with beautiful stones""",
71528,00868723,v,9,"to mark, or produce an imprint in or on something: ""a man whose name is permanently stamped on our maps,""",
71520,00867776,v,9,"line near the edge with a different material, as of a garment",
71521,00867917,v,9,"put a new facing on, as of a garment",
71522,00868017,v,9,"line with beams or planks, as of construction holes",
71523,00868130,v,9,line with a Babbitt metal,
71524,00868220,v,9,"coat with tar, as of roofs",
71526,00868523,v,9,cover or fit with feathers,
71532,00869231,v,9,"stamp with a rubber-stamp, usually an indication of official approval on a document",1820
71534,00869515,v,9,"stamp with a meter indicating the postage: ""meter the mail""",
71529,00868953,v,9,mark with stripes,
71530,00869042,v,9,produce specks in or on,
71531,00869128,v,9,"mark with, or as if with, spots",
71535,00869645,v,9,stamp with a postmark to indicate date and time of mailing,1934
71533,00869395,v,9,"affix a stamp to, as of letters",
71537,00869864,v,9,"cut the foreskin off male babies or teenage boys: ""During the bris, the baby boy is circumcised""",
71538,00870046,v,9,cut the skin over the clitoris,2232
71536,00869777,v,9,strike from the side,
71541,00870386,v,9,"pierce with a pointed object; make a hole into: ""puncture a tire""",
71548,00871284,v,9,"score a line on with a pointed instrument, as in metalworking",2279
71539,00870144,v,9,strip the skin off,
71542,00870543,v,9,"make by piercing: ""puncture a hole""",
71543,00870644,v,9,"pierce many times: ""The bullets riddled his body""",
71546,00870970,v,9,"scratch the surface of: ""scarify seeds""",
71544,00870765,v,9,"break up, of soil",
71545,00870847,v,9,make less dense,
71547,00871074,v,9,"make small marks into the surface of: ""score the clay before firing it""",
71549,00871417,v,9,"mark with lines: ""sorrow had lined his face""",
71508,00866262,v,9,coat with lacquer; as of wooden objects,2415
71550,00871542,v,9,"mark with or consist of a pattern of crossed lines: ""wrinkles crisscrossed her face""",
71551,00871694,v,9,"cut or make a notch into: ""notch the rope""",
71553,00871942,v,9,"make a recess in: ""recess the piece of wood""",
71552,00871843,v,9,notch the edge of,
71554,00872050,v,9,"hollow out in the form of a furrow or groove: ""furrow soil""",
71497,00865102,v,9,"spread butter on, as of bread",1957
71500,00865384,v,9,"cover with paper: ""paper the box""",
71557,00872449,v,9,"bend or lay so that one part covers the other: ""fold up the newspaper""",
71558,00872771,v,9,"make wrinkles or creases into a smooth surface: ""The dress got wrinkled""",
71561,00873362,v,9,"fold or collapse: ""His knees buckled""",
71560,00873266,v,9,become puckered,
71562,00873481,v,9,"gather or contract into wrinkles or folds; pucker: ""purse ones's lips""",
71563,00873632,v,9,"make smaller: ""The garment contracted in the dryer""; ""The heat contracted the woollen garment""",
71566,00874035,v,9,"cause to assume a crooked or angular form: ""bend the rod""",
71564,00873818,v,9,make a dent into,
71565,00873931,v,9,"cut into sections, as for authentication",
71567,00874277,v,9,"twist into a state of deformity: ""The wind has gnarled this old tree""",
71568,00874409,v,9,bend into the shape of a crank,
71569,00874502,v,9,"free from flexure, as of a bow",
71570,00874614,v,9,"curl, wind, or twist together",
71571,00874737,v,9,make gouges into a surface,
71572,00874838,v,9,"cut out material such as wood, etc., so as to make as certain shape",
71573,00875006,v,9,cut a rabbet in something,
71578,00875507,v,9,"draw in as if by suction: ""suck in tyour cheeks and stomach""",
71575,00875230,v,9,make a groove in,
71576,00875333,v,9,form scallops in,
71577,00875424,v,9,make holes in,
71579,00875642,v,9,"hollow out with a scoop: ""scoop out a melon""",
71580,00875761,v,9,"dig with the snout: ""the pig was rooting for truffles""",
71581,00875893,v,9,"remove the interior of: ""hollow out a tree trunk""",
71583,00876309,v,9,"hollow out as if making a cave or opening: ""The river was caving the banks""",
71582,00876200,v,9,hollow out as if making a cavern,
71584,00876484,v,9,"arrange or fold as a cover or protection: ""wrap the baby before taking her out""; ""Wrap the present""",
71585,00876797,v,9,"wrap for decorative purposes: ""The gift was done up in pretty red paper""",
71590,00877349,v,9,"remove the outer cover or wrapping of: ""Let's unwrap the gifts!""",
71586,00876932,v,9,make into a parcel,
71587,00877014,v,9,"wrap us in a cerecloth, as of a corpse",
71588,00877122,v,9,wrap something tightly with heated plastic that shrinks upon cooling,
71589,00877258,v,9,wrap a gift attractively,
71591,00877495,v,9,"undo the ties of: ""They untied the prisoner""",
71593,00877790,v,9,"tie again or anew: ""retie the string and make it si strong enough now""",
71592,00877699,v,9,loosen the ties of,
71594,00877947,v,9,"To fasten or secure with a rope, string, or cord: ""They tied their victim to the chair""",
71596,00878511,v,9,"connect or secure to: ""They rigged the bomb to the ignition""",
71595,00878404,v,9,in knitting: finish the last row,
71599,00878821,v,9,"secure with a bitt: ""bitt the ship line""",
71597,00878632,v,9,fasten with a loop,
71598,00878712,v,9,"tie up with chains, as of prisoners",
71602,00879090,v,9,"secure with or as if with ropes: ""tie down the prisoners""",
71600,00878923,v,9,bind or tie with a cord,
71601,00879008,v,9,fasten with a latch,
71603,00879299,v,9,"bind together with a cord or rope: ""Lash together these barrels!""",
71611,00880238,v,9,"fasten or secure with chains: ""Chain the chairs together""",
71604,00879443,v,9,fasten with or as if with a garter,
71574,00875095,v,9,"force with the thumb: ""gouge out his eyes""",1781
71606,00879651,v,9,tie together somebody's feet,
71607,00879744,v,9,restrain with fetters,
71609,00880063,v,9,restrain or bind with chains,
71610,00880156,v,9,make free,
71613,00880505,v,9,"fasten with a cable: ""cable trees""",
71612,00880392,v,9,remove the chains from,
71614,00880610,v,9,"fasten with a picket: ""picket the goat",
71605,00879541,v,9,tie the wings and legs of a bird before cooking,1957
71615,00880720,v,9,fasten with a rope,
71556,00872313,v,9,"make wrinkled or creased: ""furrow one's brow""",
71618,00881175,v,9,remove the strap or straps from,
71620,00881419,v,9,"attach to: ""They fastened various nicknames to each other""",
71624,00881999,v,9,"make contact or come together: ""The two roads join here""",
71621,00881541,v,9,be attached; be in contact with,
71622,00881672,v,9,become attached,
71623,00881875,v,9,come off due to an explosion or other strong force,
71626,00882513,v,9,"unite or bring into contact or bring together the edges of: ""close the circuit""; ""close a wound""",
71625,00882421,v,9,fit together in a miter joint,
71630,00883027,v,9,"bring two objects, ideas, or people together: ""This fact is coupled to the other one""",
71627,00882672,v,9,"join by anastomosis, as of blood vessels",
71629,00882927,v,9,"connect to the earth, as of a circuit",2107
71655,00886799,v,9,"attach a suffix to: ""suffix words""",1969
71631,00883249,v,9,provide with an unsuitable mate,
71632,00883345,v,9,join by a tenon and mortise,
71633,00883447,v,9,cut a mortise in,
71634,00883538,v,9,join pieces of wood with cogs,
71635,00883628,v,9,match badly; match two objects or people that do not go together,
71636,00883766,v,9,become disconnected or disjoint,
71637,00883915,v,9,make disjoint,
71638,00884048,v,9,"separate at the joints, as of a chicken",
71639,00884169,v,9,join so that the external surfaces blend smoothly,
71640,00884280,v,9,unite by a scarf joint,
71642,00884500,v,9,"join with a rebate, as of pieces of timber or stone",
71643,00884615,v,9,cause to become joined or linked,
71644,00885092,v,9,join with a rabbet joint,
71645,00885180,v,9,join with a seam,
71657,00887114,v,9,attach a morpheme into a stem word,1969
71650,00886234,v,9,"attach a bell to: ""bell cows""",
71648,00885494,v,9,cause to be attached,
71649,00886152,v,9,attach with a hinge,
71651,00886325,v,9,"attach a ring to: ""ring birds""",
71653,00886536,v,9,"disconnect or separate: ""uncouple the hounds""",
71652,00886417,v,9,link together,
71647,00885392,v,9,"make a bridge across: ""bridge a river""",2415
71656,00886923,v,9,attach or become attached to a stem word; of grammatical morphemes,1969
71658,00887219,v,9,"cause to become detached or separated; take off: ""detach the skin from the chicken before you eat it""",
71668,00888648,v,9,"put a bridle on: ""bridle horses""",2188
71669,00888762,v,9,"fit or restrain with a snaffle, as of horses",2188
71659,00887464,v,9,"break a piece from a whole: ""break a branch from a tree""",
71660,00887606,v,9,"remove by or as if by cutting: ""cut off the ear""; ""lop off the dead branch""",
71662,00887884,v,9,"come to be detached: ""His retina detached and he had to be rushed into surgery""",
71661,00887793,v,9,remove the soldering from,
71663,00888148,v,9,"come off: ""This button had fallen off""",
71665,00888339,v,9,wrap in swaddling clothes; of infants,1898
71664,00888252,v,9,tie or fasten into a knot,
71646,00885284,v,9,"join with a suture, as of a wound in surgery",2259
71666,00888458,v,9,wrap in a shroud; of corpses,
71667,00888558,v,9,bind the arms of,
71670,00888871,v,9,"keep to the curb: ""curb your dogs""",
71654,00886673,v,9,"attach a prefix to: ""prefixed words""",1969
71672,00889128,v,9,"impede the motion of, as with a chain or a burden: ""horses were clogged until they were tamed""",
71671,00888967,v,9,hold back,
71677,00890160,v,9,"tie a cinch around: ""cinch horses""",
71674,00889809,v,9,"confine to a small space, such as a cabin",
71675,00889913,v,9,"confine to a small space, as for intensive work",
71676,00890032,v,9,bind with something round or circular,
71628,00882780,v,9,"connect to a ground, of electrical connections for safety reasons",2107
71619,00881313,v,9,"tie with a tether: ""tether horses""",
71680,00890617,v,9,wrap around with something so as to cover or enclose,
71681,00890741,v,9,"bind with a rope, chain, or cord: ""lash the horse""",2188
71691,00891971,v,9,"secure with cables or ropes: ""moor the boat""",1946
71684,00891110,v,9,"make fast as if with cement: ""We cemented our friendship""",
71685,00891231,v,9,"untie or unfasten: ""unbind the feet of this poor woman""",
71688,00891564,v,9,"secure on a cleat: ""cleat a line""",
71686,00891376,v,9,"bind or tie together, as with a band",
71687,00891482,v,9,secure with a cramp,
71689,00891660,v,9,"secure a vessel with an anchor: ""We anchored at Baltimore""",
71690,00891834,v,9,"fix firmly and stably: ""anchor the lamppost in concrete""",
71693,00892186,v,9,"haul into a dock: ""dock the ships""",1946
71692,00892077,v,9,secure in or as if in a berth; of ships,1946
71695,00892410,v,9,"take out of a dock: ""undock the ship""",1946
71698,00892725,v,9,furnish with battens; of ships,1946
71704,00893495,v,9,level to the right gradient,2415
71697,00892610,v,9,"secure with battens: ""batten down a ship's hatches""",
71696,00892529,v,9,secure with spikes,
71701,00893075,v,9,"gather with a rake: ""rake leaves""",
71703,00893328,v,9,"make level or straight: ""level the ground""",2415
71699,00892842,v,9,claw with the nails,
71700,00892930,v,9,"scratch, scrape, pull, or dig with claws or nails",
71702,00893224,v,9,"level or smooth with a rake: ""rake gravel""",
71694,00892319,v,9,haul a ship into a drydock,1946
71707,00893840,v,9,"smooth with a strickle: ""strickle the grain in the measure""",
71706,00893728,v,9,"reduce the level of land, as by erosion",2119
71705,00893603,v,9,build up to a level by depositing sediment,"2119,2415"
71710,00894252,v,9,put a telephone receiver back in its cradle,1939
71708,00893983,v,9,scratch repeatedly,
71709,00894115,v,9,put something back where it belongs,
71718,00895553,v,9,remove the inner part or the core of,2415
71711,00894368,v,9,cut the surface of; wear away the surface of,
71713,00894764,v,9,"turn up, loosen, or remove earth: ""Dig we must""",
71714,00895081,v,9,"wear or cut gutters into: ""The heavy rain guttered the soil""",
71715,00895205,v,9,"dig (up) with a spade; ""I spade compost into the flower beds""",
71720,00895827,v,9,"create by digging, of cavities: ""dig a hole""",
71716,00895355,v,9,"spade into alternate ridges and troughs, of soil",
71717,00895466,v,9,excavate the earth beneath,
71719,00895732,v,9,"excavate horizontally, in mining","1787,2279,2415"
71734,00897818,v,9,"of roots and tree stumps, for example",2172
71721,00896022,v,9,"take out of the ground, of root crops: ""lift potatoes""","2314,2876"
71735,00897931,v,9,"dig out with the snout, of animals",2188
71722,00896138,v,9,dig a trench,
71723,00896214,v,9,"dig a trench in: ""trench a hill""",2415
71725,00896435,v,9,"make a hole with a dibble or as if with a dibble: ""dibble the ground""",
71730,00897166,v,9,"apply to a surface: ""daub the wall with paint""",
71726,00896568,v,9,dig out from underneath earth or snow,
71727,00896678,v,9,take out or up with or as if with a scoop,
71729,00897047,v,9,use a trowel on; for light garden work or plaster work,
71731,00897274,v,9,"wet with a spurt of liquid: ""spurt the wall with water""",
71733,00897525,v,9,"find by digging in the ground: ""I dug up an old box in the garden""; ""The archaeologists digging up the battlefield turned up a lot of old helmets""",
71732,00897419,v,9,squirt or spray (a liquid) quickly,
71736,00898029,v,9,"feel searchingly: ""She groped for his keys in the dark""",
71724,00896310,v,9,"cut a drainage tench in: ""ditch the land to drain it""",2415
71737,00898162,v,9,search for on the computer,1355
71682,00890889,v,9,"make secure by lashing: ""frap a sail""",2188
71712,00894577,v,9,"bruise, cut, or injure the skin or the surface of: ""The boy skinned his knee when he fell""",1781
71796,00907105,v,9,fasten by sewing; do needlework,
71683,00890988,v,9,"untie the lashing of: ""unlash the horse""",2188
71739,00898444,v,9,"search by divining, as if with a rod, of underground water or metals",
71740,00898584,v,9,"look around casually and randomly, as through files and directories on a computer",
71743,00899316,v,9,"hunt or look for; want for a particular reason: ""Your former neighbor is wanted by the FBI""; ""Uncle Sam wants you""",
71744,00899510,v,9,"examine minutely: ""The police scoured the country for the fugitive""",
71746,00899749,v,9,"go in search of or hunt for: ""pursue a hobby""",
71745,00899640,v,9,look for a specific person or thing,
71747,00899903,v,9,"subject to a search: ""The police searched the suspect""; ""We searched the whole house for the missing keys""",
71748,00900153,v,9,"make a wide, sweeping search of: ""The beams scanned the night sky""",
71750,00900489,v,9,"search haphazardly: ""We rummaged through the drawers""",
71751,00900615,v,9,"search thoroughly: ""They combed the area for the missing child""",
71753,00900840,v,9,"seek indirectly: ""fish for compliments""",
71752,00900750,v,9,search for plunder,
71754,00900949,v,9,"search busily: ""ferret out the truth""",
71755,00901083,v,9,"cut with a blade or mower: ""mow the grass""",
71756,00901223,v,9,"fell by sawing; hew: ""The Vietnamese cut a lot of timber while they occupied Cambodia""",
71759,00901593,v,9,"reap or harvest: ""cut grain""",
71757,00901370,v,9,"cut with a scythe, as of grass or grain",
71758,00901473,v,9,"gather, as of as crops",
71773,00903354,v,9,"kill with poison: ""She poisoned her husband""",1781
71761,00901782,v,9,"convert into a pollard, as of trees","2172,2314,2876"
71763,00901990,v,9,"cut back the growth of, of bushes and trees","2172,2314,2876"
71762,00901889,v,9,cut or cut through with shears,
71765,00902355,v,9,thin out buds to improve the quality of the remaining flowers,"2172,2314,2876"
71769,00902827,v,9,"cut open: ""she slashed her wrists""",
71766,00902480,v,9,remove the stalk of fruits or berries,"2172,2314,2876"
71785,00905433,v,9,"kill gently, as with an injection, as of pet animals",1781
71767,00902579,v,9,"write upon; engrave a pen, for example",
71768,00902727,v,9,engrave or inscribe characters on,
71774,00903462,v,9,"kill by throwing stones at: ""Adulters should be stoned according to the Koran""",1781
71770,00902939,v,9,cut with sweeping strokes; as with an ax or machete,
71771,00903064,v,9,"kill; used of animals, but also used for people to indicate brutality","1781,2188"
71772,00903254,v,9,cut through the backbone of an animal,"1781,2188"
71760,00901682,v,9,"cut with shears, as of hedges","2172,2314,2876"
71786,00905566,v,9,"get rid of; kill: ""The mafia liquidated the informer""",1781
71764,00902229,v,9,"cut the top off: ""top trees and bushes""","2172,2314,2876"
71777,00904451,v,9,"deprive of life: ""AIDS has killed thousands in Africa""",
71779,00904787,v,9,"prove fatal: ""The disease took off""",1781
71780,00904888,v,9,kill with a tomahawk,1781
71782,00905119,v,9,kill with a saber,1781
71781,00904974,v,9,"as of animals: ""The customs agents destroyed the dog that was found to be rabid""",1781
71776,00903723,v,9,"cause to die; put to death: ""This man has killed several people when he tried to rob a bank""",1781
71783,00905207,v,9,"kill by lying on: ""The sow overlay her piglets""",1781
71787,00905714,v,9,"kill en masse; kill on a large scale; kill many: ""Hitler wanted to exterminate the Jews, Gypsies, Communists, and homosexuals of Europe""",1781
71775,00903614,v,9,"kill by its poison: ""This mushrooms can kill""",1781
71784,00905337,v,9,kill by smashing someone's skull,1781
71788,00905930,v,9,"to hook or entangle: ""One foot caught in the stirrup""",
71789,00906108,v,9,"cause to become accidentally or suddenly caught, ensnared, or entangled: ""I caught the hem of my dress in the brambles""",
71792,00906566,v,9,"fix to; attach: ""append a charm to the necklace""",
71790,00906308,v,9,catch on a snag,
71791,00906393,v,9,unfasten or release from or as if from a hitch,
71793,00906733,v,9,"add to the very end: ""He appended a glossary to his novel where he used an invented language""",
71778,00904575,v,9,"kill or destroy: ""The animals were sacrificed after the experiment""; ""The general had to sacrifice several soldiers to save the regiment""",1781
71742,00899225,v,9,"cover with felt: ""felt a cap""",
71798,00907584,v,9,undo (the stitches) of (a piece of sewing),
71844,00914321,v,9,"cover with tiles, of surfaces in a dwelling: ""tile the wall and the floor of the bathroom""",2415
71800,00907822,v,9,sew over the edge of; with long slanting wide stitches,
71801,00907960,v,9,sew (two edges) with close stitches that pass over them both,
71802,00908085,v,9,do backstitches,
71803,00908176,v,9,"repair by sewing, esp. of socks",
71804,00908287,v,9,draw fabric together and sew it tightly,
71809,00908801,v,9,"sew together loosely, with large stitches: ""baste a hem""",
71806,00908508,v,9,prick with a needle; in sewing or embroidering,
71807,00908618,v,9,sew together very finely,
71808,00908708,v,9,sew a seam by folding the edges,
71810,00908928,v,9,"sew with hemstitches: ""hemstitch a sleeve""",
71811,00909045,v,9,"sew, as of mattresses: ""tick a mattress""",
71812,00909156,v,9,"fasten or attach with tape: ""tape the shipping label to the box""",
71814,00909410,v,9,"glue with epoxy: ""epoxy the shards""",
71813,00909290,v,9,join or attach with glue,
71815,00909508,v,9,"cover the surface of: ""paste the wall with burlap""",
71817,00911263,v,9,"cover as for protection against noise or smell: ""She held her ears when the jackhammer started to operate""; ""hold one's nose""",
71818,00911450,v,9,"provide with a thermally non-conducting cover; ""The tubing needs to be jacketed""",
71827,00912398,v,9,"cover with planks, as of a wall or a floor: ""The streets were planked""",
71819,00911594,v,9,cover with foil,
71820,00911679,v,9,"provide with a coating, as of chocolates",
71821,00911783,v,9,"cover up with white-out, as of a typo",
71822,00911887,v,9,"protect by covering with a thin sheet of metal, as of parts of roofs",
71823,00912018,v,9,cover with a pall,
71824,00912105,v,9,cover with sod,
71825,00912180,v,9,"provide with a binding, as of books",
71826,00912295,v,9,"provide with a new binding, as of books",
71830,00912738,v,9,"cover anew: ""recover a chair""",
71828,00912544,v,9,"cover with canvas, as of rope",
71829,00912637,v,9,cover with flakes or as if with flakes,
71831,00912832,v,9,"put something on top of something else: ""cover the meat with a lot of gravy""",
71833,00913218,v,9,"cover with a hood: ""The bandits were hooded""",
71841,00914003,v,9,"put a crown on: ""crown my teeth""",
71834,00913332,v,9,cover with a cowl,
71835,00913419,v,9,cover with clapboards,
71836,00913515,v,9,cover with a canopy,
71837,00913606,v,9,"cover with bread crumbs, as of pork chops",
71845,00914491,v,9,"tile with tesserae, as of a floor",2415
71839,00913798,v,9,cover the eyes of someone to prevent him from seeing,
71840,00913917,v,9,cover with aluminum,
71838,00913710,v,9,put blinders on a horse,2188
