73228,01127377,v,9,make perfect; bring to perfection,
73229,01127488,v,9,of marriages,
73232,01128045,v,9,"bring something new to an environment: ""A new word processor was introduced""",
73231,01127947,v,9,of conversations or friendships,
73235,01128460,v,9,"cause to happen or occur: ""The scientists set up a shockwave""",
73233,01128253,v,9,introduce gradually,
73234,01128356,v,9,terminate gradually,
73237,01128898,v,9,"engage in drawing: ""He spent the day drawing in the garden""",2479
73223,01126333,v,9,"create by artistic means: ""create a poem; ""Schoenberg created twelve-tone music""; ""Picasso created Cubism""; ""Auden made verses""",2425
73238,01129019,v,9,"actuate: ""trigger a reaction""",
73239,01129223,v,9,"cause to arise: ""induce a crisis""",
73240,01129339,v,9,"cause to appear: ""bring on the birthday cake""",
73241,01129440,v,9,"bring about abruptly: ""The crisis precipitated by Russia's revolution""",
73246,01130115,v,9,"open up an area or prepare a way: ""She pioneered a graduate program for women students""",
73242,01129587,v,9,"of bodily processes such as fever, illness, etc.",
73243,01129735,v,9,make real or concrete; give reality to,
73244,01129869,v,9,make concrete and real,
73245,01129984,v,9,make immaterial; remove the real essence of,
73247,01130277,v,9,"give rise to; cause to happen or occur, not always intentionally: ""cause a commotion""; ""make a stir""; ""cause an accident""",
73248,01130643,v,9,"compel or make somebody or something to act in a certain way: ""People cannot be made to integrate just by passing a law!""; Heat makes you sweat""",
73249,01130867,v,9,"compel somebody to do something, often against his own will or judgment: ""She finally drove him to change jobs""",
73251,01131141,v,9,"supply the inspiration for: ""The article about the artist inspired the exhibition of his recent work""",
73250,01131041,v,9,give occasion to,
73252,01131307,v,9,"call forth: ""Her behavior provoked a quarrel between the couple""",
73253,01131493,v,9,"provoke: ""pick a fight or a quarrel""",
73254,01131591,v,9,"set up or lay the groundwork for: ""establish a new department""",
73255,01131797,v,9,"set or place definitely: ""Let's fix the date for the party!""",
73256,01131926,v,9,"bring about: ""The trompe l'oeil-illusion establishes depth""",
73258,01132230,v,9,"make arrangements for: ""Arrange a party for the newly-weds""",
73257,01132085,v,9,"plan, organize, and carry out (an event)",
73261,01132564,v,9,"arrange in phases or stages: ""phase a withdrawal""",
73259,01132372,v,9,make detailed arrangements or preparations,
73266,01133198,v,9,"play incorrectly, e.g., play a wrong note",2536
73267,01133312,v,9,"of performances: ""They turned in a splendid effort""",
73262,01132676,v,9,call forth,
73263,01132776,v,9,put up,
73265,01133093,v,9,"rerun a performance of a play, for example",
73271,01133993,v,9,"start playing, as of musicians",2536
73268,01133437,v,9,"give an incentive: ""This moved me to sacrifice my career""",
73270,01133757,v,9,"get off the ground: ""Who started this company?"" ""We embarked on an exciting enterprise""",
73269,01133626,v,9,urge or force (a person) to an action; constrain or motivate,
73224,01126603,v,9,"create the design for; create or execute in an artistic or highly skilled manner: ""Chanel designed the famous suit""",2425
73236,01128737,v,9,"in baseball: earn or achieve a base by being walked by the pitcher; ""He drew a base on balls""",2871
73272,01134102,v,9,enter upon an activity or enterprise,
73273,01134235,v,9,arrange by systematic planning and united effort,
100684,N0000027,n,10,,
73277,01134978,v,9,"yield crops, of land: ""This land crops well""","2314,2876"
73276,01134906,v,9,bear seeds,"2314,2876"
73284,01136262,v,9,"make into a raft: ""raft these logs""",1787
73278,01135084,v,9,bear too much,"2314,2876"
73280,01135260,v,9,cause to bear fruit,2172
73288,01137013,v,9,build of or with wattle,2415
73281,01135342,v,9,make from scratch,
73290,01137221,v,9,"build again: ""The house was rebuild after it was hit by a bomb""",2415
73292,01137478,v,9,construct such that only one end is fixed; as of girders and beams,2415
73285,01136359,v,9,make a copy of with the intent to deceive,
73287,01136879,v,9,"build or establish something abstract: ""build a reputation""",
73294,01137704,v,9,"make by putting pieces together: ""She pieced a quilt""",1787
73289,01137100,v,9,construct by fitting or uniting parts together,2415
73293,01137612,v,9,destroy completely,2415
73279,01135163,v,9,"bear fruit, as of trees and plants","2172,2314,2876"
73291,01137371,v,9,"build with groins: ""The ceiling was groined""",2415
73299,01138569,v,9,take apart into its constituent pieces,2415
73295,01138007,v,9,"assemble without order or sense: ""She jumbles the words when she is supposed to write a sentence""",
73300,01138744,v,9,"make out of components; often in an improvising manner: ""She made a tent out of a sheet and a few sticks""",
73296,01138223,v,9,"assemble once again, after taking something apart",
73297,01138340,v,9,"set up for a particular purpose, as of a plane for a combat mission",
73298,01138474,v,9,create by mixing or combining,
73307,01140101,v,9,"form into a mound, as of earth",2119
73301,01138976,v,9,"make by tying pieces together: ""The fishermen tied their flies""",
73302,01139100,v,9,"cast or model anew: ""She had to recast her image to please the electorate in her home state""",
73304,01139389,v,9,"make something by hand: ""We handcraft all our paper""",
73303,01139276,v,9,make by hand and with much skill,
73306,01139594,v,9,"make something, usually for a specific function: ""She molded the riceballs carefully""; ""Form the dough into cylinders""",
73305,01139508,v,9,make barrels and casks,
73317,01141322,v,9,"tear down so as to make flat with the ground: ""The building was levelled""",2415
73308,01140212,v,9,form a mound over,2119
73319,01141775,v,9,bring into a condition of decay or partial ruin by neglect or misuse,2415
73309,01140305,v,9,form into a hill,
73310,01140383,v,9,shape roughly,
73311,01140463,v,9,shape again or shape differently,
73312,01140569,v,9,"of candles; by dipping the wick into hot, liquid wax",
73313,01140682,v,9,used of powdery metals or ores; to cause to become a coherent mass by heating without melting,
73315,01140995,v,9,"begin, or enable someone else to begin, a venture by providing the means, logistics, etc: ""set up an election""",
73316,01141178,v,9,"erect or construct, esp. as a temporary measure; ""Can he rig up a P.A. system?""",
73286,01136484,v,9,"make by combining materials and parts: ""this little pig made his house out of straw""; ""Some eccentric constructed an electric brassiere warmer""",2415
73326,01142646,v,9,"prepare with dry heat in an oven: ""bake a cake""",1957
73322,01142203,v,9,"cast again: ""The bell cracked and had to be recast""",
73318,01141564,v,9,"destroy completely, as if down to the roots: ""the vestiges of political democracy were soon uprooted""",2415
73320,01141919,v,9,"press from a plastic, as of records",
73321,01142037,v,9,make by pouring into a cast or mold,
73329,01143244,v,9,"put on the stove or ready for cooking: ""put on the tea, please!""",1957
73323,01142337,v,9,pour molten metal into a mold of sand,
73324,01142441,v,9,make on a potter's wheel; of pottery,
73325,01142540,v,9,make without a wheel; of pottery,
73327,01142763,v,9,prepare by brewing; of alcoholic beverages,1957
73314,01140839,v,9,"construct, build, or erect: ""Raise a barn""",2415
73282,01135771,v,9,"put together out of components or parts: ""Ford makes cars""; ""They manufacture small toys""",1787
100685,N0000441,n,10,,
73275,01134616,v,9,"bring forth, ""The apple tree bore delicious apples this year""; ""The unidentified plant bore gorgeous flowers""","2314,2876"
73338,01144398,v,9,"style and tailor in a certain fashion: ""cut a dress""; ""style a wedding dress""",2425
73331,01143492,v,9,"coat or stuff with a spicy paste: ""devilled eggs""",1957
73379,01149277,v,9,weave a design into (textiles),1787
73337,01144285,v,9,"make by sewing together quickly: ""run up a skirt""",
73336,01144127,v,9,create with cloth; of textiles,
73339,01144571,v,9,make stylish; in fashion or hairdressing,2875
73340,01144692,v,9,"make an alteration to: ""This dress needs to be altered""",
73342,01144937,v,9,stitch or sew together; of textiles,1787
73348,01145764,v,9,"use too much: ""This play has been overworked""",
73341,01144828,v,9,create by stitching together,
73334,01143876,v,9,prepare or cook quickly or hastily,1957
73343,01145053,v,9,decorate with needlework,"2425,2875"
73344,01145208,v,9,embroider with gold or silver thread,"2425,2875"
73345,01145306,v,9,edge or border with gold or silver embroidery,"2425,2875"
73346,01145413,v,9,"e.g., illustrate a book with drawings","2425,2875"
73349,01145875,v,9,"use again in altered form: ""retread an old plot""",
73353,01146305,v,9,"adorn with garlands: ""They garlanded the statue""","2425,2875"
73350,01146010,v,9,"work on a rack, of materials such as leather",
73351,01146134,v,9,work with a tool,
73352,01146212,v,9,decorate with jewels,"2425,2875"
73363,01147336,v,9,"make (textiles) by knitting; ""knit a scarf""",
73354,01146418,v,9,"decorate with feathers, as of an arrow or dart","2425,2875"
73355,01146537,v,9,decorate with spangles,"2425,2875"
73356,01146636,v,9,decorate with leaves,"2425,2875"
73357,01146721,v,9,"decorate with flags, as of buildings","2425,2875"
73358,01146819,v,9,put a caparison on; of horses,"2425,2875"
73359,01146933,v,9,decorate by sewing beads onto,"2425,2875"
73360,01147024,v,9,"trim with piping, as of garments","2425,2875"
73361,01147136,v,9,sew on as a decoration,"2425,2875"
73362,01147242,v,9,make knotted patterns,
73367,01147763,v,9,make with purl stitches,
73364,01147503,v,9,knit with a purl stitch,
73365,01147596,v,9,in knitting,
73366,01147672,v,9,form vertical ribs by knitting,
73371,01148180,v,9,"create by looping or crocheting: ""crochet a bedspread",
73368,01147855,v,9,tie or link together,
73378,01149022,v,9,"of textiles; create a piece of cloth by interlacing strands of fabric, such as wool or cotton",1787
73370,01148099,v,9,interlock,
73372,01148360,v,9,make by shell stitching,
73373,01148453,v,9,make by double stitching,
73374,01148565,v,9,make by single stitching,
73383,01149675,v,9,weave diagonal lines into; of textiles,1787
73375,01148677,v,9,"make a loop in, as of rope or string",
73376,01148824,v,9,make a noose in or of,
73377,01148908,v,9,make into knots; make knots out of,
73335,01143986,v,9,"prepare or cook by mixing ingredients: ""concoct a strange mixture""",1957
73380,01149372,v,9,do lacework,1787
73382,01149581,v,9,make by braiding,1787
73381,01149445,v,9,make lacework by knotting or looping,
73385,01149879,v,9,of metals,1787
73332,01143604,v,9,"prepare a hot meal: ""My husband doesn't cook""",1957
73384,01149776,v,9,produce by ignition; as of fire,
73387,01150098,v,9,"forge with a drop-forge, as of metals",1787
73390,01151372,v,9,"decorate or furnish with something suspended: ""Hang wallpaper""","2415,2425,2875"
73386,01149996,v,9,hammer into thin flat foils; of metal,1787
73388,01150202,v,9,form or shape by forcing through an opening; as of metal,
73391,01151496,v,9,"dress or decorate showily or gaudily: ""Roses were pranking the lawn""","2425,2875"
73392,01151628,v,9,"adorn with tinsel: ""snow flakes tinseled the trees""","2425,2875"
73369,01147991,v,9,"construct or form a web, as if by weaving",1787
73393,01151743,v,9,"decorate in a cheap and flashy way, as of a bar","2425,2875"
73333,01143729,v,9,"cook beforehand so that the actual preparation won't take long; ""precook the rice""",1957
73396,01152056,v,9,"decorate with panels, as of walls or ceilings","2415,2425,2875"
73409,01153463,v,9,represent by a silhouette,2425
73397,01152164,v,9,adorn with jewels,"2425,2875"
73398,01152244,v,9,decorate with a filet,"2425,2875"
73399,01152337,v,9,"decorate an edge with scallops, as of a dress","2425,2875"
73400,01152447,v,9,decorate tastelessly,"2425,2875"
73401,01152532,v,9,decorate a ship with flags,"2425,2875"
73405,01152980,v,9,"decorate: ""deck the halls with holly""","2425,2875"
73404,01152872,v,9,"decorate with ornaments, as of christmas trees","2425,2875"
73423,01155013,v,9,"coat with lacquer: ""A lacquered box from China""","2425,2875"
73406,01153132,v,9,"deck with a plume, as of a helmet","2425,2875"
73407,01153228,v,9,decorate with festoons,"2425,2875"
73410,01153580,v,9,represent in the form of an animal,2425
73411,01153689,v,9,"represent in profile, by drawing or painting",2425
73412,01153806,v,9,paint with fingerpaint,2511
73413,01153905,v,9,"apply in small touches, of paint",2511
73416,01154225,v,9,apply paint to a body,2511
73414,01154002,v,9,stain (skin) with indelible color,
73437,01157006,v,9,"paint again: ""He repainted the same scenery many times during his life""",2511
73426,01155358,v,9,paint onto wet plaster on a wall,2511
73417,01154313,v,9,"coat, inlay, or surface with enamel","2425,2875"
73418,01154430,v,9,extract (metals) by heating,
73419,01154538,v,9,"decorate the surface of by inserting wood, stone, and metal","2425,2875"
73420,01154678,v,9,inlay metal with gold and silver,"2425,2875"
73421,01154777,v,9,make shiny,"2425,2875"
73422,01154923,v,9,apply a glaze to (ceramics),"2425,2875"
73441,01157863,v,9,"capture anew: ""The author recaptures an old idea here""",2425
73424,01155143,v,9,lacquer with japan,"2425,2875"
73425,01155224,v,9,"decorate with, or as if with, gold leaf or liquid gold","2425,2875"
73427,01155454,v,9,paint with distemper,2511
73428,01155541,v,9,make a blueprint of,2415
73429,01155645,v,9,"paint, as of medieval manuscripts","1422,2425,2875"
73430,01155782,v,9,"decorate with letters painted red, of manuscripts","1422,2425,2875"
73432,01156010,v,9,shape from stone or wood or any other hard material,2459
73431,01155908,v,9,decorate with heraldic arms,"2425,2875"
73439,01157275,v,9,create an image or likeness of,2425
73435,01156631,v,9,"pursue a creative activity; be engaged in a creative activity: ""Don't disturb him--he is creating""",
73436,01156847,v,9,"be engaged in building: ""These architects build in interesting and new styles""",
73433,01156145,v,9,"make a painting of: ""He painted his mistress many times""",2511
73448,01158924,v,9,"write, draw, or trace with a pencil: ""he penciled a figure""",2479
73442,01157992,v,9,"show in, or as in, a picture: ""This scene depicts country life""",2425
73443,01158172,v,9,depict with an illustration,2425
73438,01157150,v,9,"place a heraldic bearing on; of weapons, shields, and banners",2511
73445,01158389,v,9,"make a map of; show or establish the features of details of: ""map the surface of Venus""",2479
73447,01158733,v,9,"make a portrait of: ""showing society what it looked like..portraying..its ugliness and its beauties..""",2425
73444,01158267,v,9,present stylistically or conventionally,2425
73451,01159491,v,9,trace the shape of,2479
73440,01157662,v,9,"succeed in representing or expressing something intangible: ""capture the essence of Spring""; ""capture an idea""",2425
73395,01151944,v,9,redo the decoration of an apartment or house,"2415,2425,2875"
73449,01159073,v,9,"represent in a painting, drawing, sculpture, or verbally: ""The father is portrayed as a coward in this play""",2425
73408,01153315,v,9,represent materialistically; as in a painting or a sculpture,2425
73446,01158591,v,9,"depict as if on a map: ""sorrow was mapped on the mother's face""",2425
73450,01159299,v,9,"present as worthy of regard, kindness, or confidence: ""His paintings commend him to the artistic world""",2425
73453,01159774,v,9,form the contours of,2479
73403,01152772,v,9,"prepare or cook with lard: ""lard meat""",1957
73454,01159885,v,9,contour economically or efficiently,2479
73452,01159629,v,9,"form by tracing with lipstick: ""The clown had lipsticked circles on his cheeks""",2479
73415,01154125,v,9,paint or stain like marble; of paper,2415
73459,01160800,v,9,draw a projection of,2479
73460,01160885,v,9,"mark or trace on a surface: ""The artist wrote Chinese characters on a big piece of white paper""","1422,2479"
73463,01161351,v,9,set down or print with letters,"1422,2479,2638"
73470,01162166,v,9,"make a copy of: ""copy that drawing""; ""re-create a picture by Rembrandt""",
73461,01161159,v,9,write in capital letters,"1422,2479"
73462,01161251,v,9,mark letters on or mark with letters,"1422,2479"
73465,01161552,v,9,mark into squares or draw squares on; draw crossed lines on,2479
73504,01166926,v,9,"write for commercial publications: ""She writes copy for ""Harper's Bazaar""","1422,2425,2657"
73467,01161825,v,9,make a doodle; draw aimlessly,2479
73469,01162085,v,9,draw cartoons of,2479
73468,01161936,v,9,make a schematic or technical drawing of; make a diagram of,2479
73492,01164896,v,9,"produce a literary work: ""She composed a poem""; ""He wrote four novels""","1422,2425,2657"
73483,01163907,v,9,paint with watercolors,2511
73471,01162419,v,9,"make a copy of (a computer file) esp. for storage in another place as a security cop; ""You'd better back up these files!""",
73475,01162853,v,9,"print copies from (a prepared stencil) using a mimeograph; ""She mimeographed the syllabus""",
73472,01162605,v,9,copy on a hectograph,
73473,01162693,v,9,make a clone of,
73474,01162779,v,9,copy again,"1422,2479"
73486,01164223,v,9,"form in clay, wax, etc: ""model a head with clay""",
73476,01163020,v,9,make copies on a roneograph,
73477,01163110,v,9,represent the effect of shade or shadow on,"2479,2511"
73456,01160087,v,9,"write, draw, or trace with chalk",2479
73479,01163427,v,9,shade with crosshatches,"2479,2511"
73480,01163518,v,9,add color to,"2479,2511"
73481,01163661,v,9,mark with spots or blotches of different color or shades of color as if stained,"2479,2511"
73482,01163822,v,9,make a veinlike pattern,
73487,01164349,v,9,construct a model of,2425
73484,01163997,v,9,decorate with colors,"2425,2875"
73485,01164126,v,9,paint with red lead or vermilion,"2425,2875"
73495,01165597,v,9,"write about a particular topic: ""Snow wrote about China""","1422,2425,2657"
73488,01164442,v,9,make a sketch of,2479
73490,01164714,v,9,of phrases or words,2657
73489,01164544,v,9,create with or from words,"1969,2657"
73491,01164813,v,9,coin new slogans,2657
73493,01165396,v,9,write lyrics for (a song),"1422,2536,2657"
73464,01161445,v,9,"write, draw, or trace with a crayon",2479
73494,01165502,v,9,write new lyrics for (a song),"1422,2536,2657"
73501,01166504,v,9,"write something fluently, and without hesitation","1422,2425,2657"
73503,01166757,v,9,"rewrite so as to make fit to suit a new or different purpose: ""adapt a play for use in schools""","1422,2425,2657"
73499,01166173,v,9,"write or name the letters that comprise the conventionally accepted form of (a word or part of a word); ""He spelled the word wrong in this letter""",
73497,01165908,v,9,write paragraphs; work as a paragrapher,"1422,1969,2425,2657"
73505,01167067,v,9,"put into dramatic form: ""adopt a book for a screenplay""","1422,2425,2657"
73500,01166409,v,9,write with a hyphen,
73502,01166619,v,9,"write quickly, as of letters or notes","1422,2425,2657"
73507,01167351,v,9,compose rhymes,2657
73496,01165752,v,9,"write about: ""The author of this article profiles a famous painter""","1422,2425,2657"
73506,01167210,v,9,"draw up an outline or sketch for something: ""draft a speech""","1422,2425,2657"
73510,01167662,v,9,"make a play on words: ""Japanese like to pun--their language is well suited to punning""",2633
73511,01167809,v,9,compose verses; put into verse,"1422,2425,2657"
73508,01167471,v,9,"supply with rhymes, as of blank verse or prose",2657
73509,01167578,v,9,use alliteration,2657
73512,01167976,v,9,"make spondaic, of verses","1422,2425,2657"
73466,01161694,v,9,"draw, trace, or represent with charcoal",2479
73513,01168067,v,9,compose an elegy,"1422,2425,2657"
73515,01168271,v,9,compose a sonnet,"1422,2425,2657"
73478,01163261,v,9,"make by small short touches that together produce an even or softly graded shadow, as in paint or ink",2511
73516,01168351,v,9,praise in a sonnet,2657
73514,01168148,v,9,"render verbally, ""recite a poem""; ""retell a story""",2425
73458,01160642,v,9,"write a legal document or paper: ""The will was drawn when he was 89 years old""","1802,2657"
73518,01168541,v,9,sing loudly and forcefully,
73519,01168640,v,9,sing a descant on a main tune or melody,
73520,01168747,v,9,sing with one vowel,
73524,01169236,v,9,supply with notes,"1422,2425,2657"
73570,01175887,v,9,"be performed: ""What's playing in the local movie theater?""",2610
73525,01169330,v,9,refer to,"1422,2425,2657"
73527,01169658,v,9,write music for (a text),2536
73566,01175344,v,9,"perform for an audience: ""Pollini is giving another concert in New York""",2425
73530,01170074,v,9,write a musical score for,2536
73637,01185662,v,9,"lead: ""conduct an orchestra""",2536
73547,01172555,v,9,"cast again, in a different role: ""He was recast as Iago""",
73531,01170180,v,9,put (a piece of music) into another key,2536
73532,01170286,v,9,supply a melody for,2536
73533,01170371,v,9,sing in harmony,2536
73534,01170461,v,9,write a harmony for,2536
73535,01170547,v,9,write an orchestra score for,2536
73536,01170644,v,9,write an instrumental score for,2536
73538,01170932,v,9,compose a sequence of dance steps to music,2621
73539,01171051,v,9,dance to jive music; dance the jive,2621
73541,01171842,v,9,dance a clog dance,2621
73540,01171148,v,9,move in a pattern; usually to musical accompaniment; do or perform a dance,2621
73553,01173263,v,9,"record in film: ""The coronation was filmed""",2606
73542,01171922,v,9,perform a tap dance,2621
73552,01173148,v,9,"locate: ""The film is set in Africa""",2610
73526,01169420,v,9,"write music: ""Beethoven composed nine symphonies""",2536
73544,01172098,v,9,guide the actors in (plays and films),"2606,2610"
73545,01172225,v,9,"select to play,sing, or dance a part in a play, movie, musical, opera, or ballet",
73546,01172475,v,9,sing in descant,
73537,01170759,v,9,rewrite a piece of music for an instrument or medium other than that originally intended; arrange,2536
73548,01172675,v,9,"cast an actor, singer, or dancer in an unsuitable role",
73549,01172794,v,9,cast repeatedly in the same kind of role,
73556,01173639,v,9,record on microfilm,2606
73554,01173430,v,9,make films; be a film maker,2606
73557,01173725,v,9,"do something the cheapest or easiest way: ""Cut corners to make a cheaper product""",
73564,01174962,v,9,"give a performance: ""Horowitz is performing at Carnegie Hall tonight""",2425
73569,01175758,v,9,"perform on a certain location: ""He played the casinos in Las Vegas""",2610
73561,01174660,v,9,"perform an interlude, as on a musical instrument",2425
73558,01173875,v,9,"to act or perform an action: ""John did the painting, the weeding, and he cleaned out the gutters""",
73559,01174394,v,9,"perform or carry out: ""cut a caper""",
73560,01174490,v,9,"perform brilliantly and rapidly, as of the actor: ""Mr. Jones blazed away in one passage after another""",
73573,01176337,v,9,"make one's debut; ""This young soprano debuts next months at the Metropolitan Opera""",2425
73565,01175266,v,9,perform rap music,2425
73562,01174775,v,9,perform hastily and carelessly,
73563,01174868,v,9,perform in a mechanical way,
73555,01173524,v,9,make a film of; adopt so as to make into a film,2606
73529,01169980,v,9,"adapt: ""put these words to music""",2536
73567,01175496,v,9,"present to view: ""He gave the sign to start""",
73550,01172900,v,9,direct for the stage,2610
73568,01175620,v,9,"give concerts; perform in concerts: ""My is off concertizing in Europe""",2425
73571,01176015,v,9,"cause to be played: ""They ran the tapes over and over again""",
73543,01172008,v,9,perform a belly dance,2621
73574,01176483,v,9,"present for the first time to the public: ""The and debuts a new song or two each month""",
73523,01169090,v,9,"write for someone else: ""How many books have you ghostwritten so far?""","1422,2425,2657"
73575,01176633,v,9,perform a work for the first time,
73576,01176742,v,9,"be performed for the first time; of a play, ballet, or composition",
73522,01168982,v,9,"be a co-author on (a book, a paper, etc.)","1422,2425,2657"
73528,01169752,v,9,"adapt for performance in a different way: ""set this poem to music""",2536
73579,01177168,v,9,"carry out, as a performance: ""They turned in top jobs for the second straight game""",
73582,01177983,v,9,"act as the stooge: ""His role was to stooge for the popular comedian""",2610
73595,01179881,v,9,"enact or perform again: ""They reenacted the battle of Princeton""",2425
73583,01178115,v,9,come on stage; in the theater,2610
73588,01178748,v,9,"behave unnaturally or affectedly: ""She's just acting""",
73594,01179717,v,9,"represent an incident, state, or emotion by action, esp. on stage; ""She could act neurotic anxiety""",2610
73585,01178318,v,9,be the star in a performance,2606
73587,01178644,v,9,be the co-star in a performance,2606
73592,01179423,v,9,pretend to be someone or something else,2610
73589,01178910,v,9,"make a pretence of: ""She assumed indifference, even though she was seething with anger""; ""he feigned sleep""",
73603,01181073,v,9,"play (music) on an instrument; ""The band played all night long""",2536
73591,01179348,v,9,make a feint,
73597,01180169,v,9,"practice play, in sports",2638
73584,01178207,v,9,play a subordinate role to (another performer),2610
73598,01180260,v,9,"assume or act the character of: ""She impersonates Madonna""",2610
