1159,00191168,n,9,"a sudden dash: ""he made a break for the open door""",
1155,00190719,n,9,a slow pace of running,
1156,00190823,n,9,a steady trot like that of a dog,
1157,00190909,n,9,a quick run,
1158,00190998,n,9,(basketball) a rapid dash to get a shot as soon as possible after taking possession of the ball,"2633,2871"
1161,00191531,n,9,"movement once around a course: ""he drove an extra lap just for insurance""","2638,2651"
1174,00193473,n,9,"the business of providing services to tourists: ""Tourism is a major business in Bermuda""","1787,1794,2772"
1165,00192460,n,9,travel (especially by foot),2772
1164,00192282,n,9,"traveling around something (by ship or plane); ""Magellan's circumnavigation of the earth proved that it is a globe""",
1145,00189453,n,9,"taking a short walk out and back: ""we took a turn in the park""",2600
1166,00192583,n,9,travel across,2772
1167,00192663,n,9,travelling about without any clear destination,2772
1168,00192806,n,9,aimless wandering from place to place,2772
1169,00192898,n,9,traveling across,2772
1170,00193005,n,9,the act of crossing a stream or river by wading or in a car or on a horse,2772
1171,00193175,n,9,fording at a shallow place,2772
1172,00193263,n,9,fording at a deep place in the stream,2772
1176,00193791,n,9,riding a horse as a means of transportation,1946
1173,00193359,n,9,taking a zigzag path on skis,"2646,2772"
1163,00191846,n,9,"the act of going from one place to another: ""he enjoyed selling but he hated the travel""",2772
1149,00189958,n,9,"a kind of dance step in which the dancer seems to be sliding on the spot: ""Michael Jackson perfected the moonwalk in the 1980s""",2621
1177,00193978,n,9,capturing cattle or horses with a lasso,
1178,00194106,n,9,breaking a bronco to saddle,"1946,2600"
8670,01471352,n,9,razor clams,"2158,2188"
1138,00188553,n,9,"the act of marching; walking with regular steps (especially in a procession of some kind); ""it was a long march""; ""we heard the sound of marching""",
1183,00194613,n,9,capturing a steer with a lasso,2600
1184,00194721,n,9,travel on a motorcycle,"1948,2643,2772"
1187,00195217,n,9,a flight that begins and ends in the same country,1946
1182,00194486,n,9,capturing a calf with a lasso and binding its feet,2600
1188,00195346,n,9,a flight that takes off in one country and lands in another,1946
1190,00195677,n,9,a night flight from which the passengers emerge with eyes red from lack of sleep,1946
1186,00195002,n,9,"a scheduled trip by plane between designated airports: ""I took the noon flight to Chicago""",1946
1192,00196097,n,9,the performance of stunts while in flight in an aircraft,1942
1213,00198945,n,9,"a section or portion of a journey or course: ""then we embarked on the second stage of our Carribean cruise""","1946,2772"
1193,00196267,n,9,flying in a balloon,1942
1195,00196489,n,9,the activity of flying a glider,1942
1196,00196652,n,9,gliding in a hang glider,1942
1197,00196735,n,9,descent with a parachute,1942
1198,00196842,n,9,performing acrobatics in free fall before pulling the ripcord of a parachute,1942
1199,00196975,n,9,gliding in a parasail,1942
1201,00197191,n,9,a flight in which the aircraft pilot is unaccompanied,1942
1202,00197295,n,9,an operational flight by a single aircraft (as in a military operation),1942
1207,00198024,n,9,an aircraft landing made entirely by means of instruments,1942
1209,00198268,n,9,a departure; especially of airplanes,1942
1204,00197549,n,9,landing an aircraft,"1942,2772"
1205,00197704,n,9,an emergency landing under circumstances where a normal landing is impossible (usually damaging the aircraft),"1942,2772"
1206,00197873,n,9,a landing in which all three wheels of the aircraft touch the ground at the same time,"1942,2772"
1208,00198146,n,9,a landing of a spacecraft in the sea at the end of a space flight,1946
1210,00198358,n,9,rapid descent of an aircraft in a steep spiral spin,1942
1220,00200009,n,9,"a regular trip: ""the ship made its run in record time""",2772
1211,00198471,n,9,flight at very low altitudes,1942
1212,00198579,n,9,the act of traveling from one place to another,2772
1214,00199147,n,9,(nautical) the distance traveled by a sailing vessel on a single tack,1942
1194,00196343,n,9,a low-altitude flight (usually of military aircraft) over spectators on the ground,1942
1217,00199551,n,9,a long wandering and eventful journey,2772
1215,00199284,n,9,(British) a section along the route of a bus for which the fare is the same,"1946,2772"
1221,00200113,n,9,"a short trip: ""take a run into town""",2772
1219,00199917,n,9,a trip to some place and back again,2772
1218,00199642,n,9,"a journey for some purpose (usually including the return); ""he took a trip to the shopping center""",2772
1228,00201036,n,9,an overland journey by hunters (especially in Africa),2656
1189,00195490,n,9,"a flight made without intermediate landings between source and destination: ""how many nonstops are there to Dallas?""",1946
1222,00200199,n,9,"a journey usually by ship: ""the outward passage took 10 days""",
1235,00201872,n,9,"travelling about: ""they took the show on the road"" or ""they lost all their games on the road""",2772
1224,00200531,n,9,"a ride in a car: ""he gave me a lift home""",
1225,00200623,n,9,"a ride in a car taken solely for pleasure: ""they took their girlfriends for joyrides in stolen cars""",
1216,00199416,n,9,"a journey over a long distance: ""it's a long haul from New York to Los Angeles""",2772
1226,00200777,n,9,a journey organized for a particular purpose,
1227,00200932,n,9,an expedition undertaken to gain information,
1229,00201174,n,9,to travel for the purpose of discovery,2772
1230,00201294,n,9,wandering from the main path of a journey,2772
1231,00201404,n,9,any long and difficult trip,2772
1232,00201482,n,9,(South African) a journey by ox wagon (especially an organized migration by a group of settlers),2772
1233,00201629,n,9,an extended journey,2772
1234,00201763,n,9,an extended sightseeing tour undertaken for pleasure,2772
1191,00195810,n,9,"an instance of traveling by air: ""flying was still an exciting adventure for him""",1942
1203,00197419,n,9,a landing (as the wheels touch the landing field); especially of airplanes,1946
1223,00200342,n,9,"a journey in a vehicle driven by someone else: ""he took the family for a drive in his new car""",2772
1237,00202155,n,9,a pilgrimage to Mecca; every Muslim must make this journey at least once,"1565,2772"
1241,00202833,n,9,a journey to some distant place,2772
1242,00202953,n,9,"a journey or passage: ""they are on the way""",
1245,00203250,n,9,a voyage across a body of water (usually across the Atlantic Ocean),2772
1259,00204953,n,9,"shifting from one form of transportation to another: ""the plane was late and he missed his connection in Atlanta""",
1243,00203046,n,9,an act of traveling by water,"1946,2772"
1244,00203158,n,9,an ocean trip taken for pleasure,"1946,2772"
1252,00204077,n,9,sailing a zigzag course,1946
1246,00203372,n,9,passage through a lock,
1247,00203448,n,9,a voyage outside the Earth's atmosphere,
1248,00203574,n,9,travel by water,"1946,2772"
1249,00203714,n,9,riding in a sailboat,"1946,2772"
1250,00203842,n,9,sailing close to the wind,"1946,2772"
1260,00205135,n,9,"the act of delivering or distributing something (as goods or mail); ""his reluctant delivery of bad news""",2872
1263,00205632,n,9,the delivery of goods for sale or disposal,2872
1253,00204151,n,9,the work of a sailor,
1254,00204287,n,9,navigation in costal waters,
1255,00204369,n,9,water travel for pleasure,"1946,2772"
1256,00204459,n,9,the travel of a commuter,
1257,00204553,n,9,the act of transporting something from one location to another,
1258,00204841,n,9,transfer from one conveyance to another for shipment,
1251,00203918,n,9,the act of beating to windward; sailing as close as possible to the direction from which the wind is blowing,1946
1261,00205359,n,9,the act of driving a herd of animals overland,
1268,00206217,n,9,"carrying something in a pack on the back: ""the backpacking of oxygen is essential for astronauts""",
1285,00208480,n,9,an injection into the skin,2232
1264,00205732,n,9,the act of passing something to another person,
1265,00205865,n,9,the act of relaying something,
1266,00205946,n,9,the act of carrying something,
1267,00206099,n,9,the act of taking aboard passengers or freight,
1240,00202658,n,9,"an short excursion (a walk or ride) in the open air; ""after lunch he took the air""; ""he took the dogs for an airing""",2600
1269,00206382,n,9,the act of carrying a person over your shoulder,
1270,00206491,n,9,carrying boats and supplies overland,
1271,00206581,n,9,the transportation of burdens by porters,
1272,00206677,n,9,the act of pursuing,
1273,00206842,n,9,the pursuit (of a person or animal) by following tracks or marks they left behind,
1274,00206989,n,9,the act of following someone secretly,
1275,00207092,n,9,the act of following prey stealthily,
1276,00207191,n,9,the fruitless pursuit of something unattainable,
1277,00207301,n,9,the act of putting one thing into another,
1278,00207536,n,9,the insertion of a cannula into a body cavity,
1279,00207683,n,9,the introduction of a liquid (by pouring or injection) drop by drop,
1280,00207854,n,9,the act of enclosing something inside something else,
1281,00208049,n,9,the enclosure of something in a box,
1282,00208165,n,9,the act of binding something into a bundle,
1283,00208262,n,9,the act of enclosing something in a case,
1284,00208372,n,9,the forceful insertion of a substance under pressure,
1286,00208574,n,9,an injection into a muscle,2232
1287,00208670,n,9,an injection into a vein,2232
1288,00208780,n,9,(informal) an intravenous injection of a narcotic drug,2232
1289,00208884,n,9,an injection under the skin,2232
1291,00209166,n,9,the introduction of blood or blood plasma into a vein or artery,2232
1262,00205456,n,9,"the act of delivering a writ or summons upon someone: ""he accepted service of the subpoena""",1802
1292,00209307,n,9,pumping a liquid into an organ or tissue (especially by way of blood vessels),
1293,00209440,n,9,the act of changing location in an upward direction,
1294,00209629,n,9,the act of lifting something with great effort,
1239,00202570,n,9,taking an excursion for pleasure,2772
1296,00209898,n,9,ascent by or as if by a ladder,
1298,00210111,n,9,an act of scaling the walls of a fortification,
1299,00210212,n,9,the activity of climbing a mountain,"2638,2772"
1300,00210328,n,9,an act of scaling rock masses on mountain sides,
1301,00210435,n,9,the act of rising upward into the air,
1302,00210530,n,9,the act of changing your location in a downward direction,
1303,00210749,n,9,a steep nose-down descent by an aircraft,
1304,00210870,n,9,a swift descent through the air,
1305,00210953,n,9,a dive accelerated by both gravity and engine power,
1306,00211061,n,9,a rapid descent by a submarine,
1308,00211274,n,9,"the act of throwing yourself down: ""he landed on the bed with a great flop""",
1311,00211639,n,9,"the act of returning to a prior location: ""they set out on their return to the base camp""",
1309,00211411,n,9,the act of causing something to move to a lower level,
1310,00211534,n,9,changing location by moving back and forth,
1320,00212689,n,9,"a very slow movement: ""the traffic advanced at a crawl""",
1312,00211817,n,9,the act of entering again,
1314,00212053,n,9,the act of sliding or gliding,
1315,00212160,n,9,an unexpected slide,
1316,00212248,n,9,the act of flowing or streaming; continuous progression,
1317,00212399,n,9,the act of allowing a fluid to escape,
1318,00212509,n,9,a large flow,
1319,00212615,n,9,flow under pressure,
1333,00215247,n,9,"the act of turning your head left and right to signify denial or disbelief or bemusement: ""I could tell from their headshakes that they didn't believe me""",
1321,00212796,n,9,changing location rapidly,
1322,00212943,n,9,the act of accelerating; increasing the speed,
1323,00213070,n,9,the act of moving along swiftly (as before a gale),
1324,00213182,n,9,the act of uniform movement,
1325,00213282,n,9,the act of uprooting and moving a plant to a new location,
1326,00213412,n,9,the act of moving from one place to another,
1328,00214309,n,9,the act of agitating something; causing it to move around (usually vigorously),
1329,00214515,n,9,a motion of the body by a player as if to make an object already propelled go in the desired direction,
1330,00214676,n,9,a circular movement of a limb or eye,
1331,00214772,n,9,the act of disturbing something or someone; setting something in motion,
1332,00215081,n,9,motion of hands or body to emphasize or help to express a thought or feeling,
1334,00215471,n,9,"a sharp hand gesture (resembling a blow); ""he warned me with a jab with his finger""; ""he made a thrusting motion with his fist""",
1336,00215794,n,9,"the act of inclining; bending forward: ""an inclination of his head indicated his agreement""",
1335,00215695,n,9,ritual hand movement in Hindu religious dancing,
1340,00216316,n,9,"a short abrupt inclination (as of the head); ""he gave me a short bob of acknowledgement""",
1337,00216009,n,9,the act of turning inside out,
1338,00216116,n,9,turning upside down,
1339,00216220,n,9,an abrupt spasmodic movement,
1343,00216657,n,9,"a rhythmic thrusting movement of the legs as in swimming or calisthenics: ""the kick must be synchronized with the arm movements""",
1341,00216454,n,9,the act of nodding the head,
1342,00216542,n,9,an inclination of the top half of the body forward and downward,
1345,00216960,n,9,"abrupt up-and-down motion (as caused by a ship or other conveyance); ""the pitching and tossing was quite exciting""",
1344,00216864,n,9,supporting yourself on your knees,
1346,00217163,n,9,"the act of opening something: ""the ray of light revealed his cautious opening of the door""",
1313,00211896,n,9,the act of sending an accused person back into custody to await trial (or the continuation of the trial),1802
1347,00217325,n,9,changing an arrangement,
1348,00217444,n,9,the act of rearranging things to give a misleading impression,
1349,00217569,n,9,a rearrangement in a different order,
1350,00217734,n,9,act of changing the lineal order of objects in a group,
10501,01781359,n,9,fritillaries,"2158,2188"
1307,00211148,n,9,"the act of dropping something: ""they expected the drop would be successful""",
1355,00218464,n,9,shuffling by splitting the pack and interweaving the two halves at their corners,2637
1362,00219234,n,9,"the act of rotating as if on an axis: ""the rotation of the top kept time with the music""",
1375,00221212,n,9,turning an oar parallel to the water between pulls,2648
1356,00218597,n,9,a series of small (usually idle) twists or turns,
1357,00218699,n,9,the act of prostrating yourself,
1358,00218788,n,9,the act of physically reaching or thrusting out,
1359,00218926,n,9,alternating back-and-forth movement,
1360,00219021,n,9,the act of assuming or maintaining a reclining position,
1361,00219132,n,9,the act of bending backward,
1364,00219627,n,9,"the act of rotating rapidly: ""he gave the crank a spin""; ""it broke off after much twisting""",
1363,00219521,n,9,flying downward in a helical path with a large radius,
1368,00220196,n,9,"the act of assuming or maintaining a seated position: ""he read the mystery at one sitting""",
1365,00219840,n,9,a rapid spin of the body (especially on the toes as in ballet),
1366,00219958,n,9,rotating a log rapidly in the water (as a competitive sport),
1367,00220085,n,9,the act of closing something,
1369,00220340,n,9,"the act of assuming a certain position (as for a photograph or portrait); ""he wanted his portrait painted but couldn't spare time for the sitting""",
1371,00220668,n,9,"a movement in an arc: ""a sweep of his arm""",
1370,00220549,n,9,the act of assuming or maintaining a squatting position,
1372,00220762,n,9,"turning or twisting around (in place); ""with a quick twist of his head he surveyed the room""",
1373,00220931,n,9,"the act of winding or twisting: ""he put the key in the old clock and gave it a good wind""",
1380,00221849,n,9,"a movement like that of an ocean wave: ""a wave of settlers""; ""troops advancing in waves""",
1374,00221089,n,9,the act of turning or winding or folding around a central axis,
1383,00222304,n,9,turning in the opposite direction,1946
1376,00221348,n,9,the act of rotating in a circle or spiral,
1377,00221455,n,9,rotation of the hands and forearms so that the palms face downward,
1378,00221595,n,9,rotation of the hands and forearms so that the palms face upward,
1379,00221734,n,9,the act of vibrating,
1382,00222172,n,9,"turning away or in the opposite direction: ""he made an abrupt turn away from her""",
1381,00221988,n,9,the act of changing the direction in which something is oriented,
1390,00223167,n,9,"the act of moving something by repeated tugs or pushes: ""vigorous worrying finally loosened the saw""",
1384,00222475,n,9,"act of pivoting 180 degrees, especially in a military formation",1946
1385,00222608,n,9,complete reversal of direction of travel,1946
1404,00225190,n,9,any diversion intended to distract attention from the main issue,1946
1386,00222701,n,9,the act of causing something to move up and down (or back and forth) with quick movements,
1387,00222862,n,9,a slight irregular shaking motion,
1388,00222957,n,9,agitating a liquid with a stirring implement,
1389,00223056,n,9,causing to move repeatedly from side to side,
1393,00223506,n,9,"the act of upsetting something: ""he was badly bruised by the upset of his sled at a high speed""",
1391,00223322,n,9,pitching dangerously to one side,
1392,00223428,n,9,walking with a rolling gait,
1396,00223895,n,9,"the act of reaching out: ""the outreach toward truth of the human spirit""",
1394,00223675,n,9,the act of moving back and forth,
1395,00223779,n,9,an involuntary vibration (as if from illness or fear),
1397,00224022,n,9,the act of assuming or maintaining an erect upright position,
1398,00224137,n,9,the act of sitting or standing astride,
1399,00224275,n,9,a single complete movement,
1400,00224408,n,9,the act of wiggling,
1401,00224499,n,9,a change in the direction that you are moving,
1405,00225312,n,9,"a turn to the right: ""take a right at the corner""",
1403,00224903,n,9,"a turning aside (of your course or attention or concern): ""a diversion from the main highway""; ""a digression into irrelevant details""; ""a deflection from his goal""",1946
1354,00218335,n,9,"shuffling (cards) again; ""the gambler demanded a reshuffle""",2637
1353,00218172,n,9,the act of mixing cards haphazardly,2637
1411,00226599,n,9,the act of reducing the budget,1753
1408,00225607,n,9,the act of changing the amount or size of something,
1409,00225760,n,9,the act of decreasing or reducing something,
1412,00226686,n,9,a act of reducing a salary,1753
1413,00226766,n,9,the act of cutting costs,1753
1414,00226849,n,9,cutting the price of merchandise to one lower than the usual or advertised price,1753
1415,00227001,n,9,the act of reducing spending,1753
1421,00227728,n,9,the reduction of something value,1753
1418,00227383,n,9,"the act of gradually lowering the size or amount: ""the doctor prescribed the tapering of the dose""",
1417,00227277,n,9,the act of causing to become less,
1425,00228188,n,9,"the act of reducing something unpleasant as pain: ""he asked the nurse for relief from the constant pain""",
1419,00227536,n,9,a reduction in quantity or rate,
1420,00227639,n,9,the act of reducing service,
1431,00229061,n,9,the act of decreasing something markedly,1753
1422,00227818,n,9,the act of reducing the vitality of something,
1423,00227941,n,9,to act in such a way as to cause an offense to seem less serious,
1424,00228089,n,9,the relaxation or relief of muscle spasms,
1436,00229705,n,9,"the act of squeezing: ""he gave her cheek a playful squeeze""",
1426,00228440,n,9,a reduction in intensity (of a crisis or a war),
1427,00228547,n,9,the easing of tensions or strained relations (especially between nations),
1428,00228674,n,9,easing the severity of a pain or a disease without removing the cause,
1429,00228800,n,9,the act of making less strict,
1430,00228920,n,9,the act of minimizing something,
1461,00232701,n,9,the act of reducing the selling price of merchandise,1753
1432,00229211,n,9,the act of consuming something,
1433,00229342,n,9,the amount of fuel used up (as in a nuclear reactor),
1434,00229447,n,9,the act of exhausting something entirely,
1435,00229544,n,9,applying pressure,
1444,00230622,n,9,"act of decreasing in length: ""the dress needs shortening""",
1437,00229872,n,9,a squeeze with the fingers,
1438,00229958,n,9,relieving pressure,
1439,00230070,n,9,the act of increasing the density of something,
1440,00230206,n,9,the act of thickening,
1441,00230299,n,9,the act of crushing,
1442,00230410,n,9,the act of grinding,
1443,00230520,n,9,squeezing out by applying pressure,
1446,00230893,n,9,"the act of shortening something by cutting off the ends: ""the barber gave him a good cut""",
1445,00230790,n,9,shortening something by omitting parts of it,
1458,00232357,n,9,"the act of abating: ""laws enforcing noise abatement""",
1447,00231128,n,9,the act of severing,
1448,00231214,n,9,the act of clipping or snipping,
1449,00231314,n,9,the act of cutting the hair,
1450,00231395,n,9,cutting down to the desired size or shape,
1451,00231527,n,9,the act of trimming a plant,
1452,00231608,n,9,removing by cutting off or clipping,
1453,00231716,n,9,act of shearing sheep,
1454,00231797,n,9,the act of becoming less,
1455,00231895,n,9,act of making on a greatly reduced scale,
1457,00232245,n,9,the act of deducting (taxes) from an employee's salary,
1407,00225511,n,9,(nautical) the act of changing tack,1942
1459,00232465,n,9,the act of rubbing together; wearing something down by friction,
1460,00232584,n,9,the act of letting the air out of something,
1462,00232838,n,9,reducing prices back to some earlier level,1753
1463,00232935,n,9,the act of reducing the strength of something,
1464,00233090,n,9,causing to become limp or drooping,
1465,00233185,n,9,weakening (reducing the concentration) by the addition of water or a thinner,
1518,00241499,n,9,the act of bringing into focus,
1416,00227088,n,9,"the action of lessening in severity or intensity: ""the object being control or moderation of economic depressions""",
1468,00233991,n,9,"the act of adding one thing to another: ""the addition of flowers created a pleasing effect""; ""the addition of a leap day every four years""",
1471,00234534,n,9,"a decrease in price or value over time: ""depreciation of the dollar against the yen""",1768
1505,00239542,n,9,"accumulating and storing a reserve supply: ""the stockpiling of war materials""",2872
1477,00235473,n,9,"the act of expanding an aperture: ""the dilation of the pupil of the eye""",
1473,00234884,n,9,the addition of a fluoride to the water supply (to prevent dental decay),
1474,00235032,n,9,the act of augmenting,
1491,00237481,n,9,an abnormal and usually permanent contraction of a muscle,2234
1476,00235235,n,9,the act of increasing in size or volume or quantity or scope,
1481,00235973,n,9,"an increase to counteract a perceived discrepancy: ""higher wages caused an escalation of prices"" or ""there was a gradual escalation of hostilities""",
1478,00235631,n,9,dilation of blood vessels (especially the arteries),
1479,00235741,n,9,the act of expanding by pressure from within,
1480,00235855,n,9,act of expanding by lengthening or widening,
1485,00236516,n,9,"the act of making something more noticeable than usual: ""the dance involved a deliberate exaggeration of his awkwardness""",
1482,00236177,n,9,the act of maximizing something,
1483,00236300,n,9,a act of filling something with air,
1484,00236409,n,9,the act of expanding something in apparent size,
1486,00236696,n,9,"act of expanding in scope; making more widely available: ""extension of the program to all in need""",
1496,00238268,n,9,"extension to or beyond the ordinary limit: ""running at full stretch""; ""by no stretch of the imagination""; ""beyond any stretch of his understanding""",
1487,00236886,n,9,act of extending over a wider scope or expanse of space or time,
1488,00237068,n,9,the act of dispersing something,
1489,00237202,n,9,the dispersion of fungicides or insecticides or fertilizer on growing crops (often from a low-flying aircraft),
1490,00237382,n,9,the act of scattering,
1492,00237596,n,9,act of stretching or straightening out a flexed limb,2234
1494,00237830,n,9,(physiology) a shortening or tensing of a part or organ (especially of a muscle or muscle fiber),2234
1493,00237740,n,9,greater than normal extension,
1501,00239058,n,9,the act of accumulating,1753
1495,00238038,n,9,a rhythmic tightening in labor of the upper uterine musculature that contracts the size of the uterus and pushes the fetus toward the birth canal,"2233,2234"
1498,00238624,n,9,"addition of extra material or illustration or clarifying detail: ""a few remarks added in amplification and defense""; ""an elaboration of the idea followed""",
1497,00238469,n,9,adding information or detail,
1475,00235112,n,9,(electricity) the act of increasing voltage or power or current,2107
1499,00238852,n,9,the act of adding notes,
1500,00238945,n,9,the act of supplementing,
1504,00239397,n,9,depositing in a warehouse,2872
1502,00239181,n,9,the act of building up an accumulation,
1503,00239291,n,9,the act of depositing,
1469,00234220,n,9,"increase in price or value: ""the news caused a general advance on the stock market""",1753
1515,00240869,n,9,"action that makes a problem or a disease (or its symptoms) worse; ""the aggravation of her condition resulted from lack of care""",
1506,00239677,n,9,the act of including,
