72217,00968805,v,9,"strike with, or as if with a baseball bat",
72220,00969175,v,9,"strike sharply: ""rap him on the knuckles""",
72219,00969058,v,9,knock unconscious or senseless,
72221,00969318,v,9,"rap with the knuckles: ""knock on the door""",
72223,00969517,v,9,"deliver a hard blow to: ""The teacher smacked the student who had misbehaved""",
72227,00969943,v,9,"strike heavily, esp. with the fist or a bat; ""He slugged me so hard that I passed out""",
72224,00969673,v,9,deliver a belt to,
72225,00969752,v,9,deliver a punch to,
72243,00972081,v,9,stir (cream) vigorously in order to make butter,1957
72228,00970105,v,9,"hit hard: ""The teacher whacked the boy""",
72237,00971255,v,9,"strike violently and repeatedly: ""She clobbered the man who tried to attack her""",
72229,00970246,v,9,strike with the fist,
72230,00970346,v,9,give a thrashing to; beat hard,
72231,00970463,v,9,beat the seeds out of a grain; in agriculture,"2314,2876"
72232,00970581,v,9,beat with or as if with a hammer,
72233,00970695,v,9,beat with a sledgehammer,
72235,00971071,v,9,hit with the hand,
72236,00971166,v,9,strike with a flat object,
72238,00971417,v,9,"strike, beat repeatedly: ""The wind buffeted him""",
72239,00971544,v,9,"strike against forcefully: ""Winds buffeted the tent""",
72240,00971707,v,9,"whip: ""whisk the eggs""",
72242,00971909,v,9,"stir vigorously: ""beat the egg whites""; beat the cream""",
72241,00971825,v,9,make cream by beating,
72244,00972191,v,9,"agitate: ""toss the salad""; ""stir nuts into the dough""",
72247,00972795,v,9,shuffle (playing cards) by separating the deck into two parts and riffling with the thumbs so the cards intermix,2637
72245,00972429,v,9,"mix so as to make a random order or arrangement: ""shuffle the cards""",
72246,00972649,v,9,"shuffle again: ""So as to prevent cheating, he was asked to reshuffle the cards""",
72251,00973405,v,9,"make into a puddle: ""puddled mire""",
72252,00973520,v,9,engage in a boxing match; in sport,2642
72248,00972971,v,9,stir with a paddle,
72249,00973053,v,9,change the arrangement or position of,
72250,00973267,v,9,make turbid by stirring up the sediments of,
72257,00974052,v,9,"hit with the fist: ""I'll box your ears!""",
72254,00973742,v,9,fight with spurs; of gamecocks in cockfights,2633
72255,00973848,v,9,box for a prize or money,2642
72267,00975735,v,9,"draw the cork from (bottles); ""uncork the French wine""",1957
72256,00973940,v,9,go through boxing motions without an opponent,2642
72266,00975619,v,9,close a bottle with a cork,1957
72261,00974668,v,9,"put or introduce into the body of something: ""insert a picture into the text""",
72258,00974161,v,9,give a spanking to; subject to a spanking,
72260,00974541,v,9,of electrical appliances,"2098,2107"
72263,00975083,v,9,"fill or close tightly with or as if with a plug: ""plug the hole""; ""stop up the leak""",
72262,00974953,v,9,"enter drop by drop, as of medication into an eye",
72264,00975328,v,9,"fill or stop up: ""Can you close the cracks with caulking?""",
72253,00973669,v,9,box lightly,2642
72265,00975520,v,9,"fill the chinks of, as with caulking",
72268,00975871,v,9,"deliver a smack to: ""The teacher smacked the naughty student""",
72271,00976184,v,9,"stir by poking: ""poke the embers in the fireplace""",
72269,00975995,v,9,strike with a club or a bludgeon,
72270,00976100,v,9,strike with a cudgel,
72226,00969848,v,9,"strike sharply, as in some sports",2638
72272,00976296,v,9,rub noses,
72214,00968379,v,9,"hit with the fists: ""He pasted his opponent""",
72277,00977109,v,9,"stroke or caress gently: ""pet the lamb""",
72276,00977015,v,9,cuddle and kiss,
72279,00977352,v,9,"kiss, embrace, or fondle with sexual passion: ""The couple were necking in the back seat of the car""",
72278,00977271,v,9,stroke soothingly,
72311,00982468,v,9,"bring or fetch: ""Get me those books over there, please""; ""Could you bring over the wine?""; ""The dog fetched the hat""",1935
72291,00979586,v,9,"copulate with, as of animals: ""The bull was riding the cow""",1703
72286,00978647,v,9,"mate with: ""male animals serve the females for breeding purposes""","1703,2188"
72283,00978384,v,9,have unlawful sex with a whore,1703
72284,00978477,v,9,frequent prostitutes,1703
72293,00979879,v,9,cause to become mongrels,2188
72285,00978560,v,9,"mate with, of male birds","1703,2188"
72290,00979316,v,9,"make love: ""Birds mate in the Spring""",1703
72287,00978803,v,9,"be available for stud services, of male domestic animals such as stallions","1703,2188"
72289,00979094,v,9,"succeed in seducing; young men's slang; ""Harry finally seduced Sally""; ""Did you score last night?"" ""Harry made Sally""",
72292,00979715,v,9,"of plants or animals: ""She breeds dogs""",2188
72288,00978940,v,9,"deprive of virginity: ""This dirty old men deflowered several young girls in the village""",1703
72282,00978251,v,9,have sex without being married,1703
72297,00980362,v,9,"copulate with a female, used esp. of horses; ""The horse covers the mare""","1703,2188"
72294,00979971,v,9,"copulate, of animals",2188
72295,00980071,v,9,mate a hybrid of the first generation with one of its parents,2188
72302,00981318,v,9,kiss lightly,1703
72296,00980199,v,9,breed animals or plants using parents of different races and varieties,"2172,2188"
72298,00980523,v,9,get sexual gratification through self-stimulation,"1502,1703"
72299,00980723,v,9,masturbate while strangling oneself,"1502,1703"
72301,00981180,v,9,"touch lightly or gently: ""the blossoms were kissed by the soft rain""",
72303,00981408,v,9,"touch or stroke lightly: ""The grass tickled her calves""",
72309,00982269,v,9,carry in a bucket,1946
72281,00978092,v,9,"have sex with; archaic use: ""He had taken this woman when she was most vulnerable""",1703
72304,00981543,v,9,pass the tongue over,
72305,00981657,v,9,lick or explore with the tongue,
72306,00981760,v,9,touch with the mouth,
72300,00980821,v,9,"touch with the lips or press the lips (against someone's moth or other body part) as an expression of love, greeting, etc; ""The newly married couple kissed""; ""She kissed her grandfather on the forehead when she entered the room""",1703
72308,00982141,v,9,"carry away rapidly and secretly, as if mysteriously",
72318,00983791,v,9,"send from one person or place to another: ""transmit a message""",1935
72310,00982350,v,9,"make a return, as of a punt or a kickback, in football","1946,2871"
72313,00982881,v,9,"be accompanied by: ""Can I bring my cousing to the dinner?""",
72312,00982792,v,9,of trained dogs,"1935,2188"
72326,00984973,v,9,"throw out onto a flat surface, as of die: ""Throw a six""",1935
72315,00983429,v,9,carry off mysteriously; as if by magic,
72316,00983557,v,9,take away quickly and suddenly,
72317,00983683,v,9,brush or wipe off lightly,
72319,00984089,v,9,"transfer from one domain into another, as of ideas and principles",1935
72321,00984362,v,9,bring to a certain spiritual state,1935
72324,00984719,v,9,"release contained air or gas from: ""deflate the air mattress""","1935,2111"
72322,00984463,v,9,"bring in through pipes, as of liquids such as oil",1946
72323,00984577,v,9,release something from a container,1935
72280,00977560,v,9,"have sexual intercourse with: ""This student sleeps with everyone in her dorm""; ""Adam knew Eve"" (know is archaic); ""Were you ever intimate with this man?""",1703
72325,00984845,v,9,"collapse by releasing contained air or gas: ""deflate a balloon""",
72320,00984219,v,9,"transmit, as in physics: ""propagate sound or light through air, for example""",1935
72307,00981851,v,9,"move while holding up or supporting: ""Bear gifts""; ""bear a heavy load""; also with communication nouns: ""bear news""; ""bearing orders""",1946
72381,00994370,v,9,"pull away from the body, of muscles",
72275,00976853,v,9,"hold (a person or thing) close, as for affection, comfort, or warmth; ""I cuddled the baby""",
72328,00985399,v,9,"mail in; cause to be delivered: ""Send in your comments""",1935
72334,00986223,v,9,"serve somebody with a warrant or summons: ""He was processed by the sheriff""","1802,1935"
72332,00985935,v,9,"bring to a destination, make a delivery",1934
72333,00986127,v,9,deliver to the wrong address,1934
72337,00987038,v,9,"capture again, as of an escaped prisoner",1802
72335,00986409,v,9,"cause to come into a particular state or condition: ""Long hard years of on the job training had brought them to their competence""; ""bring water to the boiling point""",
72336,00986697,v,9,"take hold of so as to seize or restrain or stop the motion of: ""Catch the ball!"" ""Grab the elevator door!""",
72338,00987154,v,9,"to grasp hastily or eagerly: ""Before I could stop him the dog snatched the ham bone""",
72366,00991333,v,9,"bite or chew on with the teeth: ""gnaw an old cracker""; ""chewed on a cookie""",1957
72340,00987476,v,9,"move forward or upward in order to touch; also in a metaphorical sense: ""Government reaches out to the people""",
72339,00987365,v,9,seize or catch with a swooping motion,
72341,00987679,v,9,"seize on its way, such as a letter: ""intercept a messenger""",
72342,00987838,v,9,"cut off and stop: ""The bicyclist was cut out by the van""",
72343,00987993,v,9,"make a small hole into: ""The nurce pricked my finger to get a small blood sample.""",
72344,00988164,v,9,"make a hole into: ""The needle pierced her flesh""",
72345,00988428,v,9,"penetrate or cut, as with a knife: ""The fork bit into the surface""",
72351,00989353,v,9,"attack with or as if with a pickaxe of ice or rocky ground, for example: ""Pick open the ice""",
72346,00988556,v,9,penetrate or cut through with a sharp instrument,
72347,00988821,v,9,pierce with something pointed,
72348,00988921,v,9,pierce with a thrust,
72349,00989012,v,9,pierce with a peg; knock or thrust a peg into,
72358,00990205,v,9,"move or pour through a funnel: ""funnel the liquid into the small bottle""",
72352,00989536,v,9,make a hole into,
72353,00989635,v,9,drill a hole into,"1787,2415"
72354,00989766,v,9,drill in an opposite direction,"1787,2415"
72355,00989875,v,9,make a small hole in something as a guide for a drill,
72356,00990006,v,9,cut a hole with a trepan; in surgery,"1787,2259"
72357,00990114,v,9,force a way through,
72359,00990349,v,9,"pierce with a sharp stake or point: ""impale a shrimp on a skewer""",
72360,00990550,v,9,"drive a skewer through: ""skewer the meat for the BBQ""",
72361,00990674,v,9,"pierce with a pin: ""pin down the butterfly""",
72362,00990820,v,9,"pierce with a spear: ""spear fish""",
72363,00990924,v,9,stab or pierce with a horn or tusk; of animals,2188
72331,00985859,v,9,send by pouch,1935
72364,00991039,v,9,wound by piercing with a sharp or penetrating object or instrument,
72330,00985690,v,9,"send via the postal service: ""I'll mail you the check tomorrow""",1935
72367,00991496,v,9,"bite off with a quick bite: ""The dog snapped off a piece of cloth from the intruder's pants""",
72368,00991672,v,9,"to grip, cut off, or tear with or as if with the teeth or jaws: ""Gunny invariably tried to bite her""",
72369,00991951,v,9,"give a small sharp bite to: ""The Queen's corgies always nip at her staff's ankles""",
72370,00992094,v,9,"bite off very small pieces: ""She nibbled on her cracker""",
72371,00992230,v,9,"move or swing back and forth: ""She waved her gun.""",
72373,00992533,v,9,"exert pressure or force to or upon: ""He pressed down on the boards""; ""press your thumb on this spot""",
72372,00992400,v,9,send a signal by waving a flag or a light according to a certain code,
72374,00992836,v,9,"press firmly: ""He squeezed my hand""",
72375,00993032,v,9,"cause to move along the ground by pulling: ""draw a wagon""; ""pull a sled""",
72379,00994067,v,9,"move to a rearward position; pull towards the back: ""Pull back your arms!""",
72376,00993655,v,9,move or pull with a sudden motion,
72377,00993794,v,9,twitch the hook of a fishing line through or along the surface of water,
72378,00993930,v,9,"drag along, either literally or metaphorically, as in one's wake",
72380,00994232,v,9,"draw a limb towards the body: ""adduct the thight muscle""",
72329,00985527,v,9,"transmit by mail: ""The company mailed out the catalog to all potential customers""",1935
72365,00991175,v,9,"of insects, scorpions, or other animals: ""A bee stung my arm yesterday.""",2188
72400,00997858,v,9,"carry with difficulty: ""You'll have to lug this suitcase""",1946
72388,00995825,v,9,"take away by means of a vehicle: ""They carted off the old furniture""",
72387,00995727,v,9,transport something in a cart,1946
72391,00996361,v,9,"transport, as in a truck",1946
72390,00996181,v,9,"fly people or goods to or from places not accessible by other means: ""Food is airlifted into Bosnia""",1942
72393,00996730,v,9,"pluck, as a string of an instrument: ""He twanged his bow""",2536
72386,00995576,v,9,carry someone against his will upside down such that each limb is held by one person,1946
72385,00995437,v,9,"carry, as on one's back; ""Pack your tents to the top of the mountain""",1946
72425,01001553,v,9,obtain by a fractional process; in chemistry,2111
72394,00996850,v,9,"pull hard: ""The prisoner tugged at the chains""; ""This movie tugs at the heart strings""",
72395,00997005,v,9,"pull or strain hard at: ""Each oar was tugged by several men""",
72396,00997134,v,9,"move by pulling hard: ""The horse finally tugged the cart out of the mud""",
72397,00997275,v,9,"pull, as against a resistance: ""The sleigh was drawn by four reindeer""; ""These worries were dragging at him""",
72398,00997523,v,9,"pull along heavily, like a heavy load against a resistance: ""Can you shlep this bag of potatoes upstairs?""",
72389,00996002,v,9,"transport by aeroplane: ""We fly flowers from the Carribean to North America""",1942
72399,00997740,v,9,drag loosely along a surface; allow to sweep the ground,
72401,00997989,v,9,"drag behind: ""Horses used to tow barges along the canal""",
72403,00998260,v,9,"tow (a vessel) with a tug; ""The tugboat tugged the freighter into the harbor""",
72402,00998158,v,9,"drag heavily or wearily, as of the body",
72404,00998398,v,9,"draw slowly or heavily: ""haul stones""; ""haul nets""",
72406,00998639,v,9,"raise or haul up with or as if with mechanical help: ""hoist the bicycle onto the roof of the car""",
72405,00998550,v,9,haul with a tackle,
72413,00999598,v,9,"sever or remove by pinching of snipping: ""nip off the flowers""",
72407,00998871,v,9,hoist up or in and lash or secure with a small rope,
72408,00999004,v,9,"raise with a line, as of a window shade",
72409,00999117,v,9,"raise, as of flags or sails",
72410,00999216,v,9,lift with difficulty,
72412,00999476,v,9,test the weight of something by lifting it,2053
72418,01000356,v,9,of the edge of a coin,1787
72414,00999780,v,9,"squeeze tightly between the fingers: ""He pinched her behind""; ""She squeezed the bottle""",
72419,01000439,v,9,"pass through: ""Water permeated sand easily""",
72415,00999992,v,9,make ridges into by pinching together,
72416,01000126,v,9,form flutes in,
72417,01000203,v,9,"make a groove in, or provide with a groove, as of a record, for example",
72421,01000791,v,9,"prepare in a percolator, of coffee",1957
72422,01000892,v,9,"remove by passing through a filter: ""filter out the impurities""",
72420,01000605,v,9,"cause to pass through a permeable substance in order to extract a soluble constituent, as of solvents",
72432,01002428,v,9,fuse or cause to grow together,1794
72423,01001075,v,9,"divide into components or constituents: ""Separate the wheat from the chaff""",
72433,01002550,v,9,"combine so as to form a whole; mix: ""compound the ingredients""",
72424,01001458,v,9,separate (a metal) from an ore,
72426,01001666,v,9,separate into constituents or fractions containing concentrated constituents; in chemistry,2111
72411,00999353,v,9,heave up an anchor in preparation for sailing,1946
72427,01001825,v,9,make a concoction (of) my mixing,
72428,01001922,v,9,"separate by sifting, as of flour; also used for information",
72429,01002140,v,9,sift anew,
72430,01002213,v,9,"separate with a riddle, as grain from chaff",
72431,01002329,v,9,separate from chaff; of grain,"2314,2876"
72392,00996507,v,9,"pull lightly but sharply with a plucking motion, as of guitar strings: ""he plucked the strings of his mandolin""",2536
72434,01002760,v,9,combine (a radio frequency wave) with a locally generated wave of a different frequency so as to produce a new frequency equal to the sum or the difference between the two,
72435,01002999,v,9,combine with sulfur,
72383,00994693,v,9,"be flexible under stress of physical force: ""This material doesn't give""",
72439,01003753,v,9,"twist together or entwine into a confusing mass: ""The child entangled the cord""",
72442,01004273,v,9,"extricate from entanglement: ""Can you disentangle the cord?""",
72440,01004001,v,9,"mat together and make felt-like, as of material",
72441,01004110,v,9,entangle or catch in in or as if in a mesh,
72443,01004509,v,9,"disentangle and raise the fibers of: ""tease wool""",
72444,01004644,v,9,"put into a proper or systematic order: ""arrange the flowers in the vase""",
72446,01005500,v,9,"arrange or fix in the desired order: ""She settled the teacart""",
72445,01005330,v,9,"arrange (open windows) on a computer desktop so that they overlap each other, with the title bars visible",
72451,01006090,v,9,"destroy the arrangment or order of: ""My son disarranged the papers on my desk""",
72447,01005626,v,9,arrange or build up as if on the base of a pyramid,
72448,01005741,v,9,arrange wagons so that they form a corral,
72449,01005846,v,9,"arrange in a series of rings or chains, as for spores",
72450,01005978,v,9,"provide with decoration, as of windows",
72452,01006316,v,9,"lie adjacent to another: ""Canada adjoins the U.S.""",
72453,01006503,v,9,"extend on all sides of simultaneously; encircle: ""The forest surrounds my property""",
72457,01007120,v,9,"put out or expel from a place: ""The child was expelled from the classroom""",
72455,01006889,v,9,put a girdle on or around,
72458,01007447,v,9,"eject from the premises: ""The ex-boxer's job is to bounce people who want to enter this private club""",
72461,01007880,v,9,"ask to enter: ""We invited the neighbors in for a cup of coffee""",
72459,01007612,v,9,place on top of,
72466,01008658,v,9,"in Christianity: take up someone's soul into heaven; ""This is the day when May was assumed into heaven""",1565
72462,01008034,v,9,"summon to enter: ""The nurse called in the next patient""",
72464,01008263,v,9,"express willingness to have in one's home or environs; ""The community warmly received the refugees""",
72463,01008154,v,9,"receive someone, as into one's house",
72465,01008490,v,9,"receive as a specified guest: ""the doctor will see you now""; ""The minister doesn't see anybody before noon""",
72481,01011169,v,9,"release by a toggle switch, of a bomb from an airplane",1781
72468,01008943,v,9,"take (someone) against his will for compulsory service, esp. on board a ship; ""The men were shanghaied after ebing drugged""",
72467,01008825,v,9,of people,
72469,01009142,v,9,"take arbitrarily or by force: ""The Cubans commandeered the plane and flew it to Miami""",
72470,01009365,v,9,"take someone's car from him by force; ""My car was carjacked last night!""",
72472,01009652,v,9,"throw together in a confused mass: ""They tumbled the teams with no apparent pattern""",
72471,01009511,v,9,bring into random order,
72475,01010142,v,9,"mess around, as in a liquid or paste: ""The children are having fun puddling in paint""",
72473,01009808,v,9,move around aimlessly,
72474,01009942,v,9,"do random, unplanned work or activities",
72476,01010299,v,9,"make messy or untidy: ""the child mussed up my hair""",
72477,01010429,v,9,"disarrange or rumple; dishevel: ""The strong wind tousled my hair""",
72480,01010821,v,9,"release, as from one's hands; ""Let go of the door handle, please!""",
72478,01010586,v,9,lay out in a line,
72479,01010720,v,9,lay out in parts according to a plan,
72485,01011620,v,9,"turn loose or free from restraint: ""let loose mines""; ""Loose terrible plagues upon humanity""",
72456,01006993,v,9,expel from one's property; force to move out,1707
72482,01011287,v,9,remove the hand from,
72483,01011371,v,9,"bring out of some state, for example",
72484,01011492,v,9,"release or vent, as of emotions and reactions",
72489,01012198,v,9,"obstruct the air passage of: ""The foul air was slowly suffocating the children""",
72486,01011821,v,9,"release, as of emotions",
72487,01011908,v,9,"release from a leash, as of dogs",
72488,01012013,v,9,free or remove obstruction from,
72490,01012352,v,9,"block passage through: ""obstruct the path""",
72460,01007733,v,9,"superimpose a three-dimensional surface on a plane without stretching, in geometry",2066
72438,01003631,v,9,"mix or blend: ""His book commingles sarcasm and sadness""",
72492,01012805,v,9,block off the passage through,
72493,01012924,v,9,"prevent from entering, as of light",
72495,01013218,v,9,"block with earth, as after a landslide",
72497,01013580,v,9,"bar access to: ""Due to the accident, the road had to be closed for several hours""",
72498,01013724,v,9,"become or cause to become obstructed: ""The leaves clog our drains in the Fall""; ""The water pipe is backed up""",
72499,01014058,v,9,"become obstructed or chocked up: ""The drains clogged up""",
72500,01014187,v,9,"become or cause to become unobstructed: ""The chemical that we poured down the drain unclogged it""",
72501,01014382,v,9,"obstruct, as of a passage: ""My nose is all stuffed""; ""Her arteries are blocked""",
72503,01014692,v,9,"cause to become unblocked: ""The medicine unstuffed my nose in minutes!""",
72507,01015351,v,9,capture anew,2188
72504,01014866,v,9,"capture or kill, as in hunting: ""bag a few pheasants""","2188,2656"
72505,01014980,v,9,catch birds by temporarily blinding them,"2188,2656"
72506,01015085,v,9,"capture as if by hunting, snaring, or trapping: ""I caught a rabbit in the trap toady""",2188
72520,01017226,v,9,"enclose in a shrine, as of an object for religious purposes",1565
72508,01015438,v,9,"catch rats, esp. with dogs","2188,2656"
72509,01015525,v,9,"catch in or as if in a trap: ""The men trap foxes""",2188
72511,01015779,v,9,"hang freely: ""The secret police suspended their victims from the ceiling and beat them""",
72512,01015949,v,9,"cause to be hanging or suspended: ""Hang that picture on the wall""",
72513,01016146,v,9,"place in position as by a hinge so as to allow free movement in one direction: ""hang a door""",
72514,01016300,v,9,"be placed in position as by a hinge: ""This cabinet door doesn't hang right!""",
72515,01016420,v,9,"be suspended or poised: ""Heavy fog hung over the valley""",
72516,01016520,v,9,"be suspended or hanging: ""The flag hung on the wall""",
72517,01016676,v,9,"cause to dangle or hang freely: ""He dangled the ornaments from the Christmas tree""",
72518,01016822,v,9,"arrange in a container: ""pack the books into the boxes""",
72519,01017063,v,9,"package in a container: ""The cargo was containerized for safe and efficient shipping""",
72522,01017466,v,9,"to obscure, or conceal with or as if with a veil: ""a conspiracy of silence veiling it""",
72510,01015691,v,9,"trap with a gin: ""gin game""",2188
72521,01017368,v,9,load with a pack,
72523,01017658,v,9,"remove the veil from: ""Women must not unveil themselves in public in Islamic societies""",
72524,01017835,v,9,"remove the cover from: ""unveil a painting""",
72525,01017942,v,9,"compress into a wad: ""wad paper into the box""",
72529,01018589,v,9,"seal with packing: ""pack the faucet""",
72526,01018118,v,9,"work a wet mixture, such as concrete or mud",
72528,01018491,v,9,form into one cluster,
72530,01018687,v,9,"apply a lubricant to: ""lubricate my car""; ""grease the wheels""","1787,1946"
72531,01018832,v,9,"put into a box: ""box the gift, please""",
72532,01018959,v,9,"remove from a box: ""unbox the presents""",
72534,01019165,v,9,"remove from its packing: ""unpack the presents""",
72533,01019079,v,9,put into a case,
72538,01019665,v,9,"put in a sack: ""The grocer sacked the onions""",
72535,01019384,v,9,take from stowage in preparation for usage,
72536,01019493,v,9,put into a bag,
72537,01019586,v,9,put into a pouch,
72539,01019791,v,9,"enclose in, or as if in, a case ""my feet were encased in mud.""",
72540,01020004,v,9,"put into a crate; as for protection: ""crate the paintings before shipping them to the museum""",
72541,01020178,v,9,"remove from the crate: ""uncrate the glassed carefully!""",
72542,01020316,v,9,"make into a bundle: ""he bundled up his few possessions""",
72543,01020458,v,9,"straighten by unrolling: ""roll out the big map""",
72547,01020965,v,9,"take the burden off; remove the burden from: ""unburden the donkey""",
72544,01020584,v,9,weight down with a load,
72545,01020792,v,9,load with excessive weight,
72546,01020886,v,9,weight with lead,
72502,01014575,v,9,"become chocked with silt, of rivers and lakes",2119
100681,N0000400,n,10,,
72496,01013332,v,9,"render unsuitable for passage: ""block the way""; ""barricade the streets""",
72550,01021384,v,9,"place a load on: ""Load the cart with apples""",
72553,01021803,v,9,"fill to an excessive degree: ""The air was surcharged with tension""",
72566,01023651,v,9,"attach a yoke or harness to, as of a draft animal",2188
72552,01021688,v,9,place too much a load on,
72554,01021936,v,9,"become overloaded: ""The aerator overloaded""",
72555,01022027,v,9,"load to capacity: ""charge the wagon with hay""",
72560,01022755,v,9,"fill or load: ""load a car""",
72556,01022242,v,9,load with goods for transportation,
72557,01022341,v,9,remove the charge from,
