59531,09922737,n,9,"space for movement: ""room to pass""; ""make way for"": ""hardly enough elbow room to turn around""",
59532,09923044,n,9,"sufficient room for easy breathing or movement: ""moved to the country to find breathing room""",
59534,09923355,n,9,"space for accommodation in a house: ""I wouldn't give that table houseroom""",
59533,09923216,n,9,vertical space available to allow easy passage under something,
59535,09923485,n,9,space sought for occupation by a nation whose population is expanding,
59505,09918904,n,9,"a quantity that can be processed or transported at one time: ""the system broke down under excessive loads""",1946
59537,09923765,n,9,space for maneuver at sea,
59484,09916489,n,9,"the amount that a shelf will hold: ""he bought a shelfful of books""",
59562,09928265,n,9,"an operator that leaves unchanged the element on which it operates: ""the identity under numerical multiplication is 1""",2873
59546,09925062,n,9,"(""relationship"" is often used where ""relation"" would serve (as in ""the relationship between inflation and unemployment"")) preferred usage of ""relationship"" is for human relations or states of relatedness; ""the relationship between mothers and children""",
59543,09924669,n,9,a measure of alcoholic strength expressed as an integer twice the percentage of alcohol present (by volume),"1951,2111"
59544,09924828,n,9,mutual dealings or connections or communications among persons or groups,
59545,09924967,n,9,the relation between causes and effects,
59547,09925412,n,9,"a relation such that one thing is dependent on another: ""height is a function of age""; ""price is a function of supply and demand""",
59551,09926062,n,9,"the formation of a close personal relationship between men: ""the rituals known as male bonding do not necessarily involve drinking beer together""",
59548,09925596,n,9,a relation between persons,
59549,09925728,n,9,a close personal relationship that forms between people (as between husband and wife or parent and child),
59550,09925941,n,9,the formation of a close personal relationship between women,
59552,09926266,n,9,"the attachment that forms between an infant and its mother beginning at birth: ""maternal-infant bonding influences the child's psychological and physical development""",
59561,09928113,n,9,an operator that obeys the distributive law: A(f+g) = Af + Ag (where f and g are function),2873
59553,09926502,n,9,a relation between logical propositions,"1451,2873"
59555,09926856,n,9,a mathematical relation such that each element of one set is associated with at least one element of another set,2873
59556,09927173,n,9,the function obtained by expressing the dependent variable of one function as the independent variable of another; f and g are inverse functions if f(x)=y and g(y)=x,2873
59560,09927920,n,9,"(mathematics) a symbol that represents a function from functions to functions; ""the integral operator""",2873
59558,09927564,n,9,a transformation that is a combination of single transformations such as translation or rotation or reflection on an axis,2873
59559,09927753,n,9,a function such that for every element of one set there is a unique element of another set,2873
59563,09928477,n,9,function of an angle expressed as a ratio of the sides of right-angled triangle containing the angle,2873
59542,09924436,n,9,"the number of inhabitants in a given place (country or city etc.); ""people come and go, but the population of this town has remained approximately constant for the past decade""",1820
59557,09927401,n,9,a function that changes the position or direction of the axes of a coordinate system,2873
59577,09930416,n,9,"the basis on which something is grounded: ""there is little foundation for his objections""",
59564,09928774,n,9,ratio of the opposite side to the hypotenuse,2873
59565,09928869,n,9,ratio of the adjacent side to the hypotenuse,2873
59566,09928966,n,9,ratio of the opposite to the adjacent side,2873
59567,09929062,n,9,ratio of the adjacent to the opposite side,2873
59568,09929160,n,9,ratio of the hypotenuse to the adjacent side,2873
59569,09929257,n,9,ratio of the hypotenuse to the opposite side,2873
59570,09929356,n,9,a function that takes the value 1 if a specified function of the arguments exceeds a given threshold and 0 otherwise,2873
59571,09929537,n,9,a function in which an independent variable appears as an exponent,2873
59572,09929684,n,9,an equation involving exponential functions of a variable,2873
59574,09929906,n,9,a mathematical expression consisting of the constant e raised to some power,2873
59573,09929808,n,9,a graph of an exponential function,
59575,09930050,n,9,a series derived from the expansion of an exponential expression,2873
59541,09924294,n,9,"the amount that can be contained: ""the gas tank has a capacity of 12 gallons""",1951
59578,09930598,n,9,"a relation that provides the foundation for something: ""they were on a friendly footing"" or ""he worked on an interim basis""",
59580,09930938,n,9,"the essential foundation or source: ""the problem was attacked at the grass roots""",
59579,09930810,n,9,a basis agreed to by all parties for reaching a mutual understanding,
59581,09931077,n,9,"a relation between things or events (as in the case of one causing the other or sharing features with it); ""there was a connection between eating that pickle and having that nightmare""",
59554,09926676,n,9,a relation between mathematical expressions (such as equality or inequality),2873
59825,09972198,n,9,a reciprocal relation between two or more things,
59540,09924164,n,9,"a relative amount: ""mix one volume of the solution with ten volumes of water""",
59583,09931775,n,9,an associative relation,
59584,09931870,n,9,the means of connection between things linked in series,
59586,09932233,n,9,"the linking together of a consecutive series of symbols or events or ideas etc: ""it was cause by an improbable concatenation of circumstances""",
59587,09932435,n,9,"something resembling a bridge in form or function: ""his letters provided a bridge across the centuries""",
59588,09932591,n,9,"a connection of inclusion or containment: ""he escaped involvement in the accident""; ""there was additional involvement of the liver and spleen""",
59589,09932827,n,9,"a relation implicated by virtue of involvement or close connection (especially an incriminating involvement); ""he was suspected of implication in several robberies""",
59590,09933049,n,9,"the relation of comprising something: ""he admired the inclusion of so many ideas in such a short work""",
59597,09934069,n,9,"(usually preceded by ""with"") relation of delimitation; ""he inquired with respect to the address""",
59591,09933223,n,9,the lack of a connection between things,
59592,09933378,n,9,the relation of something to the matter at hand,
59593,09933601,n,9,relevance requiring careful consideration,
59594,09933718,n,9,persuasive relevance,
59595,09933792,n,9,a style in speech or writing that arrests attention and has a penetrating or convincing quality or effect,
59596,09933949,n,9,pertinence by virtue of a close relation to the matter at hand,
59599,09934446,n,9,"a particular manner of connectedness: ""the relatedness of all living things""",
59598,09934263,n,9,relevance by virtue of being applicable to the matter at hand,
59600,09934616,n,9,"relevant relation or interconnection: ""those issues have no bearing on our situation""",
59606,09935484,n,9,a linguistic relation established by grammar,1974
59601,09934755,n,9,the lack of a relation of something to the matter at hand,
59602,09934938,n,9,irrelevance by virtue of being inapplicable to the matter at hand,
59603,09935083,n,9,complete irrelevance requiring no further consideration,
59604,09935216,n,9,the lack of any particular manner of connectedness,
59605,09935362,n,9,unrelatedness by virtue of falling outside the matter at hand,
59607,09935847,n,9,a relation between linguistic forms or constituents,1969
59608,09936000,n,9,the determination of grammatical inflection on the basis of word relations,1974
59609,09936212,n,9,"agreement in number between words in the same grammatical construction (e.g., between adjectives and the nouns they modify)",1974
59610,09936398,n,9,agreement in person between pronouns and verbs,1974
59611,09936507,n,9,agreement in grammatical case between words in the same construction,1974
59612,09936636,n,9,agreement in grammatical gender between words in the same construction,1974
59613,09936769,n,9,the grammatical relation created by a transitive verb,1974
59614,09936916,n,9,the grammatical relation created by an intransitive verb,1974
59615,09937070,n,9,the grammatical relation between two words that have a common referent,1974
59616,09937216,n,9,the coreferential relation between a reflexive pronoun and its antecedent,1974
59618,09937626,n,9,the coordination by conjunction of linguistic units of the same status,1974
59619,09937767,n,9,the subordination that occurs when a conjunction makes one linguistic unit a constituent of another,1974
59620,09937938,n,9,the conjunctive relation of units that expresses the addition of their meanings,1974
59621,09938086,n,9,the conjunctive relation of units that expresses the disjunction of their meanings,1974
59622,09938238,n,9,the conjunctive relation of units that expresses the opposition of their meanings,1974
59623,09938389,n,9,the grammatical relation of a word or phrase to a predicate,1974
59624,09938510,n,9,the grammatical relation of two constituents having the same grammatical form,1974
59625,09938646,n,9,the grammatical relation of a modifying word or phrase to its head,1974
59626,09938772,n,9,the grammatical relation that exists when a word qualifies the meaning of the phrase,1974
59629,09939326,n,9,verb inflections that express how the action or state is conceived by the speaker,1974
59627,09938975,n,9,"modification that makes the meaning more specific (""red hat"" has a more specific meaning than ""hat"")",1974
59628,09939137,n,9,"a grammatical relation between a word and a noun phrase that follows: """"Rudolph the red-nosed reindeer"" is an example of apposition""",1974
59585,09931984,n,9,"a connection allowing access between persons or places: ""how many lines of communication can there be among four people?""; ""a secret passageway provided communication between the two rooms""",
59634,09940276,n,9,some linguists consider interrogative sentences to constitute a mood,1974
59658,09944446,n,9,"a progressive tense used to express action that will be on-going in the future; """"I will be running"" is an example of the future progressive""",1974
59631,09939785,n,9,a mood that represent an act or state (not as a fact but) as contingent or possible,1974
59636,09940596,n,9,the relation between an anaphor and its antecedent,1974
59637,09940711,n,9,(linguistics) the grammatical relation of the subject of a verb to the action that the verb denotes,1974
59638,09940898,n,9,the voice used to indicate that the subject of the verb is performing the action or causing the happening denoted by the verb,1974
59639,09941109,n,9,the voice used to indicate that the subject of the verb is the recipient (not the source) of the action denoted by the verb,1974
59640,09941320,n,9,a change in the form of a word (usually by adding a suffix) to indicate a change in its grammatical function,1974
59641,09941551,n,9,the inflection of verbs,1974
59642,09941651,n,9,the inflection of nouns and pronouns and adjectives,1974
59643,09941778,n,9,systematic arrangement of all the inflected forms of a word,1974
59644,09941892,n,9,the beginning or duration or completion or repetition of the action of a verb,1974
59645,09942076,n,9,the aspect of a verb that expresses a completed completed action,1974
59646,09942217,n,9,aspect without regard to the beginning or completion of the action of the verb,1974
59647,09942376,n,9,the aspect of a verb that expresses its duration,1974
59648,09942533,n,9,the aspect of a verb that expresses its on-going action,1974
59649,09942653,n,9,aspect with regard to the beginning of the action of the verb,1974
59650,09942778,n,9,a tense of verbs used in describing action that is on-going,1974
59651,09943018,n,9,a tense used to express action that is on-going at the time of utterance,1974
59652,09943184,n,9,a tense of verbs used in describing action that has been completed (sometimes regarded as perfective aspect),1974
59654,09943658,n,9,a term formerly used to refer to the simple past tense,1974
59632,09939945,n,9,a mood (as in Greek or Sanskrit) that expresses a wish or hope; expressed in English by modal verbs,1974
59659,09944679,n,9,a relation between meanings,1969
59653,09943448,n,9,"a perfective tense used to express action completed in the present: """"I have finished"" is an example of the present perfect""",1974
59663,09945394,n,9,the semantic relation that holds between two words that can (in a given context) express opposite meanings,1969
59668,09946426,n,9,"a small part that can be considered separately from the whole: ""it was perfect in all details""",
59660,09944896,n,9,the semantic relation of being subordinate or belonging to a lower rank or class,1969
59661,09945047,n,9,the semantic relation of being superordinate or belonging to a higher rank or class,1969
59662,09945204,n,9,the semantic relation that holds between two words that can (in a given context) express the same meaning,1969
59657,09944221,n,9,"a perfective tense used to describe action that will be completed in the future: """"I will have finished"" is an example of the future perfect""",1974
59664,09945555,n,9,the semantic relation that holds between a whole and its parts,1969
59665,09945697,n,9,the semantic relation that holds between a part and the whole,1969
59666,09945857,n,9,the semantic relation of being a manner of does something,1969
59656,09944007,n,9,"a progressive tense used to describe on-going action in the past; """"I had been running"" is an example of the past progressive""",1974
59669,09946611,n,9,"the most interesting or memorable part: ""the highlight of the tour was our visit to the Vatican""",
59670,09946775,n,9,"an individual or group or structure or other entity regarded as a structural or functional constituent of a whole: ""the reduced the number of units and installations""; ""the word is a basic linguistic unit""",
59671,09947031,n,9,"anything that belongs to a set or class: ""snakes are members of the class Reptilia""; ""members of the opposite sex""",
59673,09947291,n,9,"something left after other parts have been taken away: ""there was no remainder""; ""he threw away the rest""",
59672,09947198,n,9,the stuff of which an object consists,
59633,09940115,n,9,a mood that expresses an intention to influence the listener's behavior,1974
59674,09947509,n,9,a small part or portion that remains after the main part no longer exists,
59675,09947647,n,9,a part of a part,
100641,N0000335,n,10,,
59655,09943779,n,9,"a perfective tense used to express action completed in the past: """"Ihad finished"" is an example of the past perfect""",1974
59677,09948047,n,9,relation of mutual understanding or trust between people,
59679,09948376,n,9,sympathy of each person for the other,
59699,09951604,n,9,"the ratio between the size of something and a representation of it: ""the scale of the map""; ""the scale of the model""",1951
59684,09949486,n,9,a family relationship by virtue of remarriage,1675
59682,09949111,n,9,the kinship relation between an individual and the individual's progenitors,"1675,2794"
59683,09949316,n,9,kinship by marriage or adoption; not a blood relationship,"1675,2794"
59686,09949716,n,9,the kinship relation of an offspring to the parents,1675
59685,09949594,n,9,related by blood,"1675,2794"
59687,09949831,n,9,the kinship relation between an offspring and the father,1675
59688,09949956,n,9,the kinship relation between an offspring and the mother,1675
59689,09950081,n,9,the kinship relation between a female offspring and the siblings,1675
59690,09950234,n,9,the kinship relation between a male offspring and the siblings,1675
59695,09950928,n,9,a relation between magnitudes,2076
59691,09950354,n,9,line of descent traced through both the maternal and paternal sides of the family,"1675,2794"
59692,09950499,n,9,line of descent traced through one side of the family,"1675,2794"
59693,09950653,n,9,line of descent traced through the maternal side of the family,"1675,2794"
59694,09950796,n,9,line of descent traced through the paternal side of the family,"1675,2794"
59697,09951183,n,9,the quotient obtained when the magnitude of a part is divided by the magnitude of the whole,1951
59680,09948499,n,9,"(biology) state of relationship between organisms or groups of organisms resulting in resemblance in structure or structural parts: ""in anatomical structure prehistoric man shows close affinity with modern humans""",2158
59698,09951476,n,9,the proportion of a substance that is contained in a mixture or alloy etc.,1951
59707,09953047,n,9,the percentage of all rental units (as in hotels) are occupied or rented at a given time,1753
59705,09952653,n,9,"(an extension of the baseball term) the proportion of times some effort succeeds; ""the salesman's batting average was 7 out of 12""",2871
59701,09951985,n,9,the relation of correspondence in degree or size or amount,
59702,09952143,n,9,a proportion multiplied by 100,
59703,09952367,n,9,the percentage of workers who do not report to work,
59681,09948791,n,9,state of relatedness or connection by blood or marriage or adoption,1675
59706,09952845,n,9,(baseball) the percentage of times a fielder handles a batted ball properly; number of assists and putouts divided by the number of chances,2871
59696,09951076,n,9,"relative magnitude: ""they entertained on a grand scale""",1951
59708,09953196,n,9,the percentage of all rental units (as in hotels) that are unoccupied or not rented at a given time,1753
59709,09953354,n,9,the percentage of the work force that is unemployed at any given date,1787
59710,09953487,n,9,the relative magnitudes of two quantities (usually expressed as a quotient),1951
59711,09954118,n,9,the ratio of reflected to incident light,2097
59712,09954230,n,9,the ratio of the width to the height of a tv picture,2606
59713,09954341,n,9,ratio (in percent) of the maximum breadth to the maximum length of a skull,2233
59714,09954508,n,9,the ratio of the output to the input of any system,1355
59715,09954615,n,9,the ratio (in percent) of the maximum width the the maximum height of the face,2233
59716,09954752,n,9,the ratio of the focal length to the diameter of a (camera) lens system,2527
59717,09954914,n,9,the ratio of the number of observations in a statistical category to the total number of observations,1951
59719,09955382,n,9,the average IQ of the adults in a given population,1502
59700,09951772,n,9,the proportional relation between two divisions of line or two dimension of a plane figure such that short : long :: long : (short + long),2873
59720,09955497,n,9,the minimal IQ required for someone to function normally and independently in the world (without some form of institutional assistance),1502
59721,09955702,n,9,the ratio of the annual claims paid by an insurance company to the premiums received,1896
59722,09955843,n,9,the ratio of the speed of a moving body to the speed of sound,2097
59723,09955962,n,9,the ratio of the size of an image to the size of the object,2102
59718,09955110,n,9,a measure of a person's intelligence as indicated by an intelligence test; the ratio of a person's mental age to their chronological age (multiplied by 100),1502
59704,09952478,n,9,(baseball) the percentage of times a batter gets a hit; number of base hits divided by the number of times at bat,2871
59729,09956992,n,9,(economics) the ratio of the quantity and quality of units produced to the labor per unit of time,1753
59728,09956846,n,9,the output power of a transducer divided by the input power,"1355,2284"
59730,09957148,n,9,the ratio of two quantities to be divided,2873
59731,09957262,n,9,the ratio of the velocity of light in a vacuum to that in a medium,2097
59733,09957625,n,9,the ratio of the volume of carbon dioxide expired to the volume of oxygen consumed by an organism or cell in a given period of time,2158
59725,09956218,n,9,the ratio of the number of miles traveled to the number of gallons of gasoline burned,1948
59734,09957823,n,9,the ratio of the breaking stress of a structure to the estimated maximum stress in ordinary use,2098
59735,09957997,n,9,the ratio of signal intensity to noise intensity,2101
59737,09958310,n,9,the ratio of the number of workers that had to be replaced in a given time period to the average number of workers,1794
59736,09958173,n,9,the ratio of the inductance of a circuit in henries to its resistance in ohms,
59738,09958495,n,9,the ratio of the gross weight of an airplane to some factor determining its lift,1946
59739,09958683,n,9,the ratio of the weight of an airplane to its engine power,1946
59740,09958801,n,9,the ratio of the weight of an airplane to its wingspan,1946
59741,09958914,n,9,the ratio of the weight of an airplane to its wing area,1946
59743,09959172,n,9,the relative incidence of a particular disease,2232
59742,09959028,n,9,the relative frequency of occurrence of something,
59763,09962919,n,9,the cardinal compass point that is at 0 or 360 degrees,"2076,2121,2772"
59745,09959513,n,9,"control by preventing the occurrence of something: ""money was allocated to study the cause and prevention of influenza""",
59746,09959689,n,9,"the spatial relation between something and the course along which it points or moves: ""he checked the direction and velocity of the wind""",
59760,09961909,n,9,"one of the four major division of the compass: ""the wind is coming from that quarter""",
59747,09960026,n,9,position or alignment relative to points of the compass or other specific directions,
59748,09960294,n,9,position of aircraft or spacecraft relative to a frame of reference (the horizon or direction of motion),
59749,09960471,n,9,attitude of an aircraft in flight when allowed to take its own orientation,
59750,09960596,n,9,something that is oriented horizontally,
59751,09960692,n,9,something that is oriented vertically,
59752,09960784,n,9,a direction opposite to another,
59753,09960926,n,9,the relation of opposition between things at right angles,
59754,09961086,n,9,the relation of opposition along a diameter,
59755,09961233,n,9,the relation of opposition between crystals or molecules that are reflections of one another,
59756,09961411,n,9,the direction from which the wind is coming,
59757,09961545,n,9,the side toward the wind,
59758,09961673,n,9,the direction in which the wind is blowing,
59759,09961805,n,9,the side sheltered from the wind,
59732,09957413,n,9,the ratio of the amount of water in the air at a give temperature to the maximum amount it could hold at that temperature; expressed as a percentage,2126
59762,09962743,n,9,one of the four main compass points,"2076,2121"
59764,09963041,n,9,the compass point that is one point east (clockwise) of due north,2121
59766,09963303,n,9,the compass point that is midway between north and northeast,2121
59765,09963172,n,9,the direction in which a compass needle points,
59767,09963448,n,9,the compass point that is one point north of northeast,2121
59769,09963709,n,9,the compass point that is one point east of northeast,2121
59761,09962048,n,9,"any of 32 horizontal directions indicated on the card of a compass: ""he checked the point on his compass""",2121
59770,09963833,n,9,the compass point midway between northeast and east,2121
59771,09963951,n,9,the compass point that is one point north of due east,2121
59773,09964184,n,9,the compass point that is one point south of due east,2121
59772,09964070,n,9,the cardinal compass point that is at 90 degrees,"2076,2121"
59768,09963574,n,9,the compass point midway between north and east; at 45 degrees,2121
100642,N0000336,n,10,,
59744,09959274,n,9,"a relation of constraint of one entity (thing or person or group) by another; ""measures for the control of disease""; ""they instituted controls over drinking on campus""",
59777,09964681,n,9,the compass point that is one point south of southeast,2121
59792,09966534,n,9,the compass point midway between north and west; at 315 degrees,2121
59778,09964807,n,9,the compass point midway between south and southeast,2121
59779,09964944,n,9,the compass point that is one point east of due south,2121
59781,09965180,n,9,the compass point that is one point west of due south,2121
59780,09965063,n,9,the cardinal compass point that is at 180 degrees,"2076,2121"
59782,09965299,n,9,the compass point midway between south and southwest,2121
59783,09965436,n,9,the compass point that is one point south of southwest,2121
59785,09965698,n,9,the compass point that is one point west of southwest,2121
59786,09965822,n,9,the compass point midway between west and southwest,2121
59787,09965940,n,9,the compass point that is one point south of due west,2121
59788,09966059,n,9,the cardinal compass point that is a 270 degrees,2121
59789,09966173,n,9,the compass point that is one point north of due west,2121
59790,09966292,n,9,the compass point midway between west and northwest,2121
59791,09966410,n,9,the compass point that is one point west of northwest,2121
59793,09966670,n,9,the compass point that is one point north of northwest,2121
59801,09967975,n,9,"a business relation in which two parties compete to gain customers: ""business competition can be fiendish at times""",1753
59794,09966796,n,9,the compass point that is midway between north and northwest,2121
59795,09966941,n,9,the compass point that is one point west of due north,2121
