58816,09823426,n,9,"a unit of length used in navigation; equivalent to the distance spanned by one second of arc in latitude; 1,852 meters","1942,1951"
58787,09818527,n,9,"a unit of length equal to one thousandth of an inch; used to specify thickness (e.g., of sheets or wire)",1951
58818,09823860,n,9,a former British unit of length once used in navigation; equivalent to 1828.8 meters (6000 feet),"1942,1951"
58819,09824018,n,9,the amount that can be bought for a halfpenny,
58820,09824136,n,9,the amount that can be bought for a penny,
58821,09824246,n,9,the basic monetary unit in many countries; equal to 100 cents,"1768,1951"
58822,09824793,n,9,the basic monetary unit in many countries; equal to 100 centimes,"1768,1951"
58823,09825306,n,9,a monetary unit that is valued at a fraction (usually one hundredth) of the basic monetary unit,"1768,1951"
58824,09825680,n,9,monetary unit in the Republic of Afghanistan,"1768,1951"
58825,09825827,n,9,the basic unit of money in Afghanistan,"1768,1951"
58826,09825938,n,9,100 puls equal 1 afghani,"1768,1951"
58827,09826031,n,9,monetary unit in Argentina,"1768,1951"
58828,09826145,n,9,the basic unit of money in Argentina; equal to 100 centavos,"1768,1951"
58829,09826277,n,9,monetary unit in Thailand,"1768,1951"
58830,09826403,n,9,the basic unit of money in Thailand,"1768,1951"
58831,09826516,n,9,100 satangs equal 1 baht,"1768,1951"
58832,09826612,n,9,monetary unit in Panama,"1768,1951"
58833,09826724,n,9,the basic unit of money in Panama; equal to 100 centesimos,"1768,1951"
58834,09826854,n,9,monetary unit in Ethiopia,"1768,1951"
58784,09818118,n,9,Chinese distance measure; approximately 0.5 kilometers,1951
58836,09827092,n,9,a fractional monetary unit of several countries,"1768,1951"
58847,09829952,n,9,the basic unit of money in Costa Rica; equal to 100 centimos,"1768,1951"
58838,09827598,n,9,a fractional monetary unit of Venezuela and Costa Rica and Equatorial Guinea and Paraguay and Spain,"1768,1951"
58841,09829264,n,9,monetary unit of Venezuela,"1768,1951"
58842,09829379,n,9,the basic unit of money in Venezuela; equal to 100 centimos,"1768,1951"
58843,09829511,n,9,monetary unit of Ghana,"1768,1951"
58844,09829637,n,9,the basic unit of money in Ghana,"1768,1951"
58845,09829739,n,9,100 pesewas equal 1 cedi,"1768,1951"
58846,09829835,n,9,monetary unit in Costa Rica,"1768,1951"
58890,09835401,n,9,a fractional monetary unit of Japan and Indonesia and Cambodia; equal to one hundredth of a yen or rupiah or riel,"1768,1951"
58848,09830103,n,9,monetary unit in El Salvador,"1768,1951"
58849,09830223,n,9,the basic unit of money in El Salvador; equal to 100 centavos,"1768,1951"
58850,09830377,n,9,monetary unit in Brazil,"1768,1951"
58851,09830488,n,9,the basic unit of money in Brazil; equal to 100 centavos,"1768,1951"
58852,09830618,n,9,monetary unit in Gambia,"1768,1951"
58853,09830745,n,9,the basic unit of money in Gambia,"1768,1951"
58854,09830850,n,9,100 bututs equal 1 dalasi,"1768,1951"
58855,09830954,n,9,monetary unit in Algeria,"1768,1951"
58856,09831065,n,9,the basic unit of money in Algeria,"1768,1951"
58857,09831206,n,9,100 centimes equal 1 dinar,"1768,1951"
58858,09831314,n,9,monetary unit in Bahrain,"1768,1951"
58859,09831427,n,9,"the basic unit of money in Bahrain; equal to 1,000 fils","1768,1951"
58860,09831569,n,9,a fractional monetary unit in Bahrain and Iraq and Jordan and Kuwait and Southern Yemen and Yemen; equal to one thousandth of a dinar,"1768,1951"
58861,09831867,n,9,monetary unit in Iraq,"1768,1951"
58862,09831972,n,9,"the basic unit of money in Iraq; equal to 1,000 fils","1768,1951"
58863,09832109,n,9,monetary unit in Jordan,"1768,1951"
58864,09832220,n,9,"the basic unit of money in Jordan; equal to 1,000 fils","1768,1951"
58865,09832363,n,9,monetary unit in Kuwait,"1768,1951"
58866,09832490,n,9,"the basic unit of money in Kuwait; equal 1,000 fils","1768,1951"
58867,09832628,n,9,worth one tenth of a Kuwaiti dinar; equal 100 fils,"1768,1951"
58868,09832786,n,9,monetary unit in Libya,"1768,1951"
58869,09832911,n,9,the basic unit of money in Libya,"1768,1951"
58870,09833029,n,9,100 dirhams equal 1 dinar,"1768,1951"
58871,09833142,n,9,monetary unit in Southern Yemen,"1768,1951"
58872,09833267,n,9,the basic unit of money in Southern Yemen,"1768,1951"
58873,09833403,n,9,monetary unit in Tunisia,"1768,1951"
58874,09833550,n,9,the basic unit of money in Tunisia,"1768,1951"
58875,09833672,n,9,100 dirhams equal 1 dinar,"1768,1951"
58876,09833806,n,9,"1,000 millimes equal 1 dinar","1768,1951"
58880,09834262,n,9,monetary unit in Morocco,"1768,1951"
58879,09834170,n,9,100 para equal 1 dinar,"1768,1951"
58885,09834923,n,9,the basic unit of money in the Bahamas,"1768,1951"
58882,09834520,n,9,monetary unit in the United Arab Emirates,"1768,1951"
58881,09834373,n,9,the basic unit of money in Morocco; equal to 100 centimes,"1768,1951"
58884,09834813,n,9,the basic unit of money in Australia and Nauru,"1768,1951"
58883,09834659,n,9,"the basic unit of money in the United Arab Emirates; equal to 1,000 fils","1768,1951"
58888,09835213,n,9,the basic unit of money in Bermuda,"1768,1951"
58886,09835023,n,9,the basic unit of money in Barbados,"1768,1951"
58887,09835120,n,9,the basic unit of money in Belize,"1768,1951"
58892,09835735,n,9,the basic unit of money in the Cayman Islands,"1768,1951"
58889,09835308,n,9,the basic unit of money in Brunei,"1768,1951"
58891,09835640,n,9,the basic unit of money in Canada,"1768,1951"
58893,09835848,n,9,the basic unit of money in Dominica,"1768,1951"
58837,09827379,n,9,a fractional monetary unit of several countries: Panama and Italy and Uruguay and Chile,"1768,1951"
58878,09834042,n,9,the basic unit of money in Yugoslavia,"1768,1951"
58877,09833907,n,9,monetary unit in Yugoslavia,"1768,1951"
58895,09836035,n,9,the basic unit of money in Grenada,"1768,1951"
58896,09836130,n,9,the basic unit of money in Guyana,"1768,1951"
58897,09836223,n,9,the basic unit of money in Hong Kong,"1768,1951"
58898,09836322,n,9,the basic unit of money in Jamaica,"1768,1951"
58899,09836418,n,9,the basic unit of money in Kiribati,"1768,1951"
58900,09836515,n,9,the basic unit of money in Liberia,"1768,1951"
58901,09836611,n,9,the basic unit of money in New Zealand,"1768,1951"
58902,09836714,n,9,the basic unit of money in Singapore,"1768,1951"
58903,09836813,n,9,the basic unit of money in Taiwan,"1768,1951"
58905,09837025,n,9,the basic unit of money in Tuvalu,"1768,1951"
58906,09837118,n,9,the basic unit of money in the United States,"1768,1951"
58907,09837270,n,9,a United States dollar deposited in a European bank and used as an international currency to finance trade,"1768,1951"
58908,09837433,n,9,the basic unit of money in Zimbabwe,"1768,1951"
58909,09837532,n,9,monetary unit in Vietnam,"1768,1951"
58910,09837663,n,9,the basic unit of money in Vietnam,"1768,1951"
58911,09837767,n,9,10 hao equal 1 dong,"1768,1951"
58912,09837855,n,9,monetary unit in Greece,"1768,1951"
58913,09837980,n,9,the basic unit of money in Greece,"1768,1951"
58914,09838086,n,9,100 lepta equal 1 drachma,"1768,1951"
58915,09838183,n,9,monetary unit on Sao Tome e Principe,"1768,1951"
58916,09838318,n,9,the basic unit of money on Sao Tome e Principe,"1768,1951"
58917,09838435,n,9,monetary unit in Equatorial Guinea,"1768,1951"
58918,09838565,n,9,the basic unit of money in Equatorial Guinea,"1768,1951"
58919,09838682,n,9,monetary unit on Cape Verde,"1768,1951"
58920,09838798,n,9,the basic unit of money on Cape Verde; equal to 100 centavos,"1768,1951"
58921,09838950,n,9,monetary unit in Portugal,"1768,1951"
58922,09839082,n,9,the basic monetary unit of Portugal; equal to 100 centavo,"1768,1951"
58923,09839250,n,9,"1 conto equals 1,000 escudos","1768,1951"
58924,09839349,n,9,monetary unit in Hungary,"1768,1951"
58925,09839497,n,9,the basic unit of money in Hungary,"1768,1951"
58926,09839603,n,9,100 filler equal 1 forint,"1768,1951"
58928,09839839,n,9,the basic unit of money in Belgium,"1768,1951"
58929,09839952,n,9,the basic unit of money in Benin,"1768,1951"
58930,09840042,n,9,the basic unit of money in Burundi,"1768,1951"
58931,09840155,n,9,the basic unit of money in Cameroon,"1768,1951"
58932,09840270,n,9,the basic unit of money in the Central African Republic,"1768,1951"
58933,09840402,n,9,the basic unit of money in Chad,"1768,1951"
58934,09840512,n,9,the basic unit of money in the Congo,"1768,1951"
58935,09840625,n,9,the basic unit of money in Djibouti,"1768,1951"
58936,09840721,n,9,the basic unit of money in France,"1768,1951"
58937,09840813,n,9,the basic unit of money in Gabon,"1768,1951"
58938,09840922,n,9,the basic unit of money in the Ivory Coast,"1768,1951"
58939,09841069,n,9,the basic unit of money in Luxembourg,"1768,1951"
58940,09841188,n,9,the basic unit of money in Madagascar,"1768,1951"
58941,09841288,n,9,the basic unit of money in Mali,"1768,1951"
58942,09841395,n,9,the basic unit of money in Niger,"1768,1951"
58943,09841504,n,9,the basic unit of money in Rwanda,"1768,1951"
58944,09841615,n,9,the basic unit of money in Senegal,"1768,1951"
58945,09841731,n,9,the basic unit of money in Switzerland,"1768,1951"
58946,09841846,n,9,the basic unit of money in Togo,"1768,1951"
58947,09841953,n,9,the basic unit of money in Burkina Faso,"1768,1951"
58948,09842096,n,9,the monetary unit in Haiti,"1768,1951"
58949,09842208,n,9,the basic unit of money in Haiti,"1768,1951"
58950,09842312,n,9,100 centimes equal 1 gourde,"1768,1951"
58951,09842420,n,9,monetary unit in Paraguay,"1768,1951"
58952,09842534,n,9,the basic unit of money in Paraguay; equal to 100 centimos,"1768,1951"
58953,09842665,n,9,monetary unit in the Netherlands,"1768,1951"
58954,09842781,n,9,the basic unit of money in the Netherlands; equal to 100 cents,"1768,1951"
58955,09842934,n,9,monetary unit in Suriname,"1768,1951"
58956,09843048,n,9,the basic unit of money in Suriname; equal to 100 cents,"1768,1951"
58957,09843175,n,9,monetary unit in Peru,"1768,1951"
58958,09843283,n,9,the basic unit of money in Peru,"1768,1951"
58960,09843501,n,9,the basic unit of money in Papua New Guinea,"1768,1951"
58961,09843614,n,9,100 toea equal 1 kina,"1768,1951"
58962,09843705,n,9,monetary unit in Laos,"1768,1951"
58963,09843830,n,9,the basic unit of money in Laos,"1768,1951"
58964,09843930,n,9,100 at equal 1 kip,"1768,1951"
58965,09844016,n,9,monetary unit in Czech and Slovak Federative Republic,"1768,1951"
58966,09844181,n,9,the basic unit of money in Czechoslovakia,"1768,1951"
58967,09844294,n,9,100 halers equal 1 koruna,"1768,1951"
58968,09844399,n,9,monetary unit in Iceland,"1768,1951"
58969,09844529,n,9,the basic unit of money in Iceland,"1768,1951"
58970,09844652,n,9,100 aurar equal 1 krona,"1768,1951"
58971,09844754,n,9,monetary unit in Sweden,"1768,1951"
58972,09844863,n,9,the basic unit of money in Sweden,"1768,1951"
58974,09845164,n,9,monetary unit in Denmark,"1768,1951"
58975,09845273,n,9,the basic unit of money in Denmark,"1768,1951"
58976,09845393,n,9,monetary unit in Norway,"1768,1951"
58977,09845504,n,9,the basic unit of money in Norway,"1768,1951"
58978,09845626,n,9,monetary unit in Malawi,"1768,1951"
58979,09845754,n,9,the basic unit of money in Malawi,"1768,1951"
58980,09845875,n,9,100 tambala equal 1 Kwacha,"1768,1951"
58981,09845974,n,9,monetary unit in Zambia,"1768,1951"
58982,09846101,n,9,the basic unit of money in Zambia,"1768,1951"
58983,09846223,n,9,100 ngwee equal 1 kwacha,"1768,1951"
58984,09846318,n,9,monetary unit in Angola,"1768,1951"
58985,09846445,n,9,the basic unit of money in Angola,"1768,1951"
58986,09846550,n,9,100 lwei equal 1 kwanza,"1768,1951"
58987,09846643,n,9,monetary unit in the Union of Myanmar (Burma),"1768,1951"
58988,09846792,n,9,the basic unit of money in Myanmar,"1768,1951"
58989,09846896,n,9,100 pyas equal 1 kyat,"1768,1951"
58990,09846986,n,9,monetary unit in Albania,"1768,1951"
58991,09847115,n,9,the basic unit of money in Albania,"1768,1951"
58992,09847218,n,9,100 qindarka equal 1 lek,"1768,1951"
58993,09847325,n,9,monetary unit in Honduras,"1768,1951"
58994,09847437,n,9,the basic unit of money in Honduras; equal to 100 centavos,"1768,1951"
58995,09847568,n,9,monetary unit in Sierra Leone,"1768,1951"
58996,09847688,n,9,the basic unit of money in Sierra Leone; equal to 100 cents,"1768,1951"
58997,09847818,n,9,monetary unit in Romania,"1768,1951"
58998,09847947,n,9,the basic unit of money in Romania,"1768,1951"
58999,09848050,n,9,100 bani equal 1 leu,"1768,1951"
59000,09848139,n,9,monetary unit in Bulgaria,"1768,1951"
59001,09848270,n,9,the basic unit of money in Bulgaria,"1768,1951"
59002,09848374,n,9,100 stotikni equal 1 lev,"1768,1951"
59003,09848472,n,9,monetary unit in Swaziland,"1768,1951"
59004,09848586,n,9,the basic unit of money in Swaziland; equal to 100 cents,"1768,1951"
59005,09848717,n,9,monetary unit in Italy,"1768,1951"
59006,09848825,n,9,the basic unit of money in Italy; equal to 100 centesimi,"1768,1951"
59007,09848966,n,9,monetary unit in Great Britain,"1768,1951"
59008,09849100,n,9,the basic unit of money in Great Britain; equal to 100 pence,"1768,1951"
59009,09849271,n,9,a former monetary unit in Great Britain,"1768,1951"
59010,09849409,n,9,monetary unit in Turkey,"1768,1951"
59011,09849554,n,9,the basic unit of money in Turkey,"1768,1951"
59012,09849672,n,9,100 kurus equal 1 lira,"1768,1951"
59013,09849803,n,9,20 aspers equal 1 kuru,"1768,1951"
59014,09849896,n,9,monetary unit in Lesotho,"1768,1951"
59015,09850024,n,9,the basic unit of money is Lesotho,"1768,1951"
59016,09850128,n,9,100 lisente equal 1 loti,"1768,1951"
59017,09850223,n,9,monetary unit in Germany,"1768,1951"
59019,09850484,n,9,100 pfennigs equal 1 Deutsche Mark,"1768,1951"
59020,09850591,n,9,monetary unit in Finland,"1768,1951"
59021,09850719,n,9,the basic unit of money in Finland,"1768,1951"
59022,09850825,n,9,100 penni equal 1 markka,"1768,1951"
59023,09850920,n,9,monetary unit in Mozambique,"1768,1951"
59024,09851036,n,9,the basic unit of money in Mozambique; equal to 100 centavos,"1768,1951"
59025,09851169,n,9,monetary unit in Nigeria,"1768,1951"
59026,09851298,n,9,the basic unit of money in Nigeria,"1768,1951"
59028,09851496,n,9,monetary unit in Bhutan,"1768,1951"
59029,09851625,n,9,the basic unit of money in Bhutan,"1768,1951"
59030,09851732,n,9,100 chetrums equal 1 ngultrum,"1768,1951"
59031,09851834,n,9,monetary unit in Mauritania,"1768,1951"
59033,09852079,n,9,5 khoums equal 1 ouguiya,"1768,1951"
59034,09852174,n,9,monetary unit in Tonga,"1768,1951"
59035,09852299,n,9,the basic unit of money in Tonga,"1768,1951"
59036,09852404,n,9,100 seniti equal 1 pa'anga,"1768,1951"
59037,09852502,n,9,monetary unit in Macao,"1768,1951"
59038,09852626,n,9,the basic unit of money in Macao,"1768,1951"
59039,09852730,n,9,100 avos equal 1 pataca,"1768,1951"
59040,09852822,n,9,monetary unit in Spain,"1768,1951"
59041,09852930,n,9,the basic unit of money in Spain; equal to 100 centimos,"1768,1951"
59042,09853057,n,9,monetary unit in Bolivia,"1768,1951"
59043,09853168,n,9,the basic unit of money in Bolivia; equal to 100 centavos,"1768,1951"
59044,09853300,n,9,monetary unit in Nicaragua,"1768,1951"
59045,09853415,n,9,the basic unit of money in Nicaragua; equal to 100 centavos,"1768,1951"
59046,09853547,n,9,monetary unit in Chile,"1768,1951"
59047,09853655,n,9,the basic unit of money in Chile; equal to 100 centesimos,"1768,1951"
59048,09853797,n,9,monetary unit in Colombia,"1768,1951"
59049,09853910,n,9,the basic unit of money in Colombia; equal to 100 centavos,"1768,1951"
59050,09854055,n,9,monetary unit in Cuba,"1768,1951"
59051,09854160,n,9,the basic unit of money in Cuba; equal to 100 centavos,"1768,1951"
59052,09854297,n,9,monetary unit in the Dominican Republic,"1768,1951"
59053,09854424,n,9,the basic unit of money in the Dominican Republic; equal to 100 centavos,"1768,1951"
59054,09854583,n,9,monetary unit in Guinea-Bissau,"1768,1951"
59055,09854705,n,9,the basic unit of money in Guinea-Bissau; equal to 100 centavos,"1768,1951"
59056,09854859,n,9,monetary unit in Mexico,"1768,1951"
59057,09854968,n,9,the basic unit of money in Mexico; equal to 100 centavos,"1768,1951"
59058,09855109,n,9,monetary unit in the Philippines,"1768,1951"
59060,09855383,n,9,monetary unit in Uruguay,"1768,1951"
59061,09855495,n,9,the basic unit of money in Uruguay; equal to 100 centesimos,"1768,1951"
59062,09855660,n,9,monetary unit in Cyprus,"1768,1951"
59063,09855787,n,9,the basic unit of money in Cyprus; equal to 100 cents,"1768,1951"
59064,09855927,n,9,a Cypriot monetary unit equal to one thousandth of a pound,"1768,1951"
59065,09856054,n,9,monetary unit in Egypt,"1768,1951"
59066,09856163,n,9,the basic unit of money in Egypt; equal to 100 piasters,"1768,1951"
59067,09856306,n,9,a fractional monetary unit in Egypt and Lebanon and Sudan and Syria,"1768,1951"
59069,09856698,n,9,monetary unit in the Republic of Ireland,"1768,1951"
59070,09856822,n,9,the basic unit of money in Ireland; equal to 100 pence,"1768,1951"
59071,09856968,n,9,monetary unit in Lebanon,"1768,1951"
59072,09857079,n,9,the basic unit of money in Lebanon; equal to 100 piasters,"1768,1951"
59073,09857224,n,9,monetary unit on Malta,"1768,1951"
59074,09857332,n,9,the basic unit of money on Malta; equal to 100 cents,"1768,1951"
59075,09857450,n,9,monetary unit in the Sudan,"1768,1951"
59076,09857563,n,9,the basic unit of money in the Sudan; equal to 100 piasters,"1768,1951"
59077,09857710,n,9,monetary unit in Syria,"1768,1951"
59078,09857817,n,9,the basic unit of money in Syria; equal to 100 piasters,"1768,1951"
59079,09857958,n,9,monetary unit in Botswana,"1768,1951"
59080,09858088,n,9,the basic unit of money in Botswana,"1768,1951"
59081,09858193,n,9,100 thebe equal 1 pula,"1768,1951"
59082,09858286,n,9,monetary unit in Guatemala,"1768,1951"
59083,09858401,n,9,the basic unit of money in Guatemala; equal to 100 centavos,"1768,1951"
59084,09858533,n,9,monetary unit in South Africa,"1768,1951"
59085,09858654,n,9,the basic unit of money in South Africa; equal to 100 cents,"1768,1951"
59086,09858783,n,9,monetary unit in Iran,"1768,1951"
59087,09858908,n,9,the basic unit of money in Iran,"1768,1951"
59088,09859024,n,9,100 dinars equal 1 rial,"1768,1951"
59089,09859134,n,9,monetary unit in Oman,"1768,1951"
59090,09859257,n,9,the basic unit of money in Oman,"1768,1951"
59091,09859365,n,9,"1,000 baiza equal 1 riyal-omani","1768,1951"
59093,09859574,n,9,the basic unit of money in Yemen; equal to 100 fils,"1768,1951"
59094,09859711,n,9,monetary unit in Cambodia,"1768,1951"
59095,09859824,n,9,the basic unit of money in Cambodia; equal to 100 sen,"1768,1951"
59096,09859947,n,9,monetary unit is Malaysia,"1768,1951"
59097,09860060,n,9,the basic unit of money in Malaysia; equal to 100 sen,"1768,1951"
59098,09860186,n,9,monetary unit in Qatar,"1768,1951"
59099,09860311,n,9,the basic unit of money in Qatar,"1768,1951"
59100,09860429,n,9,100 dirhams equal 1 riyal,"1768,1951"
59101,09860542,n,9,monetary unit in Saudi Arabia,"1768,1951"
59102,09860681,n,9,the basic unit of money in Saudi Arabia,"1768,1951"
59103,09860813,n,9,20 qurush equal 1 riyal,"1768,1951"
59104,09860908,n,9,monetary unit in Russia,"1768,1951"
59105,09861035,n,9,the basic unit of money in Russia,"1768,1951"
59106,09861148,n,9,100 kopecks equal 1 ruble,"1768,1951"
59107,09861262,n,9,monetary unit in India,"1768,1951"
59109,09861507,n,9,a fractional monetary unit in Bangladesh and India and Nepal and Pakistan,"1768,1951"
59110,09861708,n,9,monetary unit in Pakistan,"1768,1951"
59111,09861839,n,9,the basic unit of money in Pakistan; equal to 100 paisas,"1768,1951"
59112,09861984,n,9,a former copper coin of Pakistan,"1768,1951"
59113,09862067,n,9,monetary unit in Mauritius,"1768,1951"
59114,09862181,n,9,the basic unit of money in Mauritius; equal to 100 cents,"1768,1951"
59115,09862326,n,9,monetary unit in Nepal,"1768,1951"
59116,09862435,n,9,the basic unit of money in Nepal; equal to 100 paisas,"1768,1951"
59117,09862576,n,9,monetary unit in Seychelles,"1768,1951"
59118,09862692,n,9,the basic unit of money in Seychelles; equal to 100 cents,"1768,1951"
59119,09862839,n,9,monetary unit in Sri Lanka,"1768,1951"
59120,09862954,n,9,the basic unit of money in Sri Lanka; equal to 100 cents,"1768,1951"
59121,09863098,n,9,monetary unit in Indonesia,"1768,1951"
59122,09863213,n,9,the basic unit of money in Indonesia; equal to 100 sen,"1768,1951"
59123,09863339,n,9,monetary unit in Austria,"1768,1951"
59124,09863468,n,9,the basic unit of money in Austria,"1768,1951"
59125,09863577,n,9,100 groschen equal 1 schilling,"1768,1951"
59126,09863681,n,9,monetary unit in Israel,"1768,1951"
59127,09863808,n,9,the basic unit of money in Israel,"1768,1951"
59128,09863913,n,9,100 agorot equal 1 shekel,"1768,1951"
59129,09864009,n,9,monetary unit in Kenya,"1768,1951"
59130,09864116,n,9,the basic unit of money in Kenya; equal to 100 cents,"1768,1951"
59131,09864241,n,9,monetary unit in Somalia,"1768,1951"
59132,09864352,n,9,the basic unit of money in Somalia; equal to 100 cents,"1768,1951"
59133,09864481,n,9,monetary unit in Tanzania,"1768,1951"
59134,09864594,n,9,the basic unit of money in Tanzania; equal to 100 cents,"1768,1951"
59135,09864725,n,9,monetary unit in Uganda,"1768,1951"
59136,09864834,n,9,the basic unit of money in Uganda; equal to 100 cents,"1768,1951"
59137,09864961,n,9,monetary unit in Ecuador,"1768,1951"
59139,09865201,n,9,monetary unit in Guinea,"1768,1951"
59140,09865292,n,9,the basic unit of money in Guinea,"1768,1951"
59141,09865385,n,9,monetary unit in Bangladesh,"1768,1951"
59142,09865502,n,9,the basic unit of money in Bangladesh; equal to 100 paisas,"1768,1951"
59143,09865630,n,9,monetary unit in Western Samoa,"1768,1951"
59144,09865771,n,9,the basic unit of money in Western Samoa,"1768,1951"
59145,09865881,n,9,100 sene equal 1 tala,"1768,1951"
59146,09865972,n,9,monetary unit in Mongolia,"1768,1951"
59147,09866103,n,9,the basic unit of money in Mongolia,"1768,1951"
59148,09866220,n,9,100 mongo equal 1 tugrik,"1768,1951"
59149,09866315,n,9,monetary unit in North Korea,"1768,1951"
59150,09866452,n,9,the basic unit of money in North Korea,"1768,1951"
59151,09866578,n,9,100 chon equal 1 won,"1768,1951"
59152,09866668,n,9,monetary unit in South Korea,"1768,1951"
59153,09866805,n,9,the basic unit of money in South Korea,"1768,1951"
59154,09866931,n,9,100 chon equal 1 won,"1768,1951"
59155,09867021,n,9,monetary unit in Japan,"1768,1951"
59156,09867130,n,9,the basic unit of money in Japan; equal to 100 sen,"1768,1951"
59157,09867249,n,9,the monetary unit in the People's Republic of China,"1768,1951"
59159,09867531,n,9,10 jiao equal 1 yuan,"1768,1951"
59160,09867640,n,9,100 fen equal 1 yuan,"1768,1951"
59161,09867729,n,9,monetary unit in Zaire,"1768,1951"
59162,09867855,n,9,the basic unit of money in Zaire,"1768,1951"
59163,09867958,n,9,100 makuta equal 1 zaire,"1768,1951"
59164,09868054,n,9,monetary unit in Poland,"1768,1951"
59165,09868180,n,9,the basic unit of money in Poland,"1768,1951"
59166,09868284,n,9,100 groszy equal 1 zloty,"1768,1951"
59169,09868636,n,9,a unit of pressure equal to one newton per square meter,1951
59171,09868903,n,9,a unit of pressure,1951
59189,09871313,n,9,"a unit of temperature on a specified scale: ""the game was played in spite of the 40-degree temperature""",1951
59173,09869188,n,9,a unit of pressure equal to a million dynes per square centimeter,1951
59181,09870283,n,9,an advertising measure; one agate line appearing in one million copies of a publication,1951
59174,09869341,n,9,the absolute unit of pressure equal to one dyne per square centimeter,1951
59176,09869649,n,9,a linear unit (1/6 inch) used in printing,1951
59180,09870127,n,9,space for one line of print (one column wide and 1/14 inch deep) used to measure advertising,1951
59177,09869813,n,9,half the width of an em,1951
59178,09869910,n,9,the square of a body of any size of type,1951
59179,09870014,n,9,a linear unit of the size of type slightly larger than an em,1951
59175,09869507,n,9,a linear unit used to measure the size of type; approximately 1/72 inch,1951
59204,09873802,n,9,a system of weights used for precious metals and gemstones; based on a 12-ounce pound and an ounce of 480 grains,1951
59211,09875274,n,9,the weight of a frail (basket) full of raisins or figs; between 50 and 75 pounds,1951
59193,09871867,n,9,the basic unit of thermodynamic temperature adopted under the System International d'Unites,1951
59183,09870532,n,9,the number of lines in a piece of printed material,
59184,09870645,n,9,a logarithmic unit of sound intensity equal to 10 decibels,"1951,2101"
59185,09870757,n,9,a logarithmic unit of sound intensity; 10 times the logarithm of the ratio of the sound intensity to some reference intensity,"1951,2101"
59186,09870946,n,9,a unit of perceived loudness equal to the loudness of a 1000-hertz tone at 40 dB above threshold,"1951,2101"
59187,09871112,n,9,a unit of subjective loudness,"1951,2101"
59190,09871505,n,9,a unit of temperature equal to one-thousandth of a degree,1951
59167,09868379,n,9,a unit of pain intensity,1951
59191,09871620,n,9,a degree on the Centigrade scale of temperature,1951
59192,09871752,n,9,a degree on the Fahrenheit scale of temperature,1951
59194,09872015,n,9,an absolute temperature scale in Fahrenheit degrees,1951
59188,09871211,n,9,a unit of traffic intensity in a telephone system,1951
59195,09872136,n,9,a unit used in estimating fuel requirements for heating a building,1951
59199,09872861,n,9,unit of mass for expressing masses of atoms or molecules,1951
59196,09872259,n,9,a system of measuring temperature; 0 is the melting point of ice and 100 is the boiling point of water,"1951,2097"
