60367,10060259,n,9,"the absence of life or state of being dead: ""he seemed more content in death than he had ever been in life""",
60368,10060454,n,9,"euphemisms for death (based on an analogy between lying in a bed and in a tomb); ""she was laid to rest beside her husband""; ""they had to put their family pet to sleep""",
60369,10060721,n,9,"no longer in existence: ""the extinction of a species""",
60370,10060845,n,9,"a characteristic state or mode of living: ""social life""; ""city life""; ""real life""",
60375,10061748,n,9,a marriage relationship created by agreement and cohabitation rather than by ceremony,1675
60372,10061133,n,9,the condition of being married or unmarried,1675
60374,10061658,n,9,having more than one spouse at a time,1675
60331,10054148,n,9,the state of being retired from one's business or occupation,1675
60373,10061309,n,9,"state of being husband and wife: ""a long and happy marriage""; ""God bless this union""",1675
60528,10085781,n,9,confinement during wartime,1802
60332,10054265,n,9,"the state or fact of existing: ""a point of view gradually coming into being""; ""laws in existence for centuries""",
60378,10062221,n,9,a marriage for expediency rather than love,1675
60379,10062333,n,9,an unsuitable marriage,1675
60380,10062431,n,9,a marriage with a person of inferior social status,1675
60381,10062539,n,9,having one husband at a time,1675
60382,10062622,n,9,having one wife at a time,1675
60383,10062730,n,9,having more than one husband at a time,1675
60384,10062824,n,9,having more than one wife at a time,1675
60387,10063146,n,9,the state of being an unmarried man,1675
60385,10062925,n,9,an unmarried status (as because of religious vows),
60386,10063030,n,9,the condition or quality of being a virgin,
60389,10063365,n,9,the state of being a widow who has not remarried,1675
60393,10064174,n,9,the form of government of a social organization,1718
60417,10067721,n,9,lowering the body's normal immune response to invasion by foreign substances,2232
60392,10063906,n,9,"established customary state esp. of society; ""order ruled in the streets""; ""law and order""",
60397,10064713,n,9,"harmonious relations; freedom from disputes: ""the roommates lived in peace together""",
60401,10065207,n,9,the state prevailing during the absence of war,1718
60394,10064288,n,9,a state of order in which events conform to the law,
60395,10064397,n,9,an untroubled state; free from disturbances,
60396,10064507,n,9,a harmonious state; congruity of parts with one another and with the whole,
60405,10065762,n,9,"harmony of people's opinions or actions or characters; ""the two parties were in accord""",
60398,10064849,n,9,a state or atmosphere of harmony or mutual civility and respect,
60399,10064983,n,9,courteous respect by one nation for the laws and institutions of another,
60400,10065119,n,9,a stable order,
60414,10067245,n,9,a state of lawlessness and disorder (usually resulting from a failure of government),1718
60402,10065395,n,9,a state of friendship and cordiality,
60403,10065501,n,9,a state that is calm and tranquil,
60404,10065609,n,9,a state of peace agreed to between opponents so they can discuss peace terms,
60406,10066040,n,9,"agreement as to goals: ""the preachers and the bootleggers found they had a community of interests""",
60411,10066673,n,9,"corresponding exactly: ""marching in unison""",
60407,10066219,n,9,a state of cooperation,
60408,10066318,n,9,agreement of the majority in sentiment or belief,
60409,10066460,n,9,the opinion held by the majority of those present at the meeting,
60410,10066591,n,9,everyone being of one mind,
60419,10067954,n,9,"disorder resulting from a failure to behave predictably: ""the army retreated in confusion""",
60413,10066965,n,9,a disturbance of the peace or of public order,
60415,10067415,n,9,complete denial of all established authority and institutions,1718
60416,10067531,n,9,a disorder of the immune system,2232
60391,10063667,n,9,"the state of being unemployed or not having a job: ""unemployment is a serious social evil""; ""the rate of unemployment is an indicator of the health of an economy""",1794
60418,10067861,n,9,an unstable order,
60420,10068190,n,9,"a state of disorder and confusion: ""his inconsistency resulted in the demoralization of his staff""",
60422,10068439,n,9,"noisy confusion and turbulence: ""he was awakened by the bluster of their preparations""",
60421,10068349,n,9,a confusion of voices and other sounds,
60424,10068748,n,9,"a word for chaos or fiasco borrowed from modern Hebrew (where it is a loan word from Russian); ""it was utter and complete balagan!""",
60423,10068579,n,9,a state of extreme confusion and disorder,
60425,10068933,n,9,"a state of confusion; ritual accompanied by complicated and purposeless activity that obscures and confuses: ""he engaged in the hugger-mugger of international finance""",
60428,10069389,n,9,"a disorderly outburst or tumult: ""they were amazed by the furious disturbance they had caused""",
60426,10069174,n,9,a state of disorder involving group violence,
60427,10069279,n,9,rowdy behavior,
60429,10069677,n,9,"a public disturbance: ""the police investigated an incident at the bus station""",
60390,10063469,n,9,"the state of being employed or having a job: ""they are looking for employment""; ""he was in the employ of the city""",1794
60377,10062052,n,9,marriage to a person belonging to a tribe or group other than your own as required by custom or law,1675
60431,10070013,n,9,a center of trouble or disturbance,
60432,10070121,n,9,a state of commotion and loud confused noise,
60433,10070254,n,9,lack of agreement or harmony,
60437,10070966,n,9,"violent state of the elements: ""the sea hurled itself in thundering rage against the rocks""",
60436,10070833,n,9,a turbulent state resulting in injuries and destruction etc.,
60439,10071271,n,9,"feelings of hostility that are not manifest: ""he could sense her latent hostility to him""; ""the diplomats"" first concern was to reduce international tensions""",
60438,10071108,n,9,a state of deep-seated ill-will,
60440,10071502,n,9,"a state of opposition between persons or ideas or interests: ""his conflict of interest made him ineligible for the post""; ""a conflict of loyalties""",
60447,10072681,n,9,"the state of being suspected: ""he tried to shield me from suspicion""",
60441,10071758,n,9,a state of conflict between persons,
60444,10072276,n,9,a state of political conflict using means short of armed warfare,1718
60470,10076479,n,9,state of well-being characterized by emotions ranging from contentment to intense joy,1502
60445,10072413,n,9,a conflict of people's opinions or actions or characters,
60446,10072577,n,9,lack of unity (usually resulting from dissension),
60448,10072823,n,9,"suspicion affecting your reputation: ""after that mistake he was under a cloud""",
60450,10073092,n,9,"having abundant light or illumination: ""they played as long as it was light"" or ""as long as the lighting was good""",
60449,10072953,n,9,the degree of visibility of your environment,
60452,10073471,n,9,"darkness: ""it vanished into the night""",
60451,10073287,n,9,absence of light or illumination,
60453,10073561,n,9,"total absence of light: ""they fumbled around in total darkness""; ""in the black of night""",
60463,10074921,n,9,"a state of partial or total darkness: ""he struck a match to dispell the gloom""",
60454,10073746,n,9,darkness resulting from the extinction of lights (as in a city invisible to enemy aircraft),
60455,10073912,n,9,partial darkness,
60456,10074095,n,9,gloomy semidarkness caused by cloud cover,
60457,10074204,n,9,a state of diffused or dim illumination,
60458,10074305,n,9,relative darkness caused by light rays being intercepted by an opaque body,
60459,10074475,n,9,shade within clear boundaries,
60460,10074593,n,9,a region of complete shadow resulting from total obstruction of light,
60461,10074714,n,9,a fringe region of partial shadow around an umbra,
60462,10074818,n,9,the state of being poorly illuminated,
60475,10077290,n,9,"(informal) a state of depression or agitation; ""he was in such a state you just couldn't reason with him""",1502
60464,10075077,n,9,the state of being indistinct or indefinite for lack of adequate illumination,
60468,10075968,n,9,"state of being gratified; great satisfaction: ""dull repetitious work gives no gratification""; ""to my immense gratification he arrived on time""",1502
60466,10075577,n,9,"the state of being embarrassed (usually by some financial inadequacy); ""he is currently suffering financial embarrassments""",1502
60443,10072161,n,9,actual fighting between the warring parties,"1718,1781,2768"
60469,10076203,n,9,"your personal satisfaction (or dissatisfaction) with the cultural or intellectual conditions under which you live (as distinct from material comfort); ""the new art museum is expected to improve the quality of life""",1502
60471,10076721,n,9,a state of supreme happiness,1502
60472,10076837,n,9,a state of extreme happiness,1502
60473,10076997,n,9,a state of elated bliss,1502
60476,10077447,n,9,state characterized by emotions ranging from mild discontentment to deep grief,1502
60474,10077084,n,9,(Hinduism and Buddhism) the beatitude that transcends the cycle of reincarnation; characterized by the extinction of desire and individual consciousness,"1502,1565"
60465,10075224,n,9,"the state of a person's emotions (especially with regard to pleasure or dejection); ""his emotional state depended on her opinion""; ""he was in good spirits""; ""his spirit rose""",1502
60477,10077637,n,9,"the state of being embittered: ""the embitterment that resulted from the loss of his job never left him""",1502
60467,10075760,n,9,"a state of being carried away by overwhelming emotion: ""listening to sweet music in a perfect rapture""-Charles Dickens",1502
60435,10070620,n,9,"a state of agitation or turbulent change or development: ""the political ferment produced a new leadership""; ""social unrest""",
60480,10078101,n,9,"a state of deeply felt distress or sorrow: ""a moment of extraordinary poignancy""",1502
60481,10078249,n,9,"a state or condition of being innocent of a specific crime or offense: ""the trial established his innocence""",
60485,10078846,n,9,"the state of being free of suspicion: ""investigation showed that he was in the clear""",
60482,10078467,n,9,a state of innocence,
60483,10078596,n,9,the state of being free from sin or moral wrong; lacking a knowledge of evil,
60484,10078769,n,9,without moral defects,
60502,10081549,n,9,"the removal of constraints: ""he gave free rein to his impulses""; ""they gave full play to the artist's talent""",
60486,10078983,n,9,the state of having committed an offense,
60487,10079214,n,9,a state of guilt,
60488,10079321,n,9,the state of being guilty of bloodshed and murder,
60489,10079427,n,9,guilt as an accomplice in a crime or offense,
60490,10079528,n,9,the state of being a criminal,
60492,10079816,n,9,the state of being liable to impeachment,
60493,10079933,n,9,the condition of being free; the power to act or speak or think without externally imposed restraints,
60495,10080443,n,9,freedom from control or influence of another or others,1718
60497,10080831,n,9,government of a country by its own people,1718
60521,10084619,n,9,"the state of being confined: ""he was held in solitary confinement""",1802
60498,10081021,n,9,government free from external control,1718
60499,10081116,n,9,freedom of a local government to determine by popular vote the applicability of a controversial law in their jurisdiction,1718
60500,10081296,n,9,self-government in local matters by a city or county that is part of a national government,1718
60503,10081721,n,9,the right of merchant ships to travel freely in international waters,1946
60501,10081442,n,9,economic independence as a national policy,"1718,1753"
60504,10081855,n,9,"freedom of choice: ""liberty of opinion""; ""liberty of worship""; ""liberty--perfect liberty--to think or feel or do just as one pleases""; ""at liberty to choose whatever occupation one wishes""",
60506,10082361,n,9,license used by a writer or artist to heighten the effect of their work,2657
60507,10082493,n,9,"freedom from normal restraints in conduct: ""the new freedom in movies and novels""; ""allowed his children considerable latitude in how they spent their money""",
60505,10082169,n,9,freedom to deviate deliberately from normally applicable rules or practices (especially in behavior or speech),
60512,10083322,n,9,personal freedom from servitude or confinement or oppression,1802
60514,10083617,n,9,"a state of forcible subjugation: ""the repression of Christian sects""",
60510,10083123,n,9,freedom to act or judge on one's own,
60511,10083234,n,9,the freedom or ability to choose,
60522,10084797,n,9,the state of being constrained,1802
60513,10083436,n,9,forced submission to control by others,
60515,10083742,n,9,"kept down by unjust use of force or authority: ""the tyrant's oppression of the people""",
60516,10083885,n,9,"the state of being a slave: ""So every bondman in his own hand bears the power to cancel his captivity""-Shakespeare",
60518,10084274,n,9,"state of subjection to an owner or master or forced labor imposed as punishment: ""penal servitude""",
60517,10084106,n,9,the state of being under the control of another person,
60526,10085503,n,9,"a state of confinement (usually for a short time; ""the prisoner is on hold""; ""he is in the custody of police"")",1802
60519,10084446,n,9,the condition of a peon,
60520,10084523,n,9,the state of a serf,
60509,10082961,n,9,one's freedom to exercise one's rights as guaranteed under the laws of the country,1718
60523,10084914,n,9,something that restricts freedom as a cage restricts movement,1802
60524,10085044,n,9,a cage from which there is no escape,1802
60527,10085686,n,9,imprisonment (especially for a long time),1802
60494,10080250,n,9,the freedom of teachers and students to express their ideas in school without religious or political or institutional restrictions,1922
60479,10077974,n,9,state of sorrow over the death or departure of a loved one,1502
60525,10085136,n,9,"the state of being imprisoned: ""he was held in captivity until he died""; ""the imprisonment of captured soldiers""; ""his ignominious incarceration in the local jail""; ""he practiced the immurement of his enemies in the castle dungeon""",1802
60496,10080679,n,9,immunity from arbitrary exercise of authority: political independence,1718
60532,10086400,n,9,personal independence,1718
60545,10088238,n,9,"(aeronautics) the state of equilibrium in which centrifugal forces due to a rotating mass (e.g., a propeller) do not produce force in the shaft and so vibration is reduced",1942
60540,10087349,n,9,"the situation in a contest in which the winner is undecided at the end: ""the game ended in a draw""; ""their record was 3 wins, 6 losses and a tie""",
60534,10086663,n,9,lack of independence or self-sufficiency,
60535,10086858,n,9,the state of needing help from something,
60536,10086957,n,9,the state of relying on something,
60537,10087045,n,9,the state of being subordinate to something,
60538,10087148,n,9,the state of being contingent on something,
60539,10087248,n,9,the condition of having or giving polarity,
60548,10088697,n,9,"a state of change: ""they were in a state of steady motion""",
60541,10087598,n,9,a tie in a race,
60542,10087669,n,9,drawing position in chess: any of a player's possible moves would place his king in check,
60543,10087814,n,9,a state of equilibrium,
60550,10089131,n,9,(music) a tremulous effect produced by rapid repetition of a single tone or rapid alternation of two tones,2536
60546,10088471,n,9,a state of being balanced in a stable equilibrium,
60547,10088572,n,9,a state of disequilibrium,
60549,10088916,n,9,"a shaky motion: ""the shaking of his fingers as he lit his pipe""",
60552,10089455,n,9,"something that resembles a flowing stream in moving continuously: ""a stream of people emptied from the terminal""; ""the museum had planned carefully for the flow of visitors""",
60565,10091728,n,9,"the state of being in operation: ""the engine is running smoothly""",1787
60551,10089291,n,9,the motion of a spinning body (as a top) in which it wobbles so that the axis of rotation sweeps out a cone,
60557,10090167,n,9,"the state of being active: ""his sphere of activity""; ""he is out of action""",
60553,10089688,n,9,a state of no motion or movement,
60554,10089847,n,9,remaining in place,
60555,10089951,n,9,a state of no activity,
60556,10090043,n,9,the state of something that has outlived its relevance,
60558,10090534,n,9,"the state of being in action or exerting power: ""the agency of providence""; ""she has free agency""",
60559,10090684,n,9,"a state in which action is feasible: ""the ball was still in play""; ""insiders said the company's stock was in play""",
60560,10090849,n,9,"the state of being or appearing to be actively engaged in an activity: ""they manifested all the busyness of a pack of beavers""",
60561,10091030,n,9,"the action or reaction of something (as a machine or substance) under specified circumstances; ""the behavior of small particles can be studied in experiments""",
60563,10091362,n,9,"the state of being in effect or being operative: ""that rule is no longer in operation""",
60568,10092393,n,9,inactivity and lack of energy,2097
60564,10091540,n,9,"the state of being in good working order and ready for operation: ""put the ships into comission""; ""the motor was out of commission""",
60571,10092681,n,9,"a state of inactivity (in business or art etc); ""economic growth of less than 1% per year is considered to be economic stagnation""",1753
60566,10091847,n,9,"a state of steady vigorous action that is characteristic of an activity: ""the party went with a swing""; ""it took time to get into the swing of things""",
60572,10092910,n,9,the state of the economy declines; a widespread decline in the GDP and employment and trade lasting from six months to a year,1753
60567,10092049,n,9,the state of being inactive,
60569,10092475,n,9,a state of inactivity or disuse,
60570,10092562,n,9,inactivity resulting from a static balance between opposing forces,
60573,10093091,n,9,"a state of inaction: ""a body will continue in a state of rest until acted upon""",
60562,10091255,n,9,(of volcanos) pouring out fumes or lava,2121
60574,10093221,n,9,"no longer active; extinguished: ""the extinction of the volcano""",
60531,10086208,n,9,"personal representation that has legal status: ""an person who has been declared incompetent should have legal representation""",1802
60575,10093359,n,9,temporary cessation or suspension,
60576,10093496,n,9,a state of abeyance or suspended business,
60577,10093601,n,9,suspension of an ongoing activity,
100646,N0001842,n,10,,
60533,10086528,n,9,"political independence: ""seeking complete political separateness for Taiwan""",1718
60601,10097470,n,9,"(informal) a state of extreme exhaustion; ""he was worn to a frazzle""",2232
60591,10095866,n,9,"a specific state of mind that is temporary: ""a case of the jitters""",1502
60582,10094329,n,9,dilation and enlargement of arterioles,2234
60585,10094762,n,9,a state of comatose torpor,2234
60584,10094639,n,9,the torpid or resting state in which some animals pass the winter,"2188,2234"
60592,10095984,n,9,a temporary psychological state,1502
60586,10094888,n,9,a dormant or quiescent state,
60589,10095466,n,9,"any stoppage attributable to unusual activity: ""the legislation ran into a logjam""",
60581,10094233,n,9,an inability to retain bodily secretions,2234
60590,10095601,n,9,a state that continues for a limited time,
60612,10098879,n,9,acidosis with an accumulation of ketone bodies; occurs primarily in diabetes mellitus,2232
60593,10096145,n,9,a state in which one thinks,1502
60594,10096231,n,9,temporary loss of strength and energy resulting from hard physical or mental work,2232
60595,10096480,n,9,a tiredness of the eyes caused by prolonged close work by a person with an uncorrected vision problem,2232
60597,10096823,n,9,extreme fatigue,2232
60580,10094057,n,9,cessation from or slowing of activity during the summer; especially slowing of metabolism in some animals,2188
60598,10096949,n,9,the state of being depleted,2232
60599,10097050,n,9,loss of salt from the body without replacement (loss by vomiting or profuse perspiration or urination or diarrhea) thus upsetting the electrolyte balance,2232
60602,10097592,n,9,exhaustion that affects mental keenness,2232
60600,10097264,n,9,an equilibrium between the amounts of electrolytes (as calcium and sodium and potassium) that is essential for normal health and functioning,
60596,10096650,n,9,fatigue and sleep disturbance resulting from disruption of the body's normal circadian rhythm as a result of jet travel,2232
60603,10097707,n,9,a groggy state resulting from weariness,2232
60604,10097803,n,9,a dull and listless state resulting from weariness,2232
60627,10101037,n,9,an inability to sleep; chronic sleeplessness,2232
60606,10098150,n,9,a dazed and staggering state caused by alcohol,2232
60620,10100019,n,9,a condition in which milk is not secreted in the mother's breasts after her child has been delivered,2234
60608,10098334,n,9,the state of being sober,2232
60611,10098747,n,9,abnormally high acidity of the blood and other body tissues,2232
60609,10098443,n,9,congenital absence of the heart (as in the development of some monsters),"2232,2233"
60610,10098588,n,9,absence of the head (as in the development of some monsters),"2232,2233"
60613,10099042,n,9,a blood disorder characterized by an increased concentration of hydrogen ions in the blood (which falls below 7 on the pH scale),2232
60614,10099225,n,9,a blood disorder characterized by a lower concentration of hydrogen ions in the blood (which rises above 7.45 on the pH scale),2232
60615,10099407,n,9,a condition in which the urine (which is normally slightly acidic) is alkaline,2232
60616,10099555,n,9,abnormally high alkalinity of the blood and other body tissues,2232
60622,10100321,n,9,abnormal adhesion and rigidity of the bones of a joint,2232
60617,10099673,n,9,absence of the pupil in an eye,
60618,10099756,n,9,abnormally small extremities (underdeveloped fingers and toes),
60619,10099888,n,9,abnormal protrusion of the navel; sometimes the start of umbilical hernia,
60607,10098253,n,9,stupefaction from drink,2232
60621,10100189,n,9,absence of the mammary glands (either through surgery or developmental defect),
60623,10100444,n,9,an abnormality involving a chromosome number that is not an exact multiple of the haploid number (one chromosome set is incomplete),2168
60625,10100742,n,9,a temporary state in which you are unable (or unwilling) to sleep,2232
60624,10100632,n,9,absence of one of both testes,
60626,10100899,n,9,an inability to stay awake,2232
60628,10101154,n,9,loss of bodily sensation with or without loss of consciousness,2234
60605,10097920,n,9,a temporary state resulting from excessive consumption of alcohol,2232
60629,10101395,n,9,failure of the sweat glands,2234
60579,10093894,n,9,cessation from or slowing of activity during the winter; especially slowing of metabolism in some animals,2188
60588,10095290,n,9,"a situation in which no progress can be made: ""reached an impasse on the negotiations""",
60632,10101745,n,9,an abnormal distension of an artery,2232
60636,10102615,n,9,a disturbance of the normal sleep pattern,2232
60637,10102789,n,9,a disorder of sleep characterized by a dream of terrifying dimensions far worse than a typical nightmare; they occur during NREM sleep,2232
60655,10106111,n,9,regional anesthesia resulting from the injection of a local anesthetic on each side of the cervix; used during labor and childbirth,2234
60640,10103438,n,9,a torpid state resembling sleep,2234
60653,10105550,n,9,regional anesthesia resulting from injection of an anesthetic into the caudal end of the spinal canal; now largely replaced by epidural anesthesia,2234
60639,10103209,n,9,a recurring sleep state during which rapid eye movements do not occur and dreaming does not occur; accounts for about 75% of normal sleep time,2234
60649,10104540,n,9,anesthesia of an area supplied by a nerve; produced by an anesthetic agent applied to the nerve,2234
60641,10103521,n,9,informal term for sleep,2234
60642,10103598,n,9,a loss of will power,1502
60643,10103681,n,9,an inability to experience pleasure,1502
60644,10103772,n,9,a state that resembles sleep but that is induced by suggestion,1502
60645,10103907,n,9,hypnosis induced by yourself,1502
60646,10104030,n,9,insensibility resulting from cold,2234
60647,10104142,n,9,a state of total unconsciousness resulting from anesthetic drugs (as for a major surgical operation),2234
60648,10104348,n,9,loss of sensation in a small area of the body (as when a local anesthetic is injected for a tooth extraction),2234
60651,10105231,n,9,loss of sensation confined to the skin or mucous surfaces (as when benzocaine or lidocaine is applied to the surface),2234
60631,10101575,n,9,a state of heightened physiological activity,2234
60652,10105435,n,9,loss of sensation in the extremities,2234
60660,10107294,n,9,a dreamlike state of altered consciousness that may last for hours or days,1502
60654,10105796,n,9,regional anesthesia resulting from injection of an anesthetic into the epidural space of the spinal cord; sensation is lost in the abdominal and genital and pelvic areas; used in childbirth and gynecological surgery,2234
60635,10102311,n,9,"a natural and periodic state of rest during which consciousness of the world is suspended: ""he didn't get enough sleep last night""; ""calm as a child in dreamless slumber""",2234
