51213,08318641,n,9,plant with erect leafy stems bearing clusters of rayless yellow flower heads on bent individual stalks; moist regions of southwestern United States,"2158,2172"
51214,08318891,n,9,stiff much-branched perennial of the Mediterranean region having very white woolly stems and leaves; sometimes placed in genus Cineraria,"2158,2172"
51215,08319146,n,9,bluish-green bushy leafy plant covered with close white wool and bearing branched clusters of yellow flower heads; southwestern United States; toxic to range livestock,"2158,2172"
51216,08319419,n,9,American ragwort with yellow flowers,"2158,2172"
51217,08319561,n,9,widespread European weed having yellow daisylike flowers; sometimes an obnoxious weed and toxic to cattle if consumed in quantity,"2158,2172"
51218,08319819,n,9,perennial with sharply toothed triangular leaves on leafy stems bearing a cluster of yellow flower heads; moist places in mountains of western North America,"2158,2172"
51219,08320064,n,9,Eurasian weed with heads of small yellow flowers,"2158,2172"
51229,08322038,n,9,genus of Old World perennial herbs with spirally arranged toothed leaves,2158
51221,08320344,n,9,perennial south European herb having narrow entire leaves and solitary yellow flower heads and long black-skinned carrot-shaped edible roots,"2158,2172"
51225,08321122,n,9,woody plants grown chiefly for their silver or gray and often aromatic foliage; formerly included in the genus Artemisia,2158
51223,08320822,n,9,herb having corymbose white-rayed flowers with scaly bracts and silky indehiscent fruits,"2158,2172"
51224,08321012,n,9,a variety of white-topped aster,"2158,2172"
51207,08317292,n,9,genus of herbs of temperate and cool regions of Eurasia,2158
51226,08321396,n,9,low much-branched perennial of western United States having silvery leaves; an important browse and shelter plant,"2158,2172"
51227,08321654,n,9,plants of western and northern European coasts,"2158,2172"
51228,08321823,n,9,aromatic shrub of arid regions of western North America having hoary leaves,"2158,2172"
51231,08322375,n,9,tall North American perennial herbs,2158
51230,08322222,n,9,European perennial whose serrate leaves yield a yellow dye,"2158,2172"
51233,08322683,n,9,small genus of east African herbs,2158
51232,08322520,n,9,North American perennial having a resinous odor and yellow flowers,"2158,2172"
51235,08323139,n,9,goldenrod,2158
51234,08322824,n,9,tall Old World biennial thistle with large clasping white-blotched leaves and purple flower heads; naturalized in California and South America,"2158,2172"
51236,08323258,n,9,any of numerous chiefly summer-blooming and fall-blooming North American plants especially of the genus Solidago,"2158,2172"
51237,08323733,n,9,plant of eastern North America having creamy white flowers,"2158,2172"
51238,08323866,n,9,large North American goldenrod having showy clusters of yellow flowers on arching branches; often a weed,"2158,2172"
51239,08324076,n,9,similar to meadow goldenrod but usually smaller,"2158,2172"
51240,08324213,n,9,goldenrod similar to narrow goldenrod but having bristly hairs on edges of leaf stalks; mountainous regions of western America,"2158,2172"
51241,08324426,n,9,a dyer's weed of Canada and the eastern United States having yellow flowers sometimes used in dyeing,"2158,2172"
51242,08324608,n,9,goldenrod of eastern America (especially Blue Mountains of Pennsylvania) having aromatic leaves from which a medicinal tea is made,"2158,2172"
51243,08324837,n,9,eastern North American herb whose yellow flowers are (or were) used in dyeing,"2158,2172"
51244,08324990,n,9,vigorous showy goldenrod common along eastern and Gulf coasts of North America,"2158,2172"
51245,08325174,n,9,western American goldenrod with long narrow clusters of small yellow flowers,"2158,2172"
51246,08325335,n,9,a variety of goldenrod,"2158,2172"
51247,08325421,n,9,a variety of goldenrod,"2158,2172"
51248,08325509,n,9,a variety of goldenrod,"2158,2172"
51249,08325592,n,9,a variety of goldenrod,"2158,2172"
51250,08325684,n,9,a variety of goldenrod,"2158,2172"
51251,08325768,n,9,a variety of goldenrod,"2158,2172"
51205,08316904,n,9,small genus of tropical American annual herbs: creeping zinnia,2158
51256,08326511,n,9,genus of western North American low evergreen shrubs growing in dense tufts,2158
51255,08326356,n,9,annual Eurasian sow thistle with soft spiny leaves and rayed yellow flower heads,"2158,2172"
51258,08326996,n,9,genus of shrubs and herbs of tropical and warm Americas,2158
51257,08326696,n,9,dark green erect herb of northwestern United States and southwestern Canada having stiff leaves in dense tufts and yellow flower heads; sometimes placed in genus Haplopappus,"2158,2172"
51262,08327707,n,9,marigolds,2158
51259,08327148,n,9,any plant of the genus Stevia or the closely related genus Piqueria having glutinous foliage and white or purplish flowers; Central and South America,"2158,2172"
51260,08327369,n,9,"1 species: stokes"" aster",2158
51261,08327503,n,9,erect perennial of southeastern United States having large heads of usually blue flowers,"2158,2172"
51271,08330037,n,9,made of dried flower heads of pyrethrum plants,2111
51263,08327826,n,9,any of various tropical American plants of the genus Tagetes widely cultivated for their showy yellow or orange flowers,"2158,2172"
51264,08328055,n,9,a stout branching annual with large yellow to orange flower heads; Mexico and Central America,"2158,2172"
51265,08328260,n,9,strong-scented bushy annual with orange or yellow flower heads marked with red; Mexico and Guatemala,"2158,2172"
51281,08332352,n,9,genus of hairy yellow-flowered plants ofwestern United States; includes plants sometimes placed in genus Hymenoxys,2158
51267,08328817,n,9,tansy-scented Eurasian perennial herb with buttonlike yellow flowers; used as potherb or salad green and sometimes for potpourri or tea or flavoring; sometimes placed in genus Chrysanthemum,"2158,2172"
51268,08329200,n,9,densely hairy plant with rayless flowers; San Francisco Bay area,"2158,2172"
51269,08329372,n,9,spring-flowering garden perennial of Asiatic origin having finely divided aromatic leaves and white to pink-purple flowers; source of an insecticide; sometimes placed in genus Chrysanthemum,"2158,2172"
51270,08329700,n,9,white-flowered pyrethrum of Balkan area whose pinnate leaves are white and silky-hairy below; source of an insecticide; sometimes placed in genus Chrysanthemum,"2158,2172"
51276,08331313,n,9,an asterid dicot genus of the family Compositae including dandelions,2158
51272,08330139,n,9,lightly hairy rhizomatous perennial having aromatic feathery leaves and stems bearing open clusters of small buttonlike yellow flowers; sand dunes of Pacific coast of North America,"2158,2172"
51273,08330425,n,9,bushy aromatic European perennial herb having clusters of buttonlike white-rayed flower heads; valued traditionally for medicinal uses; sometimes placed in genus Chrysanthemum,"2158,2172"
51274,08330724,n,9,shrubby perennial of the Canary Islands having white flowers and leaves and hairy stems covered with dust-like down; sometimes placed in genus Chrysanthemum,"2158,2172"
51275,08331043,n,9,common perennial aromatic herb native to Eurasia having buttonlike yellow flower heads and bitter-tasting pinnate leaves sometimes used medicinally,"2158,2172"
51279,08332007,n,9,the foliage of the dandelion plant,2172
51277,08331493,n,9,any of several herbs of the genus Taraxacum having long tap roots and deeply notched leaves and bright yellow flowers followed by fluffy seed balls,"2158,2172"
51278,08331762,n,9,Eurasian plant widely naturalized as a weed in North America; used as salad greens and to make wine,"2158,2172"
51288,08334174,n,9,genus of Old World herbs with linear entire leaves and yellow or purple flower heads,2158
51280,08332122,n,9,perennial dandelion native to Kazakh Republic of Russia cultivated for its fleshy roots which have high rubber content,"2158,2172"
51284,08333267,n,9,genus of robust herbs of Mexico and Central America: Mexican sunflower,2158
51283,08332925,n,9,whitish hairy plant with featherlike leaves and a few stout stems each bearing an especially handsome solitary large yellow flower head; mountainous regions north central United States,"2158,2172"
51253,08325961,n,9,sow thistles,2158
51285,08333436,n,9,any plant of the genus Tithonia; tall coarse herbs or shrubs of Mexico to Panama having large sunflowerlike flower heads with yellow disc florets and golden-yellow to orange-scarlet rays,"2158,2172"
51287,08333886,n,9,dwarf tufted nearly stemless herb having a rosette of woolly leaves and large white-rayed flower heads and bristly achenes; central Canada and United States west to Arizona,"2158,2172"
51291,08334948,n,9,edible root of the salsify plant,2172
51289,08334391,n,9,European perennial naturalized throughout United States having hollow stems with a few long narrow tapered leaves and each bearing a solitary pale yellow flower,"2158,2172"
51290,08334632,n,9,Mediterranean biennial herb with long-stemmed heads of purple ray flowers and milky sap and long edible root; naturalized throughout United States,"2158,2172"
51286,08333716,n,9,genus of western American low tufted herbs: Easter daisy,2158
51591,08400852,n,9,common wild European cyclamen with pink flowers,"2158,2172"
51266,08328439,n,9,a large genus of plants resembling chrysanthemums; comprises some plants often included in other genera especially genus Chrysanthemum,2158
51301,08337339,n,9,genus of South African herbs and shrubs cultivated as ornamentals,2158
51294,08335422,n,9,perennial of southeastern United States with leaves having the fragrance of vanilla,"2158,2172"
51293,08335274,n,9,genus of herbs of southern United States,2158
51297,08336228,n,9,mat-forming perennial herb of Asia Minor; sometimes included in genus Matricaria,"2158,2172"
51298,08336449,n,9,low densely tufted perennial herb of Turkey having small white flowers; used as a ground cover in dry places; sometimes included in genus Matricaria,"2158,2172"
51303,08337675,n,9,herbs and shrubs of warm North America to Mexico; includes plants formerly placed in genus Actinomeris,2158
51300,08337045,n,9,perennial herb with large rounded leaves resembling a colt's foot and yellow flowers appearing before the leaves do; native to Europe but now nearly cosmopolitan; used medicinally especially formerly,"2158,2172"
51304,08337889,n,9,used in some classification systems for plants now included in genus Verbesina,2158
51302,08337502,n,9,any of various plants of the genus Ursinia grown for their yellow- or orange- or white-rayed flowers,"2158,2172"
51325,08342334,n,9,family of bristly hairy sometimes climbing plants; America and Africa and southern Arabia,2158
51299,08336736,n,9,genus of low creeping yellow-flowered perennial herbs of north temperate regions: coltsfoots; in some classifications includes species often placed in other genera especially Homogyne and Petasites,2158
51305,08338064,n,9,any plant of the genus Verbesina having clustered white or yellow flower heads,"2158,2172"
51306,08338304,n,9,perennial herb with showy yellow flowers; the eastern United States,"2158,2172"
51307,08338535,n,9,coarse grayish green annual yellow-flowered herb; southwestern United States to Mexico,"2158,2172"
51308,08338784,n,9,perennial herb with yellow flowers; southern and south central United States,"2158,2172"
51309,08338943,n,9,tall perennial herb having clusters of white flowers; the eastern United States,"2158,2172"
51312,08339598,n,9,coarse leafy perennial plants resembling sunflowers found especially in the United States,2158
51311,08339310,n,9,any of various plants of the genus Vernonia of tropical and warm regions of especially North America that take their name from their loose heads of purple to rose flowers that quickly take on a rusty hue,"2158,2172"
51316,08340472,n,9,coarse herbs having small heads of greenish flowers followed by burrs with hooked bristles,2158
51313,08339823,n,9,balsamic-resinous herb with clumps of lanceolate leaves and stout leafy stems ending in large deep yellow flowers on long stalks; northwestern United States,"2158,2172"
51314,08340080,n,9,herb with basal leaves and leafy hairy stems bearing solitary flower heads with white or pale cream rays; northwestern United States,"2158,2172"
51315,08340325,n,9,low tufted white-woolly yellow-flowered herb of California,"2158,2172"
51318,08340816,n,9,genus of annual densely hairy herbs of Mediterranean to southwestern Asia,2158
51317,08340672,n,9,any coarse weed of the genus Xanthium having spiny burrs,"2158,2172"
51321,08341445,n,9,genus of annual or perennial plants of tropical America having solitary heads of brightly colored flowers,2158
51319,08341010,n,9,any plant of the genus Xeranthemum native to southern Europe having chaffy or silvery flower heads with purplish tubular flowers,"2158,2172"
51320,08341215,n,9,mostly widely cultivated species of everlasting flowers having usually purple flowers; southern Europe to Iran; naturalized elsewhere,"2158,2172"
51326,08342570,n,9,genus of tropical American prickly herbs or subshrubs,2158
51322,08341647,n,9,any of various plants of the genus Zinnia cultivated for their variously and brightly colored flower heads,"2158,2172"
51323,08341890,n,9,subshrub with slender woolly stems and long narrow leaves and flower heads with white rays; southern United States and northern Mexico,"2158,2172"
51324,08342100,n,9,subshrub having short leafy stems and numerous small flower heads with nearly round yellow-orange rays; Arizona south to Mexico and east to Kansas,"2158,2172"
51310,08339122,n,9,genus of New World tropical herbs or shrubs with terminal cymose heads of tubular flowers,2158
51328,08342929,n,9,genus of bristly herbs or subshrubs of western America lacking stinging hairs,2158
51327,08342719,n,9,any of various perennial South American plants of the genus Loasa having stinging hairs and showy white or yellow or reddish-orange flowers,"2158,2172"
51333,08343851,n,9,seed vessel having hooks or prickles,2172
51329,08343137,n,9,biennial of southwestern United States having lustrous-white stems and toothed leaves grown for its large pale yellow flowers that open in early morning,"2158,2172"
51330,08343414,n,9,annual grown especially for its fragrant golden nocturnal flowers,"2158,2172"
51331,08343574,n,9,small dry indehiscent fruit with the seed distinct from the fruit wall,"2172,2354"
51332,08343715,n,9,a winged often one-seed indehiscent fruit as of the ash or elm or maple,"2172,2354"
51334,08343962,n,9,in some classifications includes Lobeliaciae,2158
51295,08335606,n,9,small genus comprising plants often included in genus Matricaria,2158
51337,08344713,n,9,perennial of northern hemisphere with slender stems and bell-shaped blue flowers,"2158,2172"
51338,08344884,n,9,erect European herb with creeping rootstocks and nodding spikelike racemes of blue to violet flowers,"2158,2172"
51339,08345076,n,9,European biennial widely cultivated for its blue or violet or white flowers,"2158,2172"
51340,08345249,n,9,bellflower of southeastern United States (Maryland to Georgia) having pale blue flowers,"2158,2172"
51341,08345423,n,9,annual or perennial of eastern North America with long spikes of blue or white flowers,"2158,2172"
51342,08345593,n,9,bellflower common in marshes of eastern North America having lanceolate linear leaves and small whitish flowers,"2158,2172"
51343,08345791,n,9,bellflower of Europe to temperate Asia having dense spikes of violet-blue to white flowers,"2158,2172"
51344,08345970,n,9,perennial European bellflower with racemose white or blue flowers,"2158,2172"
51345,08346145,n,9,bellflower of southeastern Europe,"2158,2172"
51346,08346283,n,9,bellflower of Europe and Asia and North Africa having bluish flowers and an edible tuberous root used with the leaves in salad,"2158,2172"
51347,08346507,n,9,European bellflower with blue-purple to lilac flowers formerly used to treat sore throat,"2158,2172"
51348,08346702,n,9,European perennial bellflower that grows in clumps with spreading stems and blue or white flowers,"2158,2172"
51352,08350633,n,9,type genus of the orchid family; hardy terrestrial orchids of the temperate the northern hemisphere,2158
51357,08351654,n,9,epiphytic orchids of tropical Asia having stiff 2-ranked leaves and fragrant white flowers in arching racemes,2158
51351,08348831,n,9,any of numerous plants of the orchid family usually having flowers of unusual shapes and beautiful colors,"2158,2172"
51374,08354877,n,9,genus of tropical American epiphytic orchids having striking axillary racemes of yellow to green spiderlike flowers with long slender sepals and warty lips: spider orchids,2158
51353,08350829,n,9,any of various deciduous terrestrial orchids having fleshy tubers and flowers in erect terminal racemes,"2158,2172"
51354,08351058,n,9,Eurasian orchid with showy pink or purple flowers in a loose spike,"2158,2172"
51355,08351221,n,9,Mediterranean orchid having usually purple flowers with a fan-shaped spotted or striped rose-red lip,"2158,2172"
51356,08351426,n,9,North American orchid having a spike of violet-purple flowers mixed with white; sepals and petals form a hood,"2158,2172"
51359,08351965,n,9,genus of tropical Old World epiphytic orchids with showy flowers sometimes grotesque,2158
51358,08351861,n,9,any orchid of the genus Aerides,"2158,2172"
51361,08352407,n,9,genus of delicate Asiatic orchids,2158
51363,08352755,n,9,a monocotyledonous genus of the family Orchicaceae,2158
51362,08352560,n,9,any of several delicate Asiatic orchids grown especially for their velvety leaves with metallic white or gold veining,"2158,2172"
51365,08353098,n,9,genus of bog orchids of North America and Japan,2158
51364,08352917,n,9,North American orchid bearing a single leaf and yellowish-brown flowers,"2158,2172"
51368,08353654,n,9,genus of tropical American terrestrial orchids with large purple or pink flowers,2158
51366,08353263,n,9,any of several bog orchids of the genus Arethusa having 1 or 2 showy flowers,"2158,2172"
51367,08353431,n,9,a bog orchid with usually a solitary fragrant magenta pink blossom with a wide-gaping corolla; Canada,"2158,2172"
51370,08354024,n,9,small genus of chiefly east Asiatic hardy terrestrial orchids similar to genus Bletia,2158
51369,08353831,n,9,any of various orchids of the genus Bletia having pseudo-bulbs and erect leafless racemes of large purple or pink flowers,"2158,2172"
51372,08354464,n,9,genus of tropical American epiphytic or lithophytic rhizomatous orchids,2158
51371,08354219,n,9,Japanese orchid with white-striped leaves and slender erect racemes of rose to magenta flowers; often cultivated; sometimes placed in genus Bletia,"2158,2172"
51377,08355522,n,9,terrestrial orchids of Australia to New Caledonia,2158
51373,08354636,n,9,any of various tropical American orchids with usually solitary fleshy leaves and showy white to green nocturnally fragrant blossoms solitary or in racemes of up to 7,"2158,2172"
51375,08355175,n,9,South American orchid with spiderlike pale-yellow to pale-green flowers,"2158,2172"
51376,08355347,n,9,Central American orchid having spiderlike flowers with prominent green warts,"2158,2172"
51380,08356066,n,9,large and widely distributed genus of terrestrial orchids,2158
51378,08355690,n,9,any of various orchids of the genus Caladenia,"2158,2172"
51379,08355828,n,9,orchid with red-tinged linear leaves and panicle of purple-marked pale-yellow flowers with deep red or purple lip; southwestern Australia,"2158,2172"
51349,08346909,n,9,order of plants with irregular flowers having minute seeds: Orchidaceae; Burmanniaceae,2158
51350,08347128,n,9,enormous cosmopolitan family of perennial terrestrial or epiphytic plants with fleshy tubers or rootstocks and unusual flowers,2158
51384,08356706,n,9,1 species found throughout much of northern North America and Eurasia,2158
51383,08356576,n,9,an orchid,"2158,2172"
51386,08357088,n,9,genus of tropical American orchids having showy male and female flowers usually on separate inflorescences,2158
51385,08356854,n,9,rare north temperate bog orchid bearing a solitary white to pink flower marked with purple at the tip of an erect reddish stalk above 1 basal leaf,"2158,2172"
51390,08358070,n,9,small genus of temperate Old World terrestrial orchids,2158
51387,08357306,n,9,orchid having both male and female flowers in the same raceme; when a sensitive projection at the base of the column of the male flower is touched the pollen is suddenly ejected,"2158,2172"
51382,08356428,n,9,terrestrial orchids of North America,2158
51389,08357825,n,9,any orchid of the genus Cattleya characterized by a hood-shaped three-lobed lip enclosing the column; among the most popular and most extravagantly beautiful orchids known,"2158,2172"
51399,08359934,n,9,large diverse genus of tropical Asiatic epiphytic orchids,2158
51391,08358263,n,9,any of several orchids of the genus Cephalanthera,"2158,2172"
51392,08358407,n,9,orchid of Mediterranean and Asia having a lax spike of bright rose-pink flowers,"2158,2172"
51394,08358818,n,9,orchid of northeastern United States with magenta-pink flowers having funnel-shaped lip; sometimes placed in genus Pogonia,"2158,2172"
51395,08359096,n,9,orchid of central and northern South America having 1- to 3-blossomed racemes of large showy rose-colored flowers; sometimes placed in genus Pogonia,"2158,2172"
51401,08360451,n,9,genus of leafless root-parasitic orchids having small purplish or yellowish racemose flowers with lobed lips; widely distributed in temperate regions,2158
51397,08359571,n,9,orchid with broad ovate leaves and long-bracted green very irregular flowers,"2158,2172"
51398,08359751,n,9,orchid having hooded long-bracted green to yellow-green flowers suffused with purple,"2158,2172"
51406,08361812,n,9,small genus of tropical American epiphytic or lithophytic orchids,2158
51410,08362604,n,9,genus of tropical epiphytic or terrestrial Old World orchids; one of the most popular orchid genera,2158
51402,08360718,n,9,a wildflower of the genus Corallorhiza growing from a hard mass of rhizomes associated with a fungus that aids in absorbing nutrients from the forest floor,"2158,2172"
51403,08361003,n,9,common coral root having yellowish- or reddish- or purplish-brown leafless stems bearing loose racemes of similarly colored flowers with white purple-spotted lips; Guatemala to Canada,"2158,2172"
51404,08361275,n,9,nearly leafless wildflower with erect reddish-purple stems bearing racemes of pale pinkish and brownish-striped flowers; western Canada to Mexico,"2158,2172"
51405,08361508,n,9,plant having clumps of nearly leafless pale yellowish to greenish stems bearing similarly colored flowers with white lower lips; northern New Mexico north through South Dakota and Washington to Alaska,"2158,2172"
51408,08362215,n,9,genus of epiphytic or terrestrial tropical American orchids,2158
51407,08361991,n,9,any of several orchids of the genus Coryanthes having racemes of a few musky-scented waxy flowers with a helmet-shaped lip process,"2158,2172"
51396,08359357,n,9,terrestrial orchids of cooler parts of North America and Europe: satyr orchid,2158
51409,08362386,n,9,any of several orchids of the genus Cycnoches having slender arching columns of flowers suggesting the neck of a swan,"2158,2172"
51412,08363126,n,9,genus of chiefly American perennial leafy-stemmed orchids: lady's slippers; sometimes includes species of genus Paphiopedilum,2158
51388,08357587,n,9,large and highly valued genus of beautiful tropical American epiphytic or lithophytic orchids; the typical orchids; known in many varieties,2158
51393,08358589,n,9,terrestrial orchids of North and South America having slender fibrous roots; allied to genus Pogonia,2158
51413,08363385,n,9,a plant or flower of the genus Cypripedium,"2158,2172"
51414,08363502,n,9,any of several chiefly American wildflowers having an inflated pouchlike lip; difficult or impossible to cultivate in the garden,"2158,2172"
51415,08363886,n,9,once common rose pink woodland orchid of eastern North America,"2158,2172"
51416,08364043,n,9,pale pink wild orchid of northeastern America having an inflated pouchlike lip,"2158,2172"
51417,08364275,n,9,orchid of northern North America having a brownish-green flower and red-and-white lip suggestive of a ram's head,"2158,2172"
51418,08364496,n,9,"maroon to purple-brown orchid with yellow lip; Europe, North America and Japan","2158,2172"
51419,08364732,n,9,plant of eastern and central North America having slightly fragrant purple-marked greenish-yellow flowers,"2158,2172"
51420,08364945,n,9,often having many yellow-green orchids with white pouches growing along streams and seeps of southwestern Oregon and northern California,"2158,2172"
51411,08362803,n,9,"any of various plants of the genus Cymbidium having narrow leaves and a long drooping cluster of numerous showy and variously colored boat-shaped flowers; extensively hybridized and cultivated as houseplants and important florists"" flowers","2158,2172"
51422,08365477,n,9,leafy plant having a few stems in a clump with 1 white and dull purple flower in each upper leaf axil; Alaska to northern California and Wyoming,"2158,2172"
51426,08366375,n,9,large genus and variable genus of chiefly epiphytic or lithophytic orchids of tropical and subtropical Asia and Australasia,2158
51424,08365915,n,9,any of several orchids of the genus Dactylorhiza having fingerlike tuberous roots; Europe and Mediterranean region,"2158,2172"
51425,08366107,n,9,European orchid having lanceolate leaves spotted purple and pink to white or mauve flowers spotted or lined deep red or purple,"2158,2172"
51428,08366764,n,9,genus of showy tropical African terrestrial orchids,2158
