52358,08563076,n,9,leafless fleshy saprophytic plants; in some classifications placed in the family Pyrolaceae,2158
52393,08570616,n,9,any of various beeches of the southern hemisphere having small usually evergreen leaves,"2158,2172"
52394,08570927,n,9,large evergreen tree of Tasmania,"2158,2172"
52395,08571043,n,9,Chilean evergreen whose leafy boughs are used for thatching,"2158,2172"
52396,08571195,n,9,any of several tall New Zealand trees of the genus Nothofagus; some yield useful timber,"2158,2172"
52397,08571383,n,9,New Zealand beech with usually pale silvery bark,"2158,2172"
52398,08571532,n,9,tall deciduous South American tree,"2158,2172"
52360,08563536,n,9,"term used in some classifications for the pinesaps, which are usually included in the genus Monotropa",2158
52486,08590872,n,9,mostly deciduous monoecious trees or shrubs: hornbeams; sometimes placed in subfamily Carpinaceae,2158
52405,08572477,n,9,oaks,2158
52407,08573299,n,9,the hard durable wood of any oak; used especially for furniture and flooring,"2172,2415"
52408,08573480,n,9,oak given a weathered appearance by exposure to fumes of ammonia; used for cabinetwork,"2172,2415"
52409,08573622,n,9,any of several American evergreen oaks,"2158,2172"
52411,08574033,n,9,"any of numerous Old World and American oaks having 6 to 8 stamens in each floret, acorns that mature in one year and leaf veins that never extend beyond the margin of the leaf","2158,2172"
52412,08574408,n,9,large slow-growing deciduous tree of the eastern United States having stout spreading branches and leaves with usually 7 rounded lobes; yields strong and durable hard wood,"2158,2172"
52413,08574659,n,9,semi-evergreen shrub or small tree of Arizona and New Mexico having acorns with hemispherical cups,"2158,2172"
52414,08574841,n,9,large flaky-barked deciduous oak of the eastern United States with leaves having fewer lobes than other white oaks; yields heavy strong wood used in construction; thrives in wet soil,"2158,2172"
52415,08575115,n,9,large deciduous tree of central and southern Europe and Asia Minor having oblong-lanceolate leaves with spiked lobes,"2158,2172"
52416,08575327,n,9,medium-sized evergreen of southwestern United States and northwestern Mexico with oblong leathery often spiny-edged leaves,"2158,2172"
52417,08575568,n,9,medium-large thick-trunked deciduous tree of the eastern United States and southern Canada having close-grained wood and deeply 7-lobed leaves turning scarlet in autumn,"2158,2172"
52418,08575813,n,9,small to medium deciduous oak of east central North America; leaves have sharply pointed lobes,"2158,2172"
52419,08576005,n,9,"any of numerous American oaks having 4 stamens in each floret, acorns requiring two years to mature and leaf veins usually extending beyond the leaf margin to form points or bristles","2158,2172"
52421,08576601,n,9,small deciduous tree of western North America with crooked branches and pale gray bark,"2158,2172"
52422,08576794,n,9,evergreen oak of southern Europe having leaves somewhat resembling those of holly; yields a hard wood,"2158,2172"
52423,08577012,n,9,hard wood of the holm oak tree,"2172,2415"
52424,08577097,n,9,shrubby oak of southeastern United States usually forming dense thickets,"2158,2172"
52425,08577245,n,9,small deciduous tree of eastern and central United States having shining laurel-like leaves; wood used in western states for shingles,"2158,2172"
52426,08577470,n,9,small semi-evergreen shrubby tree of southeastern United States having hairy young branchlets and leaves narrowing to a slender bristly point,"2158,2172"
52427,08577700,n,9,large deciduous tree of the Pacific coast having deeply parted bristle-tipped leaves,"2158,2172"
52428,08577871,n,9,small slow-growing deciduous shrubby tree of dry sandy barrens of southeastern United States having leaves with bristle-tipped lobes resembling turkey's toes,"2158,2172"
52429,08578124,n,9,large nearly semi-evergreen oak of southeastern United States; thrives in damp soil,"2158,2172"
52430,08578296,n,9,tall graceful deciduous California oak having leathery leaves and slender pointed acorns,"2158,2172"
52431,08578508,n,9,medium-large deciduous timber tree of central and southern United States; acorns deeply immersed in the cup and mature in first year,"2158,2172"
52432,08578715,n,9,medium to large deciduous oak of central and eastern North America with ovoid acorns deeply immersed in large fringed cups; yields tough close-grained wood,"2158,2172"
52433,08578987,n,9,any of various chiefly American small shrubby oaks often a dominant form on thin dry soils sometimes forming dense thickets,"2158,2172"
52434,08579220,n,9,a common scrubby deciduous tree of central and southeastern United States having dark bark and broad 3-lobed (club-shaped) leaves; tends to form dense thickets,"2158,2172"
52435,08579484,n,9,medium to large deciduous tree of moist areas of southeastern United States similar to the basket oak,"2158,2172"
52436,08579670,n,9,oak with moderately light fine-grained wood; Japan,"2158,2172"
52437,08579842,n,9,an oak having leaves resembling those of chestnut trees,"2158,2172"
52438,08580028,n,9,medium-sized deciduous tree of the eastern United States that yields a strong durable wood,"2158,2172"
52439,08580241,n,9,small evergreen shrub or tree of southeastern United States; often forms almost impenetrable thickets in sandy coastal areas,"2158,2172"
52440,08580463,n,9,relatively tall deciduous water oak of southeastern United States often cultivated as a shade tree; thrives in wet soil,"2158,2172"
52441,08580667,n,9,similar to the pin oak; grows in damp sites in Mississippi River basin,"2158,2172"
52442,08580830,n,9,deciduous European oak valued for its tough elastic wood,"2158,2172"
52443,08580981,n,9,medium to large deciduous tree of the eastern United States; its durable wood is used as timber or split and woven into baskets or chair seats,"2158,2172"
52406,08572627,n,9,"a deciduous tree of the genus Quercus; has acorns and lobed leaves: ""great oaks grow from little acorns""","2158,2172"
52445,08581503,n,9,medium to large deciduous oak of the eastern United States having long lanceolate leaves and soft strong wood,"2158,2172"
52446,08581687,n,9,deciduous shrubby tree of northeastern and central United States having a sweet edible nut and often forming dense thickets,"2158,2172"
52447,08581931,n,9,medium to large deciduous European oak having smooth leaves with rounded lobes; yields hard strong light-colored wood,"2158,2172"
52448,08582153,n,9,large symmetrical deciduous tree with rounded crown widely distributed in eastern North America; has large leaves with triangular spiny tipped lobes and coarse-grained wood less durable than that of white oaks,"2158,2172"
52449,08582460,n,9,"large deciduous red oak of southern and eastern United States having large 7- to 9-lobed elliptical leaves, large acorns and medium hard coarse-grained wood","2158,2172"
52450,08582712,n,9,small deciduous tree of eastern and central United States having dark green lyrate pinnatifid leaves and tough moisture-resistant wood used especially for fence posts,"2158,2172"
52451,08582991,n,9,medium-sized evergreen oak of southern Europe and northern Africa having thick corky bark that is periodically stripped to yield commercial cork,"2158,2172"
52452,08583206,n,9,small deciduous tree having the trunk branched almost from the base with spreading branches; Texas and southern Oklahoma,"2158,2172"
52453,08583401,n,9,a low spreading or prostrate shrub of southwestern United States with small acorns and leaves resembling those of the huckleberry,"2158,2172"
52454,08583634,n,9,"medium to large deciduous tree of China, Japan, and Korea having thick corky bark","2158,2172"
52455,08583799,n,9,medium to large deciduous timber tree of the eastern United States and southeastern Canada having dark outer bark and yellow inner bark used for tanning; broad 5-lobed leaves are bristle-tipped,"2158,2172"
52456,08584110,n,9,medium-sized evergreen native to eastern North America to the east coast of Mexico; often cultivated as shade tree for it wide-spreading crown; extremely hard tough durable wood once used in shipbuilding,"2158,2172"
52458,08584707,n,9,nuts of forest trees (as beechnuts and acorns) accumulated on the ground; used especially as food for swine,"2172,2354"
52460,08585246,n,9,a genus of trees of the family Betulaceae (such as birches),2158
52473,08588288,n,9,alders,2158
52461,08585601,n,9,any betulaceous tree or shrub of the genus Betula having a thin peeling bark,"2158,2172"
52462,08585960,n,9,hard close-grained wood of any of various birch trees; used especially in furniture and interior finishes and plywood,"2172,2415"
52463,08586148,n,9,tree of eastern North America with thin lustrous yellow or gray bark,"2158,2172"
52464,08586334,n,9,small American birch with peeling white bark often worked into e.g. baskets or toy canoes,"2158,2172"
52465,08586577,n,9,medium-sized birch of eastern North America having white or pale gray bark and valueless wood; occurs often as a second-browth forest tree,"2158,2172"
52466,08586834,n,9,European birch with silvery white peeling bark and markedly drooping branches,"2158,2172"
52467,08587044,n,9,European birch with dull white to pale brown bark and somewhat drooping hairy branches,"2158,2172"
52468,08587240,n,9,birch of swamps and river bottoms throughout the eastern United States having reddish-brown bark,"2158,2172"
52469,08587454,n,9,common birch of the eastern United States having spicy brown bark yielding a volatile oil and hard dark wood used for furniture,"2158,2172"
52470,08587702,n,9,Alaskan birch with white to pale brown bark,"2158,2172"
52471,08587849,n,9,birch of western United States resembling the paper birch but having brownish bark,"2158,2172"
52472,08588097,n,9,small shrub of colder parts of North America and Greenland,"2158,2172"
52474,08588569,n,9,north temperate shrubs or trees having toothed leaves and conelike fruit; bark is used in tanning and dyeing and the rot-resistant wood,"2158,2172"
52475,08588969,n,9,wood of any of various alder trees; resistant to underwater rot; used for bridges etc,"2172,2415"
52476,08589125,n,9,medium-sized tree with brown-black bark and woody fruiting catkins; leaves are hairy beneath,"2158,2172"
52477,08589353,n,9,native to Europe but introduced in America,"2158,2172"
52478,08589486,n,9,shrub or small tree of southeastern United States having soft light brown wood,"2158,2172"
52479,08589660,n,9,tree of western United States,"2158,2172"
52480,08589803,n,9,large tree of Pacific coast of North America having hard red wood much used for furniture,"2158,2172"
52481,08589996,n,9,common shrub of Canada and northeastern United States having shoots scattered with rust-colored down,"2158,2172"
52482,08590191,n,9,common shrub of the eastern United States with smooth bark,"2158,2172"
52483,08590359,n,9,shrub of mountainous areas of Europe,"2158,2172"
52484,08590488,n,9,North American shrub with light green leaves and winged nuts,"2158,2172"
52459,08584865,n,9,monoecious trees and shrubs (including the genera Betula and Alnus and Carpinus and Corylus and Ostrya and Ostryopsis),2158
52485,08590663,n,9,used in some classification systems for the genera Carpinus; Ostryopsis; and Ostryopsis,2158
52488,08591279,n,9,medium-sized Old World tree with smooth gray bark and beech-like leaves that turn yellow-orange in autumn,"2158,2172"
52489,08591486,n,9,tree or large shrub with gray bark and blue-green leaves that turn red-orange in autumn,"2158,2172"
52491,08591933,n,9,any of several trees resembling hornbeams with fruiting clusters resembling hops,"2158,2172"
52492,08592127,n,9,medium-sized hop hornbeam of southern Europe and Asia Minor,"2158,2172"
52493,08592296,n,9,medium-sized hop hornbeam of eastern North America,"2158,2172"
52503,08594326,n,9,chiefly herbaceous plants with showy flowers; some are cultivated as ornamentals,2158
52497,08593114,n,9,any of several shrubs or small trees of the genus Corylus bearing edible nuts enclosed in a leafy husk,"2158,2172"
52498,08593406,n,9,the fine-grained wood of a hazelnut tree (genus Corylus) and the hazel tree (Australian genus Pomaderris),"2172,2415"
52499,08593601,n,9,nut-bearing shrub of eastern North America,"2158,2172"
52500,08593724,n,9,small nut-bearing tree much grown in Europe,"2158,2172"
52501,08593876,n,9,hazel of western United States with conspicuous beaklike involucres on the nuts,"2158,2172"
52676,08628937,n,9,oleaster,2158
52514,08596495,n,9,genus of tropical Asiatic and African plants: especially Persian violets,2158
52512,08595973,n,9,small genus of herbs of warm regions of southern North America to northern South America,2158
52505,08594958,n,9,any of various plants of the genus Centaurium,"2158,2172"
52506,08595185,n,9,erect plant with small clusters of pink trumpet-shaped flowers of southwestern United States,"2158,2172"
52507,08595353,n,9,common European glabrous annual centaury with flowers in dense cymes,"2158,2172"
52508,08595502,n,9,tufted perennial of western Europe and Azores having bright pink to white flowers,"2158,2172"
52509,08595669,n,9,a variety of centaury found at the seaside,"2158,2172"
52510,08595774,n,9,a variety of centaury with broad leaves,"2158,2172"
52511,08595881,n,9,a slender variety of centaury,"2158,2172"
52502,08594035,n,9,Gentianaceae; Apocyanaceae; Asclepiadaceae; Loganiaceae; Oleaceae; Salvadoraceae,2158
52513,08596169,n,9,one of the most handsome prairie wildflowers laving large erect bell-shaped bluish flowers; of moist places in prairies and fields from eastern Colorado and Nebraska south to New Mexico and Texas,"2158,2172"
52516,08596865,n,9,genus of North American herbs: columbo; includes some species sometimes placed in genus Swertia,2158
52515,08596673,n,9,perennial cultivated especially as a houseplant for its fragrant bluish to dark lavender flowers,"2158,2172"
52519,08597627,n,9,type genus of the Gentianaceae; cosmopolitan genus of herbs nearly cosmopolitan in cool temperate regions; in some classifications includes genera Gentianopsis and Gentianella,2158
52517,08597087,n,9,any of various tall perennial herbs constituting the genus Frasera; widely distributed in warm dry upland areas of the United States Pacific states,"2158,2172"
52518,08597388,n,9,tall herb with panicles of white flowers flushed with green; northwestern United States; sometimes placed in genus Swertia,"2158,2172"
52529,08599768,n,9,genus of herbs with flowers that resemble gentian; in some classifications included in genus Gentiana,2158
52520,08597931,n,9,any of various plants of the family Gentianaceae especially the genera Gentiana and Gentianella and Gentianopsis,"2158,2172"
52521,08598332,n,9,low-growing alpine plant cultivated for its dark glossy green leaves in basal rosettes and showy solitary bell-shaped blue flowers,"2158,2172"
52522,08598539,n,9,gentian of eastern North America having tubular blue or white flowers that open little if at all,"2158,2172"
52523,08598750,n,9,tufted sometimes sprawling perennial with blue flowers spotted with green; western North America,"2158,2172"
52524,08598931,n,9,similar to Gentiana andrewsii but with larger flowers,"2158,2172"
52525,08599079,n,9,robust European perennial having clusters of yellow flowers,"2158,2172"
52526,08599241,n,9,perennial Eurasian gentian with sky-blue funnel-shaped flowers of damp open heaths,"2158,2172"
52527,08599445,n,9,erect perennial of wet woodlands of North America having leaves and flower buds resembling those of soapwort,"2158,2172"
52528,08599637,n,9,a perennial marsh ventian of eastern North America,"2158,2172"
52532,08600426,n,9,genus of fringed gentians; in some classifications included in genus Gentiana,2158
52530,08600004,n,9,gentian of eastern North America having clusters of bristly blue flowers,"2158,2172"
52531,08600253,n,9,gentian of Europe and China having creamy white flowers with fringed corollas,"2158,2172"
52504,08594732,n,9,genus of low-growing herbs mostly of northern hemisphere having flowers with protruding spirally twisted anthers,2158
52496,08592889,n,9,deciduous monoecious nut-bearing shrubs of small trees: hazel; sometimes placed in the subfamily or family Corylaceae,2158
52495,08592713,n,9,used in some classification systems for the genus Corylus,2158
52534,08600943,n,9,tall widely distributed fringed gentian of eastern North America having violet-blue or white fringed flowers,"2158,2172"
52535,08601137,n,9,medium-tall fringed gentian with pale-glue to blue-purple flowers; circumboreal in distribution,"2158,2172"
52536,08601318,n,9,small blue-flowered fringed gentian of east central North America,"2158,2172"
52537,08601488,n,9,small blue-flowered fringed gentian of western United States (Rocky Mountains) especially around hot springs in Yellowstone National Park,"2158,2172"
52538,08601715,n,9,small blue-flowered fringed gentian of Sierra Nevada mountains,"2158,2172"
52541,08602211,n,9,genus of smooth slender North American herbs with showy flowers,2158
52540,08602054,n,9,any of various plants of the genus Halenia having flowers with spurred lobes,"2158,2172"
52546,08603085,n,9,genus of herbs of mountains of North America and Eurasia and Africa,2158
52542,08602373,n,9,any of various plants of the genus Sabbatia having usually pink cymose flowers; occur from acid bogs to brackish marshes,"2158,2172"
52543,08602621,n,9,pink-flowered marsh plant of the eastern United States,"2158,2172"
52544,08602787,n,9,pink-flowered marsh plant of the eastern United States,"2158,2172"
52545,08602939,n,9,prairie herb with solitary lilac-colored flowers,"2158,2172"
52550,08604086,n,9,evergreen trees and shrubs having oily one-seeded fruits,2158
52549,08603902,n,9,coextensive with the family Oleaceae; in some classifications included in the order Gentianales,2158
52557,08605378,n,9,deciduous trees or shrubs: fringe tree,2158
52551,08604301,n,9,a tree of the genus Olea cultivated for its fruit,"2158,2172"
52552,08604499,n,9,hard yellow often variegated wood of an olive tree; used in cabinetwork,"2172,2415"
52553,08604641,n,9,evergreen tree cultivated in the Mediterranean region since antiquity and now elsewhere; has edible shiny black fruits,"2158,2172"
52554,08604906,n,9,small ovoid fruit of the European olive tree; important food and source of oil,"2172,2354"
52555,08605074,n,9,northern Zealand tree having dense hard light-brown wood,"2158,2172"
52556,08605227,n,9,small New Zealand tree having red pulpy one-seeded fruit,"2158,2172"
52560,08605879,n,9,genus of often spiny American shrubs and trees,2158
52558,08605532,n,9,any of various small decorative flowering trees or shrubs of the genus Chionanthus,"2158,2172"
52559,08605709,n,9,small bushy tree of southeastern United States having profuse clusters of white flowers,"2158,2172"
52563,08606435,n,9,forsythia,2158
52561,08606026,n,9,any plant of the genus Forestiera,"2158,2172"
52565,08606810,n,9,ash,2158
52564,08606544,n,9,any of various early blooming oleaceous shrubs of the genus Forsythia; native to eastern Asia and southern Europe but widely cultivated for their branches of bright yellow bell-shaped flowers,"2158,2172"
52779,08648274,n,9,1 species: pomegranates,2158
52566,08606923,n,9,any of various deciduous pinnate-leaved ornamental or timber trees of the genus Fraxinus,"2158,2172"
52567,08607363,n,9,strong elastic wood of any of various ash trees; used for furniture and tool handles and sporting goods such as baseball bats,"2172,2415"
52568,08607557,n,9,spreading American ash with leaves pale green or silvery beneath and having hard brownish wood,"2158,2172"
52569,08607728,n,9,small ash of swampy areas of southeastern United States,"2158,2172"
52570,08607862,n,9,shrubby ash of southwestern United States having fragrant white flowers,"2158,2172"
52571,08608014,n,9,shrubby California ash with showy off-white flowers,"2158,2172"
52572,08608145,n,9,tall ash of Europe to the Caucasus having leaves shiny dark-green above and pale downy beneath,"2158,2172"
52573,08608341,n,9,timber tree of western North America yielding hard light wood; closely related to the red ash,"2158,2172"
52574,08608531,n,9,vigorous spreading North American tree having dark brown heavy wood; leaves turn gold in autumn,"2158,2172"
52575,08608735,n,9,southern Mediterranean ash having fragrant white flowers in dense panicles and yielding manna,"2158,2172"
52576,08608917,n,9,smallish American tree with velvety branchlets and lower leaf surfaces,"2158,2172"
52577,08609096,n,9,a variety of red ash having glossy branchlets and lower leaf surfaces,"2158,2172"
52578,08609261,n,9,ash of central and southern United States with bluish-green foliage and hard brown wood,"2158,2172"
52579,08609428,n,9,low-growning ash of Texas,"2158,2172"
52580,08609532,n,9,timber tree of central and southeastern United States having hairy branchlets and a swollen trunk base,"2158,2172"
52548,08603467,n,9,trees and shrubs having berries or drupes or capsules as fruits; sometimes placed in the order Oleales: olive; ash; jasmine; privet; lilac,2158
52539,08601886,n,9,genus of herbs of Eurasia and the Americas: spurred gentians,2158
52582,08609862,n,9,winged seed of the ash tree,"2172,2354"
52584,08610160,n,9,any of several shrubs and vines of the genus Jasminum chiefly native to Asia,"2158,2172"
52585,08610381,n,9,evergreen rambling yellow-flowered shrub of western China,"2158,2172"
52586,08610519,n,9,deciduous rambling shrub widely cultivated for its winter-blooming yellow flowers,"2158,2172"
52587,08610683,n,9,tall-climbing deciduous shrub with fragrant white or yellow or red flowers used in perfume and to flavor tea,"2158,2172"
52588,08610901,n,9,East Indian evergreen vine cultivated for its profuse fragrant white flowers,"2158,2172"
52600,08613296,n,9,small genus of evergreen shrubs of the Mediterranean region,2158
52590,08611202,n,9,any of various Old World shrubs having smooth entire leaves and terminal panicles of small white flowers followed by small black berries; many used for hedges,"2158,2172"
52591,08611558,n,9,eastern Asian shrub cultivated especially for its persistent foliage,"2158,2172"
52592,08611705,n,9,fast-growing and tightly branched hybrid of Ligustrum ovalifolium and Ligustrum obtusifolium,"2158,2172"
52593,08611893,n,9,evergreen shrub of Japan and Korea having small dark leaves and flowers in loose panicles; related to but smaller than Chinese privet,"2158,2172"
52594,08612110,n,9,erect evergreen treelike shrub of China and Korea and Japan having acuminate leaves and flowers in long erect panicles; resembles Japanese privet,"2158,2172"
52595,08612353,n,9,small deciduous shrub having graceful arching branches and luxuriant foliage,"2158,2172"
52596,08612498,n,9,semi-evergreen Japanese shrub having malodorous flowers; used extensively for hedges because more likely to stay green that common privet,"2158,2172"
52597,08612723,n,9,deciduous semi-evergreen shrub used for hedges,"2158,2172"
52616,08616430,n,9,a group of chiefly woody plants considered among the most primitive of angiosperms; perianth poorly developed or lacking; flowers often unisexual and often in catkins and often wind pollinated; contains 23 families including the Betulaceae and Fagaceae (includes the Amentiferae); sometimes classified as a superorder,2158
52599,08613076,n,9,small tree of southern United States having panicles of dull white flowers followed by dark purple fruits,"2158,2172"
52618,08617160,n,9,genus of fossil plants of the Oligocene having flowers resembling those of the witch hazel; found in Baltic region,2158
52601,08613467,n,9,evergreen shrub with white flowers and olivelike fruits,"2158,2172"
52622,08618073,n,9,deciduous shrubs or small trees: witch hazel,2158
52603,08613795,n,9,any of various plants of the genus Syringa having large panicles of usually fragrant flowers,"2158,2172"
52604,08614066,n,9,robust upright shrub of mountains of northern India having oblong-eliptic leaves and pale lilac or white malodorous flowers,"2158,2172"
52605,08614267,n,9,central European upright shrub having elliptic leaves and upright clusters of lilac or deep violet flowers,"2158,2172"
52606,08614472,n,9,small densely branching Asiatic shrub having lanceolate leaves and panicles of fragrant lilac flowers,"2158,2172"
52607,08614651,n,9,small tree of Japan having narrow pointed leaves and creamy-white flowers,"2158,2172"
52608,08614840,n,9,lilac of northern China having ovate leaves and profuse early summer rose-lilac flowers,"2158,2172"
52609,08615006,n,9,large European lilac naturalized in North America having heart-shaped ovate leaves and large panicles of highly fragrant lilac or white flowers,"2158,2172"
52611,08615322,n,9,some genera placed in family Liliaceae,2158
52613,08615704,n,9,type genus of family Haemodoraceae,2158
52612,08615538,n,9,any of various plants of the family Haemodoraceae; roots contain a deep red coloring matter,"2158,2172"
52617,08616999,n,9,used in some classification systems for plants that bear catkins,2158
52615,08616170,n,9,sedgelike spring-flowering herb having clustered flowers covered with woolly hairs; Australia,"2158,2172"
52589,08611057,n,9,genus of Old World shrubs: privet,2158
52619,08617379,n,9,genus of fossil plants having wood identical with or similar to that of the witch hazel,2158
52621,08617740,n,9,comprises genera Hamamelis; Corylopsis; Fothergilla; Liquidambar; Parrotia; other small genera,2158
52620,08617571,n,9,genus of fossil plants having leaves similar to those of the witch hazel,2158
52602,08613599,n,9,genus of Old World shrubs or low trees having fragrant flowers in showy panicles: lilacs,2158
52610,08615227,n,9,hardened suggary exudation of various trees,2111
