51666,08416504,n,9,oats,2158
51662,08415664,n,9,coarse perennial Eurasian oatlike grass found on roadside verges and rough grassland and in hay meadows; introduced in North America for forage,"2158,2172"
51693,08420978,n,9,tufted or perennial or annual grasses having runners: finger grass; windmill grass,2158
51664,08416150,n,9,used by Maoris for thatching,"2158,2172"
51665,08416283,n,9,large rhizomatous perennial grasses found by riversides and in ditches having jointed stems and large gray-white feathery panicles,"2158,2172"
51672,08417415,n,9,a genus of grasses of the family Gramineae,2158
51658,08415042,n,9,tall annual or perennial grasses with spikelike racemes; warm regions,2158
51668,08416870,n,9,widely cultivated in temperate regions for its edible grains,"2158,2172"
51669,08417021,n,9,common in meadows and pastures,"2158,2172"
51670,08417137,n,9,oat of southern Europe and southwestern Asia,"2158,2172"
51671,08417260,n,9,Mediterranean oat held to be progenitor of modern cultivated oat,"2158,2172"
51679,08418667,n,9,forage grasses,2158
51673,08417563,n,9,any of various woodland and meadow grasses of the genus Bromus; native to temperate regions,"2158,2172"
51674,08417828,n,9,drought-resistant perennial with awns lacking or very short and long creeping rhizomes; Europe and temperate Asia,"2158,2172"
51675,08418023,n,9,weedy annual native to Europe but widely distributed as a weed especially in wheat,"2158,2172"
51676,08418184,n,9,annual or winter annual grass with softly hairy leaves of the Mediterranean,"2158,2172"
51677,08418412,n,9,annual grass of Europe and temperate Asia,"2158,2172"
51678,08418529,n,9,grass of Mediterranean and temperate Asia,"2158,2172"
51683,08419239,n,9,buffalo grass,2158
51680,08418793,n,9,pasture grass of plains of South America and western North America,"2158,2172"
51681,08419004,n,9,of western North America,"2158,2172"
51682,08419106,n,9,especially of western coastal regions of North America,"2158,2172"
51685,08419540,n,9,reed grass,2158
51684,08419360,n,9,short grass growing on dry plains of central United States (where buffalo roam),"2158,2172"
51689,08420222,n,9,a genus of grasses of the family Gramineae that have burs,2158
51686,08419669,n,9,any of various tall perennial grasses of the genus Calamagrostis having feathery plumes; natives of marshland fens and wet woodlands of temperate northern hemisphere,"2158,2172"
51687,08419946,n,9,a variety of reed grass,"2158,2172"
51688,08420074,n,9,tall Australian reedlike grass sometimes used for hay,"2158,2172"
51690,08420408,n,9,a grass of the genus Cenchrus,"2158,2172"
51691,08420541,n,9,grass of the eastern United States and tropical America having spikelets enclosed in prickly burs,"2158,2172"
51655,08414282,n,9,annual or perennial grasses including decorative and meadow species as well as notorious agricultural weeds,2158
51694,08421149,n,9,any grass of the genus Chloris; occurs in short grassland especially on waste ground or poor soils,"2158,2172"
51667,08416612,n,9,"annual grass of Europe and North Africa; grains used as food and fodder (referred to primarily in the plural: ""oats"")","2158,2172"
100619,N0000017,n,10,,
51692,08420761,n,9,erect tussock-forming perennial bur grass used in especially in South Africa and Australia for pasture and forage,"2158,2172"
51696,08421522,n,9,perennial Australian grass having numerous long spikes arranged like the vanes of a windmill,"2158,2172"
51700,08422315,n,9,creeping perennial grasses of tropical and southern Africa,2158
51698,08421932,n,9,tall perennial grass of pampas of South America having silvery plumes and growing in large dense clumps,"2158,2172"
51699,08422135,n,9,tall grass of New Zealand grown for plumelike flower heads,"2158,2172"
51703,08423019,n,9,a monocotyledonous grass of the family Gramineae (has only one species),2158
51701,08422500,n,9,trailing grass native to Europe now cosmopolitan in warm regions; used for lawns and pastures especially in southern United States and India,"2158,2172"
51702,08422810,n,9,perennial grass having stems 3 to 4 feet high; used especially in Africa and India for pasture and hay,"2158,2172"
51705,08423335,n,9,a monocotyledonous genus of the family Gramineae,2158
51704,08423181,n,9,widely grown stout Old World hay and pasture grass,"2158,2172"
51711,08424259,n,9,annual or perennial succulent grasses of warm regions,2158
51706,08423486,n,9,a creeping grass with spikes like fingers,"2158,2172"
51708,08423769,n,9,grasses with creeping stems that root freely; a pest in lawns,"2158,2172"
51709,08423987,n,9,a weed,"2158,2172"
51710,08424078,n,9,a European forage grass grown for hay; a naturalized weed in United States,"2158,2172"
51741,08429796,n,9,annual to perennial grasses of temperate northern hemisphere and South America: barley,2158
51712,08424447,n,9,a coarse annual panic grass; a cosmopolitan weed; occasionally used for hay or grazing,"2158,2172"
51717,08425664,n,9,tall tufted perennial grasses (such as lyme grass or wild rye),2158
51715,08425166,n,9,coarse annual grass having fingerlike spikes of flowers; native to Old World tropics; a naturalized weed elsewhere,"2158,2172"
51716,08425413,n,9,"East Indian cereal grass whose seed yield a somewhat bitter flour, a staple in the Orient","2158,2172"
51724,08426699,n,9,annual or perennial grasses of tropics and subtropics,2158
51718,08425851,n,9,a grass of the genus Elymus,"2158,2172"
51719,08425990,n,9,any of several grasses of the genus Elymus,"2158,2172"
51720,08426142,n,9,stout perennial grass of western North America,"2158,2172"
51721,08426291,n,9,a dune grass of the Pacific seacoast used as a sand binder,"2158,2172"
51722,08426469,n,9,North American wild rye,"2158,2172"
51723,08426574,n,9,weedy rye grass having long bristling awns,"2158,2172"
51728,08427558,n,9,genus of reedlike grasses having spikes crowded in a panicle covered with long silky hairs,2158
51697,08421733,n,9,tall ornamental grasses of South America and New Zealand and New Guinea: pampas grass,2158
51726,08427092,n,9,an African grass economically important as a cereal grass (yielding white flower of good quality) as well as for forage and hay,"2158,2172"
51727,08427324,n,9,perennial South African grass having densely clumped flimsy stems; introduced into United States especially for erosion control,"2158,2172"
51731,08428151,n,9,a genus of tufted perennial grasses of the family Gramineae,2158
51729,08427779,n,9,a reedlike grass of the genus Erianthus having large plumes,"2158,2172"
51730,08427933,n,9,grass often cultivated for its long white-ribbed leaves and large plumes resembling those of pampas grass,"2158,2172"
51735,08428870,n,9,manna grass,2158
51732,08428356,n,9,grass with wide flat leaves cultivated in Europe and America for permanent pasture and hay and for lawns,"2158,2172"
51733,08428581,n,9,cultivated for sheep pasturage in upland regions or used as a lawn grass,"2158,2172"
51734,08428764,n,9,of Australia and New Zealand,"2158,2172"
51738,08429327,n,9,a genus of Old World grasses widely cultivated in America,2158
51736,08428991,n,9,any of several moisture-loving grasses of the genus Glyceria having sweet flavor or odor,"2158,2172"
51737,08429188,n,9,a pasture grass of moist places throughout North America,"2158,2172"
51707,08423633,n,9,crab grass; finger grass,2158
51739,08429471,n,9,tall European perennial grass having a velvety stem; naturalized in United States and used for forage,"2158,2172"
51740,08429664,n,9,European perennial grass with soft velvety foliage,"2158,2172"
51714,08424975,n,9,annual and perennial grasses of savannas and upland grasslands,2158
51742,08429990,n,9,cultivated since prehistoric times; grown for forage and grain,"2158,2172"
51743,08430196,n,9,"grass yielding grain used for for breakfast food, animal feed and in malt beverages","2158,2172"
51744,08430395,n,9,a grain of barley,"2172,2354"
51745,08430488,n,9,European annual grass often found as a weed in waste ground especially along roadsides and hedgerows,"2158,2172"
51725,08426866,n,9,any of various grasses of the genus Eragrostis; useful especially for forage and prevention of erosion,"2158,2172"
51747,08430919,n,9,annual barley native to western North America and widespread in southern United States and tropical America,"2158,2172"
51754,08432145,n,9,a genus of grasses of the family Gramineae grown in America and Asia,2158
51748,08431105,n,9,genus that in some classifications overlaps the genus Elymus,2158
51750,08431374,n,9,any of several annual or perennial Eurasian grasses,"2158,2172"
51751,08431565,n,9,European perennial grass widely cultivated for pasture and hay and as a lawn grass,"2158,2172"
51752,08431748,n,9,European grass much used for hay and in United States also for turf and green manure,"2158,2172"
51753,08431930,n,9,weedy annual grass often occurs in grainfields and other cultivated land; seeds sometimes considered poisonous,"2158,2172"
51756,08432529,n,9,rice,2158
51755,08432331,n,9,slender branching American grass of some value for grazing in central United States,"2158,2172"
51759,08432985,n,9,rice grass,2158
51757,08432637,n,9,annual or perennial rhizomatous marsh grasses; seed used for food; straw used for paper,"2158,2172"
51758,08432831,n,9,yields the staple food of 50 percent of world's population,"2158,2172"
51763,08433658,n,9,panic grass,2158
51760,08433107,n,9,any grass of the genus Oryzopsis,"2158,2172"
51761,08433263,n,9,valuable forage grass of dry upland areas and plains of western North America to northern Mexico,"2158,2172"
51762,08433483,n,9,perennial mountain rice native to Mediterranean region and introduced into North America,"2158,2172"
51789,08438903,n,9,tall perennial reedlike grass originally of southeastern Asia: sugarcane,2158
51764,08433777,n,9,any grass of the genus Panicum; grown for grain and fodder,"2158,2172"
51765,08433984,n,9,North American grass with slender brushy panicles; often a weed on cultivated land,"2158,2172"
51766,08434207,n,9,grass of western America used for hay,"2158,2172"
51768,08434524,n,9,annual weedy grass used for hay,"2158,2172"
51773,08435397,n,9,a genus of Old World grasses,2158
51770,08434827,n,9,tall tufted perennial tropical American grass naturalized as pasture and forage grass in southern United States,"2158,2172"
51771,08435062,n,9,perennial tropical American grass used as pasture grass in arid areas of Gulf states,"2158,2172"
51772,08435242,n,9,low-growing weedy grass with spikelets along the leaf stems,"2158,2172"
51777,08436277,n,9,a genus of grasses with broad leaves and a dense spike of flowers,2158
51775,08435886,n,9,tall perennial ornamental grass with long nodding flower plumes of tropical Africa and Asia,"2158,2172"
51776,08436101,n,9,northeastern tropical African plant having feathery panicles,"2158,2172"
51781,08437160,n,9,grasses native to temperate regions,2158
51778,08436490,n,9,perennial grass of marshy meadows and ditches having broad leaves; Europe and North America,"2158,2172"
51779,08436738,n,9,Canary Islands grass; seeds used as feed for caged birds,"2158,2172"
51780,08436912,n,9,perennial grass of Australia and South Africa; introduced in North America as forage grass,"2158,2172"
51783,08437511,n,9,reeds of marshes and riversides in tropical or temperate regions,2158
51782,08437301,n,9,grass with long cylindrical spikes frown in northern United States and Europe for hay,"2158,2172"
51785,08437966,n,9,chiefly perennial grasses of cool temperate regions,2158
51784,08437688,n,9,"tall North American reed having relative wide leaves and large plumelike panicles; widely distributed in moist areas; used for mats, screens and arrow shafts","2158,2172"
51794,08439932,n,9,overlaps the genus Andropogon,2158
51786,08438136,n,9,any of various grasses that thrive in the presence of abundant moisture,"2158,2172"
51787,08438371,n,9,valuable meadow and pasture grass in Europe and especially central United States having tall stalks and slender bright green leaves; a chief constituent in lawn grass mixtures,"2158,2172"
51788,08438696,n,9,slender European grass of shady places; grown also in northeastern America and temperate Asia,"2158,2172"
51791,08439358,n,9,juicy canes whose sap is a source of molasses and commercial sugar; fresh canes are sometimes chewed for the juice,2172
51790,08439106,n,9,tall tropical southeast Asian grass having stout fibrous jointed stalks; sap is a chief source of sugar,"2158,2172"
51769,08434646,n,9,a genus of perennial grasses of warm regions,2158
51792,08439560,n,9,sugarcanes representing the highest development of the species; characterized by large soft-rinded juicy stalks and high sugar content,"2158,2172"
51793,08439751,n,9,tough Asiatic grass whose culms are used for ropes and baskets,"2158,2172"
51795,08440062,n,9,handsome hardy North American grass with foliage turning pale bronze in autumn,"2158,2172"
51749,08431252,n,9,darnel; ryegrass,2158
51799,08440900,n,9,annual or perennial grasses of warm regions: bristlegrasses,2158
51808,08442803,n,9,"a strong slender often flexible stem as of bamboos, reeds, rattans, or sugar cane",2172
51800,08441086,n,9,grasses of grasslands and woodlands having large gracefully arching spikes with long bristles beneath each spikelet,"2158,2172"
51801,08441295,n,9,two species of coarse annual foxtails that are naturalized weeds in United States,"2158,2172"
51802,08441436,n,9,common weedy and bristly grass found in nearly all temperate areas,"2158,2172"
51803,08441649,n,9,European foxtail naturalized in North America; often a troublesome weed,"2158,2172"
51804,08441869,n,9,"coarse drought-resistant annual grass grown for grain, hay and forage in Europe and Asia and chiefly for forage and hay in United States","2158,2172"
51805,08442174,n,9,millet having orange to reddish grains in long bristly spikes,"2158,2172"
51806,08442327,n,9,millet having yellow grains in large drooping spikes,"2158,2172"
51807,08442496,n,9,"any of various small-grained annual cereal and forage grasses of the genera Panicum, Echinochloa, Setaria, Sorghum, and Eleusine","2158,2172"
51809,08442989,n,9,the stem of various climbing palms of the genus Calamus and related genera used to make wickerwork and furniture and canes,2172
51810,08443178,n,9,stem of the rattan palm used for making canes and umbrella handles,2172
51837,08448316,n,9,annual cereal grasses from Mediterranean area; widely cultivated in temperate regions,2158
51811,08443317,n,9,tall woody perennial grasses with hollow slender stems especially of the genera Arundo and Phragmites,"2158,2172"
51813,08443689,n,9,economically important Old World tropical cereal grass,"2158,2172"
51814,08443906,n,9,important for human and animal food; growth habit and stem form similar to Indian corn but having sawtooth-edged leaves,"2158,2172"
51815,08444138,n,9,any of several sorghums cultivated primarily for grain,"2158,2172"
51816,08444360,n,9,sorghums of dry regions of Asia and North Africa,"2158,2172"
51817,08444523,n,9,a Sudanese sorghum having exceptionally large soft white grains,"2158,2172"
51818,08444679,n,9,Sudanese sorghums having white seeds; one variety grown in southwestern United States,"2158,2172"
51819,08444817,n,9,"sorghums of China and Manchuria having small white or brown grains (used for food) and dry pithy stalks (used for fodder, fuel and thatching)","2158,2172"
51820,08445013,n,9,small drought-resistant sorghums having large yellow or whitish grains,"2158,2172"
51821,08445147,n,9,sorghum having slender dry stalks and small hard grains; introduced into United States from India,"2158,2172"
51822,08445326,n,9,any of several sorghums cultivated as a source of syrup,"2158,2172"
51824,08445785,n,9,tall grasses grown for the elongated stiff-branched panicle used for brooms and brushes,"2158,2172"
51829,08446726,n,9,cosmopolitan annual and perennial grasses (as dropseed or rushgrass),2158
51826,08446164,n,9,any of several perennial grasses of the genus Spartina; some important as coastal soil binders,"2158,2172"
51827,08446382,n,9,tall reedlike grass common in salt meadows,"2158,2172"
51828,08446510,n,9,North American cordgrass having leaves with dry membranous margins and glumes with long awns,"2158,2172"
51834,08447627,n,9,lawn grasses,2158
51830,08446946,n,9,a grass of the genus Sporobolus,"2158,2172"
51797,08440470,n,9,cereal grass widely cultivated for its grain: rye,2158
51832,08447363,n,9,erect smooth grass of sandy places in eastern North America,"2158,2172"
51833,08447507,n,9,grass having wiry stems and sheathed panicles,"2158,2172"
51812,08443523,n,9,annual or perennial tropical and subtropical cereal grasses: sorghum,2158
51835,08447757,n,9,low mat-forming grass of southern United States and tropical America; grown as a lawn grass,"2158,2172"
51836,08447975,n,9,grass whose starchy grains are used as food: wheat; rice; rye; oats; maize; buckwheat; millet,"2158,2172"
51825,08445956,n,9,"grass of freshwater swamps and salt marshes of Europe, Africa, America, and South Atlantic islands",2158
51838,08448511,n,9,annual or biennial grass having erect flower spikes and light brown grains,"2158,2172"
51839,08448790,n,9,a grain of wheat,"2172,2354"
51840,08448883,n,9,"wheat with hard dark-colored kernels high in gluten and used for bread and pasta; grown especially in southern Russia, North Africa, and northern central North America","2158,2172"
51841,08449184,n,9,wheat with soft starch kernels used in pastry and breakfast cereals,"2158,2172"
51842,08449308,n,9,widely cultivated in temperate regions in many varieties for its commercially important grain,"2158,2172"
100620,N0000880,n,10,,
51831,08447087,n,9,grass native to West Indies but common in southern United States having tufted wiry stems often infested with a dark fungus (Helminthosporum ravenelii),"2158,2172"
51845,08449839,n,9,found wild in Palestine; held to be prototype of cultivated wheat,"2158,2172"
51856,08451762,n,9,wild rice,2158
51847,08450110,n,9,tall annual cereal grass bearing kernels on large ears: widely cultivated in America in many varieties; the principal cereal in Mexico and Central and South America since pre-Columbian times,"2158,2172"
51848,08450514,n,9,(South African) an ear of corn,"2172,2354"
51849,08450597,n,9,corn grown primarily for animal feed or market grain,"2158,2172"
51850,08450760,n,9,the dried grains or kernels or corn used as animal feed or ground for meal,"2172,2354"
51851,08450904,n,9,corn whose young ears are sweet and suitable for eating as a vegetable,"2158,2172"
51852,08451111,n,9,corn whose kernels contain both hard and soft starch and become indented at maturity,"2158,2172"
51853,08451272,n,9,corn having kernels with a hard outer layer enclosing the soft endosperm,"2158,2172"
51854,08451449,n,9,corn having kernels almost entirely of soft starch,"2158,2172"
51855,08451601,n,9,corn having small ears and kernels that burst when exposed to dry heat,"2158,2172"
51863,08452990,n,9,bamboos,2158
51857,08451879,n,9,perennial aquatic grass of North America bearing grain used for food,"2158,2172"
51846,08450006,n,9,corn,2158
51859,08452271,n,9,any of several creeping grasses of the genus Zoysia,"2158,2172"
51860,08452448,n,9,lawn grass common in the Philippines; grown also in United States,"2158,2172"
51861,08452614,n,9,lawn grass common in China and Japan; grown also in United States,"2158,2172"
51862,08452783,n,9,Asiatic creeping perennial grass; introduced in southern United States as a dought-resistant lawn grass,"2158,2172"
51866,08453658,n,9,tall tender clumping bamboos,2158
51864,08453185,n,9,woody tropical grass having hollow woody stems; mature canes used for construction and furniture,"2158,2172"
51865,08453498,n,9,the hard woody stems of bamboo plants; used in construction and crafts and fishing poles,"2172,2415"
51868,08454038,n,9,North American bamboo,2158
51867,08453794,n,9,extremely vigorous bamboo having thin-walled culms striped green and yellow; so widely cultivated that native area is uncertain,"2158,2172"
51871,08454551,n,9,giant clumb-forming bamboos,2158
51869,08454194,n,9,tall grass of southern United States growing in thickets,"2158,2172"
51870,08454380,n,9,small cane of watery or moist areas in southern United States,"2158,2172"
51873,08454903,n,9,medium and large bamboos,2158
51872,08454698,n,9,immense tropical southeast Asian bamboo with tough hollow culms that resemble tree trunks,"2158,2172"
51885,08457701,n,9,large genus of plants found in damp woodlands and bogs and ditches or at water margins: sedges,2158
51874,08455085,n,9,small bamboo of southeastern China having slender culms flexuous when young,"2158,2172"
51875,08455291,n,9,small bamboo having thin green culms turning shining black,"2158,2172"
51876,08455462,n,9,large bamboo having thick-walled culms; native of China and perhaps Japan; widely brown elsewhere,"2158,2172"
51879,08456370,n,9,type genus of Cyperaceae; grasslike rhizomatous herbs; cosmopolitan except very cold regions,2158
51880,08456645,n,9,African sedge widely cultivated as an ornamental water plant for its terminal umbrellalike cluster of slender grasslike leaves,"2158,2172"
51881,08456892,n,9,European sedge having small edible nutlike tubers,"2158,2172"
51882,08457093,n,9,European sedge having rough-edged leaves and spikelets of reddish flowers and aromatic roots,"2158,2172"
51883,08457288,n,9,tall sedge of the Nile valley yielding fiber that served many purposes in historic times,"2158,2172"
51884,08457502,n,9,a widely distributed perennial sedge having small edible nutlike tubers,"2158,2172"
51888,08458293,n,9,cotton grass,2158
51886,08457918,n,9,European maritime sedge naturalized along Atlantic coast of United States; rootstock has properties of sarsaparilla,"2158,2172"
51887,08458138,n,9,tufted sedge of temperate regions; nearly cosmopolitan,"2158,2172"
51891,08458756,n,9,rhizomatous perennial grasslike herbs,2158
51889,08458419,n,9,any sedge of the genus Eriophorum; north temperate bog plants with tufted spikes,"2158,2172"
51890,08458609,n,9,having densely tufted white cottony or downlike glumes,"2158,2172"
51894,08459280,n,9,sedges having dense spikes of flowers and leaves reduced to basal sheaths,2158
51892,08458920,n,9,widely distributed North American sedge having rigid olive green stems,"2158,2172"
51893,08459111,n,9,sedge of eastern North America having numerous clustered woolly spikelets,"2158,2172"
51877,08455692,n,9,bulrush; chufa; cotton grass; papyrus; umbrella plant,2158
51858,08452060,n,9,lawn grasses native to southeastern Asia and New Zealand; grown especially in warm regions,2158
51897,08459801,n,9,fine-leaved aquatic spike rush; popular as aerator for aquariums,"2158,2172"
51898,08460001,n,9,cylendrical-stemmed sedge,"2158,2172"
51904,08461019,n,9,fiber from leaves of the pandanus tree; used for woven articles (such as mats),1787
51905,08461152,n,9,perennial marsh plants with creeping rootstocks and long linear leaves,2158
51902,08460674,n,9,any of various Old World tropical palmlike trees having huge prop roots and pineapplelike leaves and edible conelike fruits,"2158,2172"
51903,08460902,n,9,Polynesian screw pine,"2158,2172"
51906,08461352,n,9,reed maces; cattails,2158
51910,08462199,n,9,coextensive with the genus Sparganium,2158
51911,08462375,n,9,type and sole genus of Sparganiaceae; marsh or aquatic herbs of temperate regions,2158
51907,08461476,n,9,tall erect herbs with sword-shaped leaves; cosmopolitan in fresh and salt marshes,"2158,2172"
51909,08462008,n,9,"reed maces of America, Europe, North Africa, Asia","2158,2172"
51916,08463166,n,9,a family of herbaceous vines (such cucumber or melon or squash or pumpkin),2158
51901,08460529,n,9,type genus of the Pandanaceae (as screw pines),2158
51912,08462570,n,9,marsh plant having elongated linear leaves and round prickly fruit,"2158,2172"
51913,08462710,n,9,"dry seedlike fruit produced by the cereal grasses: e.g. wheat, barley, Indian corn","2172,2354"
51899,08460115,n,9,families Typhaceae; Sparganiaceae; Pandanaceae,2158
51915,08463069,n,9,the seed of the cereal grass,"2172,2354"
51917,08463546,n,9,any plant of the family Cucurbitaceae,2158
51920,08464009,n,9,type genus of the Cucurbitaceae,2158
51918,08463638,n,9,any vine of the family Cucurbitaceae that bears hard-rinded fruits,"2158,2172"
51919,08463896,n,9,any of numerous hard-rinded inedible fruits,"2172,2354"
51940,08468779,n,9,climbing perennial herbs: bryony,2158
51921,08464304,n,9,a coarse vine widely cultivated for its non-keeping large pulpy round orange fruit with firm orange skin and numerous seeds; subspecies of Cucurbita pepo include the summer squashes and a few autumn squashes,"2158,2172"
51922,08464671,n,9,any of numerous annual tendril-bearing trailing plants of the genus Cucurbita grown for their fleshy edible fruits,"2158,2172"
51923,08464944,n,9,any of various usually bushy plants producing fruit that is eaten while immature and before the rind or seeds harden,"2158,2172"
51924,08465277,n,9,any of various squash plants grown for their yellow fruits with somewhat elongated necks,"2158,2172"
51925,08465444,n,9,any of various squash plants grown for their elongated fruit with smooth dark green skin and whitish flesh,"2158,2172"
51926,08465693,n,9,marrow squash plant whose fruit are eaten when small,"2158,2172"
51927,08465831,n,9,squash plant having dark green fruit with skin mottled with light green or yellow,"2158,2172"
51928,08466014,n,9,squash plant having flattened round fruit with a scalloped edge; usually greenish white,"2158,2172"
51929,08466192,n,9,squash plant bearing oval fruit with smooth yellowish skin and tender stranded flesh resembling spaghetti,"2158,2172"
