37859,06079663,n,9,"a group of organisms of the same species populating a given area: ""they hired hunters to keep down the deer population""",2772
37865,06080663,n,9,the third estate of the realm; the commons (especially in Britain or France) viewed as forming a political order having representation in a parliament,1675
37858,06079469,n,9,"the group of people comprising the government of a sovereign state: ""the state has lowered its income tax""",1718
37825,06072206,n,9,persons who administer the law,"1718,1820"
37826,06072383,n,9,the executive under President Clinton,1820
37848,06076411,n,9,an international organization of European countries formed in 1958 to reduce trade barriers and increase cooperation among its members,1718
37849,06076869,n,9,an international organization created in 1949 by the North Atlantic Treaty for purposes of collective security,1718
37851,06078196,n,9,the administrative agency of the Organization of American States,1820
37852,06078325,n,9,an organization of countries formed in 1961 to agree on a common policy for the sale of petroleum,1718
37853,06078749,n,9,a nation that possesses formidable naval strength,1718
37854,06078854,n,9,a state powerful enough to influence events throughout the world,1718
37857,06079233,n,9,a government that undertakes responsibility for the welfare of its citizens through programs in public health and public housing and pensions and unemployment compensation etc.,"1718,1753"
37850,06077390,n,9,an association of countries in the W hemisphere; created in 1948 to promote military and economic and social and cultural cooperation,1718
37855,06079025,n,9,a state ruled by religious authority,"1675,1718"
37856,06079120,n,9,a state consisting of a sovereign city,1718
37860,06079857,n,9,too much population,2772
37864,06080527,n,9,the segment of the public that is easily influenced by mass media (chiefly British),2516
37863,06080290,n,9,"the common people generally: ""separate the warriors from the mass""; ""power to the people""",1718
37866,06080872,n,9,"a social class comprising those who do manual labor or work for wages: ""there is a shortage of skilled labor in this field""",1675
37861,06079949,n,9,"people in general considered as a whole: ""he is a hero in the eyes of the public""",2516
37867,06081123,n,9,the source of trained people from which workers can be hired,1675
37868,06081254,n,9,the social class lowest in the social hierarchy,1675
37869,06081359,n,9,the social class between the lower and upper classes,1675
37870,06081521,n,9,class composed of persons lacking noble or knightly or gentle rank,1675
37874,06082225,n,9,a large gathering of people,
37875,06082383,n,9,a teeming multitude,
37876,06082453,n,9,a vast multitude,
37878,06082744,n,9,a large number of people united for some specific purpose,
37879,06082852,n,9,a dense crowd of people,
37881,06083098,n,9,archaic terms for army,1781
37888,06083970,n,9,(British) a company that is organized to give its owners limited liability,1794
37887,06083786,n,9,"a social gathering of guests or companions: ""the house was filled with company when I arrived""",
37883,06083357,n,9,a disorderly crowd of people,
37884,06083469,n,9,a mob that kills a person for some presumed offense without legal authority,
37885,06083600,n,9,a moving crowd,
37886,06083682,n,9,a group of animals (a herd or flock) moving together,"2158,2188"
37918,06088783,n,9,"an opposing military force: ""the enemy attacked at dawn""",1781
37889,06084119,n,9,a company with controlling shares in other companies,1794
37890,06084251,n,9,a holding company owning or controlling one or more banks,1794
37891,06084393,n,9,a bank holding company owning several banks,1794
37898,06085460,n,9,a public utility providing local transportation,1946
37892,06084508,n,9,a company that performs a public service; subject to government regulation,
37893,06084772,n,9,a company or agency that performs a public service; subject to government regulation,
37894,06084928,n,9,a public utility that provides telephone service,
37895,06085092,n,9,a public utility that provides electricity,
37896,06085245,n,9,a public utility that provides water,
37897,06085354,n,9,a public utility that provides gas,
37899,06085597,n,9,one of the chartered companies of London originating with the craft guilds,1794
37901,06086069,n,9,a company that produces operas,2425
37913,06087639,n,9,"a travelling company of entertainers; including trained animals: ""he ran away from home to join the circus""",2425
37902,06086159,n,9,a company that produces plays,2425
37903,06086268,n,9,a theatrical company that performs plays from a repertoire,2425
37904,06086406,n,9,a company that produces ballets,2425
37905,06086536,n,9,a group of people assembled to sing together,2536
37906,06086651,n,9,a company of actors who comment (by speaking or singing in unison) on the action in a classical Greek play,2425
37909,06087156,n,9,a chorus that sings as part of a religious ceremony,2536
37880,06082959,n,9,a number of vehicles blocking one another until they can scarcely move,1946
37908,06087003,n,9,a body of dancers or singers who perform together,
37910,06087278,n,9,a family of similar musical instrument playing together,2536
37912,06087517,n,9,the chorus of a ballet company,2425
37911,06087395,n,9,a social gathering for the purpose of husking corn,
37914,06087799,n,9,a troupe of performers in blackface typically giving a comic program of negro songs and jokes,2425
37915,06088009,n,9,a troupe of minstrels,2425
37917,06088666,n,9,a military unit or region under the control of a single officer,1781
37919,06088910,n,9,a temporary military unit formed to accomplish a particular objective,1781
37907,06086825,n,9,"a group of musicians playing or singing together: ""a string ensemble""",2536
37920,06089036,n,9,a military unit that is part of an army,1781
37921,06089493,n,9,an organization of military land forces,1781
37922,06089726,n,9,a military unit that is part of a navy,1781
37923,06089894,n,9,an organization of military naval forces,1781
37924,06090056,n,9,the navy of the United States of America,1781
37925,06090171,n,9,a military service responsible for the safety of maritime traffic in coastal waters,1781
37926,06090330,n,9,an amphibious division of the US Navy,1781
37927,06090463,n,9,previously the air division of the US Army,1781
37928,06090561,n,9,the airforce of Great Britain,1781
37900,06085732,n,9,"organization of performers and associated personnel (especially theatrical); ""the traveling company all stayed at the same hotel""",2425
37882,06083198,n,9,"(plural) hosts or armies; used in the book of Romans in the New Testament of the Bible: ""Lord of Sabaoth""","1565,1781"
37931,06091016,n,9,an organization of military air forces,1781
37932,06091176,n,9,a force that is a branch of the armed forces,1781
37934,06091847,n,9,the military forces of a nation,1781
37938,06092519,n,9,"a group of people having the power of effective action: ""he joined forces with a band of adventurers""",
37935,06092042,n,9,armed forces that are not on active duty but can be called in an emergency,1781
37941,06093198,n,9,a cooperative unit,2638
37936,06092208,n,9,the US military establishment,"1781,1820"
37956,06095787,n,9,"an army unit large enough to sustain combat: ""two infantry divisions were held in reserve""",1781
37943,06093865,n,9,French police force; a group of gendarmes or gendarmes collectively,1781
37940,06093082,n,9,a semipermanent unit created to carry out a continuing task,
37944,06094022,n,9,the federal police force of Canada,1781
37955,06095661,n,9,"a body of people associated together: ""diplomatic corps""",
37951,06095033,n,9,the secret state police in Nazi Germany; known for its terrorist methods,1781
37945,06094151,n,9,the detective department of the metropolitan police force of London,1781
37947,06094485,n,9,a police group to enforce laws against gambling and prostitution,1781
37946,06094298,n,9,a privately employed group hired to protect the security of a business or industry,
37948,06094606,n,9,a military corps that enforces discipline and guards prisoners,1781
37949,06094767,n,9,the military police of the navy,1781
37950,06094857,n,9,a police force that operates in secrecy (usually against persons suspected of treason or sedition),1781
37952,06095159,n,9,the force of workers available,1753
37962,06096711,n,9,small military unit; usually two or three platoons,1781
37953,06095338,n,9,an army unit usually consisting of two or more divisions,1781
37954,06095502,n,9,a training program to prepare college students to be commissioned officers,1781
37957,06095988,n,9,a division of the United States Army that is specially trained for guerrilla fighting,1781
37966,06097368,n,9,"a group of persons who are engaged in a common activity: ""platoons of tourists poured out of the busses""; ""the defensive platoon of the football team""",1675
37958,06096200,n,9,an army unit usually consisting of five companies,1781
37959,06096346,n,9,army unit smaller than a division,1781
37960,06096453,n,9,army unit smaller than a division,1781
37964,06097081,n,9,a team of policemen working under the military platoon system,1781
37974,06098615,n,9,a detachment under the command of a provost marshall,1781
37930,06090808,n,9,a military unit that is part of the airforce,1781
37965,06097234,n,9,a small team of policemen working as part of a police platoon,1781
37967,06097572,n,9,a small unit of troops of special composition,1781
37961,06096540,n,9,an army unit usually consisting of a headquarters and three or more companies,1781
37968,06097782,n,9,the leading units moving at the head of an army,1781
37969,06097890,n,9,a group of men who escort and protect some important person,1781
37970,06098087,n,9,a British volunteer cavalry force organized in 1761 for home defense later incorporated into the Territorial Army,1781
37971,06098274,n,9,a detachment used for security or reconnaissance,1781
37972,06098375,n,9,a detachment of troops guarding an army from surprise attack,1781
37973,06098488,n,9,a detachment empowered to force civilians to serve in the army or navy,1781
37933,06091419,n,9,"a unit that is part of some military service: ""he sent Caesar a force of six thousand men""",1781
37942,06093563,n,9,"the force of policemen and officers: ""the law came looking for him""",1781
37976,06098856,n,9,a small army unit usually having a special function,1781
37977,06098961,n,9,a division of an orchestra containing all instruments of the same class,2536
37978,06099196,n,9,the section of an orchestra that plays stringed instruments,2536
37979,06099334,n,9,the section of an orchestra that plays violins,2536
37980,06099441,n,9,the section of a band or orchestra that plays percussion instruments,2536
37981,06099570,n,9,the section of a band or orchestra that plays brass instruments,2536
37939,06092672,n,9,"group of people willing to obey orders: ""a public force is necessary to give security to the rights of citizens""",1820
37975,06098727,n,9,a detachment assigned to protect the rear of a (retreating) military body,1781
37984,06099977,n,9,the section of a band or orchestra that plays clarinets,2536
37985,06100095,n,9,a smallest army unit,1781
37987,06100346,n,9,a group of workers who work for a specific period of time,1753
38006,06103316,n,9,"a gathering of spectators or listeners at a (usually public) performance; ""the audience applauded""; ""someone in the audience began to cough""",
37988,06100509,n,9,workers who work during the day (as 8 a.m. to 4 p.m.),1753
37989,06100630,n,9,workers who work during the evening (as 4 p.m. to midnight),1753
37990,06100749,n,9,workers who work during the night (as midnight to 8 a.m.),1753
37992,06101031,n,9,a group of ships of similar type,1781
37993,06101118,n,9,a unit of the US air force usually comprising two or more wings,1781
37994,06101255,n,9,a unit of military aircraft,1781
37995,06101371,n,9,a unit of the US air force larger than a squadron and smaller than a wing,1781
37996,06101500,n,9,a unit of the US air force larger than a flight and smaller than a group,1781
37997,06101646,n,9,a cavalry unit consisting of two or more troops and headquarters and supporting arms,1781
37998,06101785,n,9,a naval unit that is detached from the fleet for a particular task,1781
37999,06101906,n,9,a unit of the US air force smaller than a squadron,1781
38000,06102009,n,9,a formation of aircraft in flight,1942
38002,06102171,n,9,an administrative unit in government or business,"1718,1794,1820"
38001,06102095,n,9,a flock of flying birds,"2158,2188"
38004,06102786,n,9,(biology) a group of organisms forming a subdivision of a larger category,2158
38003,06102348,n,9,(botany) taxonomic unit of plants corresponding to a phylum,"2158,2172"
38005,06103166,n,9,an artificial taxonomic category for organisms of which the true relationships are obscure,2158
38010,06104115,n,9,the audience reached by television,"1935,2516,2606"
38011,06104236,n,9,"the audience gathered together in a theatre or cinema: ""the house applauded""; ""he counted the house""",
38007,06103604,n,9,spectators at a golf or tennis match,
38009,06103972,n,9,the audience reached by written communications (books or magazines or newspapers etc.),"1935,2516"
38012,06104407,n,9,a group of followers hired to applaud at a performance,2516
38017,06104982,n,9,"a group of people living in a particular local area: ""the team is drawn from all parts of the community""",
38013,06104533,n,9,a group of followers or enthusiasts,2516
38014,06104709,n,9,any loyal and steadfast following,2516
38015,06104797,n,9,the fans of a sport or famous person,2516
38020,06105666,n,9,a community of people in a religious order (especially nuns) living together,1565
38016,06104886,n,9,a local church community,
37986,06100185,n,9,"number needed to make up whole force: ""a full complement of workers""",1753
37983,06099838,n,9,the section of a band or orchestra that plays reed instruments,2536
38023,06106024,n,9,"people living near one another: ""it is a friendly neighborhood""; ""my neighborhood voted for Bush""",
38021,06105815,n,9,the members of a religious community living together,1565
38026,06106524,n,9,the government of a municipality,1718
38022,06105919,n,9,people sharing a given language or dialect,
38024,06106214,n,9,"people living or working on the same street: ""the whole street protested the absence of street lights""",
38029,06106897,n,9,"people living in a large densely populated municipality: ""the city voted for Republicans in 1994""",
38025,06106369,n,9,people living in a town or city having local self-government,
38028,06106806,n,9,the government of a US state,1718
38019,06105527,n,9,"a group of nations having common interests: ""they hoped to join the NATO community""",1718
38087,06115836,n,9,the body of students who graduate together this year,1919
38030,06107058,n,9,"the people living in a municipality smaller than a city: ""the whole town cheered the team""",
38027,06106641,n,9,a municipal government that combines legislative and executive authority in the members of a commission,1718
38031,06107243,n,9,a community of people smaller than a town,
38032,06107364,n,9,a community of people smaller than a village,
38033,06107474,n,9,an association formed and operated for the benefit of those using it,
38018,06105250,n,9,"a group of people having ethnic or cultural or religious characteristics in common: ""the Christian community of the apostolic age""; ""he was well known throughout the Catholic community""",1565
38042,06109380,n,9,a club of people to play chess,2600
38036,06108547,n,9,a literary or scientific association for the promotion of learning,"1898,2600"
38064,06112041,n,9,"an organization of employees formed to bargain with the employer: ""you have to join the union in order to get a job""","1718,1753"
38068,06112803,n,9,a union of workers for a single company; a union not affiliated with with a larger union,1753
38039,06108995,n,9,the largest organization of U.S. war veterans,"1781,2600"
38040,06109121,n,9,an organization of U.S. war veterans,"1781,2600"
38037,06108680,n,9,"a local branch of some fraternity or association: ""he joined the Atlanta chapter""",2600
38043,06109467,n,9,a suburban club for recreation and socializing,2600
38044,06109572,n,9,a club organized to sing together,2600
38045,06109661,n,9,a club of people to play golf,2871
38046,06109746,n,9,an association of huntsmen who hunt for sport,2600
38047,06109854,n,9,a club to promote and regulate horse racing,2600
38048,06109955,n,9,club for players of racket sports,2600
38049,06110046,n,9,a club for person who row,2649
38050,06110129,n,9,(British) a group of people who save money in a common fund for a specific purpose (usually distributed at Christmas),2600
38051,06110303,n,9,a club of people to play tennis,2871
38052,06110392,n,9,a club of tumblers or gymnasts,2600
38053,06110498,n,9,club that promotes and supports yachting and boating,2600
38054,06110607,n,9,an association of sports teams that organizes matches for its members,2638
38055,06110886,n,9,the most important league in any sport (especially baseball),2638
38056,06111046,n,9,a league of teams that do not belong to a major league (especially baseball),2638
38057,06111209,n,9,a league of baseball teams,2638
38058,06111334,n,9,a commercially sponsored baseball league for players between 8 and 12 years of age,2638
38059,06111495,n,9,a team that plays in a little league,2638
38060,06111634,n,9,a league of basketball teams,2871
38061,06111745,n,9,a league of bowling teams,2631
38062,06111831,n,9,a league of football teams,2638
38063,06111938,n,9,a league of hockey teams,2646
38065,06112339,n,9,a labor union that admits all workers in a given industry irrespective of their craft,1753
38080,06114591,n,9,"a consortium of companies formed to limit competition: ""they set up the trust in the hope of gaining a monopoly""","1753,2872"
38066,06112504,n,9,a labor union whose membership is restricted to workers in a particular craft,1753
38067,06112639,n,9,a cooperative depository financial institution whose members can obtain loans from their combined savings,1766
38069,06112951,n,9,a company whose workers are hired without regard to their membership in a labor union,1794
38041,06109253,n,9,a club that people join in order to buy selected books at reduced prices,2600
38070,06113092,n,9,a company that hires only union members,1794
38072,06113359,n,9,a social club for male undergraduates,2600
38073,06113479,n,9,a social club for female undergraduates,2600
38076,06113834,n,9,a club of professional or business people organized for their coordination and active in public services,2600
38074,06113573,n,9,a society that conceals its activities from nonmembers,"1675,2600"
38075,06113724,n,9,Freemasons collectively,"1675,2600"
38077,06114033,n,9,club dedicated to promoting responsible citizenship and good government and community and national and international welfare,2600
38078,06114257,n,9,a group of businessmen in a town organized as a service club and to promote world peace,2600
38081,06114774,n,9,the actors in a play,2425
38079,06114444,n,9,an association of companies for some definite purpose,"1753,2872"
38082,06114923,n,9,a cast other than the principles,2425
38083,06115031,n,9,the body of voters who elect a representative for their area,1718
38084,06115188,n,9,the body of electors who formally elect the US president and vice-president,1718
38085,06115327,n,9,"a body of students who are taught together: ""early morning classes are always sleepy""",1919
38038,06108853,n,9,an ecclesiastical assembly of the monks in a monastery or even of the canons of a church,1565
38086,06115587,n,9,"a body of students who graduate together: ""the class of ""97""; ""she was in my year at Hoehandle High""",1919
38035,06108270,n,9,"an association of people who share common beliefs or activities: ""the message was addressed not just to employees but to every member of the company family""; ""the church welcomed new members into its fellowship""",
38093,06116465,n,9,final grade or class in high school or college,1919
38094,06116570,n,9,penultimate class in high school or college,1919
38095,06116672,n,9,the second class in a four-year college or high school,1919
38096,06116788,n,9,the first class in college or high school,1919
38113,06119534,n,9,"an association of criminals: ""police tried to break up the gang""; ""a pack of thieves""",1802
38098,06117068,n,9,"an unofficial association of people or groups: ""the smart set goes there""; ""they were an angry lot""",
38100,06117608,n,9,"an inner circle of advisors (especially under President Reagan); ""he's no longer in the loop""",
38099,06117365,n,9,an exclusive circle of people with a common purpose,
38103,06118015,n,9,"a small group of indispensable persons or things: ""five periodicals make up the core of their publishing program""",
38101,06117752,n,9,a clique that seeks power usually through intrigue,
38115,06119878,n,9,a gang whose members are teenagers,1802
38106,06118590,n,9,"a crew of workers selected for a particular task: ""a detail was sent to remove the fallen trees""","1753,1787"
38104,06118220,n,9,an association of practitioners of a given profession,
38105,06118344,n,9,an organized group of workmen,"1753,1787"
38114,06119764,n,9,"a gang of criminals assembled in one place: ""a nest of thieves""",1802
38107,06118739,n,9,a gang of convicts chained together,"1753,1787"
38108,06118831,n,9,the crew of technicians and mechanics who service aircraft on the ground,"1753,1787"
38109,06118983,n,9,a gang of road workers,"1753,1787"
38110,06119061,n,9,a work crew assigned to a section of a railroad,"1753,1787"
38111,06119186,n,9,crew of workers who move scenery or handle properties in a theatrical production,"1753,1787"
38138,06123240,n,9,"a large orchestra; can perform symphonies: ""we heard the Vienna symphony""",2536
38136,06123023,n,9,small orchestra; usually plays classical music,2536
38116,06120007,n,9,a class of woman not considered respectable because of indiscreet or promiscuous behavior,1675
38117,06120171,n,9,the criminal class,1675
38125,06121419,n,9,class of small freeholders who cultivated their own land,1675
38118,06120284,n,9,underworld organizations,"1675,1802"
38119,06120501,n,9,(informal) any tightly knit group of trusted associates,
38120,06120617,n,9,a secret terrorist group in Sicily; originally opposed tyranny but evolved into a criminal organization in the middle of the 19th century,"1675,1802"
38121,06120832,n,9,a crime syndicate in the United States; organized in families; believed to have important relations to the Sicilian Mafia,"1675,1802"
38122,06121028,n,9,a secret terrorist society in the US early in the 20th century,"1675,1802"
38123,06121147,n,9,a secret society in Naples notorious for violence and blackmail,"1675,1802"
38124,06121264,n,9,a loose affiliation of gangsters in charge of organized criminal activities,"1675,1802"
38126,06121530,n,9,an organization of musicians who perform together,2536
38127,06121915,n,9,two performers or singers who perform together,2536
38128,06122027,n,9,three performers or singers who perform together,2536
38129,06122126,n,9,four performers or singers who perform together,2536
38130,06122257,n,9,an instrumental quartet with 2 violins and a viola and a cello,2536
38131,06122399,n,9,five performers or singers who perform together,2536
38132,06122512,n,9,six performers or singers who perform together,2536
38133,06122631,n,9,seven performers or singers who perform together,2536
38134,06122743,n,9,eight performers or singers who perform together,2536
38135,06122853,n,9,instrumentalists including string players,2536
38137,06123133,n,9,an orchestra playing only string instruments,2536
38102,06117892,n,9,a nucleus of military personnel capable of expansion,1781
38139,06123389,n,9,instrumentalists not including string players,2536
38091,06116267,n,9,students beginning elementary school,1919
38140,06123540,n,9,a group of musicians playing only brass and percussion instruments,2536
38141,06123663,n,9,a group of musicians playing brass and woodwind and percussion instruments,2536
38142,06123812,n,9,a musical group that uses jugs and washboards and kazoos and other improvised instruments,2536
38097,06116890,n,9,"a league ranked by quality: ""he played baseball in class D for two years""; ""Princeton is in the NCAA Division 1-AA""",2638
38143,06123956,n,9,a group of musicians playing popular music for dancing,
38144,06124164,n,9,a large dance or jazz band usually featuring improvised solos by lead musicians,
38148,06124614,n,9,(British) a band of musicians who play skiffle,2536
38152,06125074,n,9,a band of warriors (originally a unit of a Roman Legion),2768
38149,06124720,n,9,a band that plays instruments made from the heads of oil drums (Caribbean Islands),
38150,06124859,n,9,a nomadic community,
38151,06124948,n,9,a Mongolian army that swept over eastern Europe in the 13th century,
38155,06125445,n,9,the exclusive social set of a city,1675
38153,06125183,n,9,a company of companions or supporters,
38154,06125273,n,9,a group of conspirators banded together to achieve some harmful or illegal purpose,
38164,06127075,n,9,a party of people assembled for dancing,2621
38156,06125557,n,9,a set of people sharing a devotion to horses and horseback riding and horse racing,
38157,06125708,n,9,a set of rich and fashionable people who travel widely for pleasure,
38158,06125829,n,9,a dissenting clique,
38159,06126017,n,9,a faction or sect that has broken away from its parent organization,
38160,06126145,n,9,a gathering for the purpose of promoting fellowship,
