36552,05872497,n,9,ground coconut blended with hot water or hot milk and strained,1957
36553,05872618,n,9,oval reproductive body of a fowl (especially a hen) used as food,1957
36555,05873050,n,9,the yellow spherical part of an egg that is surrounded by the albumen,1957
36556,05873193,n,9,egg cooked briefly in the shell in gently boiling water,1957
36557,05873337,n,9,an egg boiled gently until both the white and the yolk solidify,1957
36559,05873625,n,9,egg-shaped chocolate candy,1957
36571,05875198,n,9,eggs cooked by sauteing in oil or butter; sometimes turned and cooked on both sides,1957
36560,05873711,n,9,egg-shaped candy,1957
36561,05873783,n,9,egg cooked in gently boiling water,1957
36562,05873889,n,9,eggs beaten and cooked to a soft firm consistency while stirring,1957
36563,05874013,n,9,halved hard-cooked egg with the yolk mashed with mayonnaise and seasonings and returned to the white,1957
36564,05874185,n,9,egg cooked individually in cream or butter in a small ramekin,1957
36566,05874534,n,9,eggs beaten with milk or cream and cooked until set,1957
36567,05874679,n,9,omelet cooked quickly and slid onto a plate,1957
36568,05874782,n,9,souffle-like omelet made by beating and adding the whites separately,1957
36569,05874910,n,9,a firm omelet that has diced ham and peppers and onions,1957
36570,05875026,n,9,light fluffy dish of egg yolks and stiffly beaten egg whites mixed with e.g. cheese or fish or fruit,1957
36572,05875337,n,9,milk and butter and cheese,1957
36542,05871290,n,9,for venison: brown sauce with sauteed vegetables and trimmings and marinade and plenty of pepper,1957
36573,05875585,n,9,a white nutritious liquid secreted by mammals and used as food by human beings,1957
36574,05876056,n,9,any of several nutritive milklike liquids,1957
36576,05876439,n,9,a liquid food for infants,1957
36581,05876923,n,9,milk fermented by bacteria; used to treat gastrointestinal disorders,1957
36577,05876518,n,9,milk that has been exposed briefly to high temperatures to destroy microorganisms and prevent fermentation,1957
36578,05876687,n,9,milk obtained from dairy cows,1957
36579,05876773,n,9,the milk of a yak,1957
36580,05876847,n,9,the milk of a goat,1957
36582,05877054,n,9,subjected to carefully controlled heating to destroy undesirable microorganisms,1957
36546,05871841,n,9,brown sauce with sauteed chopped onions and parsley and dry white wine or vinegar,1957
36583,05877195,n,9,unpasteurized milk,1957
36584,05877268,n,9,milk heated almost to boiling,1957
36585,05877356,n,9,milk with the fat particles broken up and dispersed uniformly so the cream will not rise,1957
36586,05877507,n,9,from dairies regulated by an authorized medical milk commission,1957
36587,05877631,n,9,dehydrated milk,1957
36588,05877762,n,9,dehydrated skimmed milk,1957
36589,05877847,n,9,milk concentrated by evaporation,1957
36590,05877959,n,9,sweetened evaporated milk,1957
36591,05878045,n,9,milk from which the cream has been skimmed,1957
36565,05874333,n,9,beaten eggs or an egg mixture cooked until just set; may be folded around e.g. ham or cheese or jelly,1957
36558,05873462,n,9,a colored hard-boiled egg or egg-shaped candy used to celebrate Easter,1957
36595,05878572,n,9,the part of milk containing the butterfat,1957
36597,05878876,n,9,cream that has enough butterfat (30% to 36%) to be whipped,1957
36602,05879421,n,9,an edible emulsion of fat globules made by churning milk or cream; for cooking and table use,1957
36598,05878995,n,9,cream that has at least 18% butterfat,1957
36599,05879105,n,9,contains more than 36% butterfat,1957
36600,05879195,n,9,(Britain) thick cream made from scalded milk,1957
36601,05879318,n,9,artificially soured light cream,1957
36603,05879638,n,9,butter made clear by heating and removing the sediment of milk solids,1957
36593,05878312,n,9,milk from which some of the cream has been removed,1957
36604,05879803,n,9,clarified butter used in Indian cookery,1957
36606,05880053,n,9,clarified butter browned slowly and seasoned with lemon juice and parsley,1957
36596,05878755,n,9,half milk and half light cream; contains 10% to 18% butterfat,1957
36607,05880203,n,9,a custard-like food made from curdled milk,1957
36608,05880355,n,9,yogurt with sweetened blueberries or blueberry jam,1957
36628,05883135,n,9,soft creamy white cheese; milder than Camembert,1957
36609,05880468,n,9,"watery part of milk produced when raw milk sours and coagulates: ""Little Miss Muffet sat on a tuffet eating some cuds and whey""",1957
36640,05884327,n,9,hard dry sharp-flavored Italian cheese; often grated,1957
36613,05881045,n,9,a solid food prepared from the pressed curd of milk,1957
36614,05881601,n,9,the rind of a cheese,1957
36616,05881817,n,9,soft unripened cheese made of sweet milk and cream,1957
36615,05881698,n,9,a part that is pared or cut off; especially skin or peel,
36617,05881944,n,9,fresh soft French cheese containing at least 60% fat,1957
36618,05882070,n,9,fresh soft French cheese containing at least 72% fat,1957
36619,05882196,n,9,mild white cheese made from curds of soured skim milk,1957
36620,05882355,n,9,made by blending several lots of cheese,1957
36621,05882474,n,9,processed cheddar-style cheese,1957
36622,05882566,n,9,cheese containing a blue mold,1957
36623,05882750,n,9,English blue cheese,1957
36624,05882823,n,9,French blue cheese,1957
36625,05882897,n,9,Italian blue cheese,1957
36626,05882973,n,9,blue cheese of Denmark,1957
36627,05883053,n,9,blue cheese of Bavaria,1957
36629,05883240,n,9,semisoft sweet American cheese from whole milk in a brick form,1957
36634,05883769,n,9,"made from goats"" milk",1957
36630,05883361,n,9,rich soft creamy French cheese,1957
36631,05883447,n,9,hard smooth-textured cheese,1957
36632,05883560,n,9,a mild yellow English cheese with a crumbly texture,1957
36633,05883673,n,9,mild yellow Dutch cheese made in balls,1957
36635,05883857,n,9,mild cream-colored Dutch cheese shaped in balls,1957
36605,05879893,n,9,clarified butter browned slowly and seasoned with vinegar or lemon juice and capers,1957
36636,05883979,n,9,hard or semihard cheese grated,1957
36637,05884069,n,9,any cheese originally molded by hand,1957
36638,05884163,n,9,mild white Italian cheese,1957
36639,05884245,n,9,semisoft pale-yellow cheese,1957
36641,05884434,n,9,soft Italian cheese like cottage cheese,1957
36647,05885127,n,9,trademark: soft processed American cheese,1957
36642,05884527,n,9,cheese formed in long strings twisted together,1957
36643,05884633,n,9,hard pale yellow cheese with many holes from Switzerland,1957
36644,05884802,n,9,large-holed Swiss cheese,1957
36645,05884920,n,9,small-holed Swiss cheese,1957
36648,05885223,n,9,ground nuts blended with a little butter,1957
36612,05880953,n,9,raw milk that has soured and thickened,1957
36649,05885320,n,9,a spread made from ground peanuts,1957
36650,05885413,n,9,a very sweet white spread resembling marshmallow candy,1957
36651,05885531,n,9,butter blended with minced onion,1957
36652,05885622,n,9,butter blended with mashed pimento,1957
36610,05880646,n,9,"coagulated milk; used to made cheese: ""Little Miss Muffet sat on a tuffet eating some curds and whey""",1957
36611,05880817,n,9,"a coagulated liquid resembling milk curd: ""bean curd""; ""lemon curd""",1957
36656,05886080,n,9,a tasty mixture to be spread on bread or crackers,1957
36657,05886442,n,9,spread made of cheese mixed with butter or cream or cream cheese and seasonings,1957
36658,05886581,n,9,butter blended with mashed anchovies,1957
36655,05885996,n,9,"butter made from yaks"" milk",1957
36659,05886678,n,9,a paste of fish or shellfish,1957
36660,05886762,n,9,butter seasoned with mashed garlic,1957
36662,05886989,n,9,liver or meat or fowl finely minced or ground and variously seasoned,1957
36672,05888570,n,9,sugar and water and sometimes corn syrup boiled together; used as sweetening especially in drinks,1957
36663,05887144,n,9,a pate made from duck liver,1957
36664,05887227,n,9,a pate made from goose liver (marinated in cognac) and truffles,1957
36666,05887514,n,9,something added to foods to make them taste sweeter,1957
36668,05887861,n,9,a sweet yellow liquid produced by bees,1957
36669,05887970,n,9,a crystalline substance 500 times sweeter than sugar; used as a calorie-free sweetener,1957
36670,05888112,n,9,a white crystalline carbohydrate used as a sweetener and preservative,1957
36654,05885855,n,9,butter blended with chopped lobster or seasoned with essence from lobster shells,1957
36671,05888357,n,9,a thick sweet sticky liquid,1957
36674,05888877,n,9,made from juice of sweet sorghum,1957
36673,05888725,n,9,thick dark syrup produced by boiling down juice from sugar cane; especially during sugar refining,1957
36689,05890606,n,9,rice and chicken cooked together Spanish style; highly seasoned especially with saffron,1957
36677,05889184,n,9,made by concentrating sap from sugar maples,1957
36661,05886856,n,9,for preparing snails: butter seasoned with shallots and garlic and parsley,1957
36678,05889285,n,9,syrup prepared from corn,1957
36679,05889366,n,9,(Old Testament) food that God gave the Israelites during the exodus,1565
36680,05889523,n,9,a flour mixture thin enough to pour or drop from a spoon,1957
36681,05889686,n,9,a flour mixture stiff enough to knead or roll,1957
36682,05889838,n,9,any of various doughs for bread,1957
36683,05889927,n,9,batter for making pancakes,1957
36684,05890014,n,9,batter for making fritters,1957
36685,05890101,n,9,piece of solid food for dipping in a liquid,1957
36686,05890201,n,9,chicken and onions and mushrooms braised in red wine and seasonings,1957
36687,05890325,n,9,rice and chicken cooked together with or without other ingredients and variously seasoned,1957
36688,05890495,n,9,a Cantonese dish of chicken and sauted vegetables,1957
36690,05890755,n,9,eggs (fried or scrambled) served with bacon,1957
36675,05888982,n,9,a pale cane syrup,1957
36691,05890859,n,9,baked or roasted with a spicy sauce,1957
36692,05890972,n,9,beef and mushrooms and onions stewed in red wine and seasonings,1957
36693,05891122,n,9,rare-roasted beef tenderloin coated with mushroom paste in puff pastry,1957
36694,05891281,n,9,corned beef simmered with onions and cabbage and usually other vegetables,1957
36695,05891442,n,9,dried navy beans baked slowly with molasses and salt pork,1957
36696,05891564,n,9,(British) leftover cabbage and potatoes and meat fried together,1957
36697,05891691,n,9,tubular pasta filled with meat or cheese,1957
36698,05891788,n,9,beef stewed in beer seasoned with garlic and served with boiled potatoes,1957
36699,05891946,n,9,puffy dish of cheese and eggs (whites beaten separately) and white sauce,1957
36700,05892079,n,9,braised chicken with onions and mushrooms in a wine and tomato sauce,1957
36701,05892209,n,9,thin slices of chicken stuffed with cheese and ham and then sauteed,1957
36702,05892342,n,9,chicken fried than oven-baked and served with milk gravy,1957
36703,05892461,n,9,chicken simmered in broth with onions and paprika then mixed with sour cream,1957
36704,05892619,n,9,prepared with mushrooms in a cream sauce served over pasta and topped with cheese,1957
36706,05892943,n,9,(Mexican) ground beef and chili peppers or chili powder often with tomatoes and kidney beans,1957
36707,05893105,n,9,a hotdog with chili con carne on it,1957
36676,05889068,n,9,thin syrup made from pomegranate juice; used in mixed drinks,1957
100296,N0002424,n,10,,
36667,05887724,n,9,an artificial sweetener made from aspartic acid; used as a calorie-free sweetener,1957
36710,05893510,n,9,usually made of flaked salt cod and mashed potatoes,1957
36711,05893635,n,9,seafood served in a scallop shell,1957
36712,05893723,n,9,scallops in white wine sauce served in scallop shells,1957
36713,05893846,n,9,meat pie with filling of meat and vegetables,1957
36715,05894086,n,9,minced cooked meat or fish coated in egg and breadcrumbs and fried in deep fat,1957
36709,05893419,n,9,chop suey served with fried noodles,1957
36716,05894218,n,9,well-seasoned rice (with nuts or currants of minced lamb) simmered or braised in stock,1957
36717,05894380,n,9,Chinese omelet containing onions and celery and chopped meat or fish,1957
36718,05894521,n,9,(Chinese) minced vegetables and meat wrapped in a pancake and fried,1957
36719,05894657,n,9,toasted English muffin topped with ham and a poached egg (or an oyster) and hollandaise sauce,1957
36720,05894810,n,9,(Mexican) tortilla with meat filling baked in chili-seasoned tomato sauce,1957
36722,05895097,n,9,fried fish and french-fried potatoes,1957
36714,05893950,n,9,minced cooked meats (or vegetables) in thick white sauce; breaded and deep-fried,1957
36723,05895194,n,9,hot sauce-like melted cheese or chocolate in which bread or fruits are dipped,1957
36724,05895368,n,9,fondue made of cheese melted in wine for dipping bread and sometimes fruits,1957
36725,05895503,n,9,fondue made of chocolate melted with milk or cream for dipping fruits,1957
36726,05895635,n,9,cubes of meat or seafood cooked in hot oil and then dipped in any of various sauces,1957
36727,05895797,n,9,cubes of beef cooked in hot oil and then dipped in various tasty sauces,1957
36729,05896092,n,9,boiled rice mixed with scallions and minced pork or shrimp and quickly scrambled with eggs,1957
36730,05896260,n,9,Italian omelet with diced vegetables and meats; cooked until bottom is set then inverted into another pan to cook the top,1957
36733,05896707,n,9,well-seasoned balls of ground fish and eggs and crushed crumbs simmered in fish stock,1957
36734,05896863,n,9,(Scotland) made of sheep's or calf's viscera minced with oatmeal and suet and onions and boiled in the animal's stomach,1957
36731,05896436,n,9,hind legs of frogs used as food; resemble chicken and cooked as chicken,"1957,2188"
36742,05897873,n,9,(Russian Jewish) baked or fried turnover filled with potato or meat or cheese; often eaten as a snack,1957
36732,05896582,n,9,boned poultry stuffed then cooked and covered with aspic; served cold,1957
36751,05899181,n,9,mixed diced fruits or vegetables; hot or cold,1957
36737,05897248,n,9,hash made with corned beef,1957
36738,05897337,n,9,"spicy Creole dish of rice and ham, sausage, chicken, or shellfish with tomatoes, peppers, onions, and celery",1957
36739,05897501,n,9,cubes of meat marinated and cooked on a skewer usually with vegetables,1957
36740,05897663,n,9,(British) a dish of rice and hard-boiled eggs and cooked flaked fish,1957
36741,05897786,n,9,(Greek) made of lamb,1957
36743,05898026,n,9,baked dish of layers of lasagna pasta with sauce and cheese and meat or vegetables,1957
36735,05897035,n,9,eggs (scrambled or fried) served with ham,1957
36744,05898172,n,9,seafood in Newburg sauce served on toast or rice,1957
36745,05898337,n,9,lobster in Newburg sauce served on buttered toast or rice,1957
36746,05898479,n,9,shrimp in Newburg sauce usually served in a rice ring,1957
36748,05898753,n,9,diced lobster mixed with Mornay sauce placed back in the shell and sprinkled with grated cheese and browned,1957
36749,05898924,n,9,(Scandinavian) dried cod soaked in a lye solution before boiling to give it a gelatinous consistency,1957
36750,05899089,n,9,macaroni in a cheese sauce,1957
36752,05899282,n,9,ground meat formed into a ball and fried or simmered in broth,1957
36736,05897135,n,9,chopped meat mixed with potatoes and browned,1957
36753,05899434,n,9,meat patties rolled in rice and simmered in a tomato sauce,1957
36754,05899566,n,9,meatballs simmered in stock,1957
36755,05899656,n,9,a baked loaf of ground meat,1957
36756,05899768,n,9,pie made with meat or fowl enclosed in pastry or covered with pastry or biscuit dough,1957
36757,05899980,n,9,small meat pie or turnover,1957
36758,05900094,n,9,small pie filled with minced seasoned pork,1957
36759,05900191,n,9,pasta somewhat resembling little moustaches,1957
36728,05895952,n,9,bread slice dipped in egg and milk and fried; topped with sugar or fruit or syrup,1957
36721,05894939,n,9,(Middle Eastern) small croquette of mashed chick peas or fava beans seasoned with sesame seeds,1957
36764,05900897,n,9,a dish of roast pheasant served in a manner characteristic of expensive restaurants,1957
36763,05900756,n,9,very tender and very nutritious tissue from marrowbones,"1957,2233"
36765,05901047,n,9,small frankfurters wrapped in biscuit dough and baked,1957
36767,05901378,n,9,pilaf made with bulgur wheat instead of rice and usually without meat,1957
36768,05901506,n,9,Italian open pie made of thin bread dough spread with a spiced mixture of e.g. tomato sauce and cheese,1957
36769,05901762,n,9,tomato and cheese pizza with sausage,1957
36770,05901858,n,9,tomato and cheese pizza with pepperoni,1957
36771,05901958,n,9,pizza with lots of cheese,1957
36772,05902042,n,9,tomato and cheese pizza with anchovies,1957
36773,05902140,n,9,pizza made with a thick crust,1957
36774,05902230,n,9,Hawaiian dish of taro root pounded to a paste and often allowed to ferment,1957
36775,05902373,n,9,dried beans cooked with pork and tomato sauce,1957
36776,05902479,n,9,soft food made by boiling oatmeal or other meal or legumes in water or milk until thick,1957
36777,05902694,n,9,porridge made of rolled oats,1957
36778,05902785,n,9,thick gruel,1957
36779,05902851,n,9,deep-dish meat and vegetable pie or a meat stew with dumplings,1957
36780,05902966,n,9,rice cooked with broth and sprinkled with grated cheese,1957
36781,05903091,n,9,flaked fish baked in a loaf with bread crumbs and various seasonings,1957
36782,05903233,n,9,fish loaf made with flaked salmon,1957
36783,05903324,n,9,ground beef patty usually with a sauce,1957
36785,05903587,n,9,shredded cabbage fermented in brine,1957
36800,05905512,n,9,parboiled head of cabbage scooped out and filled with a hash of chopped e.g. beef or ham and baked; served with tomato or cheese sauce,1957
36786,05903679,n,9,sauteed cutlets (usually veal or poultry) that have been pounded thin and coated with flour,1957
36787,05903858,n,9,thin sauteed cutlets of veal,1957
36788,05903948,n,9,large shrimp sauteed in oil or butter and garlic,1957
36789,05904049,n,9,hard-cooked egg encased in sausage meat then breaded and deep-fried,1957
36790,05904173,n,9,creamy scrambled eggs on toast spread with anchovy paste,1957
36791,05904291,n,9,pie of hash covered with mashed potatoes and browned in the oven,1957
36792,05904416,n,9,spaghetti with meatballs in a tomato sauce,1957
36793,05904528,n,9,spicy rice with tomatoes and onions and green peppers,1957
36794,05904640,n,9,steak with sauteed kidneys and onions cooked in wine and stock then covered with pastry and baked,1957
36795,05904804,n,9,like steak and kidney pie but without steak,1957
36797,05905078,n,9,strips of steak sauteed with green peppers and onions,1957
36870,05915535,n,9,made of fermented honey and water,2354
36798,05905190,n,9,steak covered with crushed peppercorns pan-broiled and served with brandy-and-butter sauce,1957
36799,05905374,n,9,sauteed strips of beef and mushrooms in sour cream sauce served with noodles,1957
36801,05905708,n,9,(Jewish) roasted fowl intestines with a seasoned filling of matzo meal and suet,1957
36802,05905856,n,9,parboiled green peppers stuffed usually with rice and meat and baked briefly,1957
36803,05905994,n,9,tomato cases filled with various mixtures and baked briefly,1957
36804,05906135,n,9,tomato cases filled with various salad mixtures and served cold,1957
36805,05906281,n,9,fresh corn and lima beans with butter or cream,1957
36806,05906383,n,9,(Japanese) thin beef strips (or chicken or pork) cooked briefly at the table with onions and greens and soy sauce,1957
36807,05906551,n,9,(Japanese) very thinly sliced raw fish,1957
36808,05906643,n,9,(Japanese) rice (with raw fish) wrapped in seaweed,1957
36809,05906745,n,9,steak braised in tomato and onion mixture,1957
36810,05906844,n,9,(Mexican) corn and cornmeal dough stuffed with a meat mixture then wrapped in corn husks and steamed,1957
36811,05906997,n,9,Mexican-like meat mixture covered with cornbread topping,1957
36812,05907110,n,9,(Japanese) vegetables and seafood dipped in batter and deep-fried,1957
36796,05904904,n,9,ground beef mixed with raw egg and e.g. onions and capers and anchovies; eaten raw,1957
36784,05903424,n,9,pot roast marinated several days in seasoned vinegar before cooking; usually served with potato dumplings,1957
36762,05900614,n,9,a bone containing edible marrow; used especially in flavoring soup,2233
36815,05907474,n,9,cheese melted with ale or beer served over toast,1957
36816,05907607,n,9,(Viennese) deep-fried breaded veal cutlets,1957
36817,05907724,n,9,(Mexico) thin unleavened pancake made from cornmeal or wheat flour,1957
36818,05907863,n,9,(Mexico) a tortilla rolled cupped around a filling,1957
36819,05907982,n,9,a taco with a chicken filling,1957
36820,05908070,n,9,(Mexico) a flour tortilla folded around a filling,1957
36821,05908191,n,9,a burrito with a beef filling,1957
36822,05908279,n,9,(Mexico) a crisp flat tortilla,1957
36823,05908363,n,9,a flat tortilla with various fillings piled on it,1957
36824,05908484,n,9,a flat tortilla topped with refried beans,1957
36825,05908584,n,9,(Mexico) dried beans cooked and mashed and then fried in lard with various seasonings,1957
36827,05909261,n,9,any thin watery drink,2354
36855,05913813,n,9,pale beer with strong flavor of hops; especially a Bohemian beer,2354
36829,05909690,n,9,a commercially prepared mixture of dry ingredients,1957
36830,05909835,n,9,a food mixture used to fill pastry or sandwiches,1957
36831,05909955,n,9,a sweet filling made of prunes or apricots,1957
36832,05910050,n,9,a medicinal or magical or poisonous beverage,2354
36833,05910183,n,9,a substance believed to cure all ills,2354
36834,05910291,n,9,a substance believed to maintain life indefinitely,2354
36836,05910601,n,9,a serving of drink (usually alcoholic),2354
36840,05911542,n,9,"a single serving of a beverage: ""I asked for a hot drink""; ""likes a drink before dinner""",2354
36838,05910868,n,9,a drink in honor of or to the health of a person or event,2354
36835,05910402,n,9,a drink credited with magical power; can make the one who takes it love the one who gave it,2354
36841,05911988,n,9,a mixture containing half alcohol by volume at 60 degrees Fahrenheit,2354
36814,05907362,n,9,a pate or fancy meatloaf baked in an earthenware casserole,1957
36843,05912220,n,9,(facetious) a serving of an alcoholic beverage,2354
36842,05912115,n,9,a serving (of wine) poured out in honor of a deity,1957
36844,05912321,n,9,an alcoholic beverage (especially beer) made at home,2354
36826,05908749,n,9,"any liquid suitable for drinking: ""may I take your beverage order?""",2354
36845,05912429,n,9,an illicitly distilled (and usually inferior) alcoholic liquor,2354
36846,05912552,n,9,(Polynesian) an alcoholic drink made from the aromatic roots of the kava shrub,2354
36847,05912692,n,9,taken before a meal as an appetizer,2354
36848,05912782,n,9,drink made by steeping and boiling and fermenting rather than distilling,2354
36849,05913023,n,9,fermented alcoholic beverage brewed from malt and hops,2354
36850,05913243,n,9,dark-colored heavy-bodied beers usually imported from Germany or Holland or Scandinavia,2354
36851,05913422,n,9,imported from Germany,2354
36852,05913501,n,9,strong dark beer brewed in the fall and aged through the winter for spring consumption,2354
36853,05913650,n,9,beer stored for aging,2354
36854,05913723,n,9,beer with reduced alcohol content,2354
36856,05913942,n,9,beer brewed for immediate consumption,2354
36859,05914226,n,9,grain that is kiln-dried after having been germinated by soaking in water; used especially in brewing and distilling,1957
36857,05914046,n,9,unlicensed drinking establishment,2415
36858,05914133,n,9,very effervescent light-colored beer,2354
36860,05914430,n,9,unfermented or fermenting malt,1957
36861,05914511,n,9,alcoholic beverage made with malt,2354
36862,05914628,n,9,half beer and half porter,2354
36863,05914713,n,9,fermented alcoholic beverage similar to but heavier than beer,2354
36864,05914878,n,9,(British) dry sharp-tasting ale with strong flavor of hops,2354
36865,05914989,n,9,a strong dark English ale (brewed at Burton-on-Trent in Derbyshire),2354
36866,05915109,n,9,dark sweet ale brewed from black malt,2354
36867,05915233,n,9,strong dark heavy-bodied porter,2354
36868,05915334,n,9,a kind of bitter stout,2354
36869,05915411,n,9,(Russian) fermented beverage resembling beer but made from rye or barley,2354
36837,05910721,n,9,"a serving to each of a group (usually alcoholic); ""he ordered a second round""",1957
36839,05910986,n,9,"a liquor or brew containing alcohol as the active agent: ""alcohol (or drink) ruined him""",2354
36875,05916124,n,9,Japanese beverage from fermented rice usually served hot,2354
36889,05918771,n,9,dry fruity red table wine drunk within a few months after it is made; from southern Burgundy in France,2354
36876,05916257,n,9,a fermented alcoholic beverage made of molasses and spruce twigs fermented with yeast,2354
36877,05916400,n,9,made from sap of the Australasian nipa palm,2354
36878,05916513,n,9,sweet liqueur made from wine and brandy flavored with plum or peach or apricot kernels and bitter almonds,2354
36879,05916701,n,9,fermented juice (of grapes especially),2354
36881,05917325,n,9,wine having a red color derived from skins of dark-colored grapes,2354
36873,05915880,n,9,drink that resembles beer but with less than 1/2 percent alcohol,2354
36882,05917572,n,9,pale yellowish wine made from white grapes or red grapes with skins removed before fermentation,2354
36883,05917922,n,9,pinkish table wine from red grapes whose skins were removed after fermentation began,2354
36884,05918094,n,9,used in a communion service,2354
